,date,publication,words,author,title,intro
0,2022-09-22,Le Monde,880mots,Audrey Garric,Guterres plaide pour taxer les profits dans les énergies fossiles,"    ...  riches à taxer ces profits pour les redistribuer aux pays victimes des conséquences du changement  climatique et aux populations touchées par l’inflation. Les industriels du charbon, du pétrole et du gaz ...  "
1,2022-10-28,Le Monde,1288mots,Audrey Garric,"Pour le climat, «une année gâchée»","    ...  un nouvel avertissement pour les gouvernements, à dix jours de la conférence mondiale sur le  climat (COP27), qui se tiendra du 6 au 18 novembre à CharmElCheikh, en Egypte. Malgré ...  "
2,2022-09-30,Le Monde,1058mots,Audrey Garric,Climat: le manque de financements dénoncé,"    Il ne reste que quarante jours avant la prochaine conférence mondiale sur le  climat, la COP27, et pourtant, le chemin paraît encore long. Cette grandmesse annuelle, qui se tiendra à Charm ...  "
3,2022-09-15,Le Monde,1202mots,Audrey Garric,L’ONU alerte sur le «chaos climatique» à venir,"    ... ’empirer, battant des records à une fréquence toujours plus alarmante. Sans mesures radicales, la crise  climatique sera de plus en plus dévastatrice, touchant en premier lieu les populations les plus vulnérables, prévient ...  "
4,2022-10-07,Le Monde,1099mots,Audrey Garric,Climat: la sécheresse de cet été liée au réchauffement,"    ...  été frappée par une sécheresse historique. Selon une étude publiée mercredi 5 octobre, le dérèglement  climatique d’origine humaine a rendu ces épisodes au moins vingt fois plus probables, réduisant les récoltes ...  "
5,2022-10-22,Le Monde,1262mots,Propos recueillis par Audrey Garric (à Paris) Propos recueillis par Audrey Garric (à Paris) et Thomas Wieder,"«Face au réchauffement, chaque Etat doit sortir de sa zone de confort»","    Jennifer Morgan, secrétaire d’Etat et représentante spéciale pour la politique  climatique internationale auprès du ministère des affaires étrangères allemand, a effectué son premier déplacement officiel à Paris, jeudi 20 octobre. Dans ...  "
6,2022-10-14,Le Monde,746mots,Perrine Mouterde,"Le réchauffement climatique, une menace majeure et croissante","    ...  les prises accidentelles liées à la pêche illégale.  Mais d’autres pressions, liées au réchauffement  climatique, pèsent sur ces animaux.  «Le nombre de mâles et de femelles à naître est fixé par ...  "
7,2022-09-10,Le Monde,1372mots,Audrey Garric,Climat: des seuils critiques bientôt franchis?,"    ...  la notion la plus effrayante de tout le répertoire de catastrophes convoyées par la crise  climatique?: celle des points de bascule (tipping points, en anglais), ces seuils de réchauffement audelà desquels ...  "
8,2022-09-22,Le Monde,2776mots,Audrey Garric,"Valérie Masson-Delmotte, une climatologue au sommet","    ...  août, lui a encore fait franchir une nouvelle dimension médiatique. Cette combattante infatigable pour le  climat, à 50 ans, est devenue incontournable, en France comme à l’étranger. Depuis le début du ...  "
9,2022-09-13,Le Monde,990mots,Aurélie Fardeau,Le succès des «fonds climat»,"    Lutter contre le réchauffement  climatique avec son épargne, telle est la promesse faite par ces produits de placement que l’industrie financière appelle les «fonds  climat».  «Ils visent un rendement financier, mais ...  "
10,2022-10-21,Le Monde,838mots,Propos recueillis par Au. G.,"«En2050, dépasser 30  0 C en octobre ne sera plus exceptionnel»","    ... ’un des principaux auteurs du rapport du Groupe d’experts intergouvernemental sur l’évolution du  climat (GIEC) publié en août 2021, explique la survenue de la vague de chaleur en cours et ...  "
11,2022-09-12,Le Monde,969mots,par Stéphane Foucart,Le «fétichisme» du carbone,"    Quelle que soit la méthode comptable, il faut bien le reconnaître: le poids  climatique des déplacements en jet privé de quelques personnes fortunées est minuscule, négligeable. Selon les estimations du ministère des ...  "
12,2022-10-22,Le Monde,1446mots,Sandrine Cassini et Matthieu Goar,La cause climatique peine à trouver son temps politique,"    ...  en Ukraine à la pénurie de carburants. Comme si l’enjeu universel de la transition  climatique était encore une fois victime d’autres contingences.  «Le temps de l’émotion passe, mais ça ...  "
13,2022-10-06,Le Monde,892mots,Claire Legros,Adaptation,    ...  et à s’y adapter. L’idée n’est pas nouvelle?: l’adaptation au changement  climatique fait l’objet de nombreux travaux de recherche depuis vingt ans. Elle est aussi au cœur ...  
14,2022-10-29,Le Monde,719mots,,Résister au fatalisme mortifère,"        1 A quelques jours de l’ouverture de la 27e conférence mondiale sur le  climat (COP27) à Charm ElCheikh, en Egypte, une nouvelle alerte sur le changement  climatique est lancée par ...  "
15,2022-09-05,Le Monde,1022mots,Anne-Françoise Hivert,Suède: les Verts marginalisés à l’approche des élections,"    ...  accompagnée de sa pancarte blanche où est écrit  «skolstrejk för klimatet»  («?grève scolaire pour le?climat?»). La jeune Suédoise, âgée de 19 ans, avait entamé son action, le 20 août 2018, à ...  "
16,2022-10-29,Le Monde,1187mots,Audrey Garric,Une vague de chaleur inédite par son intensité et sa durée,"    ...  circulation atmosphérique de très grande échelle.  «Cette configuration est classique, mais désormais, avec le changement  climatique, elle s’accompagne de températures toujours plus élevées» , indique le directeur de recherche au CNRS, qui ...  "
17,2022-10-28,Le Monde,1075mots,Delphine Roucaute,Les impacts du réchauffement climatique sur la santé humaine,"    ...  tous les pays du monde, meurent chaque année des conséquences directes et indirectes du réchauffement  climatique. Vagues de chaleur, fortes précipitations, feux de forêt, tempêtes et sécheresses: l’augmentation de la probabilité ...  "
18,2022-10-15,Le Monde,1143mots,Audrey Garric,Le sursaut «fragile» des investissements pour le climat en France,"    ...  la transition écologique n’a jamais semblé aussi urgent que sous la pression des crises  climatique et énergétique, toutes deux liées à notre addiction aux énergies fossiles. Après une décennie de  «sous ...  "
19,2022-10-18,Le Monde,1645mots,Frédéric Lemaître,L’agriculture chinoise au défi du réchauffement,"    ... ’elle vient de connaître, mais il est d’ores et déjà évident que le réchauffement  climatique aura des effets encore plus dévastateurs qu’anticipé, notamment sur l’agriculture.  «Le gouvernement fait tout ...  "
20,2022-10-13,Le Monde,969mots,R. Bx.,La formation des fonctionnaires à la transition écologique est lancée,"    ...  L’ensemble du gouvernement avait alors écouté la climatologue Valérie MassonDelmotte expliquer les enjeux de la lutte contre le changement  climatique, une mise au point rapide de quelque trente minutes.  ...  "
21,2022-09-24,Le Monde,3484mots,Nicolas Truong,Penser et agir dans un monde en feu,"    ... ’éminent Paul J. Crutzen nous a emprunté notre vocabulaire – et les problèmes liés au réchauffement  climatique sont étudiés par des scientifiques de premier plan, physiciens de formation» . Sans compter qu’en France ...  "
22,2022-10-27,Le Monde,1154mots,Stéphane Mandard,BNP Paribas sommée de cesser de financer le fossile,"    ...  Oxfam France, qui ont contribué à faire condamner l’Etat en justice pour son  «inaction  climatique» , entendent désormais ouvrir le  «procès d’un financeur du chaos  climatique».  Un premier jalon a été ...  "
23,2022-10-25,Le Monde,996mots,Perrine Mouterde,Le rôle des forêts pour le climat sous-estimé,"    ...  sont encore plus importantes que les décideurs ne le pensent habituellement pour la régulation du  climat: audelà du cycle du carbone, elles ont des effets sur les températures et les précipitations ...  "
24,2022-10-08,Le Monde,1086mots,"Six députés socialistes et apparentés, dont le président du groupe, Boris Vallaud, et apparentés, dont le président du groupe, Boris Vallaud,","La sobriété solidaire: un projet ambitieux, porteur de progrès social, environnemental et technologique","    Dans le contexte actuel de crise énergétique et  climatique, il est plus qu’urgent de nous interroger collectivement sur notre mode de vie et sur notre modèle de développement en prenant en ...  "
25,2022-09-12,Le Monde,1228mots,,Climat: au feu!,"        ... ’ai une situation professionnelle qui me permet de vivre confortablement,  (…)  ma relation amoureuse se passe très bien, pourtant, au fond de moi, je ressens une angoisse permanente liée au changement  climatique.»  ...  "
26,2022-09-30,Le Monde,814mots,propos recueillis par Au. G.,«C’est un investissement de survie pour l’humanité»,"    ...  et à quelle intensité. Il n’y a pas de justification à ne pas agir dans la lutte contre le changement  climatique. Sans action, l’espoir n’est qu’une illusion.  ...  "
27,2022-10-06,Le Monde,718mots,Propos recueillis par Joséfa Lopez,«Les villes doivent éviter la “mal-adaptation”»,"    directrice de recherche au Laboratoire des sciences du  climat et de l’environnement au Commissariat à l’énergie atomique et aux énergies alternatives (CEA), et coprésidente du groupe de travail 1 du ...  "
28,2022-10-22,Le Monde,1337mots,Claire Gatinois et Ivanne Trippenbach,Elisabeth Borne lance son plan pour une «France nation verte»,"    ...  tiendra dans le nouveau slogan gouvernemental,  «Agir, mobiliser, accélérer» , afin de faire plus pour le  climat en huit ans que tout ce que la France a accompli en trentedeux ans. Le ...  "
29,2022-09-10,Le Monde,795mots,Rémi Barroux,Les ONG écologistes partagées sur l’utilité du processus,"    ...  en place pour  «bâtir du consensus  (…)  face aux défis immenses, comme celui de la transition  climatique» . Pourtant, le matin, devant la presse, le chef de l’Etat n’évoquait que  «trois grands ...  "
30,2022-10-18,Le Monde,440mots,par Philippe Escande,Vie chère et climat,"    ...  écologistes ont marché, dimanche 16 octobre, pour protester  «contre la vie chère et l’inaction  climatique».  L’enjeu immédiat est, bien entendu, de demander de meilleurs salaires face à l’inflation qui ...  "
31,2022-10-24,Le Monde,1225mots,Audrey Tonnelier,L’exécutif peine à intégrer les enjeux climatiques dans l’horizon politique,"    ...  en refixe de nouveaux» , estime Benoît Leguet, directeur général de l’institut économique pour le  climat (I4CE), un think tank sur l’économie de la transition écologique fondé par la Caisse des ...  "
32,2022-09-30,Le Monde,486mots,Audrey Garric,Fuites sur Nord Stream: le risque d’une «bombe climatique»,"    ...  détectées au large du Danemark, possiblement dues à un sabotage. Elles font craindre un  «désastre  climatique et environnemental» , a déclaré Stefano Grassi, chef de cabinet de la commissaire européenne à l’énergie ...  "
33,2022-10-27,Le Monde,3884mots,"Jean-Michel Bezat, Marjorie Cessac, et Isabelle Chaperon","TotalEnergies: Patrick Pouyanné, un patron brut","    ...  de l’Ukraine à la crise énergétique, de la taxation des superprofits à l’urgence  climatique. Au temps des «?Guignols de l’info?», ce polytechnicien taillé comme un deuxième ligne de rugby ...  "
34,2022-09-10,Le Monde,948mots,,François Gemenne Le changement climatique est déjà un des premiers facteurs de migration,"        ...  plan national d’adaptation, pour améliorer la résilience du pays face aux impacts du changement  climatique. Mais que peut l’adaptation face à des inondations qui touchent des dizaines de millions de ...  "
35,2022-10-24,Le Monde,864mots,Rémi Barroux,Le Conseil national de la refondation va devoir prouver son utilité,"    ...  incarner et expliquer quelles seront les missions du Conseil national de la refondation (CNR) version  «climat et biodiversité» , lancé vendredi 21 octobre dans les locaux de La Recyclerie, dans le 18e arrondissement ...  "
36,2022-09-14,Le Monde,2117mots,Yann Chavance,"Au Groenland , sur les traces de Charcot","    ...  Charcot au Groenland», se souvient Pierre SansJofre.  Le projet Greenlandia, présenté comme une  «initiative  climatique, pédagogique, scientifique et documentaire» , se penche alors, en effet, sur les impacts des changements climatiques dans ...  "
37,2022-10-21,Le Monde,1034mots,Audrey Garric,Climat: un réchauffement aggravé en France,"    ...  orages, fut celui de tous les dangers, préfigurant notre avenir sous l’effet du dérèglement  climatique. Ce futur s’annonce encore plus sombre que prévu en France. Selon de nouvelles projections climatiques ...  "
38,2022-10-08,Le Monde,1359mots,Matthieu Goar,Macron cherche sa planification écologique,"    ...  se pencher sur six thèmes, en reprenant les sujets de la convention citoyenne pour le  climat (se nourrir, se loger, travailler, se déplacer, consommer) et en en ajoutant un, la préservation des ...  "
39,2022-10-27,Le Monde,578mots,,Avis d’expert | Entreprises Menace du modèle actionnarial sur le climat,"        ...  ne saurait se voir dicter cellesci par un chef d’entreprise. Ainsi, l’engagement  climatique de BlackRock porte atteinte aux intérêts et aux droits des citoyens de la Louisiane, ce qui ...  "
40,2022-09-28,Le Monde,831mots,Manuel Armand,"Salers, saint-nectaire: des producteurs en difficulté",    ...  constat est d’autant plus inquiétant que c’est une tendance lourde résultant du changement  climatique. Ce qui fait peser une menace sur l’économie laitière de montagne. Les chambres d’agriculture ...  
41,2022-09-16,Le Monde,1176mots,Juliette Garnier,Patagonia se restructure au profit de la planète,    ... ’entreprise. Le reste sera entièrement distribué à des associations  «qui luttent contre la crise du  climat» . Patagonia est une entreprise jugée pionnière par tous ceux qui militent en faveur de la responsabilité ...  
42,2022-09-14,Le Monde,152mots,Audrey Garric,Points de bascule climatique: cinq seuils bientôt atteints,"    ...  de bascule ( tipping points ), ces seuils de réchauffement audelà desquels des pans du système  climatique entrent dans un état complètement nouveau et souvent irréversible, avec des impacts majeurs pour le climat ...  "
43,2022-10-28,Le Monde,811mots,Propos recueillis par P. Es. et F. F.,«Ce n’est pas le blocage des raffineries qui a donné lieu à l’accord»,"    ... ’utilité sociale, et plaide pour plus de dialogue pour répondre à l’inquiétude des salariés. La grève des raffineries touche à sa fin,quel est votre sentiment sur le  climat social?  ...  "
44,2022-10-08,Le Monde,539mots,Audrey Garric,Les fuites de méthane moins importantes qu’annoncé,"    ... ,4 % des émissions annuelles françaises , explique Philippe Ciais, climatologue (CEA) au Laboratoire des sciences du  climat et de l’environnement . C’est beaucoup si on compare aux efforts de décarbonation d’un ...  "
45,2022-09-17,Le Monde,1071mots,Claire Gatinois,Le parti présidentiel Renaissance cherche toujours un cap clair,"    ...  la presse présidentielle (APP), à dénoncer les pratiques «?aberrantes?» de quelques ultrariches nocives pour le  climat.  Mais réguler les jets privés en France comme le suggéraient certains dans son camp?? Hors de ...  "
46,2022-09-21,Le Monde,972mots,Julie Carriat (Service politique),"L’écologie partout, les écologistes nulle part","    Sur le dérèglement  climatique, les écologistes, depuis au moins René Dumont et son  «verre d’eau précieuse» , ont eu raison avant tout le monde. Mais  «il ne suffit pas d’avoir raison ...  "
47,2022-09-20,Le Monde,1040mots,par Stéphane Lauer,Nucléaire: le débat impossible,"    ...  une opinion raisonnable sur un sujet crucial, au moment où la lutte contre le réchauffement  climatique se double d’une crise énergétique sans précédent.  «Il est très compliqué d’obtenir la photographie ...  "
48,2022-10-19,Le Monde,960mots,Marine Miller,«Je ne peux pas cautionner ça»: le boycott des jeunes engagés,"    ... ’est emparé d’une certaine frange de la jeunesse – plutôt diplômée et engagée pour le  climat –, à l’approche de la Coupe du monde qui se déroulera au Qatar, du 20 novembre ...  "
49,2022-09-15,Le Monde,1188mots,Valérie Masson-Delmotte et Olivier Schneider,Valérie Masson-Delmotte et Olivier Schneider   L’Etat doit engager un plan Marshall pour le vélo,"    ...  conséquences de ces choix. Face à la crise actuelle de l’énergie, à celle du  climat et face aux effets dévastateurs du manque d’activité physique lié à la sédentarité, ne commettons ...  "
50,2022-09-09,Le Monde,682mots,par Marie de Vergès,L’Afrique aux prises avec l’injustice climatique,"    ...  des pluies diluviennes font des morts et ruinent des vies. On le sait, un fléau  climatique touche d’autant plus une population que son niveau de revenu est faible. Or, l’Afrique ...  "
51,2022-09-15,Le Monde,623mots,par Pierre-Cyrille Hautcœur,Les enseignements climatiques de l’histoire,"    ...  historiens, d’autant qu’ils se caractérisent autant par l’accroissement de la variabilité du  climat (températures, humidité, multiplication des phénomènes extrêmes) que par un changement univoque. Ils sont aujourd’hui clairement ...  "
52,2022-09-26,Le Monde,726mots,Nicolas Bauduceau,Nicolas Bauduceau Accroître la prévention,    ...  de l’intensité et de la fréquence des catastrophes naturelles sous l’effet du dérèglement  climatique est un défi majeur?: l’été 2022 pourrait devenir la norme à partir de 2050. Le ...  
53,2022-09-05,Le Monde,916mots,Laurence Scialom,Laurence Scialom Les vieilles recettes sont inappropriées,"    ...  produits agricoles, composantsclés de l’industrie du numérique, etc.), souvent favorisées par le dérèglement  climatique. Cette idée d’une inflation d’origine  climatique est partagée par certains banquiers centraux. Isabel Schnabel ...  "
54,2022-09-12,Le Monde,587mots,,Réinventer le soft power occidental,"        ... ’elle est: une préfiguration parmi bien d’autres des bouleversements à venir entraînés par le dérèglement  climatique. Les pays les plus instables, politiquement et économiquement, y seront malheureusement les plus exposés.  ...  "
55,2022-10-24,Le Monde,967mots,Claire Gatinois,Borne pose les premiers jalons de sa planification écologique,    ...  20 °C) pour un mois d’octobre. Elisabeth Borne ne le sait que trop. Le  climat et ses dérèglements s’imposent à son agenda. Entre deux allersretours à l’Assemblée pour ...  
56,2022-10-28,Le Monde,544mots,Rémi Barroux,Ecologie Un modèle tourné vers la production et la recherche scientifique,"    ...  pour que la journaliste de France 2, Caroline Roux, aborde la question de l’urgence  climatique, interrogeant Emmanuel Macron sur les véhicules électriques et le retard pris par la France dans ce ...  "
57,2022-09-01,Le Monde,1136mots,Audrey Garric,Le deuxième été le plus chaud en France,"    ...  été inédit, qui deviendra la norme autour de 2050 sous l’effet de la crise  climatique si les émissions de gaz à effet de serre d’origine humaine se poursuivent au même ...  "
58,2022-09-21,Le Monde,697mots,par Corine Lesnes,"En Californie, le nucléaire a le vent en poupe","    ...  chez les démocrates américains?: à l’heure de la crise énergétique et de l’urgence  climatique, peuton éviter de relancer le nucléaire?? Devant une station de chargement de véhicules électriques, avec ...  "
59,2022-09-29,Le Monde,1580mots,Isabelle RegnieR,"Les tours Duo, monuments à contretemps","    ...  Paris était à New York, où se tenait la quatorzième édition de la Semaine du  climat. Elle fut pourtant à l’origine du projet au début des années 2010, lorsqu’elle était ...  "
60,2022-10-28,Le Monde,572mots,Au. G.,Niveaux record de gaz à effet de serre dans l’atmosphère,"    ...  de même que la hausse des précipitations dans ces régions, sous l’effet du phénomène  climatique La Niña. Autre piste: une diminution de la concentration du radical OH (hydroxyle), qui dégrade le ...  "
61,2022-10-07,Le Monde,1001mots,Audrey Tonnelier,La conversion contrainte de Macron,"    ...  qui menace le portefeuille des Français et les bouleversements à venir en matière de transition  climatique, dont chacun a pu sentir les effets délétères cet été. Ce qui permettra au pays de ...  "
62,2022-09-09,Le Monde,940mots,Mathilde Gérard (Service Planète),"La viande, symbole masculin et aliment délétère pour le climat","    ... ’origine humaine, dont la moitié sont dues à l’élevage. Réduire la consommation de viande est un des leviers individuels les plus importants, tant pour le  climat que pour la santé.  ...  "
63,2022-09-21,Le Monde,1549mots,Marine Miller,Des polytechniciens «écolos» à l’assaut de l’Etat,"    ...  de la pyramide ont terminé leur formation dans les années 1990 où la question du  climat et de la biodiversité n’était abordée ni de près ni de loin» , explique le consultant ...  "
64,2022-09-10,Le Monde,655mots,Sarah Belouezzane,La droite soucieuse de combler son «retard» sur l’écologie,"    ...  derrière l’économie et la sécurité. Six?ans plus tard, et alors que la question  climatique devient centrale pour nombre de citoyens, LR ne semble pas donner de signes d’une prise ...  "
65,2022-09-16,Le Monde,1264mots,Perrine Mouterde,Avenir des forêts: la position ambitieuse des eurodéputés,    ... ?Les politiques en matière de bioénergie de l’UE constituent une grave menace pour le  climat et ont terni pendant des années son leadership sur le sujet. Mais ce vote marque un ...  
66,2022-10-11,Le Monde,833mots,,Non au pipeline géant de Total en Afrique de l’Est!,"        ...  forêt, inondations d’une ampleur jamais vue… Plus personne ne peut en douter, le bouleversement  climatique s’accélère et risque d’échapper complètement à notre contrôle. Mais alors que nous sommes des ...  "
67,2022-09-26,Le Monde,937mots,par Stéphane Foucart,"Climat, pollution: péril sur l’eau","    ...  n’existe aucun miracle technologique capable de remplacer une bonne vieille pluie. Avec le changement  climatique en cours, ces réalités s’imposeront toujours plus durement à l’Europe et au reste du ...  "
68,2022-10-11,Le Monde,3710mots,Nicolas Truong,Bruno Latour,"    ...  de penser en rond, 2021), Bruno Latour n’a cessé de penser le  « nouveau régime  climatique »  dans lequel nous vivons ( Face à Gaïa , La Découverte, 2015). Car  « nous avons changé de monde ...  "
69,2022-09-10,Le Monde,174mots,,Climat Cinq points de bascule déjà inéluctables,        ...  chercheurs identifie seize seuils de rupture entraînant un emballement mondial ou régional pour le changement  climatique. Ils montrent un risque de multiplication de ces points de nonretour audelà d’un ...  
70,2022-09-01,Le Monde,1067mots,Marjorie Cessac,L’Europe renoue avec le polluant charbon,"    ...  ont acté la sortie du charbon,  rappelle Neil Makaroff, chargé du dossier au Réseau Action  Climat.  Y compris la Roumanie, la République tchèque ou la Bulgarie, même si les horizons – respectivement 2030 ...  "
71,2022-10-22,Le Monde,933mots,Perrine Mouterde,Avis critique sur le projet de loi d’accélération du nucléaire,    ...  seront ensuite appelés à débattre de la loi de programmation sur l’énergie et le  climat au second semestre 2023. «Une insécurité juridique» Le CNTE rappelle que le gouvernement ne peut soumettre ...  
72,2022-09-20,Le Monde,915mots,Béatrice Gurrey,"A St Barnabas, on prie un peu pour la reine, beaucoup pour le climat","    ... prêtre pionnière» et militante de la cause écologiste, proche du mouvement Extinction Rebellion. « La crise  climatique n’est pas un problème parmi d’autres. C’est une alarme qui clignote audessus ...  "
73,2022-10-10,Le Monde,1126mots,Perrine Mouterde,Une COP biodiversité sans chefs d’Etat ?,"    ...  pour l’alimentation, l’agriculture, la santé humaine ou encore pour lutter contre le réchauffement  climatique. Relations diplomatiques tendues Pour la COP27 pour le  climat, prévue début novembre, plus de quatrevingt ...  "
74,2022-09-01,Le Monde,750mots,Frédéric Lemaître,La Chine fait tourner ses centrales au maximum,"    ...  pénurie d’énergie provoquée par une sécheresse historique et des températures caniculaires dues au réchauffement  climatique, la Chine remet à l’honneur le charbon, pourtant reconnu comme l’une des principales causes ...  "
75,2022-09-07,Le Monde,1023mots,collectif de treize universitaires,Nous devons adapter notre système alimentaire dès à présent face à la crise climatique,"    ...  effet de serre au rythme actuel, le Groupe d’experts intergouvernemental sur l’évolution du  climat (GIEC) prévoit une augmentation de la température de 3,9 °C d’ici à 2050, qui ...  "
76,2022-09-07,Le Monde,1842mots,Propos recueillis par Claire Legros,Joëlle Zask «Il nous faut redevenir les gardiens de notre planète»,"    ...  celui du mégafeu, feu extrême, qui a la particularité d’être directement lié au dérèglement  climatique, dont les activités humaines sont responsables. Alors que les feux faisaient partie de la vie normale ...  "
