,date,publication,words,author,title,intro
305,2022-09-30,Le Monde,534mots,"Claire Mayer(Bordeaux,correspondante) Claire Mayer(Bordeaux,correspondante) Claire Mayer(Bordeaux,correspondante)","A Bordeaux, le maire veut être «plus ambitieux» que l’Etat","    ...  de son investiture à la mairie de Bordeaux, Pierre Hurmic déclarait  «l’état d’urgence  climatique».  Un  « acte fondateur de notre vision pour Bordeaux » , rappelle l’élu écologiste au  Monde  lorsqu’on ...  "
306,2022-10-05,Le Monde,115mots,,Une France qui reste mécontente mais se décrispe,"        ...  la situation de majorité relative, et plébiscitent le consensus et l’opposition constructive ▶ La crise  climatique devient un enjeu majeur, mais seules 61% des personnes pensent qu’elle est liée à l ...  "
307,2022-09-26,Le Monde,582mots,,Football: en finir avec un régime d’exception,"        ...  de déplacement alternatifs à l’avion afin de contribuer à la lutte contre le réchauffement  climatique, il avait répondu par une mauvaise plaisanterie, en expliquant que l’équipe réfléchissait à l’utilisation ...  "
308,2022-10-22,Le Monde,3249mots,Claire Legros,Les droits de la nature une révolution juridique,"    ...  éruptive des “autres qu’humains” dans l’arène politique , note Sophie Gosselin.  Avec le réchauffement  climatique et ses aléas meurtriers, nous sommes en train d’éprouver notre propre vulnérabilité et l’impasse ...  "
309,2022-10-14,Le Monde,294mots,N. W.,Un chamanisme démocratique,"    ...  éleveurs de rennes, ils sont devenus de sédentaires chasseurscueilleurs), aux prises avec un dérèglement  climatique dont les effets se font particulièrement sentir dans cette partie du globe. Alors que le dernier ...  "
310,2022-10-17,Le Monde,1402mots,Julie Carriat et Sandrine Cassini,"Entre Ruffin et LFI, l’heure des comptes","    ... Avant la «marche contre la vie chère et l’inaction  climatique» du 16 octobre, organisée par les partis de gauche, et la mobilisation interprofessionnelle du mardi 18, le député de la Somme ...  "
311,2022-09-12,Le Monde,652mots,,Restaurer la souveraineté des citoyens,"        ...  près de la moitié de l’humanité vit dans des situations hautement vulnérables au changement  climatique, l’économie financière place nos ressources dans des activités compromettant la vie sur terre. Dans un ...  "
312,2022-09-19,Le Monde,2406mots,Par Anne-Lise Carlo,Les nouveaux Robinson,"    ...  l’âge d’être scolarisé, ils opteront pour l’école à distance. Malgré le dérèglement  climatique et la violente réponse des éléments naturels – récemment, les feux de forêt estivaux –, l’attrait d ...  "
313,2022-09-26,Le Monde,128mots,,Le contexte Franck Guarnieri Du risque naturel au risque industriel Anne-Marie Granet-Abisset La mémoire oubliée des catastrophes Une nouvelle économie des risques Jean-Louis [...],"        La situation  climatique et géopolitique mondiale, de plus en plus imprévisible, oblige à trouver, pour l’avenir, les voies et moyens d’une prospérité qui soit capable de résister à des chocs ...  "
314,2022-10-18,Le Monde,851mots,"Sana Ben Achour Sana Ben Achour, Kamel Daoud et Sana Ben Achour Leïla Slimani","Sana Ben Achour , Kamel Daoud et Leïla Slimani Le Maghreb n’est pas une utopie","    ...  générations futures vont devoir relever des défis que nous ne pouvons même pas imaginer?: réchauffement  climatique, immigration massive, crise démographique, effondrements populistes. Nous vivons des temps dangereux. Et c’est dans ce ...  "
315,2022-09-28,Le Monde,42mots,,Les vestiges de la civilisation de l’Indus menacés par la pluie,        La mousson exceptionnelle qui afflige le Pakistan a aussi endommagé la cité antique de MohenjoDaro. Les archéologues s’inquiètent de la récurrence d’atteintes d’origine  climatique  ...  
316,2022-10-31,Le Monde,1501mots,,Hommage à Bruno Latour «Ta pensée audacieuse est devenue la pensée du temps présent»,"        ... ’ils sont bien faits – a rencontré le plus vaste des enchevêtrements, celui du «nouveau régime  climatique»; c’est là qu’une pensée audacieuse et en apparence paradoxale, qui séduisait les plus brillants ...  "
317,2022-10-31,Le Monde,570mots,,[Ne dites pas à ses enfants qu’il ne plante...],"        ...  choix des végétaux, produits localement et adaptés à la région et aux conséquences du réchauffement  climatique, tout comme les matériaux (paillage en lin, piquets en châtaignier, etc.) et les partenariats avec des ...  "
318,2022-10-17,Le Monde,606mots,Audrey Sommazi,"Pas encore né, l’avion régional entièrement électrique d’Aura Aero séduit déjà","    ...  décarbonation de l’aviation n’est pas optionnelle. On ne peut plus ignorer le réchauffement  climatique et on doit effectuer cette transition» , poursuit le patron, un ancien salarié d’Airbus et d ...  "
319,2022-09-28,Le Monde,121mots,,"Les chiffres Les fromages AOP fragilisés par la crise climatique Au pays du reblochon, les petites coopératives s’organisent face à [...]","        ... Les chiffres Les fromages AOP fragilisés par la crise  climatique Au pays du reblochon, les petites coopératives s’organisent face à Lactalis Salers, saintnectaire: des producteurs en difficulté  ...  "
320,2022-10-15,Le Monde,1042mots,B. Bi. et Julie Carriat,LFI tente de récupérer la mobilisation syndicale,"    ... A l’approche de la «grande marche contre la vie chère et l’inaction  climatique», qu’ils organisent, dimanche 16 octobre à Paris, les «insoumis» cherchent à tirer parti de l’effervescence ...  "
321,2022-10-15,Le Monde,1487mots,Bertrand Bissuel et Matthieu Goar Bertrand Bissuel et Matthieu Goar,Le gouvernement face au risque de contagion du mouvement social,"    ...  gauche, notamment les mélenchonistes, qui organisent leur «marche contre la vie chère et l’inaction  climatique», dimanche 16 octobre.  «Ce qui permet de produire ces avancées sociales, ce sont ces mobilisations. Bien ...  "
322,2022-10-17,Le Monde,648mots,Sylvain Siclier,L’écoresponsabilité de la filière musicale en débat,"    ... ’importantes ressources en eau non prévues  «ont été des électrochocs, la manifestation concrète du dérèglement  climatique».  Mais de ces trois jours, il ressort d’abord que si la prise de conscience est ...  "
323,2022-10-28,Le Monde,633mots,,"Emmanuel Macron, en retard d’une vision","        ...  l’Europe sens dessus dessous. Un autre bouleversement s’impose?: la lutte contre le réchauffement  climatique, qui suppose de revoir, en un temps record, tout notre modèle de développement. Le président de ...  "
324,2022-10-29,Le Monde,904mots,Nathaniel Herzberg (à Paris) et Gilles Rof,"Vecteurs de la dengue, les moustiques tigres prolifèrent cet automne","    ...  venir. Il y sera question de moustiques, de dengue, mais aussi de chikungunya, de Zika, de?West Nile, autant d’«?arboviroses?» que le réchauffement  climatique transforme désormais en menace de proximité.  ...  "
325,2022-10-29,Le Monde,719mots,Laurence Girard,Le feuilleton météorologique inédit de l’année bouscule le monde agricole,"    ...  que jamais, les agriculteurs s’interrogent sur la manière de s’adapter à ce changement  climatique. Ils se posent la question des calendriers de culture, des variétés plus résistantes au stress hydrique ...  "
326,2022-10-27,Le Monde,48mots,,"TotalEnergies Patrick Pouyanné, un patron au cœur des crises","        ...  major mondiale a été critiqué pour son action tardive face au blocage de ses raffineries ▶ Crise énergétique, superprofits, urgence  climatique… Il est mêlé à toutes les secousses qui affectent la société  ...  "
327,2022-09-20,Le Monde,796mots,"Emmanuel Davidenkoff, Joséfa Lopez, Yoanna Sultan-R’bibo et Gilles van Kote",Un festival pour mieux connaître «Le Monde»,"    ...  a lâché dans un glacier du Groenland en 2008 pour mesurer la vitesse du réchauffement  climatique? «Ne rien louper» Pendant trois jours, le parvis de notre immeuble, sous l’arche dessinée par ...  "
328,2022-09-21,Le Monde,710mots,Nathaniel Herzberg,"Le phoque moine, décimé pendant l’Antiquité",    ...  font clairement remonter l’événement majeur d’effondrement des populations à l’Antiquité.» Un événement  climatique?? Une épidémie?? Rien ne peut être tout à fait exclu. Mais aucune analyse ne soutient un ...  
329,2022-10-27,Le Monde,331mots,C. Le.,Un essai implacable sur «une fiction politique»,    ...  sontils adaptés aux défis écologiques de notre époque? A l’heure où le réchauffement  climatique et l’effondrement de la biodiversité nous imposent collectivement des choix difficiles et appellent des réponses ...  
330,2022-10-28,Le Monde,1069mots,Marjorie Cessac et Véronique Chocron,"Gaz, électricité: des HLM sans solution","    ...  lie» , indique le fournisseur. Avant d’ajouter:  «Selon le niveau de rigueur de l’hiver  climatique que nous traverserons, et en cas de surconsommation par rapport aux prévisions  (…) , il est possible que ...  "
331,2022-09-30,Le Monde,947mots,Jessica Gourdon (service Campus),Grandes écoles-industrie: une génération d’étudiants plus engagée,"    ...  probablement passé comme une lettre à la poste. Aujourd’hui, dans un contexte de crises  climatique et énergétique, d’aggravation des inégalités et d’interrogations sur les responsabilités des grands groupes, les ...  "
332,2022-10-01,Le Monde,1083mots,Sarah Belouezzane,Xavier Bertrand lance son parti en vue de 2027,"    ...  propositions en matière d’environnement étaient sousdimensionnées face à l’urgence de la crise  climatique. Pour autant, il ne renonce pas à sa  «République des territoires» , concept qu’il a présenté ...  "
333,2022-10-12,Le Monde,1010mots,par Françoise Fressoz,Les députés en quête de responsabilité,"    ...  énergétique, de l’inflation, des risques de récession et de la lutte contre le réchauffement  climatique, les effets de manche se dévaluent vite. Les députés sont soumis à la même pression que ...  "
334,2022-10-10,Le Monde,1010mots,de Thomas Piketty,Repenser le fédéralisme,"    Face à la crise géopolitique et  climatique, la question de la souveraineté est sur toutes les lèvres. Chaque pays cherche à retrouver la maîtrise de son destin, de ses approvisionnements et de ...  "
335,2022-10-11,Le Monde,51mots,,"B runo L atour, penseur du «nouveau régime climatique»","        ... B runo L atour, penseur du «nouveau régime  climatique»  ...  "
336,2022-09-30,Le Monde,29mots,,Alerte maximale sur les gazoducs qui alimentent l’Europe,"        Le sabotage dans la Baltique se confirme, faisant redouter une catastrophe  climatique et des tensions géopolitiques  ...  "
337,2022-10-04,Le Monde,1380mots,Olivier Razemon,"La Forêt-Noire, un paradis vert","    ...  l’histoire d’un arbre bicentenaire et, en comparant avec les arbres voisins, l’histoire  climatique de la région, en repérant par exemple les années à sécheresse ou la présence de cendres ...  "
338,2022-10-05,Le Monde,1013mots,P. Sa. et Stéphane Foucart,Des troubles au centre de vifs débats,    ...  un «sport de contact» . La formule sied aussi bien à la recherche sur le réchauffement  climatique qu’à celle sur les conséquences à long terme du Covid. En témoigne la tempête qui ...  
339,2022-10-06,Le Monde,1082mots,Hélène Bienvenu,Comment Ljubljana s’est mise au vert,"    ...  un service public qui ne sera jamais profitable, mais essentiel à l’heure du réchauffement  climatique pour réduire l’empreinte carbone de ces objets peu usités»,  conclut Jost Derlink, gestionnaire du projet ...  "
340,2022-10-06,Le Monde,709mots,,«Il faut faire évoluer nos imaginaires pour réussir la transition»,"        ...  sociétés? Le film  Don’t Look Up [Adam McKay, 2021]  nous interpelle sur l’inaction  climatique, mais comment peutil nous aider à y remédier? Comme le montre l’étude «Des récits ...  "
341,2022-10-07,Le Monde,1100mots,Alain Bergounioux Jean-Christophe Cambadélis et Michel Destot Laurent Joffrin,L’histoire nous lance un défi: refonder l’Europe une troisième fois,"    ...  mondial. Elle s’ajoute aux autres grands défis internationaux, au premier rang desquels le dérèglement  climatique. Au fil des crises récentes, l’Union européenne a démontré sa résilience: elle a gardé sa ...  "
342,2022-10-27,Le Monde,320mots,Brice Laemle,La revue «écolo catho» «Limite» cesse de paraître,"    ...  si’du pape François, dans laquelle celuici fustige le consumérisme et dénonce le réchauffement  climatique, ils s’inspirent des écrits de Simone Weil ou de Georges Bernanos. La revue  Limite  assume ...  "
343,2022-10-26,Le Monde,1103mots,Bruno Nassim Aboudrar,"Bruno Nassim Aboudrar L’œuvre des «Tournesols» n’est pas vraiment visée, c’est le musée qui l’est",    ...  Corée  ne fournit qu’une sollicitation iconographique un peu poussive en forme d’équation:  «Chaos  climatique =guerre + famine» . Mais la différence essentielle entre l’acte de Mary Richardson et ses répliques contemporaines ...  
344,2022-09-20,Le Monde,708mots,Matthieu Goar,"Renaissance, le nouveau parti des macronistes","    ...  Renaissance soit  «l’aiguillon»  d’un exécutif confronté à plusieurs crises (guerre en Ukraine, énergie,  climat). Appel à l’unité Pensé par M. Séjourné, en lien étroit avec le chef de l ...  "
345,2022-09-24,Le Monde,1188mots,Matthieu Goar,Retraites: Macron espère renouer avec son ambition réformatrice,"    ...  ne sont pas non plus favorables à cet empressement, craignant que cela n’altère le  climat social. L’Elysée, qui affirme n’avoir jamais privilégié aucune piste, renvoie maintenant vers Matignon. Jeudi ...  "
346,2022-09-13,Le Monde,49mots,,Politique L’exécutif face au risque de fracture sociale sur le climat,        ... Politique L’exécutif face au risque de fracture sociale sur le  climat  ...  
347,2022-09-17,Le Monde,33mots,,La sécheresse en France résiste à la fin de l’été,"        Après un été exceptionnellement chaud et sec, les restrictions des usages de l’eau devraient se poursuivre cet automne  ...  "
348,2022-10-26,Le Monde,1349mots,Corine Lesnes,"En Californie, l’aile gauche démocrate en appelle aux jeunes","    ...  Granda, étudiant en sciences politiques, fait la liste de tout ce qui l’inquiète. Le  climat:  «On en a assez de la sécheresse; on ne veut plus d’incendies.»  La démocratie:  «J ...  "
349,2022-09-13,Le Monde,1086mots,Cécile Prudhomme,"La chasse aux promos, nouvelle passion française","    ...  le 1er septembre, le gouvernement expérimente, dans onze collectivités, une mesure issue de la loi  Climat et résilience pour réduire le gaspillage, le système «Oui pub» qui restreint la réception des imprimés ...  "
350,2022-09-13,Le Monde,1066mots,Anne Vigna,Brésil: Lula en opération séduction auprès de l’électorat évangélique,"    ...  juillet, dans le sud du pays. Devant la presse, Lula s’est exprimé sur le  climat de  «haine politique qui devrait tous  [les]  inquiéter» , reléguant au passage la question des évangéliques, raison ...  "
351,2022-09-14,Le Monde,680mots,David Larousserie,Intégrité scientifique: les doctorants sous serment,"    ...  pensons qu’il ne pouvait répondre au manque d’intégrité, que nous attribuons plutôt au  climat de compétition, à la baisse des moyens, à la précarité dans les laboratoires…», indique Julie Crabot ...  "
352,2022-09-15,Le Monde,505mots,chronique par Anne Rodier,La sobriété a déjà son chef (ou presque),"    ...  pas avoir demandé de chief sobriety officer.  «Les postes extrêmement demandés sont ceux des responsables  climat dont une partie de la feuille de route a trait à la sobriété» , expliquetelle ...  "
353,2022-09-26,Le Monde,1013mots,Laurence Caramel,L’ombre de la Russie sur la brouille franco-malgache,"    ...  deuxième réunion devrait avoir lieu à Paris, le 3 novembre. Mais, en trois ans, le  climat des relations entre les deux pays s’est dégradé. Fin août, la rencontre entre les deux ...  "
354,2022-09-23,Le Monde,1307mots,Lilia Blaise,"En Tunisie, l’émigration clandestine s’intensifie","    Des femmes voilées de noir, un mouchoir entre les mains. Des chaises éparpillées devant les maisons pour les visiteurs venus présenter leurs condoléances. A Bouhajla, dans le centre de la Tunisie ...  "
355,2022-10-10,Le Monde,69mots,,Un objectif de neutralité carbone en2050 pour l’aviation,"        Un accord pour atteindrela neutralité carbone en2050 dans l’aviation civile mondiale a été conclu parles représentants des 193 Etats vendredi 7octobre, a annoncé l’Organisationde l’aviation civile ...  "
356,2022-10-12,Le Monde,831mots,Antoine Reverchon,Triple prix Nobel pour la science des crises bancaires,"    ...  négliger, à quelques exceptions près, les économistes à la pointe des préoccupations actuelles comme le  climat ou les inégalités, pour s’intéresser plutôt à des hommes âgés travaillant aux EtatsUnis sur ...  "
357,2022-10-31,Le Monde,1834mots,Propos recueillis par Stéphanie Le Bars,Matthijs Rooduijn «L’arrivée au pouvoir de l’extrême droite en Italie et en Suède n’est pas une surprise»,"    ...  trouve dans ces mouvements les tenants de théories du complot, comme celles, récentes, autour du  climat ou du Covid19. Qu’estce qui les distingue des mouvements des années 1930? Eux ...  "
358,2022-09-24,Le Monde,940mots,Perrine Mouterde,Un plan pour rattraper le retard sur l’éolien et le solaire,"    ...  l’ambition affirmée de miser sur les renouvelables pour faire face aux crises énergétique et  climatique, alors que la France est aujourd’hui l’un des mauvais élèves de l’Union européenne ...  "
359,2022-09-13,Le Monde,955mots,par Jean-Michel Bezat,Un patron d’EDF sous surveillance,"    ... elle d’un atout important (et fragile): le retour en grâce de l’énergie atomique en Europe, porté par l’embargo de la Russie sur son gaz, et l’urgence  climatique.  ...  "
360,2022-10-04,Le Monde,771mots,Marie Delcas,Les Etats-Unis échangent deux neveux de l’épouse Maduro contre six Américains,"    ...  l’histoire de la Colombie, les sujets ne manquent pas, du dossier migratoire au réchauffement  climatique, en passant par la politique antidrogue. Dès son investiture, le 7 août, M. Petro a évoqué ...  "
361,2022-10-03,Le Monde,830mots,Olivier Thébaud,Olivier Thébaud La pêche entre deux eaux,    ...  des pressions sur les écosystèmes marins et l’influence majeure des changements associés au réchauffement  climatique conduisent aujourd’hui l’humanité à s’interroger sur la vitesse à laquelle ces approches pourront ...  
362,2022-09-13,Le Monde,657mots,A. Fu,Les fonds à impact doivent encore faire leurs preuves,"    ...  à la gouvernance) des entreprises, ils visent un objectif précis, par exemple limiter le réchauffement  climatique, réduire les inégalités sociales, élargir l’accès à l’éducation, préserver la biodiversité, etc. Ils entendent ...  "
363,2022-09-30,Le Monde,452mots,par Philippe Escande,L’hydrogène et le spectre du photovoltaïque,"    ...  de la technologie et en l’occurrence celle liée à la lutte contre le réchauffement  climatique. Il faudra donc marier pertinence, constance et performance. Le secret d’une bonne politique industrielle en ...  "
364,2022-10-24,Le Monde,1109mots,"Julien Bouissou et Carole Dieterich(Correspondance, New Delhi) et Carole Dieterich(Correspondance, New Delhi)","A Pondichéry, les écologistes contre l’AFD","    ...  de Pondichéry, situé le long de l’océan Indien. Un phénomène aggravé par le changement  climatique, notamment la hausse du niveau de la mer.  «L’augmentation de la salinité a un impact ...  "
365,2022-09-15,Le Monde,1384mots,Jérôme Gautheret,Fratelli d’Italia aux portes du pouvoir,"    ...  à peine quatre mois, et l’expérience s’achève par un désastre politique, dans un  climat d’émeute. Mutation profonde Considéré comme infréquentable par la démocratie chrétienne, qui cependant ne rompt jamais ...  "
366,2022-09-19,Le Monde,5036mots,"Cécile Ducourtieux (Londres, correspondante),avec Isabelle Dellerba (Sydney, correspondance) et Hélène Jouan (Montréal, correspondante) Cécile Ducourtieux (Londres, correspondante),avec Isabelle Dellerba (Sydney, correspondance) et Hélène Jouan (Montréal, correspondante) Cécile Ducourtieux (Londres, correspondante),avec Isabelle Dellerba (Sydney, correspondance) et Hélène Jouan (Montréal, correspondante) Cécile Ducourtieux (Londres, correspondante),avec Isabelle Dellerba (Sydney, correspondance) et Hélène Jouan (Montréal, correspondante) Cécile Ducourtieux (Londres, correspondante),avec Isabelle Dellerba (Sydney, correspondance) et Hélène Jouan (Montréal, correspondante)",Commonwealth L’empire fantôme d’Elizabeth II,"    ...  Payette, contrainte à la démission, en janvier 2021, pour avoir imposé à ses collaborateurs un «climat de travail toxique», ou encore le reproche adressé par les Québécois à sa remplaçante, l’autochtone ...  "
367,2022-09-21,Le Monde,1183mots,Laurent Telo,Le retour périlleux d’Anne Hidalgo à la Mairie de Paris,"    ...  sujets anxiogènes.  «?Je reviens de Bruxelles, où j’ai rencontré le commissaire européen chargé du  climat. Ils veulent m’aider, c’est très agréable. Je pars bientôt à Berlin, puis à New ...  "
368,2022-09-16,Le Monde,1307mots,Raphaëlle Rérolle,Les dilemmes linguistiques des écrivains ukrainiens,"    ... ’est pas interdit en Ukraine, contrairement à ce qu’affirme la propagande du Kremlin,mais leur démarche reflète un  climat où la culture est fortement impliquée dans l’effort de guerre.  ...  "
369,2022-10-08,Le Monde,1276mots,Virginie Malingreet Philippe Ricard Virginie Malingreet Philippe Ricard,"A Prague, les Européens face à Vladimir Poutine","    ...  dont l’intitulé fait écho aux enjeux du moment: «Paix et sécurité» en Europe; «Energie,  climat et économie». Des axes de coopération future ont été identifiés: énergie, migration, jeunesse, cybersécurité et protection ...  "
370,2022-10-01,Le Monde,3655mots,Marion Dupont,"L’opposition, mauvais rôle de la politique française","    ...  Mathan . C’est comme si la divergence d’opinion n’était pas pensable: dans un  climat de peur généralisée et de dangers réels liés à la contrerévolution, elle est presque systématiquement ...  "
371,2022-10-27,Le Monde,35mots,,"L’art, cible des activistes du climat","        ... L’art, cible des activistes du  climat  ...  "
372,2022-10-31,Le Monde,3614mots,Nicolas Bourcier,"Turquie L’AKP, du projet de société au pouvoir solitaire","    ...  marche pour la paix. Le bilan s’élève à cent deux morts. Dans un tel  climat de violences, l’AKP est le seul parti en mesure de faire campagne. Avec son savoir ...  "
373,2022-10-12,Le Monde,1478mots,David Larousserie,"Alain Aspect, un Nobel quantique charismatique et pédagogue","    ...  partie du progrès. Conviction que je répète aujourd’hui?: on ne résoudra pas la crise  climatique sans la science.?» Ce qui le marque aussi à l’époque, outre les livres de Jules ...  "
374,2022-10-17,Le Monde,973mots,Arnaud Leparmentier,"Le plan de paix pour l’Ukraine d’Elon Musk, stratège autoproclamé","    ...  la migration sur Mars ou en développant la voiture électrique pour lutter contre le réchauffement  climatique. Il n’a pas à expier sa richesse brutalement acquise comme Carnegie, Rockefeller, Gates et Soros ...  "
375,2022-10-01,Le Monde,1019mots,Gaspard Estrada,Gaspard Estrada Un retour du Brésil sur la carte diplomatique serait plus que bienvenu,"    ...  la matrice économique du Brésil. D’autre part, en affirmant la centralité de l’urgence  climatique, tant sur le plan de la politique intérieure qu’extérieure. Il s’agirait de restaurer les ...  "
376,2022-09-30,Le Monde,1090mots,Florent Georgesco,Regarder se faire et se défaire les formes du monde,"    ...  lance pas d’alerte. Difficile pourtant d’en ressortir sans une conscience de la crise  climatique accrue, aiguisée par l’évidence du miracle précaire qui nous constitue et nous fait vivre. A ...  "
377,2022-10-06,Le Monde,167mots,,Programme Vers une nouvelle ère urbaine,        Comment les villes peuventelles agir face à la crise  climatique? Quelle place et quel rôle de la culture pour répondre au défi de la résilience? Quels droits reconnaître au fleuve? Quelle ...  
378,2022-10-10,Le Monde,858mots,Benoît Floc’h,L’Etat octroie une aide financière aux collectivités locales,"    ...  Borne, fin août, destiné aux collectivités locales pour les aider à lutter contre le changement  climatique. Enfin, la première ministre a promis de lancer  «très prochainement»  le chantier de la décentralisation du ...  "
379,2022-10-10,Le Monde,1328mots,Virginie Malingre et Philippe Ricard,Energie: les Européens au bord de la panique,"    ...  en péril les efforts de découplage avec la Russie et de lutte contre le réchauffement  climatique. Pour faire baisser les prix du gaz, qui sont plus élevés en Europe qu’en Asie ...  "
