,date,publication,words,author,title,intro
380,2022-10-15,Le Monde,125mots,,Crise des carburants: la tentation de la contagion,"        ...  A l’approche de la marche «contre la vie chèreet l’inaction  climatique» qu’elle organise dimanche, LFI cherche à tirer parti de cette effervescence sociale ▶ Chez TotalEnergies, la direction est parvenue ...  "
381,2022-10-19,Le Monde,712mots,Audrey Tonnelier,"L’ISF, «symbolede la politique pro-riches» de Macron, pris pour cible","    ...  cheffe de file des députés La France insoumise (LFI), Mathilde Panot, selon laquelle un ISF  climatique – indexé sur les émissions de CO2 – rapporterait 10 milliards d’euros par an.  «La politique fiscale ...  "
382,2022-10-19,Le Monde,896mots,é. Gi.,"Covoiturage, un succès à surveiller","    ... travail pourrait avoir de conséquences néfastes sur la qualité de l’air et le réchauffement  climatique. Dans un premier temps, cette pratique permet de s’affranchir de sa propre voiture pour se ...  "
383,2022-09-15,Le Monde,1186mots,Anthony Villeneuve,"En Moselle, la centrale à charbon Emile-Huchet prête à rouvrir","    ... (Moselle) devait s’arrêter définitivement trois jours plus tard. Une conséquence de la loi Energieclimat, qui, en limitant leur production annuelle à sept cents heures de fonctionnement, actait, de fait, la ...  "
384,2022-09-30,Le Monde,801mots,Antoine de Baecque,"La nostalgie, maladie mortelle devenue bénigne","    ...  occidentale. On lie d’abord ce mal – comme beaucoup de choses à l’époque – au  climat, en se fondant sur les effets différentiels de la pression atmosphérique; puis prédomine l’explication vitaliste ...  "
385,2022-09-28,Le Monde,1695mots,Corine Lesnes,"En Arizona, les républicains espèrent effacer 2020",    ... ’affrontement oppose la négationniste à la légitimiste. Difficile de voir une élection plus symbolique du  climat politique de 2022. L’Arizona est le «Ground Zero» du déni de la victoire de Joe ...  
386,2022-10-03,Le Monde,757mots,,Conseils pour faire sa mue,        ...  un copropriétaire s’instruire quelques heures auprès d’un maître composteur? L’Agence parisienne du  climat (APC) a par ailleurs conçu un guide très clair de toutes les bonnes pratiques – «La Gestion ...  
387,2022-10-05,Le Monde,1395mots,"Rémy Ourdan, Stéphanie Maupas et Philippe Ricard",Débat autour du «crime d’agression»,"    ...  de verrouillage par les membres permanents du Conseil de sécurité de l’ONU entretient le  climat d’impunité pour les agresseurs, surtout lorsque l’un des membres est impliqué.?» Des cinq membres ...  "
388,2022-10-07,Le Monde,793mots,Anne-Françoise Hivert,L’aide internationale et le climat dans le viseur des Démocrates de Suède,    ... L’aide internationale et le  climat dans le viseur des Démocrates de Suède  ...  
389,2022-10-14,Le Monde,491mots,Sophie Fay,Un protectionnisme d’intérêt général,    ...  aisés et les grands groupes. Faire appliquer un accord mondial sur la fiscalité ou le  climat prend des années voire des décennies. Il faut donc  «réinventer une nouvelle forme de souveraineté économique ...  
390,2022-10-28,Le Monde,156mots,,"Travail, sécurité: Macron adresse des signaux à la droite","        ...  entre immigration et insécurité, il juge l’immigration illégale «très présente dans la délinquance » et s’attaque à la question du  climat, d’abord sous l’angle de la reconquête industrielle .  ...  "
391,2022-10-05,Le Monde,988mots,par Françoise Fressoz,Les leçons du phénomène Rousseau,"    ... La montée continue des préoccupations liées au réchauffement  climatique donnait quelque crédit au pari. La stratégie, empreinte de bon sens, consistait à renforcer l’assise locale du mouvement avant de revendiquer la ...  "
392,2022-09-15,Le Monde,1137mots,collectif de personnalités du monde de la recherche et de la culture collectif de personnalités du monde de la recherche et de la culture,Préserver les sols autour des villes est une absolue nécessité,    ...  y compris ceux qui ne se sentaient pas encore concernés par les effets du dérèglement  climatique. Mais l’effroi qui nous saisit désormais tient moins à la sévérité de ces événements qu ...  
393,2022-09-19,Le Monde,41mots,,L’Italie sous le déluge,"        ...  personnes sont mortes, ces derniers jours, dans la région des Marches, frappée par de violents orages ▶ La question de la crise  climatique est la grande absente de l’actuelle campagne électorale  ...  "
394,2022-10-10,Le Monde,1346mots,L. Gi.,Premier coup de frein pour l’agriculture bio,"    ...  prix s’affiche au premier rang des préoccupations majeures des Français (54 %) devant le réchauffement  climatique (43?%), la guerre en Ukraine (32 %) et la crise sanitaire (11 %). Cet institut estime que depuis ...  "
395,2022-10-12,Le Monde,928mots,,«Réfléchissons à la prise de parole des chercheurs»,"        ...  scientifiques activistes, et sa difficultéà politiser de façon non partisane les enjeux de la crise  climatique fontdirectement écho à l’inquiétude croissante exprimée par les personnes interrogéesà propos du lien de confiance ...  "
396,2022-10-14,Le Monde,1072mots,Belinda Cannone,Belinda Cannone Un mouvement de libération potentiellement porteur de dérives,"    ...  contre la vague #metoo. Trop instrumentalisée, elle irrite ceux qu’inquiète à présent la crise  climatique ou la guerre. Et ceux qui pensent que la lutte si dangereuse des femmes iraniennes contre ...  "
397,2022-10-19,Le Monde,867mots,,Le vote du Parlement européen ôtera à l’hydrogène sa pertinence pour réduire nos émissions de gaz à effet de serre,"        ...  ne le serait pas nécessairement a été adopté par le Parlement… Outre la tromperie que cela constituerait pour le consommateur, cela génère une triple bombe à retardement:  climatique, financière et industrielle.  ...  "
398,2022-10-29,Le Monde,884mots,Philippe Gagnebet,"La Garonne, à un niveau très bas, s’en remet aux lâchers d’eau","    ...  2013, l’agence AdourGaronne travaille à un  «scénario 2050»  sur les effets du changement  climatique. Jeudi 27 octobre, il n’a fait «que» 24 °C à Toulouse, mais près de 30 ...  "
399,2022-09-12,Le Monde,1840mots,Pascale Krémer,Des écoliers sur le bon chemin,"    ...  moment de l’apprentissage final sur la voirie, souvent abandonné. La convention citoyenne pour le  climat avait envisagé le prêt de vélos à l’école, sur le modèle des manuels scolaires. Idée ...  "
400,2022-09-29,Le Monde,752mots,Perrine Mouterde,Nouveaux réacteurs nucléaires: les ONG critiquent l’exécutif,"    ...  appelé à se prononcer sur le texte dès le 5octobre. Pour le Réseau Action  Climat, le gouvernement agit «dans la précipitation en réduisant à néant le dialogue environnemental».  La Ligue pour ...  "
401,2022-10-03,Le Monde,1064mots,Isabelle Chaperon,"A la Société générale, le choix d’un patron de rupture",    ...  aux 117000 collaborateurs de désigner rapidement le nouveau responsable afin de sortir d’un  climat de flottement accentué par l’annonce du départ de la directrice des risques et de la ...  
402,2022-10-14,Le Monde,1224mots,Véronique Chocron,Le défi des passoires thermiquesen Ile-de-France,"    ...  2025, les «?F?» en 2028 et les «?E?» en 2034, comme le prévoit la loi  Climat et résilience.  «La situation devient compliquée lorsque la copropriété refuse les grosses rénovations, notamment pour les ...  "
403,2022-09-10,Le Monde,982mots,Jean-Pierre Stroobants,"En Belgique, la colère sociale gronde","    ...  Engagés (chrétiens démocrates) réclament une  «union nationale»  autour des questions de l’énergie et du  climat. Plafonnement du prix du gaz Le 30 août, une rencontre entre les pouvoirs régionaux et les ...  "
404,2022-10-15,Le Monde,1243mots,Rémi Dupré et Alexandre Pedro,Règlements de comptes à la Fédération française de football,"    ...  J’ai toujours entretenu des relations respectueuses avec mes collaboratrices et mes collaborateurs dans un  climat de confiance mutuelle. Ces allégations anonymes, à la fois mensongères et malveillante,s visent manifestement à ...  "
405,2022-09-27,Le Monde,1312mots,Aline Leclerc,Pouvoir d’achat: les salariés veulent leur dû,"    ...  pandémie de Covid19. Ce mouvement amorce une semaine capitale pour prendre le pouls du  climat social. Après l’effervescence du premier semestre, où les conflits se sont multipliés dans les entreprises ...  "
406,2022-09-29,Le Monde,1074mots,Coralie Pierret,RDC: la nouvelle force militaire régionale inquiète,    ... Cellesci vivent déjà dans un  climat de profonde instabilité depuis près de trente ans. Plus d’une centaine de milices et de groupes armés opèrent dans l’est congolais. Mais au ...  
407,2022-10-28,Le Monde,112mots,,Rima Abdul Malak juge «absurdes» les actions d’activistes dans les musées,"        ...  à la National Gallery de Londres.  «C’est terrible! Comment la logique de défense du  climat amène à vouloir détruire une œuvre d’art? C’est proprement absurde» , a déclaré la ministre ...  "
408,2022-10-06,Le Monde,1598mots,Élise Vincent,La France sommée de redéfinir sa présence militaire en Afrique,"    Le coup d’Etat qui secoue le Burkina Faso depuis le 30 septembre est un nouveau coup de semonce pour Paris, un peu plus d’un mois après le départ du ...  "
409,2022-10-01,Le Monde,109mots,,"Au Brésil, un vote crucial pour le pays et le climat","        ... Au Brésil, un vote crucial pour le pays et le  climat  ...  "
410,2022-10-14,Le Monde,693mots,Sylvie Lecherbonnier,Nette augmentation des atteintes à la laïcité depuis le deuxième semestre,    ...  concernés et la récurrence des faits  «peut contribuer ici ou là à la dégradation du  climat scolaire   » . Le port de signes et de tenues litigieuses augmente de 300 % entre l’année scolaire ...  
411,2022-09-12,Le Monde,26mots,,Un climat de fragilité,        ... Un  climat de fragilité  ...  
412,2022-09-28,Le Monde,162mots,,L’accélération du solaire et de l’éolien au menu du conseil des ministres,"        ...  le combat du nucléaire contre les renouvelables, ni le combat de la biodiversité contre le  climat, mais celui des énergies décarbonées contre les fossiles», a assuré la ministre. Le texte sera débattu ...  "
413,2022-10-19,Le Monde,797mots,,Chantal Jouanno Le débat sur le nucléaire est empreint de défiance car les politiques ont été marquées par le secret [...],        ...  doit désormais vraiment éclairer les parlementaires qui devront écrire la prochaine loi de programmation énergie  climat. Les décisions ne pourront pas être prises dans le dos du public et des parlementaires. Je ...  
414,2022-09-20,Le Monde,546mots,Dominique Gallois,Spatial: la France investit 9milliards d’euros,"    ...  sur trois ans seront investis dans les lanceurs (Ariane 6), la compétitivité industrielle, l’exploration, le  climat et la défense. Soit quasiment 25% de plus que lors des trois précédentes années.  ...  "
415,2022-09-15,Le Monde,584mots,,Fin de vie : un débat délicat mais nécessaire,"        ...  Tout doit être fait pour que les déceptions soulevées par la convention citoyenne pour le  climat de 2020 ne se renouvellent pas. La nouvelle consultation pourra être utile au pays, à condition ...  "
416,2022-09-26,Le Monde,1275mots,Bruno Meyerfeld et Anne Vigna,Election présidentielle au Brésil: la désinformation à plein régime,"    ...  cette avalanche de fake news est la manière dont elle a pu peser sur le  climat de la campagne électorale. Au Brésil, la violence a envahi la toile, mais aussi les rues ...  "
417,2022-10-08,Le Monde,948mots,Jean-Pierre Stroobants,La Belgique coupe les vivres à l’organe de gestion du culte musulman,"    ...  notamment le paiement des imams et des professeurs ou des aumôniers de prison. Dans un  climat plus que tendu: le président de l’EMB, Mehmet Ustun, en a appelé à la séparation ...  "
418,2022-09-17,Le Monde,951mots,Laurence Boccara,Acheter une maison de campagne entre amis,"    ...  On voit surgir progressivement des tensions susceptibles de mener à des fâcheries. Or, dans un  climat dégradé, la cohabitation devient impossible et il faut vendre. Et souvent, on ne se revoit plus ...  "
419,2022-09-16,Le Monde,54mots,,Violent typhon en Chine,"        Porteur de vents violents et de fortes pluies, le typhon Muifa a frappé, jeudi 15?septembre, la côte est de la Chine, provoquant l’évacuation de plus de 1?million de ...  "
420,2022-09-24,Le Monde,2082mots,Louis Imbert,L’Autorité palestinienne dans le piège de la répression,"    ...  des poursuites, et quasiment aucune à la condamnation des auteurs, ce qui contribue à un  climat d’impunité.»  Selon, Ammar AlDwaik, directeur de la commission, qui visite ces centres de détentions ...  "
421,2022-10-12,Le Monde,1402mots,Emmanuel Grynszpan et Rémy Ourdan,"«Poutine veut nous terroriser, mais nous n’avons plus peur»","    ...  où les Kiéviens aiment déambuler, ne s’expliquent que par la volonté d’instaurer un  climat de terreur. Les deux missiles autour du parc ont atterri l’un près de l’université ...  "
422,2022-10-21,Le Monde,778mots,"Marjorie Cessac, Aline Leclerc et Richard Schittly(Lyon, correspondant) et Richard Schittly(Lyon, correspondant)",Le mouvement de grève s’essouffle dans les raffineries de TotalEnergies,"    ...  de trois semaines, cela a été très dur et il est temps d’apaiser le  climat”,  rapporte M. Sellini . Mais si la direction veut reprendre le travail avec des gens qui ne ...  "
423,2022-10-24,Le Monde,795mots,Joël Morio,Fin d’année difficile pour les particuliers à la recherche d’un crédit,"    ...  de l’offre bancaire, plus particulièrement auprès d’une clientèle modeste déjà fragilisée par le  climat anxiogène actuel et par une perte de pouvoir d’achat» , note l’observatoire Crédit logementCSA ...  "
424,2022-09-12,Le Monde,761mots,Philippe Pons,La nouvelle doctrine nucléaire de la Corée du Nord envisage des frappes préventives,"    ...  ce qu’il survienne avant le congrès du Parti communiste chinois, le 16 octobre. Le  climat conflictuel entre les EtatsUnis et leurs alliés, d’une part, et la Russie et la ...  "
425,2022-09-19,Le Monde,1022mots,Ivanne Trippenbach,"Edouard Philippe, une rentrée entre deux eaux","    ...  de plusieurs ministres et cadres de la majorité. Derrière les politesses, tous savent que le  climat politique est bien moins amical qu’il n’y paraît.  «La liberté d’Edouard Philippe lui ...  "
426,2022-09-21,Le Monde,616mots,émilie Grangeray,"Anne Sinclair, l’intervieweuse interviewée","    ...  a eus avec le journaliste Ivan Levaï, l’un très engagé dans la défense du  climat, quand l’autre se lance dans l’agriculture biologique. Elle dit aimer les tribus, et s ...  "
427,2022-09-21,Le Monde,1322mots,Jérôme Gautheret,Italie: les milieux d’affaires penchent pour Meloni,"    ...  et l’autre ont tout intérêt à ce que la transition se fasse dans un  climat apaisé. Or, les milieux d’affaires, eux aussi, ont horreur des soubresauts et des embardées.  ...  "
428,2022-10-14,Le Monde,80mots,,BASF annonce un plan d’économies de 1 milliard d’euros,"        ...  et 2024, avec un accent mis sur l’Europe, en raison de la détérioration du  climat économique. Plus de la moitié des économies doivent être réalisées sur le complexe de Ludwigshafen (ouest ...  "
429,2022-10-15,Le Monde,1283mots,Propos recueillis parJean-Michel Bezat Propos recueillis parJean-Michel Bezat et Marjorie Cessac,Energie chère: «Il y a un risque de délocalisation»,"    ...  Ne redoutezvous pas, comme chez TotalEnergies et EDF, des conflits salariaux chez Engie? Le  climat social est toujours difficile à anticiper, et chaque groupe a ses propres enjeux. Depuis le début ...  "
430,2022-10-21,Le Monde,888mots,Olivier Bonnel,Italie: Berlusconi «renoue» avec Poutine et embarrasse la coalition,"    ...  presse transalpine, toutes tendances politiques confondues, s’est fait l’écho avec atterrement de ce  climat délétère au sein de la future coalition au pouvoir.  «Silvio, arrêtetoi!»,  a exhorté le quotidien ...  "
431,2022-10-21,Le Monde,909mots,Olivier Pinaud,"Chez SFR, la fébrilité gagne tous les étages","    ...  nouveau PDG de SFR, et les représentants du personnel se sont déroulés dans un bon  climat, selon plusieurs sources.  «Il s’est dit à l’écoute, ouvert à la discussion et conscient ...  "
432,2022-10-24,Le Monde,938mots,,"Christophe Clergeau, Olivier Faure et Sylvie Guillaume Bâtir un nouveau projet européen avec Olaf Scholz","        ...  transparence, le contrôle et l’élaboration démocratique des choix européens. La mobilisation pour sauver le  climat et réussir la transition écologique et énergétique d’une part, l’ambition en matière de justice ...  "
433,2022-10-01,Le Monde,2049mots,Isabelle Chaperon,EDF ou l’histoire d’un naufrage français,"    ...  dans sa bulle» , lâche l’un d’entre eux. De quoi expliquer en partie le  climat délétère qui s’est installé avec l’Autorité de sûreté nucléaire (ASN).  «EDF n’a informé ...  "
434,2022-09-29,Le Monde,1197mots,Martine Valo,Une technique redoutable pour les fonds marins crispe les pêcheurs,"    ...  députés et sénateurs: voilà pour la mobilisation à terre des pêcheurs français, tandis que le  climat se tend en mer.  Cette fois, c’est l’arrivée dans la Manche de la senne ...  "
435,2022-10-03,Le Monde,880mots,Sophie Douce,Burkina Faso: Damiba le putschiste renversé par un nouveau coup d’Etat,"    ...  soldats encagoulés bloquant les axes stratégiques de la ville. Puis l’attente, longue, dans un  climat de confusion, jusqu’à l’apparition sur les écrans de télévision des nouveaux visages de ceux ...  "
436,2022-10-05,Le Monde,1597mots,Propos recueillis par Propos recueillis par Julie Carriatet Sandrine Cassini Julie Carriatet Sandrine Cassini,Bayou: «C’est un dévoiement du féminisme»,"    ...  n’est pas prête, ni aux incendies ni à la pénurie d’eau. Face au  climat comme enjeu de sécurité nationale, on est vulnérables. Estce qu’on organise la métamorphose pour ...  "
437,2022-09-27,Le Monde,953mots,par Jean-Michel Bezat,Chine et Occident en phase de découplage,"    ... Citroën. Carlos Tavares n’a pas hésité à dénoncer, fin juillet,  «une nette politisation du  climat des affaires depuis quatre ou cinq ans». La fin de l’eldorado chinois Et quelles menaces ...  "
438,2022-09-22,Le Monde,543mots,par Jules Thomas,"«Team bonding», des liens qui libèrent","    ...  les salariés développeront la confiance et l’empathie envers leurs congénères, ce qui favorise un  climat social plus apaisé. Le  team bonding  cherchera des moments d’exception, où l’on se lâche ...  "
439,2022-10-18,Le Monde,834mots,Eliane Assassi Arnaud Bazin,Le gouvernement n’est pas au rendez-vous en matière de transparence,"    ...  plus que doublé depuis 2018. Nous devons également sortir de l’opacité, qui alimente un  climat de suspicion: les citoyens sont en droit de connaître les missions «déléguées» à des prestataires privés ...  "
440,2022-10-14,Le Monde,734mots,Jean-Michel Bezat et Sophie Fay,"Dans la filière nucléaire et à la SNCF, le risque de la contagion","    ... ’électricité en France, déjà fragilisés par l’envolée des prix du mégawattheure. C’est un  climat social tendu que le nouveau PDG d’EDF, Luc Rémont, trouvera à son arrivée au siège ...  "
441,2022-10-13,Le Monde,791mots,Christine Berkovicius,Ciretec: plan social après un incendie,"    ...  ministère de l’industrie. En vain. La négociation du plan social s’achève, dans un  climat tendu. La direction a proposé des reclassements dans d’autres unités, à Châteaubourg, près de Rennes ...  "
442,2022-10-22,Le Monde,122mots,,Planification écologique: Borne expose sa méthode,"        ...  signal positif, quitte à s’atteler au sujet à la hâte  ▶ Bien que devenu l’une des grandes inquiétudes des Français, le  climat peinait jusqu’alors à trouver son temps politique  ...  "
443,2022-09-15,Le Monde,892mots,Gaétan Supertino,Prosélytisme,    ...  toujours eu la connotation négative qui est la sienne aujourd’hui.  «C’est dans le  climat de conflit et de polémique du XIXe siècle entre les porteurs d’idéologies laïques et les ...  
444,2022-09-16,Le Monde,1216mots,Rémi Dupré et Alexandre Pedro,"Noël Le Graët, président fragilisé de la FFF",    ...  fin du troisième mandat de M. Le Graët par l’accumulation des affaires et le  climat toxique qui régnerait boulevard de Grenelle.  «Mais une ingérence de l’Etat dans la FFF avec ...  
445,2022-09-24,Le Monde,911mots,Philippe Escande,Une histoire de l’abondance,"    ... tsé ont anéanti les efforts de développement. Les plantes, les animaux à domestiquer et le  climat favorable ont poussé au développement des premières civilisations au sud de la Turquie et le long ...  "
446,2022-10-12,Le Monde,919mots,J. Th.,"Dans la publicité, le mouvement a fait bouger quelques lignes, sans supprimer l’impunité",    ...  interrogés affirmaient avoir été victimes de harcèlement sexuel en agence. La nécessité de changer ce  climat toxique apparaît d’autant plus urgente qu’il pourrait faire fuir des nouvelles générations plus engagées ...  
447,2022-10-07,Le Monde,751mots,Mathilde Gérard,Adoption d’un amendement ciblant les associations de protection animale,"    ... Quarante associations (dont Greenpeace, Oxfam, Réseau Action  Climat, la Ligue pour la protection des oiseaux, Compassion in World Farming, etc.) ont signé un communiqué commun dénonçant une tentative de  «museler la société ...  "
448,2022-10-08,Le Monde,923mots,Ludovic Clerima,"Acheter en zone inondable, un choix risqué","    ... ’alourdit.» Selon la fédération professionnelle France Assureurs, le coût annuel moyen des sinistres liés au  climat, inondations comprises, est passé d’un peu plus de 1 milliard d’euros dans les années ...  "
449,2022-10-01,Le Monde,956mots,,Odilon Caldeira Neto Les menaces qu’agite Jair Bolsonaro contre la démocratie font partie d’un projet politique,"        ...  Voyant que le processus électoral est à son désavantage, Jair Bolsonaro cherche à créer un  climat de méfiance pour s’attacher et radicaliser son électorat, qui représenterait aujourd’hui entre 20% et ...  "
450,2022-10-05,Le Monde,711mots,Martial Foucault(professeur à Sciences Poet directeur du Cevipof) Martial Foucault(professeur à Sciences Poet directeur du Cevipof) Martial Foucault(professeur à Sciences Poet directeur du Cevipof),La guerre en Ukraine réveille le sentiment européen,    ...  que la contestation des démocraties libérales. Ces attaques contre le système politique occidental installent un  climat anxiogène chez près de neuf Français sur dix. Une unanimité qui transcende largement les positionnements idéologiques ...  
451,2022-10-11,Le Monde,812mots,A. Bs,"Dans les départements où le prédateur arrive, les éleveurs en colère","    ...  Quelque 150 d’entre eux s’étaient rassemblés à Mende, lundi 26 septembre, dans un  climat tendu. En réponse, le préfet promettait, le jour même, des tirs de prélèvement, devenus très rares ...  "
452,2022-10-24,Le Monde,165mots,,Notre sélection Dimanche 23 octobre Lundi 24 octobre,"        ...  Jane, l’Amérique selon Fonda  22.50Féministe et activiste historique, l’actrice Jane Fonda, surnommée «L’Insoumise du  climat», est l’objet de ce documentaire réalisé en 2020 par Florence Platarets.   ...  "
453,2022-10-04,Le Monde,3613mots,Mariama Darame (À Paris)et Solenn de Royer Mariama Darame (À Paris)et Solenn de Royer,"Yaël Braun-Pivet, présidente non alignée de l’Assemblée","    ...  couple a deux enfants, dont Yaël, née à Nancy en 1970, qui grandit dans un  climat de  «confiance et d’amour» . Modeste, la famille vote à gauche, respecte les fêtes juives. Elle ...  "
454,2022-09-28,Le Monde,1062mots,Gilles Gressani,"Gilles Gressani La cheffe de Fratelli d’Italia n’incarne pas le retour du fascisme, mais l’apparition d’une nouvelle formule politique","    La victoire nette de Giorgia Meloni et de son parti, Fratelli d’Italia, donne une majorité parlementaire absolue à une coalition dite «de centre droit», qui, malgré de fortes contradictions internes ...  "
455,2022-10-19,Le Monde,929mots,Philippe Jacqué et Jean-Pierre Stroobants,L’OTAN teste en Europe ses capacités de dissuasion nucléaire,"    ...  cet exercice mené par l’OTAN en novembre était tellement réaliste et ce, dans un  climat international tendu entre les Américains et les Russes, que l’étatmajor soviétique pensait qu’une ...  "
456,2022-10-06,Le Monde,1539mots,Philippe Jacqué et Virginie Malingre Philippe Jacqué et Virginie Malingre,Les Européens en quête d’une Communauté,"    ...  ont donc été planifiées – «la paix et la sécurité» d’une part, «l’énergie, le  climat et l’économie» d’autre part –, avec le plus grand soin, là aussi, pour ne pas ...  "
