,date,publication,words,author,title,intro
82,2018-02-21,Les Echos,513mots,JOEL COSSARDEAUX,Danone muscle son offensive dans le bio,"    ...  contrer les facteurs qui dégradent les capacités nourricières des terres, notamment les effets du réchauffement  climatique et l'appauvrissement de la biodiversité ambiante. Il s'agit aussi de favoriser le bienêtre ...  "
83,2018-03-26,Les Echos,1703mots,RICHARD HIAULT,L'énergie sous-marine face aux courants contraires,"    ...  Quelque peu délaissée, l'énergie marine, propre, retrouve une seconde jeunesse. La luttecontre le réchauffement  climatique est passée par là. « Le site d'essais Seeneoh permet de tester les technologies avant une ...  "
84,2018-04-27,Les Echos,137mots,,Présidence du Medef : trois des neuf candidats se rassemblent,"        ...  le plus jeune de tous les candidats, président d'une TPE spécialisée dans la transition  climatique, Pierre Brajeux, président du Medef des HautsdeSeine, et Patrick Martin, président du Medef Auvergne ...  "
85,2018-04-20,Les Echos,740mots,DOMINIQUE SEUX,"Brice Couturier : « En réalité, ce libéral est très modéré »","    ...  la gestion à court terme et par l'horizon à vingt ans : dette publique, réchauffement  climatique, etc. C'est, à mon avis, la vraie signification du « en même temps » au sens de ...  "
86,2018-02-23,Les Echos,1787mots,MARIE-JOSEE COUGARD|EMMANUEL GRASLAND|DAVID BARROUX,Thierry Blandinières : « Il ne faut pas diaboliser la mondialisation de l'agriculture »,    ...  le Maroc ne pourront pas produire suffisamment de céréales pour leurs populations avec le réchauffement  climatique. C'est la France la mieux placée pour répondre à leurs besoins. Entre la demande des ...  
87,2018-03-20,Les Echos,590mots,OLIVIER KLEIN,Pour un capitalisme partenarial,    ...  la moindre sécurité des produits ou l'obsolescence accélérée qui leur est imposée. L'environnement  climatique est aussi l'un des impacts des choix des entreprises. Ces partenaires doivent donc pouvoir être ...  
88,2018-03-29,Les Echos,740mots,HUBERT VIALATTE,"Patrick Poirrier, chocolatovore !","    ...  où la pluviométrie devient plus erratique. Nous devons tenir compte de l'impact du changement  climatique »,  poursuit Patrick Poirrier, qui souhaite, par ailleurs, via la WCF, accroître la professionnalisation des planteurs : adaptation ...  "
89,2018-04-03,Les Echos,1657mots,VINCENT COLLEN|DAVID BARROUX|NICOLAS BARRE,Patrick Pouyanné : « Je suis le premier VRP de Total »,    ...  rôle central aussi bien dans l'évolution de nos marchés qu'en matière d'enjeu  climatique ces prochaines années. Nous ne voulons pas seulement être un producteur mais être présents sur toute ...  
90,2018-04-13,Les Echos,406mots,LES ECHOS,Aide au développement : la France remonte la pente,"    ...  aux projets soutenus, l'AFD a mis l'accent sur la lutte contre le changement  climatique et ses conséquences, qui a bénéficié de plus de 4 milliards d'euros, dont 1 milliard ...  "
91,2018-04-24,Les Echos,271mots,JACQUES HUBERT-RODIER,Le Canada lance la bataille contre le plastique,"    ...  D'après le quotidien de Montréal, la ministre fédérale de l'Environnement et du Changement  climatique, Catherine McKenna, vient de lancer à Eastern Passage en NouvelleEcosse une vaste consultation nationale pour ...  "
92,2018-02-22,Les Echos,398mots,CECILE CORNUDET,"Anne Hidalgo, la voie bouchée","    ... àvis d'Emmanuel Macron.  « Il écoute, il est leader sur les questions de changement  climatique »  , louetelle sur Public Sénat.  « Depuis 2015, l'ouverture dominicale des commerces a apporté une ...  "
93,2018-04-09,Les Echos,194mots,YANN VERDO,Des sommets de plus en plus colonisés,    ...  montagnes. Et ce n'est pas une bonne nouvelle. Car c'est bien le réchauffement  climatique qui en est la cause et elle fait partie de ce que les experts appellent la ...  
94,2018-02-13,Les Echos,466mots,MICHEL DE GRANDI,Franck Galland : « Les autorités du Cap n'ont pas assez anticipé »,"    ...  la planification. Le Cap dépendait de ressources souterraines et de réserves de surface. Le réchauffement  climatique aidant, les nappes souterraines se sont progressivement asséchées et les réserves des barrages n'ont pas ...  "
95,2018-03-13,Les Echos,460mots,GUILLAUME BENOIT,L'introduction en Bourse de Saudi Aramco de nouveau reportée,"    ...  justice cinq grandes compagnies pétrolières, en raison de la menace que fait peser le réchauffement  climatique. Londres, qui a accepté, malgré la controverse, d'assouplir ses règles de cotation pour Aramco, serait ...  "
96,2018-04-18,Les Echos,85mots,,Le transport maritime s'engage à réduire de moitié ses émissions carbone,"        ... 'industrie du transport maritime fixe des objectifs chiffrés en matière de lutte contre le changement  climatique. La marine commerciale représente de 2 à 3 % des émissions mondiales de CO2, selon les sources ...  "
97,2018-01-17,Les Echos,398mots,LAURENCE BOISSEAU,BlackRock appelle les entreprises à agir pour le bien commun,"    ...  de la croissance lente des salaires à l'automatisation croissante, en passant par le changement  climatique  affectent votre potentiel de croissance. » Cela peut sembler surprenant, mais BlackRock rappelle aux sociétés la nécessité ...  "
98,2018-03-22,Les Echos,484mots,ALEXANDRE COUNIS,Le Lloyd's de Londres essuie sa première perte en six ans,"    ...  impossible de prédire les prochaines catastrophes naturelles, Inga Beale en est déjà convaincue : leur fréquence et leur gravité risquent fort de s'accentuer sous l'effet du réchauffement  climatique. Alexandre Counis  ...  "
99,2018-01-24,Les Echos,117mots,ISABELLE COUET,Les prix du soja devraient baisser,"    ...  record l'an passé, ont encore un fort niveau d'emblavements. En conséquence,  « sauf accident  climatique, les prix du soja devraient enfin baisser »,  avance CyclOpe, qui anticipe un repli de 15 % en ...  "
100,2018-02-01,Les Echos,33mots,,La finance priée de se mettre au vert,"        Mandatés par Bruxelles, des experts avancent 24 propositions pour inciter la finance à se mettre au diapason de la lutte contre le changement  climatique.  ...  "
101,2018-01-23,Les Echos,928mots,JEAN-MARC VITTORI,Des entreprises au service du bien commun ?,"    ... 'argument financier vont main dans la main  » . Les entreprises prennent la main sur la question  climatique, poussées par des investisseurs de plus en plus réticents à financer la saleté. Dans une tribune ...  "
102,2018-03-07,Les Echos,577mots,GUILLAUME BENOIT,Les places européennes en avance sur les « green bonds »,"    A l'heure où les appels à trouver des fonds pour permettre la transition  climatique se multiplient, la finance verte est devenue un enjeu de compétition entre les places financières. Mais il ...  "
103,2018-02-21,Les Echos,502mots,MARION KINDERMANS,Une bibliothèque 4.0 pour l'Esiee,"    ... 'euros. Schlumberger ou la startup Bodycap y font des essais, tout comme SenseCity, la miniville  climatique, qui sera inaugurée dans quelques semaines à la Cité Descartes. Marion Kindermans  ...  "
104,2018-03-21,Les Echos,641mots,PIERRE DE VILLIERS|MARTIN DEMPSEY|NICK HOUGHTON,Faire face ensemble à la dangerosité du monde,"    ...  posent au niveau mondial, qu'il s'agisse du terrorisme, des inégalités sociales, du réchauffement  climatique ou de l'immigration de masse. Les responsables internationaux sont de plus en plus absorbés par ...  "
105,2018-02-21,Les Echos,1900mots,ISABELLE FICEK|ELSA FREYSSENET,Migrants : l'histoire du changement de pied de Macron,"    ...  frontière entre réfugiés politiques et migrants économiques devient intenable, à l'heure où le changement  climatique va pousser des populations entières à se déplacer, se sont sentis trahis. Et un député LREM ...  "
106,2018-01-12,Les Echos,751mots,MARJORIE CESSAC,"Mathias Pellissard, vigneron du monde","    ...  Inde, cela a pris du temps. Mais désormais cela roule. »  Enfin presque. Car le changement  climatique vient s'en mêler. A Bangalore, la mousson est moins abondante qu'il y a cinq ...  "
107,2018-03-28,Les Echos,396mots,MARTINE ROBERT,"Au Grand Palais, Hopscotch creuse le sillon des salons engagés","    ...  à présenter à un large public toutes les solutions permettant d'agir contre le réchauffement  climatique, attirant en marge de la COP21 plus de 40.000 visiteurs, dont beaucoup de jeunes. Le ...  "
108,2018-04-23,Les Echos,431mots,RICHARD HIAULT,Le FMI s'alarme du regain d'endettement dans les pays pauvres,"    ...  la France, comme l'a rappelé Bruno Le Maire lors d'une conférence de presse, vendredi soir, touten précisant souhaiter queles projets de lutte contre le réchauffement  climatique soientprivilégiés. R. H.  ...  "
109,2018-01-31,Les Echos,495mots,JOEL COSSARDEAUX,La France n'en fait toujours pas assez,"    ...  cinq dernières centrales électriques au charbon encore en activité. Ces dates couperets bornent le plan  climat conçu par Nicolas Hulot pour désintoxiquer la société de ces énergies fossiles, qui rejettent des particules ...  "
110,2018-01-22,Les Echos,342mots,GUILLAUME MAUJEAN,Le jeu dangereux de Trump avec Wall Street,"    ...  et diplomatiques. Mais il n'a fait dérailler ni l'économie ni les marchés. Le  climat des affaires reste au plus haut, le taux de chômage est bien parti pour casser le ...  "
111,2018-01-23,Les Echos,422mots,NATHALIE HAMOU,Mike Pence accueilli en héros en Israël,    ...  Palestine » . Il est vrai que la visite de Mike Pence s'est déroulée dans un  climat tout sauf harmonieux. Non seulement les dirigeants palestiniens ont décidé de boycotter la tournée du vice ...  
112,2018-02-12,Les Echos,427mots,MICHEL DE GRANDI,La Colombie veut mieux contrôler l'afflux de migrants vénézuéliens,"    ...  continuer à démanteler la démocratie vénézuélienne » .  Ce dernier, en fin de semaine et afin d'apaiser le  climat, se disait prêt à reprendre le dialogue avec l'opposition. Michel De Grandi  ...  "
113,2018-02-07,Les Echos,464mots,GUILLAUME MAUJEAN,L'épreuve du feu pour la Fed,"    ...  cent mois d'expansion d'affilée, la troisième séquence la plus longue depuis 1854. Le  climat des affaires s'est redressé dans tous les secteurs, en particulier dans l'industrie. Les résultats ...  "
114,2018-01-16,Les Echos,799mots,LAURENCE BOISSEAU,Gouvernance : les évolutions à attendre pour 2018,"    ...  auprès de la société en général ? Quel est son impact sur l'environnement, sur le  climat ? Jouetelle un rôle dans l'innovation technologique ? Ce n'est que si elle répond ...  "
115,2018-03-16,Les Echos,793mots,ALEXANDRE COUNIS|DIDIER BURG,Unilever rapatrie son siège londonien aux Pays-Bas,"    ...  choix d'Unilever, les autorités néerlandaises, elles, en soulignaient l'importance. «  Cette décision prouve le  climat d'investissement favorable aux PaysBas à l'égard des multinationales  », s'est félicité le ministre ...  "
116,2018-03-23,Les Echos,58mots,,ALLEMAGNE : LE CLIMAT DES AFFAIRES S'ALTèRE,        ... ALLEMAGNE : LE  CLIMAT DES AFFAIRES S'ALTèRE  ...  
117,2018-03-23,Les Echos,689mots,ROGER-POL DROIT,Faut-il être dur avec les médecines douces ?,"    ...  la bombe atomique, ses capacités destructrices. Au XXIe siècle, les effets des technosciences sur le  climat, l'alimentation, la qualité de vie se révèlent porteurs de catastrophes possibles. Dès lors, à tort ...  "
118,2018-03-07,Les Echos,567mots,MARION KINDERMANS,"A Paris, le chauffage public passe sous contrôle numérique",    ...  Ce pilotage numérique des bâtiments est une des briques pour atteindre les objectifs du Plan  climat : 30 % d'économie d'énergie d'ici à 2020 et la neutralité carbone du territoire en ...  
119,2018-03-19,Les Echos,688mots,VERONIQUE LE BILLON,Trois mois de débats sur la transition énergétique,"    ...  Bringault, qui coordonne les associations, de Greenpeace à WWF en passant par le Réseau Action  Climat ou France Nature Environnement. L'éléphant au milieu de la pièce Comme depuis le lancement des ...  "
120,2018-04-23,Les Echos,706mots,PIERRICK FAY,Petite poussée de fièvre sur les marchés obligataires,"    ...  Carmignac,  « le marché est trop confiant sur le financement du déficit américain »  surtout  « dans un  climat de guerre commerciale » . Les tensions sur les taux américains ont aussi pesé sur les taux dans ...  "
121,2018-04-23,Les Echos,525mots,ELSA CONESA|NICOLAS RAULINE,Macron à Washington pour célébrer son entente avec Trump,"    ...  seront aussi attendus sur le financement du terrorisme, la Syrie, la Corée du Nord, le  climat et la question de l'extraterritorialité. Pour autant, ni Paris ni Washington ne disent s'attendre ...  "
122,2018-01-25,Les Echos,423mots,MATTHIEU QUIRET,Une vingtaine de PME financées par un nouveau fonds vert parisien,"    ...  le recyclage des déchets, etc. «  Les sociétés devront démontrer leur contribution aux objectifs du plan  climat de Paris  », ajoute la Mairie. Cet impact sera mesuré par le cabinet spécialisé Carbone 4. Le ...  "
123,2018-01-26,Les Echos,1639mots,GUILLAUME MAUJEAN|FRANCOIS VIDAL|GUILLAUME BENOIT,Interview // Stéphane Boujnah : « La dette française est une bombe à retardement »,"    En ce début d'année, quel regard portezvous sur le  climat des affaires en France ? Il y a un retour indéniable de la croissance, comme le montrent les bons chiffres du ...  "
124,2018-02-07,Les Echos,513mots,GREGOIRE POUSSIELGUE,Macron se débat avec les nationalistes corses,"    ...  à Claude Erignac.  « Le préfet Erignac savait qu'il venait en Corse pour dissiper un  climat de confusion et d'incertitudes. Vingt ans plus tard, la République doit conserver cette ambition de ...  "
125,2018-02-12,Les Echos,935mots,GUILLAUME MAUJEAN,La chute de la Bourse peut-elle dégénérer en krach ?,    ...  jamaisvu depuis une dizaine d'années. Les enquêtes de confiance et les indicateurs de  climat des affaires sont au beau fixe. Il y a bien quelques nuages à l'horizon  le ...  
126,2018-01-26,Les Echos,315mots,DEREK PERROTTE,Electricité : aide record de Bruxelles pour relier la France et l'Espagne,"    ...  du marché unique de l'énergie »  , insiste le commissaire européen à l'action pour le  climat, l'Espagnol Miguel Arias Cañete. Doubler la capacité d'échange Cette interconnexion, longue de 280 kilomètres ...  "
127,2018-03-19,Les Echos,33mots,,POUTINE RééLU DANS UN CLIMAT DE GUERRE FROIDE,        ... POUTINE RééLU DANS UN  CLIMAT DE GUERRE FROIDE  ...  
128,2018-02-22,Les Echos,512mots,NICOLAS RAULINE,Vives spéculations autour du rythme de hausse des taux de la Fed,"    ...  marchés. Les gigantesques besoins de financement de Washington, sur fond de réformes Trump, créent un  climat d'inquiétude. Biais plus agressif de la Fed Lors de la dernière réunion du comité de ...  "
129,2018-02-27,Les Echos,518mots,MARTINE ROBERT,Bataille pour le Zénith de Nantes,    ...  je sais où mon coeur balance... à #Nantes et ses élus de bien choisir. » Le  climat de tension extrême autour de cet appel d'offres inquiète le milieu de la musique. « Cela ...  
130,2018-02-14,Les Echos,518mots,PHILIPPE BERTRAND,Le scandale Steinhoff secoue l'économie sud-africaine,"    Le scandale Steinhoff n'allège pas le  climat en Afrique du Sud. Le groupe d'ameublement et de distribution textile se classe, selon « Forbes », à la deuxième place des entreprises du pays ...  "
131,2018-02-15,Les Echos,388mots,CECILE CORNUDET,Le service mal engagé,"    ...  obligatoire du dispositif; Gérard Collomb la contredit. La mesure mal engagée devient cafouillage, dans un  climat budgétaire toujours aussi contraint. Premier bilan d'étape : les idées les plus évidentes ne sont pas ...  "
132,2018-04-26,Les Echos,376mots,CECILE CORNUDET,"Macron, l'homme de l'antithèse","    ...  amitié » avec le président américain pour l'amener à de meilleures intentions politiques, sur le  climat, sur la relation avec l'Iran, notamment. Mais il joue en même temps de l'inquiétude ...  "
133,2018-04-10,Les Echos,89mots,,Fonction publique : le chantier du dialogue social lancé,"        ...  gouvernement, qui porte sur la simplification du dialogue social, a été lancé lundi dans un  climat de défiance à l'égard de l'exécutif. Celuici veut réduire le nombre d'instances ...  "
134,2018-04-09,Les Echos,639mots,PIERRE-ALAIN FURBURY,Faure construit l'identité du nouveau PS contre Macron,"    ...  de Jean Jaurès, et ne citant François Hollande que pour saluer son action sur le  climat, Olivier Faure a promis une  « renaissance intellectuelle et programmatique »  qui tire  « les leçons de l'échec ...  "
135,2018-04-05,Les Echos,80mots,LAURANCE N'KAOUA,FONDATION RAJA-DANIELE MARCOVICI : Ghislaine Tandonnet Guiran,"    ...  de masters sur les questions de l'économie de l'environnement, du développement et du  climat, est responsable développement durable du groupe Raja. Elle est membre du comité de direction. Après avoir ...  "
136,2018-04-16,Les Echos,29mots,,Trudeau à Paris : Climat et commerce au menu,        ... Trudeau à Paris :  Climat et commerce au menu  ...  
137,2018-04-12,Les Echos,575mots,LES ECHOS,"Syrie : « Les missiles arrivent », prévient Trump","    ...  mettre un terme à ce qu'il appelle une  « course aux armements » . « Responsables » Dans ce  climat de guerre froide ravivé, la prudence n'a ainsi pas totalement déserté les débats. A Paris ...  "
138,2018-02-07,Les Echos,434mots,THIERRY GANDILLOT,Garde à vue,"    ... 'aux derniers plans, spectaculaires. Léa Drucker, Denis Ménochet et le jeune Thomas Gioria portent ce  climat de tension avec retenue. Les cadrages serrés et les dialogues au scalpel ajoutent à la sensation ...  "
139,2018-01-05,Les Echos,302mots,NICOLAS RAULINE,Trump veut doper l'exploitation pétrolière américaine,"    ... 'instant), tenté d'imposer de nouvelles barrières douanières dans le solaire ou abrogé le plan  climat de Barack Obama, Washington veut désormais ouvrir les vannes du pétrole et du gaz offshore. Le ...  "
140,2018-01-29,Les Echos,430mots,YVES BOURDILLON,"En Turquie, l'hostilité monte face aux réfugiés syriens",    ...  rumeurs de harassement de femmes ou des photos de détritus attribués aux réfugiés aggravent ce  climat bien éloigné de l'hospitalité initiale et de la solidarité entre musulmans au nom du code ...  
141,2018-01-30,Les Echos,460mots,DOMINIQUE SEUX,Macron doit combattre le malheur français,"    ...  acteurs publics. Gageons que s'ils avaient tenu les promesses des quatre derniers quinquennats, le  climat serait différent et les travers de la vie politique ordinaire leur seraient pardonnés. Or, le taux ...  "
142,2018-02-28,Les Echos,715mots,JACQUES HUBERT-RODIER,"Brendan Berne, ambassadeur d'Australie et « diploconomiste »","    ...  pour le maintien du système international fondé sur des normes »,  notamment sur les questions du  climat, ajoute le diplomate, passé lors de ses études par la case Banque centrale d'Australie. « Diploconomiste ...  "
143,2018-03-16,Les Echos,169mots,,Relever le prix du carbone,"        ...  bilan carbone médiocre, lié à l'utilisation massive des centrales à charbon, la «  chancelière du  climat  », comme on appelle Angela Merkel, pourrait évoluer. Le chantier est toutefois ambitieux. Non seulement car l ...  "
144,2018-03-16,Les Echos,511mots,AUDE VILLIERS-MORIAMé,"De retour au pouvoir, Piñera dévoile ses priorités","    ...  Chiliens en 2016 et 2017 lors d'importantes manifestations. Sebastián Piñera, qui bénéficie d'un  climat économique favorable, souhaite créer un administrateur public de fonds de pension pour venir en complément des ...  "
145,2018-04-03,Les Echos,447mots,DIDIER BURG,Fin de l'exploitation du plus grand gisement gazier d'Europe,"    ...  danger des séismes reste toujours là »  , a estimé le ministre des Affaires économiques et du  Climat, Eric Wiebes, suite à l'annonce du Premier ministre. D'où son constat limpide : « Il faut ...  "
146,2018-04-16,Les Echos,669mots,LES ECHOS|VERONIQUE RICHEBOIS,WPP : le départ de Martin Sorrell sonne la fin d'une époque,    ...  le « Facebookgate » et l'éviction de Martin Sorrell aiguise les curiosités. C'est dans ce  climat de surprise et de soupçon qu'ont pris fin deux semaines de tension amorcées par la ...  
147,2018-04-19,Les Echos,468mots,NICOLAS RAULINE,Les banques américaines portées par la réforme fiscale de Trump,"    ...  de se réjouir. Leurs activités ont été portées, en ce début d'année, par un  climat plus favorable, dépassant les prévisions des analystes.  « Notre croissance a non seulement été portée par la ...  "
148,2018-04-23,Les Echos,486mots,ELSA CONESA,Comment les deux hommes se sont trouvés,"    ...  à peu près rien : ni sur le commerce, ni sur l'Iran, ni sur le  climat, ni sur le futur de l'Europe. Pourtant, ils ont choisi de cultiver une forme deproximité ...  "
149,2018-01-24,Les Echos,497mots,MICHEL DE GRANDI,Ridha Chalghoum : « Nous sommes satisfaits que la Tunisie soit retirée de la liste noire »,"    ...  mijanvier contre les nouvelles taxes. Que fautil faire pour calmer les esprits ? Le  climat est pesant, mais nous n'allons pas pour autant amender la loi de finances à l ...  "
150,2018-01-29,Les Echos,667mots,VALERIE LEBOUCQ,Les marques invitées à se risquer sur le terrain politique,"    ...  règle de voter contre les résolutions défavorisant la diversité ethnique ou l'action pour le  climat, lors des assemblées générales des entreprises dont il est actionnaire,. Audelà de la RSE Pour ...  "
151,2018-01-19,Les Echos,725mots,ETIENNE GOETZ,Une plaie pour la planète ?,"    ...  majorité chinois, brûlent du charbon à toutva. A l'heure des conférences sur le  climat, il faut d'urgence enterrer le bitcoin, pour le bien de la planète et de nos ...  "
152,2018-01-12,Les Echos,728mots,MARIE-CHRISTINE CORBIER,"La nouvelle plate-forme d'admission post- bac, Parcoursup, ouvre dans un climat d'inquiétude","    ... La nouvelle plateforme d'admission post bac, Parcoursup, ouvre dans un  climat d'inquiétude  ...  "
153,2018-02-08,Les Echos,381mots,PASCALE BRAUN,Vent porteur pour les logiciels Crisalid,"    ...  mort, tant pour les commerçants que pour les éditeurs. Ces nouvelles dispositions ont créé un  climat lourd, mais elles assainissent le marché et nous tirent vers le haut »  , estime Luc Ercole. Crisalid ...  "
154,2018-01-08,Les Echos,351mots,JACQUES HUBERT-RODIER,Macron et le « rêve » chinois,"    ...  conclure des accords économiques, culturels ainsi qu'un  « partenariat stratégique »  sur le terrorisme et le  climat. En vérité, rien de très nouveau. Ce n'est pas la première visite au cours de ...  "
155,2018-02-23,Les Echos,680mots,PAUL MOLGA,"Miami, nouvel eldorado de la French Tech","    ...  laboratoire pour nos clients »,  assure le patron. Avantage supplémentaire : une fiscalité aussi clémente que le  climat tropical des Caraïbes. La Floride, comme neuf autres Etats (mais pas la Californie, qui taxe à ...  "
156,2018-02-26,Les Echos,572mots,OLIVIER TOSSERI,Une campagne électorale placée sous le signe du mensonge en Italie,    ...  avant les législatives de dimanche prochain. Elle a été marquée ces derniers jours par un  climat de plus en plus tendu avec une recrudescence de violences physiques notamment à l'égard d ...  
157,2018-03-27,Les Echos,870mots,JEAN-MARC VITTORI,Jusqu'où ira la révolte contre le numérique,    ...  dizaines de millions d'autres est abrégée par les particules émises par les voitures. Le  climat de la planète est affecté par la concentration croissante de dioxyde de carbone dans l'atmosphère ...  
158,2018-03-30,Les Echos,101mots,DANIEL FORTIN,Macron doit expliquer davantage son action,"    ... 'explication risque, à terme, de lui jouer des tours. Notamment à l'heure où le  climat social se tend. Les bons résultats économiques attendus ne suffiront pas à pallier ce manque de ...  "
159,2018-04-05,Les Echos,380mots,MONIQUE CLEMENS,Cegedim SRH fait mouche avec son test grandeur nature,"    ...  montré que les difficultés ne sont pas d'ordre technique, mais  « de l'ordre du  climat anxiogène sur la nouvelle dimension apportée au métier de responsable de paie, qui devient collecteur de ...  "
160,2018-03-22,Les Echos,1776mots,ADRIEN LELIEVRE,"Erdogan, l'homme de fer de la Turquie","    ... 'organisation patronale Tukson, proches des gulénistes, ont dû mettre la clef sous la porte. Un  climat de peur s'est installé dans le pays, tandis que la perspective d'une entrée de ...  "
161,2018-03-21,Les Echos,480mots,ALAIN RUELLO,La baisse du taux de chômage devrait marquer une pause,"    Si le  climat des affaires s'assombrit très légèrement, celui du marché du travail, lui, reste au beau fixe. Au premier semestre 2018, l'emploi, tous secteurs confondus, devrait continuer à progresser ...  "
162,2018-03-14,Les Echos,598mots,ELSA CONESA,Trump place un de ses lieutenants à la tête de la diplomatie américaine,"    ...  Corée du Nord, l'ingérence de la Russie, ou l'accord de Paris sur le  climat.  « On s'entendait plutôt bien mais nous n'étions pas d'accord sur un certain nombre ...  "
163,2018-02-06,Les Echos,105mots,LEILA DE COMARMOND,Fonctionnaires : les syndicats préparent leur riposte,"    ...  par le gouvernement de son projet de réforme de la fonction publique, alors que le  climat social s'est fortement dégradé ces dernières semaines avec la multiplication des conflits catégoriels  de la ...  "
