,date,publication,words,author,title,intro
161,2019-05-22,Les Echos,523mots,GREGOIRE POUSSIELGUE,Le président accusé d'opportunisme écologique,"    ...  position éligible. Elle compte aussi quelques propositions chocs, comme la création d'une banque du  climat ou un investissement de 1.000 milliards d'euros dans la transition écologique. But atteint Figure ...  "
162,2019-07-03,Les Echos,569mots,CHRISTIAN DE BOISSIEU,Recréer la confiance en l'Europe,"    ... 'est plus une option. Malheureusement, sur les défis de l'économie mondiale autres que le  climat  la menace protectionniste, la question iranienne ou l'essor tous azimuts de l'unilatéralisme américain , l ...  "
163,2019-06-18,Les Echos,543mots,MURYEL JACQUE,Le marché européen du carbone a gagné en crédibilité,"    ...  à produire au gaz qu'au charbon. Mais, du Brexit à l'impact des autres politiques  climat européennes et nationales, les enjeux à plus long terme de ce marché restent immenses.  ...  "
164,2019-07-15,Les Echos,160mots,,BlackRock : les nouvelles exigences du premier gestionnaire d'actifs au monde,"        Pour Larry Fink, de passage à Paris pour la réunion sur le  climat et l'investissement organisée à l'inititiave d'Emmanuel Macron, plus de doute : les entreprises les plus vigilantes en ...  "
165,2019-08-14,Les Echos,36mots,JOEL COSSARDEAUX,Climat : la convention citoyenne recrute,    La campagne de recrutement des 150 participants à la Conventin citoyenne pour le  climat débute le 24 août. Une assemblée que ses organisateurs veulent à l'image exacte de la France.  ...  
166,2019-06-11,Les Echos,610mots,JOEL COSSARDEAUX,Le chef du gouvernement va devoir démontrer sa conversion à l'écologie,"    ...  débats parlementaires, du projet de loi d'orientation des mobilités, du projet de loi énergieclimat et de celui sur l'économie circulaire, lequel doit encore être examiné début juillet en Conseil ...  "
167,2019-05-09,Les Echos,573mots,STANISLAS DU GUERNY,"Anne-Marie Tréguier, les océans pour horizon","    ...  Grâce au numérique, nous pouvons comprendre comment les tourbillons marins influencent les grands cycles du  climat, mais aussi le déplacement des espèces animales »,  raconte, avec fougue, la scientifique. Des travaux d'autant ...  "
168,2019-06-07,Les Echos,649mots,ANNE FEITZ|JULIEN DUPONT-CALBO,Comment Bruno Le Maire est passé du soutien aux doutes,"    ...  trouver un accord final. Ce sera chose faite, in extremis, avant le conseil de mercredi.  Climat de confiance dégradé Ce qui n'était pas prévu, c'est la position pour le moins ...  "
169,2019-07-03,Les Echos,91mots,THIBAUT MADELIN,Climat : les autorités vont évaluer les engagements de la finance,"    ...  d'évaluation des engagements pris par les entités de la place financière en matière de  climat. Ce dispositif sera conduit par l'ACPR et l'AMF, dans le cadre de leurs missions ...  "
170,2019-07-26,Les Echos,82mots,LES ECHOS,Députés et sénateurs s'accordent sur le texte énergie-climat,    ...  et sénateurs sont parvenus jeudi à un accord sur le projet de loi énergie et  climat qui prévoit notamment la  « neutralité carbone »  à l'horizon 2050 et un dispositif progressif de rénovation ...  
171,2019-06-18,Les Echos,1250mots,VERONIQUE LE BILLON,« Réformer le tarif de l'électricité ne se fait pas en claquant des doigts »,    ... Le projet de loi Energie et  climat sera examiné ce mardi en commission à l'Assemblée nationale.Le ministre de la Transition écologique veut que les consommateurs bénéficient des coûts stables du ...  
172,2019-06-18,Les Echos,532mots,GUILLAUME BENOIT,Les marchés expriment leurs doutes à l'égard de la BCE,    ... La Banque centrale européenne va tenir son forum annuel de Sintra dans un  climat tendu. Les anticipations d'inflation par les acteurs financiers déclinent à des plus bas historiques.  ...  
173,2019-07-30,Les Echos,641mots,DEREK PERROTTE,"A Bruxelles, chacun cherche son commissaire","    ...  politiques : soit un portefeuille économique fort, par exemple le commerce, soit celui en charge du  climat »  . Pour le  climat, le nom de l'eurodéputé Pascal Canfin revient. Mais, élu début juillet à ...  "
174,2019-07-15,Les Echos,1094mots,NICOLAS BARRE,« Les taux négatifs ne font qu'entretenir la peur de l'avenir »,"    ...  6.500 milliards de dollars d'actifs, était à Paris pour la réunion sur le  climat et l'investissement organisée par Emmanuel Macron.Capitalisme français, taux négatifs, activistes, Brexit, Donald Trump... Il ...  "
175,2019-07-02,Les Echos,236mots,,Compenser ses émissions carbone,"        Face à l'intérêt des investisseurs pour le  climat, les fonds au « bilan carbone neutre » se développent de plus en plus. Pour réduire à zéro l'empreinte carbone de leurs portefeuilles, les ...  "
176,2019-07-08,Les Echos,445mots,DIDIER BURG,L'économie des Pays-Bas s'essouffle,"    ... L'indice des directeurs d'achat PMI, qui mesure le  climat de confiance au sein des branches industrielles, est au plus bas depuis six ans. La production industrielle a chuté et le ...  "
177,2019-08-09,Les Echos,31mots,JOEL COSSARDEAUX,Climat : le GIEC redoute des crises alimentaires,    Le groupe d'experts intergouvernemental sur le  climat appelle à des actions rapides dans la production et la consommation alimentaires pour réduire le réchauffement.  ...  
178,2019-05-10,Les Echos,622mots,GREGOIRE POUSSIELGUE,Macron s'engage dans la campagne des européennes,"    ... .000 milliards d'euros dans la transition écologique et la création d'une banque du  climat, LREM se teint fortement en vert. Après avoir convaincu les écologistes Pascal Canfin et Pascal Durand ...  "
179,2019-05-21,Les Echos,405mots,THIERRY OGIER,L'économie brésilienne connaît de nouveaux ratés,"    ...  parlementaire est complexe et le gouvernement, inexpérimenté et quelque peu désorganisé. Tout cela alimente un  climat d'incertitudes.  « Nous devons encore démontrer que nous prenons la discipline budgétaire au sérieux »  , souligne le ...  "
180,2019-05-24,Les Echos,1360mots,LES ECHOS,« Le centre de gravité politique de la France est à droite »,"    ...  donc pas imprimé ? Il y a pourtant eu des débats sur les travailleurs détachés, le  climat, etc. Souvenonsnous que lors du précédent scrutin européen, nous étions en pleine crise grecque, les ...  "
181,2019-05-31,Les Echos,389mots,CECILE CORNUDET,"Ecologie, l'attrape-jeunes","    ... Si Emmanuel Macron met l'accent sur l'écologie, c'est aussi pour parler à cette jeunesse militante du  climat, qui semble vouloir se réconcilier avec la politique.  ...  "
182,2019-07-01,Les Echos,129mots,ANNE FEITZ,La loi énergie-climat adoptée en première lecture à l'Assemblée,"    ENERGIE :  Les députés ont adopté la loi sur l'énergie et le  climat en première lecture vendredi  en pleine canicule. Progressivement étoffée pour affirmer les ambitions vertes du gouvernement, la loi décrète ...  "
183,2019-06-04,Les Echos,392mots,JOEL COSSARDEAUX,Ecologie : l'assemblée citoyenne dans les starting-blocks,"    ...  la crise des « gilets jaunes » . Dans le cadre de l'Accord de Paris sur le  climat, la France s'est engagée à réduire de 40 % ses émissions de gaz à effet de ...  "
184,2019-05-06,Les Echos,642mots,VALERIE DE SENNEVILLE,"France Télécom : dix ans après, le procès des années noires","    ... 'arrivée de Free et au choc technologique, l'ensemble impliquant une évolution rapide des métiers.  Climat anxiogène Brigitte Jolivet et Emmanuelle Robin précisent qu'il ne s'agit pas de remettre en ...  "
185,2019-06-28,Les Echos,170mots,VIRGINIE ROBERT,"Commerce, climat, Iran : toutes les tensions se cristallisent au G20","    ...  réparer leur relation bilatérale. De son côté, Emmanuel Macron, qui veut défendre le dossier du  climat, s'est dit très critique de la méthode bilatérale employée par Washington. Et a fait part ...  "
186,2019-07-19,Les Echos,480mots,LIONEL STEINMANN,Le groupe public veut conforter sa présence en Chine,"    ...  ce pays l'an dernier, grâce à ses filiales dans la logistique, les transports urbains et l'architecture. Les équipes locales doivent s'adapter à un  climat économique qui se durcit.  ...  "
187,2019-05-29,Les Echos,487mots,PAULINE HOUEDE,"Après la déroute électorale, le pari risqué de la cheffe du SPD","    Affaiblie en interne par la déroute électorale du parti socialdémocrate allemand aux élections européennes et dans la villeEtat de Brême le weekend dernier, la présidente du SPD, Andrea ...  "
188,2019-05-13,Les Echos,362mots,,Jean-Claude Mas Des vérités dérangeantes,"        ...  dans une région où les vignes souffrent énormément des contraintes hydriques engendrées par le changement  climatique. Et quand on lui parle de culture biologique, l'homme n'a pas sa langue dans ...  "
189,2019-05-27,Les Echos,404mots,JEAN-FRANCIS PECRESSE,L'avenir en noir et blanc,"    ...  habitants de notre continent de vivre dans des conditions convenables malgré l'accélération du changement  climatique, de profiter d'une relative prospérité en dépit de l'impitoyable compétition des empires pour le ...  "
190,2019-06-03,Les Echos,48mots,DOMINIQUE SEUX,Le populisme est résistible,"    ...  tôt pour y voir l'amorce d'un reflux, les forces favorables à l'action européenne, y compris dans le domaine  climatique, l'ont emporté dans de nombreux pays. Dominique Moïsi  ...  "
191,2019-05-17,Les Echos,427mots,FRANK NIEDERCORN,Vinexpo contraint de s'adapter,"    ...  organisateurs ont alors choisi de parier sur le qualitatif avec un symposium consacré au changement  climatique et une manifestation à « taille humaine », offrant davantage de temps aux échanges et aux dégustations. Il ...  "
192,2019-05-16,Les Echos,542mots,ALAIN RUELLO,Européennes : plaidoyer des principaux candidats pour une Union qui protège,"    ...  l'Union. Montée des nationalistes, attentats, guerre en Syrie, crise migratoire, sans oublier le réchauffement  climatique dans tous les esprits désormais... Le contexte depuis la dernière campagne il y a cinq ans ...  "
193,2019-06-12,Les Echos,675mots,ISABELLE FICEK,Réformes : le Premier ministre monte au front,"    ... chômage, retraites, statut de l'élu, dépendance, bioéthique, haute fonction publique, lutte contre le réchauffement  climatique, fiscalité locale, etc. Avec, donc, un Premier ministre en première ligne pour porter politiquement les réformes ...  "
194,2019-06-06,Les Echos,385mots,JOEL COSSARDEAUX,Les entreprises tricolores se montrent très « proactives » pour réduire leur CO2,"    ...  une politique de réduction de leur CO2, ce gaz dont l'accumulation provoque le réchauffement  climatique. Ce score, attribué à la France par l'agence d'informations financières Refinitiv, codétenue par le ...  "
195,2019-06-20,Les Echos,306mots,LES ECHOS,"Assurance-chômage : les emplois saisonniers, victimes de la réforme","    ...  tirer de ce projet ? Que le gouvernement fait le pari que les effets du réchauffement  climatique sont déjà tels qu'il n'y aura bientôt plus de saisons ? Heureusement pour nous, pas ...  "
196,2019-06-27,Les Echos,45mots,MICHEL DE GRANDI,Coup de chaud au G20 avant son coup d'envoi,    ...  autour des grands dossiers du G20 qui ne commence que vendredi à Osaka. Donald Trump a menacé la Chine de nouvelles taxes. Emmanuel Macron a appelé à une forte ambition  climatique.  ...  
197,2019-07-16,Les Echos,449mots,NESSIM AIT-KACIMI,Le fonds d'Abou Dabi s'inquiète du recul de la mondialisation,    ...  sur cette classe d'actifs suivent les indices obligataires. Il commence à intégrer le risque  climatique dans ses décisions et veut capitaliser sur l'intelligence artificielle pour améliorer le rendement de son ...  
198,2019-07-08,Les Echos,515mots,NINON RENAUD,De nouvelles incertitudes planent sur l'économie allemande,"    ...  commandes, couplée avec les défis liés à la numérisation de l'économie et au changement  climatique, menace ce second moteur. Si le nombre de chômeurs a légèrement reculé en juin, les annonces ...  "
199,2019-07-04,Les Echos,647mots,,La filière nucléaire a juste besoin de projets,"        ...  autorités de contrôle s'assurent précisément de l'inverse. Alors que la matérialité du changement  climatique n'est plus contestée, la filière nucléaire pourrait bénéficier des encouragements de ceux qui sont mobilisés ...  "
200,2019-07-09,Les Echos,521mots,MARIE-JOSEE COUGARD,"« Vins de France », l'étonnante seconde vie des vins de table","    ... levier pour reconquérir ou asseoir certains marchés comme les EtatsUnis »  , expliquetil. C'est aussi un moyen d'échapper au changement  climatique et aux petites récoltes. MarieJosée Cougard  ...  "
201,2019-07-08,Les Echos,351mots,,Un scandale pharmaceutique,"        ...  ces « médicaments » est tout aussi fort que celui pour dénoncer l'impact humain du réchauffement  climatique, sauf qu'ici les scientifiques sont ignorés. En 2012, une action en justice commencée aux Etats ...  "
202,2019-07-24,Les Echos,559mots,ELSA DICHARRY,La France s'organise face à la nouvelle vague de chaleur,"    ... Ce phénomène  climatique implique la mise en oeuvre de mesures exceptionnelles dans différents secteurs d'activité. Sur les chantiers, les entreprises de construction et de travaux publics doivent décaler les horaires de ...  "
203,2019-05-10,Les Echos,560mots,GABRIEL GRESILLON,"A Sibiu, les Européens affichent une unité de façade avant la bataille des élections","    ...  Macron a longuement défendu son projet, se posant en leader le plus ambitieux au plan  climatique. Le Hongrois Viktor Orbán, lui, appelait à élire des dirigeants opposés à l'immigration pour protéger ...  "
204,2019-05-09,Les Echos,496mots,FRANK NIEDERCORN,Vignoble : les épisodes de gel se multiplient,"    ...  majeur dans l'avenir pour compenser les pertes financières. D'autant qu'avec le réchauffement  climatique, on craint des dégâts supérieurs, car le gel affectera des plantes plus mûres. A Bordeaux, moins ...  "
205,2019-06-03,Les Echos,352mots,GREGORY PLESSE,"En Australie, la réélection des conservateurs conforte les producteurs de charbon","    L'élection fédérale australienne, le 18 mai dernier, devait être celle du changement  climatique. Elle a finalement été, une fois encore, celle du charbon. Le Premier ministre, Scott Morrison, est un fervent ...  "
206,2019-06-05,Les Echos,732mots,RICHARD HIAULT,Le nombre de pays pauvres a été divisé par deux en vingt ans,"    ...  revenu intermédiaire : risques de conflits, enclavement géographique, forte dépendance à l'agriculture que le changement  climatique peut déstabiliser et perspectives de ralentissement économique mondial pouvant réduire la demande de matières premières. De ...  "
207,2019-07-12,Les Echos,392mots,MONIQUE CLEMENS,La cote du comté booste les investissements dans les fruitières,"    ...  charges, le CIGC a confirmé ses valeurs sociétales en renforçant ses mesures de bienêtre animal et d'adaptation au changement  climatique, et en limitant la productivité des troupeaux. Monique Clémens  ...  "
208,2019-07-22,Les Echos,706mots,,La France menacée d'une sécheresse exceptionnelle,"        ...  alerte François Jobard. Selon le prévisionniste, les épisodes caniculaires se multiplient depuis une vingtaine d'années. Avec le réchauffement  climatique, la tendance ne semble pas près de s'inverser. Tifenn Clinkemaillié  ...  "
209,2019-07-05,Les Echos,586mots,,Changer les règles de la coopération internationale,"        ...  souplesse et d'agilité pour s'adapter aux énormes défis qui les attendent : le changement  climatique, les évolutions technologiques radicales et les tensions liées aux changements dans les rapports de pouvoir. Mettons ...  "
210,2019-08-22,Les Echos,422mots,NESSIM AIT-KACIMI,Le fonds norvégien gagne 3 % au deuxième trimestre,"    ...  ses préoccupations sur des problématiques liées à l'impact de leur activité sur le changement  climatique, la composition de leur conseil d'administration et la rémunération de leur dirigeant. Un quart des ...  "
211,2019-08-30,Les Echos,787mots,,Oser l'innovation financière contre la pauvreté,"        ...  sont réunis dans un même package politique. Une course est engagée entre la rapide dégradation  climatique et les lents progrès économiques. Raison de plus pour combattre la vulnérabilité en priorité, avant la ...  "
212,2019-05-09,Les Echos,653mots,GABRIEL GRESILLON,Les Européens réunis en Roumanie pour plancher sur l'après-Juncker,"    ...  de la France, qui entend par exemple mettre en avant la lutte contre le réchauffement  climatique ou la nécessité de repenser les politiques commerciale et industrielle de l'UE  des objectifs dans ...  "
213,2019-05-14,Les Echos,357mots,JEAN-LOUIS FRECHIN,Les problèmes vicieux,"    ...  pour le compte de la région IledeFrance la transition énergétique et l'adaptation  climatique du Parc naturel régional du Vexin français ou les Jeux Olympiques. Ces travaux, mêlant architecture, design ...  "
214,2019-05-17,Les Echos,847mots,JULIEN DAMON,En finir avec les idées reçues sur la pauvreté,"    ...  Banque mondiale ou les instances européennes. Il estime que la pauvreté compte, avec le changement  climatique, parmi les deux plus grands défis de l'humanité. Il faut donc bien comprendre ce « concept ...  "
215,2019-06-07,Les Echos,87mots,ANTOINE BOUDET,La France veut désormais une taxe européenne sur le transport aérien,"    ...  Transports, Elisabeth Borne, a mis le sujet sur la table, au Conseil des ministres des Transports de l'UE, jeudi à Luxembourg, au nom de  « l'urgence de l'enjeu  climatique »  .  ...  "
216,2019-06-14,Les Echos,711mots,JOEL COSSARDEAUX,G20 : le Japon à l'offensive contre les déchets plastique,"    ...  G20 pourraient s'engager à combattre en mobilisant leurs moyens de recherche.  « Contrairement au changement  climatique, on manque de données pour évaluer et suivre précisément la diffusion des microparticules dans des mers ...  "
217,2019-06-12,Les Echos,577mots,JEAN-HERVE LORENZI,Comment retrouver la confiance ?,    ... 'interroger sur la manière dont le monde définira une politique satisfaisante en matière de réchauffement  climatique et ses conséquences en matière de migrations. Ce sont ces cinq grandes interrogations qui seront abordées ...  
218,2019-06-18,Les Echos,1767mots,ALAIN RUELLO|MARIE BELLAN,Contrats courts : la parole aux « accusés »,"    ...  la construction. Une embellie confirmée par Olivier Salleron, patron d'une entreprise familiale de génie  climatique et de plomberie basée à Périgueux (24), qui compte 35 salariés en CDI ainsi que quatre ...  "
219,2019-06-20,Les Echos,484mots,RICHARD HIAULT,La Banque mondiale appelle à investir dans les infrastructures,"    ... Il est d'autant plus urgent d'entreprendre ces travaux que le dérèglement  climatique et sa cohorte de pluies diluviennes, de tsunamis, de glissements de terrain, d'inondations ou de sécheresses peut ...  "
220,2019-07-03,Les Echos,1710mots,THIERRY OGIER,"Natura, la multinationale brésilienne qui défend l'Amazonie","    ...  spécialisé dans la beauté. On doit promouvoir la diversité et combattre la menace du changement  climatique. Les affaires peuvent être une force au service du bien »  , martèletil. L'hédoniste et ...  "
221,2019-07-17,Les Echos,610mots,MICHEL FREDEAU,Les groupes français doivent rester les champions de la RSE,"    ...  de nombreuses années. C'est une excellente nouvelle. Mais au vu de l'urgence sociale, environnementale et  climatique, s'en satisfaire serait une grande erreur. Et ce, pour trois raisons principales.  ...  "
222,2019-06-17,Les Echos,596mots,AGNES VERDIER-MOLINIE,Le gouvernement renonce à la compétitivité des entreprises,"    ...  ménages et les entreprises n'est pas la solution. Par ailleurs, l'inclusion du changement  climatique à l'article 1er de la Constitution risque bel et bien de nous faire revivre le ...  "
223,2019-07-22,Les Echos,637mots,PAULINE HOUEDE,"A Berlin, Angela Merkel ferme sereinement boutique avant les vacances","    ...  des Verts. Une taxe CO2 Très critiquée sur sa politique de lutte contre le réchauffement  climatique, alors que le gouvernement a admis qu'il ne parviendra pas à atteindre ses objectifs de ...  "
224,2019-06-26,Les Echos,538mots,GREGOIRE POUSSIELGUE,Canicule : l'exécutif se défend de tout zèle,"    ...  à intervalles réguliers.  « L'anormal est en train de devenir le normal, conséquence du réchauffement  climatique »  , a averti Edouard Philippe à l'Assemblée.  « Nous devons donc  [...]  nous adapter, adapter notre société, adapter ...  "
225,2019-08-09,Les Echos,496mots,,Incendies : une hausse limitée malgré la sécheresse,"        ...  au Languedoc et à l'est de la région Paca »  , détailletelle. Autre explication  climatique de cette baisse : l'absence de vent. « Les années sont très hétérogènes, le ratio de surfaces ...  "
226,2019-07-24,Les Echos,1466mots,,Le Jadot de la Méduse,"        ...  participants y alla de son éloge de l'union, main sur le coeur. L'urgence  climatique, la crise sociologique, le drame démocratique, la tragédie économique, le marasme diplomatique, enfin toute cette horreur ...  "
227,2019-08-26,Les Echos,639mots,BERTRAND PICCARD,Vers un transport maritime plus propre,"    ...  qui assure 90 % du commerce mondial. Pourtant, compte tenu des prévisions en matière de changement  climatique, chaque acteur de chaque industrie doit faire sa part pour devenir bien plus durable. La grande ...  "
228,2019-08-05,Les Echos,252mots,,Mike Pompeo,"        ...  proférés suite à l'attentat de Boston en 2013, et ses doutes quant au réchauffement  climatique font de lui le parfait lieutenant pour Donald Trump. Sa fidélité au locataire de la Maison ...  "
229,2019-08-02,Les Echos,556mots,JOEL COSSARDEAUX,L'exécutif fait chou blanc dans l'opinion sur son action environnementale,"    ...  et de JeanLuc Mélenchon (75 %), les plus sévères. Or, l'environnement et le réchauffement  climatique sont désormais un sujet de préoccupation constant des Français. C'est même le deuxième par ordre ...  "
230,2019-05-27,Les Echos,684mots,JOEL COSSARDEAUX,"Les Verts, troisième force politique","    ...  capitaliser sur la crédibilité de sa formation à s'attaquer à la crise écologique et  climatique, qui redouble. Ce n'était pas gagné, La République En marche (LREM) et les autres partis ...  "
231,2019-05-17,Les Echos,408mots,ANTOINE BOUDET,"Raja, moteur de la transition écologique dans les emballages",    ...  être en bonne santé pour s'engager dans la transition écologique qu'impose le réchauffement  climatique. Et sans doute aussi le statut de leader sur un marché impose d'en être le ...  
232,2019-05-31,Les Echos,820mots,EMMANUEL SCHAFROTH,Quand les fonds thématiques battent les indices,"    ...  plusieurs des 17 objectifs édictés en 2015 par les Nations unies : lutte contre le réchauffement  climatique ou réduction des inégalités, par exemple. Mais investir dans des fonds comme Sycomore Eco Solutions ou ...  "
233,2019-05-22,Les Echos,493mots,NINON RENAUD,Berlin à l'offensive sur la question migratoire,"    ...  allemand, la question migratoire s'est fait outreRhin voler la vedette par le changement  climatique : les sociauxdémocrates et l'Union CDUCSU s'opposent désormais sur la mise en place ...  "
234,2019-07-04,Les Echos,1605mots,BENJAMIN QUENELLE,"L'Arctique, la route de la soie russe","    ...  maritime le long des côtes polaires devenue de plus en plus navigable grâce au réchauffement  climatique et à la fonte des glaces. Avec, pour ambitieux objectif, un volume annuel de 80 millions ...  "
235,2019-07-10,Les Echos,602mots,GUILLAUME BENOIT,Amundi et la BEI visent 1 milliard d'euros pour développer la finance verte,"    ...  tant que banque de l'Union européenne, particulièrement impliquée dans le sujet de la transition  climatique, il nous paraissait important de chercher des solutions permettant de créer des marchés efficaces là où ...  "
236,2019-08-07,Les Echos,367mots,CATHERINE CHATIGNOUX,L'Union européenne poursuit sa reconquête des citoyens,"    ...  européen, c'est l'immigration qui arrive en tête (34 %) même si son intensité a baissé (58 % en 2015), devant le changement  climatique (22 %) et la situation économique (18 %). Catherine Chatignoux  ...  "
237,2019-08-08,Les Echos,1722mots,TRISTAN GASTON-BRETON,"Kjell Inge Rokke, celui qui veut nettoyer les océans","    ...  sont étouffés par la surpêche, la pollution côtière, la destruction de l'habitat, le changement  climatique et l'acidification des eaux. Mais, surtout, le principal défi est celui de la plastification de ...  "
238,2019-05-29,Les Echos,755mots,ZHAI JUN,Le monde a plus que jamais besoin du multilatéralisme,"    ...  décennie suivante, le G20, l'accord historique de la Conférence de Paris sur le changement  climatique, l'amélioration constante de la gouvernance mondiale et la forte adhésion de notre époque au multilatéralisme ...  "
239,2019-06-05,Les Echos,379mots,GABRIELLE SERRAZ,Les entreprises accompagnent la transition touristique des stations,"    ...  accompagnent même ces dernières dans l'ingénierie, nécessaire pour se bâtir une seconde jeunesse et imaginer l'aprèsski à l'heure du réchauffement  climatique et de la fonte des glaces.  ...  "
