,date,publication,words,author,title,intro
0,2019-06-06,Les Echos,577mots,JACQUES DELPLA,Quel prix pour notre avenir climatique ?,    Quels efforts sommesnous prêts à consentir pour sauvegarder le  climat dans lequel vivront les générations futures ? Cette question revient avec des taux d'intérêt historiquement bas et avec le débat sur ...  
1,2019-07-02,Les Echos,550mots,LAURENCE DAZIANO,Climat : passer de la parole aux actes,"    ...  du G20 s'est conclu à Osaka le 29 juin par un accord sur le  climat signé par tous les Etats membres, sauf les EtatsUnis. Cet accord  climatique, largement porté par ...  "
2,2019-08-06,Les Echos,603mots,VALDIS DOMBROVSKIS,Finance durable : ce que l'Europe entend par « vert »,"    ...  le monde, des millions de jeunes rejoignent un mouvement international de lutte contre le dérèglement  climatique, exigent des actions concrètes avant qu'il ne soit trop tard. La jeune génération souligne que ...  "
3,2019-08-28,Les Echos,749mots,JOEL COSSARDEAUX|ELSA FREYSSENET,« Il est urgent de changer de braquet sur le climat » en France,    ...  arrêter la déforestation de l'Amazonie et si l'action internationale était à la hauteur de l'urgence  climatique. Ce n'est pas le cas malgré les efforts de la France.  ...  
4,2019-07-04,Les Echos,598mots,,« On ne gagnera pas la guerre pour le climat avec les règles du commerce international »,"        ...  climatiques », pour reprendre vos mots ? Aujourd'hui, le Mercosur n'apporte aucune garantie sur le  climat. Le résumé de l'accord, sorti lundi soir, confirme nos craintes. L'Accord de Paris y ...  "
5,2019-08-14,Les Echos,695mots,ETIENNE GOETZ,Climat : pourquoi les banques françaises se mettent au vert,"    ...  de dollars en 2019. Les établissements français prennent au sérieux la lutte contre le dérèglement  climatique, par conviction, par opportunité commerciale, mais aussi pour anticiper un renforcement de la réglementation environnementale.  ...  "
6,2019-08-08,Les Echos,730mots,,Nucléaire et changement climatique : haro sur les idées reçues,"        ...  effet de serre, engendrant l'impression que cette source d'énergie accélère la dégradation du  climat. Plusieurs éléments doivent être examinés afin de prendre ce problème sous tous ces angles. De manière ...  "
7,2019-07-10,Les Echos,609mots,SYLVIE GOULARD,Comment les banques centrales veulent « verdir » la finance,"    Le changement  climatique concernetil les banques centrales ? La réponse est résolument oui. Le réchauffement planétaire des températures entraîne des risques financiers considérables, mettant en péril la stabilité de tout le ...  "
8,2019-08-30,Les Echos,486mots,LES ECHOS,Le réchauffement climatique pourrait déplacer 280 millions de personnes,"    ... Dans un projet de rapport à paraître en septembre, les scientifiques du GIEC s'inquiètent de l'effet du réchauffement  climatique sur les océans et la cryosphère.  ...  "
9,2019-08-30,Les Echos,573mots,GABRIELLE SERRAZ,Chamonix se dote d'un plan climat,    ... La vallée lance un plan transfrontalier pour adapter la pratique de la haute montagne au changement  climatique et prévenir d'éventuelles catastrophes.  ...  
10,2019-05-13,Les Echos,1129mots,,Chaleur et sécheresse : les vignerons ont soif de stratégies,"        ...  mai à Bordeaux, le Salon international Vinexpo a choisi d'explorer l'impact du changement  climatique avec la participation de « game changers » d'envergure mondiale, dont les géants espagnol Torres (lire ci ...  "
11,2019-08-23,Les Echos,474mots,RICHARD HIAULT,Remobilisation attendue autour du climat,"    ... L'objectif du Chef de l'Etat est d'assurer la reconstitution du fonds vert pour le  climat, un dossier à l'agenda du sommet des Nations Unies le mois prochain.  ...  "
12,2019-06-26,Les Echos,671mots,JOEL COSSARDEAUX,La France n'en fait pas assez pour lutter contre le réchauffement climatique,    ...  ambitieux qu'elle a pris dans le cadre de l'Accord de Paris. Le premier rapport du Haut Conseil pour le  climat pointe les lacunes dans la politique  climatique du gouvernement.  ...  
13,2019-07-09,Les Echos,752mots,FREDERIC MAZZELLA,L'urgence climatique est déjà là,"    ...  2015, la France s'enorgueillissait d'avoir fait naître le premier accord universel sur le  climat lors de la COP21. 195 nations s'étaient alignées sur l'objectif suivant : atteindre la neutralité ...  "
14,2019-07-08,Les Echos,1351mots,PAUL MOLGA,"Ozone, le polluant climatique","    Quel effet aura le réchauffement  climatique sur la qualité de l'air que nous respirons ? L'équipe de recherche francoitalienne du projet Climaera veut percer les secrets de cette équation, et ...  "
15,2019-05-16,Les Echos,427mots,ELSA CONESA,La question du climat peine à s'imposer chez les majors américaines du pétrole,"    ...  de BP, Shell ou du norvégien Equinor évoquaient les risques industriels posés par le changement  climatique, leurs homologues américains détaillaient de leur côté leurs prochains projets de forage, jugeant le moment opportun ...  "
16,2019-06-27,Les Echos,403mots,ETIENNE GOETZ,Climat : de très gros investisseurs réclament des mesures d'urgence,"    Face à l'urgence  climatique, 477 investisseurs, représentant 34.000 milliards de dollars, c'estàdire la moitié du capital investi dans le monde, réclament aux gouvernements du G20 qui se ...  "
17,2019-07-19,Les Echos,630mots,,Economie et climat : qui peut sauver qui ?,"        ...  Echos » du 26 juin, Dominique Seux signe un éditorial titré : « L'économie peut sauver le  climat » . Riche, l'article ne dissimule pas son adhésion aux vertus du marché : ce qui a été ...  "
18,2019-06-03,Les Echos,689mots,,Pour des budgets enfin compatibles avec l'Accord de Paris,"        ...  des débats. C'est une bonne nouvelle. Nous le savons, la lutte contre le changement  climatique et la protection de la biodiversité nécessitent l'engagement absolu de l'ensemble des acteurs de ...  "
19,2019-08-14,Les Echos,546mots,,Les sujets incontournables,        ... Les sujets abordés par la Convention citoyenne pour le  climat devraient toucher les secteurs les plus concernés par le dérèglement  climatique. L'objectif : faire émerger des propositions concrètes pour abaisser d'au ...  
20,2019-07-17,Les Echos,528mots,JOEL COSSARDEAUX,Un ministre de transition dont la trace va vite s'effacer,"    ...  permis à cet « écoloréalo » d'imprimer sa marque. Les réformes phares  transition énergétique, biodiversité,  climat  du quinquennat ayant été engagés par Nicolas Hulot, l'élu de LoireAtlantique n'a en ...  "
21,2019-07-11,Les Echos,517mots,,Macron réunit le gratin de la finance internationale pour le climat,        ...  mondiaux se sont engagés à coopérer pour mieux prendre en compte l'impact du changement  climatique dans leurs politiques d'investissement. Ils s'associent ainsi à une initiative lancée l'an dernier ...  
22,2019-08-29,Les Echos,1750mots,PATRICK ARTUS,« Le capitalisme a été à la hauteur de ce qu'on attendait de lui »,"    ...  le creusement les inégalités dans les pays riches. La seconde, c'est le dérèglement du  climat. Ces deux conséquences étaient largement prévisibles. L'erreur, c'est de ne pas les avoir expliquées ...  "
23,2019-06-17,Les Echos,1081mots,PAUL MOLGA,Climat : le rôle clef de la symbiose forestière,    ... Des chercheurs ont dressé la cartographie mondiale des coopérations entre les arbres et les champignons. Leur symbiose sera lourdement affectée par le réchauffement  climatique.  ...  
24,2019-06-24,Les Echos,502mots,DEREK PERROTTE,Neutralité carbone : les réticences de l'Est freinent les ambitions de l'Europe,"    ...  cadre à mettre en place, afin de déterminer comment assurer une transition  » vers la «  neutralité  climatique, en ligne avec l'Accord de Paris »  . Sans mentionner de date. Planche de salut pour les ...  "
25,2019-05-15,Les Echos,1069mots,JOEL COSSARDEAUX|PIERRE-ALAIN FURBURY,« La crédibilité de Macron sur l'écologie est nulle »,"    ...  font », martèle la tête de liste d'EELV aux élections européennes.Il prône l'adoption, via un référendum, d'un traité qui place  climat et biodiversité comme loi fondamentale. Yannick Jadot  ...  "
26,2019-05-27,Les Echos,349mots,HERVE LE TREUT,"Climat, biodiversité : « et » ou « ou » ?","    ...  le patrimoine vivant de la planète est une démarche profondément complémentaire de la préservation du  climat, c'estàdire de l'univers plus physique et minéral qui est le support indispensable ...  "
27,2019-08-26,Les Echos,630mots,MARIE-JOSEE COUGARD,« L'Inra prépare les outils de gestion des bouleversements du climat »,    ...  que la société en a. Les gens se rendent compte que ce genre de phénomène  climatique va faire partie de leur vie et qu'il va falloir faire face aux irrégularités météorologiques ...  
28,2019-07-08,Les Echos,468mots,NESSIM AIT-KACIMI,Un intérêt pour l'investissement responsable,"    ... Les fonds souverains sont prêts à adopter une politique d'investissement plus responsable pour donner l'exemple, notamment sur le  climat et l'environnement, mais pas à n'importe quel prix.  ...  "
29,2019-07-24,Les Echos,367mots,,« Il faudra réfléchir à l'évolution des centrales nucléaires »,"        ...  pris au sérieux ? Oui, EDF a été la première entreprise à travailler sérieusement sur le  climat. Cela remonte à la fin des années 1980. Et encore plus depuis 2003. L'entreprise est ...  "
30,2019-06-18,Les Echos,517mots,SOPHIE ROLLAND,Climat : 700 sociétés montrées du doigt pour défaut de transparence,"    ...  de lui fournir ces informations. Chaque année, un questionnaire leur est envoyé dans le but d'évaluer leur impact  climatique, leur gestion de l'eau et leur action sur les forêts.  ...  "
31,2019-05-28,Les Echos,987mots,NICOLAS RAULINE,Le climat s'invite dans la politique américaine,"    ...  Sunrise Movement, un groupe né en 2017 avec un objectif simple : faire parler du réchauffement  climatique aux EtatsUnis et peser sur les décisions politiques. Un vrai défi dans l'Amérique de ...  "
32,2019-07-29,Les Echos,611mots,,Pour un « GIEC des talents » face à la crise des compétences dans l'énergie,"        ...  Gore, prix Nobel de la paix 2007, a lancé un débat mondial sur le changement  climatique. Ce film fit du dérèglement  climatique une question clef des programmes politiques mondiaux. Cette nouvelle préoccupation ...  "
33,2019-08-19,Les Echos,529mots,ELSA FREYSSENET,Climat : l'Australie déçoit les nations du Pacifique,    ... L'Australie s'est opposée à tout engagement ferme pour lutter contre le changement  climatique. Le pays s'est brouillé avec les dixsept autres nations membres du Forum des îles du ...  
34,2019-05-13,Les Echos,660mots,,Ces vignerons qui s'affranchissent des cépages bordelais,"        ... A Bordeaux, des vignerons expérimentent des cépages non admis par l'appellation. Une façon de s'adapter au défi  climatique. Et de contourner le bordeaux bashing.  ...  "
35,2019-05-09,Les Echos,280mots,LES ECHOS,"Non, le capitalisme ne sauvera pas le climat",    ...  des objectifs clairs et juridiquement contraignants peuvent pousser le capitalisme à lutter contre le dérèglement  climatique. Activisme : « Les personnes qui ont visité Londres pendant les fêtes de Pâques ont pu voir des ...  
36,2019-06-27,Les Echos,679mots,RICHARD HIAULT|MICHEL DE GRANDI,"A la veille du G20, les tensions s'exacerbent sur le climat et le commerce","    ...  il imposerait de nouvelles taxes sur les importations non encore visées. Emmanuel Macron, de son côté, refusera de signer la déclaration finale si elle n'affiche pas une ambition  climatique forte.  ...  "
37,2019-07-04,Les Echos,447mots,ETIENNE GOETZ,Climat : la place de Paris s'engage pour la neutralité carbone d'ici à 2050,    ...  et le secteur financier français ont pris mardi soir une série d'engagements visant à lutter contre le dérèglement  climatique et en faveur de la neutralité carbone à horizon de 2050.  ...  
38,2019-07-03,Les Echos,114mots,ETIENNE GOETZ,"Les militants du climat « pire menace » du pétrole, selon l'Opep",    ...  de sorte qu'on lui fait croire que le pétrole est la cause du changement  climatique ! C'est peutêtre la pire menace pour notre industrie à l'avenir. » La lutte contre ...  
39,2019-08-19,Les Echos,490mots,THIERRY OGIER,Déforestation en Amazonie : le Brésil sanctionné,"    ...  certains financements accordés par le Fonds Amazonie, établi en 2008 pour lutter contre le changement  climatique. Et a récemment modifié sa gouvernance, sans l'accord des principaux bailleurs, à savoir la Norvège ...  "
40,2019-07-25,Les Echos,952mots,ISABELLE FICEK,« L'apocalypse qu'on promettait sur nos grandes réformes structurelles n'a pas eu lieu »,"    ...  que le commerce international, par nature, contrevient à l'objectif de lutte contre le réchauffement  climatique. C'est le postulat de Nicolas Hulot, qui avait d'ailleurs un discours assez différent quand ...  "
41,2019-05-21,Les Echos,1367mots,PAUL MOLGA,Climat : pression sur l'eau potable,"    ...  la population mondiale vit dans des régions régulièrement victimes de stress hydrique. Avec le dérèglement  climatique, la pénurie s'accentue. Près de 6 milliards d'êtres humains pourraient être menacés en 2050 ...  "
42,2019-05-24,Les Echos,294mots,JOEL COSSARDEAUX,L'environnement,"    L'urgence  climatique a été l'un des grands thèmes de la campagne. Le RN n'a pourtant pas de proposition vraiment concrète sur le sujet, la défense de l'écologie relevant ...  "
43,2019-06-26,Les Echos,413mots,DOMINIQUE SEUX,L'économie peut sauver le climat,"    Le tout neuf Haut Conseil pour le  climat ne pouvait rêver meilleure rampe de lancement : la publication, mardi, de son premier rapport s'est faite en pleine semaine caniculaire. Son écho dans ...  "
44,2019-06-27,Les Echos,626mots,JOEL COSSARDEAUX|ISABELLE FICEK,Passoires thermiques : vers un accord entre l'exécutif et les députés,    ...  mercredi par Matignon sera débattue jeudi par les députés qui ont engagé l'examen en première lecture du projet de loi énergie et  climat à l'Assemblée. Il y a urgence.  ...  
45,2019-07-01,Les Echos,743mots,RICHARD HIAULT|YANN ROUSSEAU,Le G20 d'Osaka parvient de justesse à éviter la faillite,"    ... 'à la dernière minute entre les leaders du G20 réunis à Osaka. Sur les deux sujets épineux, le commerce et le  climat, ils ont évité le pire et maintenu leurs ambitions.  ...  "
46,2019-08-09,Les Echos,694mots,JOEL COSSARDEAUX,Climat : le GIEC redoute de voir la planète affamée par la vitesse du réchauffement,"    ...  publié jeudi matin, les scientifiques mandatés par les Nations unies redoutent l'apparition de graves crises alimentaires d'origine  climatique. Les terres s'appauvrissent et la qualité nutritionnelle des récoltes baisse.  ...  "
47,2019-07-19,Les Echos,619mots,TRIBUNE COLLECTIVE,"Dirigeants d'entreprise, engagez-vous pour sauver la planète","    ...  au Japon, les membres du G20 ont fini par arracherun accord a minima sur le  climat. Audelà des Etats, des formes inédites de coopération entre les territoires, les entreprises, les ONG ...  "
48,2019-07-10,Les Echos,85mots,LES ECHOS,Paris se déclare en « état d'urgence climatique »,"    ... POLITIQUE  :  La Ville de Paris s'est déclarée mardi en  « état d'urgence  climatique »   comme de nombreuses villes dans le monde  et a annoncé le lancement d'une  « Académie du  climat »  , un ...  "
49,2019-07-17,Les Echos,1299mots,RICHARD HIAULT,« Les entreprises françaises ont déjà su tirer les bénéfices du Ceta »,"    ...  le Canada, sans oublier, à la demande de la France, l'instauration d'un veto  climatique accepté par le Canada plaident en ce sens. Ce « veto  climatique » sanctuarise le droit à réguler ...  "
50,2019-07-17,Les Echos,638mots,RICHARD HIAULT,L'accord du Ceta en passe d'être ratifié par les députés français,"    ...  parfums et cosmétiques ont vu leurs exportations grimper de 16,4 %. Création d'un « veto  climatique » Conscient des craintes exprimées, le gouvernement n'a pas ménagé ses efforts pour tenter de déminer ...  "
51,2019-05-13,Les Echos,589mots,SOPHIE AMSILI,Ce que proposent les principaux partis européens,"    ... Accords migratoires, budget de la zone euro, taxe sur le numérique, changement  climatique... Les principaux partis ont déjà présenté leurs propositions.  ...  "
52,2019-08-29,Les Echos,650mots,MARIE-JOSEE COUGARD,« La France est en train de perdre des chasses gardées »,"    ...  si la bagarre s'annonce rude. La France a de solides atouts parmi lesquels son  climat tempéré, qui, à quelques exceptions près comme 2016 l'année des inondations, lui garantit une production ...  "
53,2019-08-19,Les Echos,110mots,ELSA FREYSSENET,L'Islande commémore la première disparition d'un glacier,"    CLIMAT :  C'est une première dans le monde : l'Islande a dévoilé dimanche une plaque à la mémoire de l'Okjökull, premier glacier de l'île à avoir perdu son statut, englouti ...  "
54,2019-05-31,Les Echos,997mots,RENAUD HONORE|JOEL COSSARDEAUX|LIONEL STEINMANN,Comment l'executif veut s'y prendre,"    ... 'est l'objectif, ambitieux, du gouvernement et que porte le projet de la loi énergieclimat, dont le parcours parlementaire débute mercredi à l'Assemblée en commission. Le texte livre notamment le ...  "
55,2019-05-21,Les Echos,384mots,JEAN-MARC JANCOVICI,"Le risque, c'est de ne pas agir","    ...  est en train de devenir un enjeu majeur pour notre espèce : celle qui concerne le  climat (et l'environnement en général). Comme pour le social, elle demande de donner aujourd'hui pour ...  "
56,2019-06-24,Les Echos,433mots,ANDRÉ LÉVY-LANG,"Le libra de Facebook, un défi pour le climat","    ... Cet investissement informatiquerisque de soulever un problème de réchauffement  climatique du fait des émissions de CO2 liées au traitement de ces transactions, ce qui est résumé par la « trace carbone » . Pour la ...  "
57,2019-05-17,Les Echos,627mots,MARIE-JOSEE COUGARD,Les vignerons aux avant-postes du dérèglement climatique,"    ...  l'Académie du vin de France, lors d'un symposium consacré à l'impact du  climat sur la vigne dans le cadre de Vinexpo à Bordeaux. Le calendrier des vendanges a lui ...  "
58,2019-05-06,Les Echos,1029mots,CATHERINE CHATIGNOUX|ISABELLE FICEK,Nathalie Loiseau : « Le statu quo n'est pas tenable pour l'Union européenne »,    ...  même de réussir sa transition écologique. Nous proposons ainsi de créer une banque européenne du  climat qui orientera l'épargne des Européens vers les investissements verts indispensables pour lutter contre le dérèglement ...  
59,2019-05-23,Les Echos,515mots,ANTOINE JACOB,"En Suède, seule « l'urgence climatique » unit","    ...  affaiblis, une campagne qui s'anime dans la dernière ligne droite autour des thèmes du  climat et de la « protection » du pays : les élections européennes en Suède ne se différencient guère de ...  "
60,2019-07-01,Les Echos,126mots,MARIE-CHRISTINE CORBIER,Hulot appelle à l'unité dans la « guerre » pour le climat,"    ...  l'unité pardelà les clivages politiques afin d'affronter la  « guerre »  contre le dérèglement  climatique, dans un entretien, dimanche, à « OuestFrance » .  « Il est urgent d'affronter la réalité  climatique, écologique ...  "
61,2019-05-29,Les Echos,642mots,VINCENT COLLEN,Le réchauffement climatique s'invite aux assemblées générales des pétroliers,"    ...  Au Mozambique, où Total va racheter les actifs d'Anadarko, en plus de l'impact  climatique de l'exploitation du gaz, des déplacements de population ont commencé, privant les communautés de l ...  "
62,2019-06-20,Les Echos,646mots,JOEL COSSARDEAUX,La France a réduit ses émissions de gaz à effet de serre en 2018,"    ...  la France, qui revendique d'être à la pointe de la lutte contre le réchauffement  climatique. En 2018, ses émissions de gaz à effet de serre (GES) ont reculé de 4,2 ...  "
63,2019-07-23,Les Echos,552mots,,Climat : des investisseurs font pression sur les cimentiers,"        ...  avec les pouvoirs publics, pour atteindre l'objectif de limitation à 2 °C du réchauffement  climatique. Mais aussi en revoyant leur modèle de gouvernance  ils proposent de nommer un « responsable  climat » au ...  "
64,2019-05-09,Les Echos,88mots,BEATRICE GAIGNAND,Climat : 200 maires européens pour la neutralité carbone d'ici à 2050,    ...  UE) s'associent  « pour exhorter »  les dirigeants européens à  « engager  [l'UE]  dans une stratégie  climatique de long terme visant un niveau net d'émissions nul d'ici à 2050 »  lors du ...  
65,2019-07-24,Les Echos,568mots,JOEL COSSARDEAUX,Le Ceta voté dans la douleur par la majorité,"    Le  climat  c'est le cas de le dire  s'y prêtait peu. Après plusieurs semaines de débats musclés, l'Assemblée a voté ce mardi la ratification du Ceta, le controversé traité ...  "
66,2019-08-28,Les Echos,1184mots,NINON RENAUD,« Nous avons besoin d'une politique industrielle européenne capable de peser dans les grands débats économiques mondiaux »,"    ...  économique, aurezvous assez de moyens pour relever les défis industriels, notamment liés au changement  climatique, auxquels le pays fait face ? Nous avons entamé un processus de délibérations sur les mesures à ...  "
67,2019-05-13,Les Echos,125mots,DANIEL BASTIEN,Climat : António Guterres juge que le monde n'est « pas en bonne voie »,"    ...  la hausse des températures. Dans un message fort destiné à réclamer des actes pour le  climat, le secrétaire général a jugé que la détermination des différents pays du monde s'émoussait, ajoutant ...  "
68,2019-05-24,Les Echos,374mots,CECILE CORNUDET,Le scrutin des deux peurs,    ... La campagne européenne a vu naître un net clivage entre ceux qui tentent de répondre à la peur  climatique et ceux qui privilégient la peur identitaire.  ...  
69,2019-08-27,Les Echos,777mots,RICHARD HIAULT,"Commerce, Iran, climat : Macron ob tient la détente au G7","    ...  réussi à aller aussi loin qu'espéré sur tous les dossiers et les avancées restent fragiles. Mais sur le plan dip lomatique, commercial,  climatique et fiscal, le pire a été évité.  ...  "
70,2019-05-31,Les Echos,754mots,PIERRE GOGUET,L'Europe doit maintenant redéfinir ses ambitions,"    ...  la réponse européenne aux grands défis de l'humanité. D'abord, bien sûr, le défi  climatique. Il ressort d'ailleurs clairement des urnes. La Commission mondiale sur l'économie et le climat ...  "
71,2019-06-11,Les Echos,394mots,CECILE CORNUDET,Philippe-Jadot : le chassé-croisé,"    ...  l'écologie pousse un chassécroisé. La majorité veut creuser le sillon de l'écologie pragmatique   « concrète »,  dirait Jadot , celle qui préserve le  climat sans trop contraindre la vie des gens.  ...  "
72,2019-05-28,Les Echos,573mots,,Pourquoi la France doit revoir son mix énergétique,"        L'action en faveur du  climat n'est plus une option, c'est une obligation. Dans un contexte qui va requérir de lourds investissements et des innovations importantes, la programmation pluriannuelle de ...  "
73,2019-07-22,Les Echos,700mots,,Passoires thermiques : pour un dispositif solidaire de rénovation énergétique,"        ...  la nuit du jeudi 18 au vendredi 19 juillet, le projet de loi énergie et  climat. Ce texte comporte un éventail de dispositifs dont l'ambition est de promouvoir la rénovation énergétique ...  "
74,2019-08-16,Les Echos,623mots,,Véhicule électrique : il est urgent de passer à la vitesse supérieure,        ...  de progrès technologiques considérables ces dernières années. Il est une véritable réponse aux impératifs de  climat et de santé publique des villes. Mais pourquoi le mouvement estil encore si timide en ...  
75,2019-05-06,Les Echos,234mots,VIRGINIE ROBERT,"Commerce, défense, climat, social : pour Nathalie Loiseau, il faut sortir du statu quo en Europe","    ...  C'est la bonne échelle pour répondre en matière commerciale, de puissance industrielle, de défi  climatique, de défi migratoire et de défense »,  assuretelle. Elle prône une Europe puissante, qui puisse ...  "
76,2019-07-18,Les Echos,566mots,JOEL COSSARDEAUX,Ecologie : Borne attendue sur les promesses de Macron,"    ...  le Sénat, la toujours ministre des Transports a défendu le projet de loi énergie et  climat. Il est la première traduction de la profession de foi environnementale prononcée parEdouard Philippe dans son ...  "
77,2019-08-30,Les Echos,74mots,YVES BOURDILLON,Le GIEC s'alarme de la montée des eaux,"    ...  servira de base de travail aux pays de l'ONU lors du sommet sur le  climat de fin septembre, prédit une forte montée des océans pour cause de réchauffement  climatique. Jusqu'à ...  "
78,2019-06-25,Les Echos,497mots,MYRIAM CHAUVOT,La ville veut devenir plus cool,"    ...  ville, où le bitume accroît l'effet de canicule en concentrant la chaleur solaire, réfléchit à son adaptation au réchauffement  climatique. Il faut changer la manière de construire et de rénover.  ...  "
79,2019-05-13,Les Echos,508mots,,"Jean-Marc Touzard : « En vingt ans, la maturité du raisin a beaucoup avancé »","        ...  à Montpellier et coanimateur du projet Laccave sur l'adaptation des vignobles français au changement  climatique, les appellations sont condamnées à innover pour rester dans leur aire géographique. JeanMarc Touzard Directeur ...  "
