,date,publication,words,author,title,intro
164,2018-04-06,Les Echos,375mots,PHILIPPE BERTRAND,Vers une sortie de crise chez Carrefour,"    La grève de Pâques a permis la résurrection d'un  climat social apaisé chez Carrefour. Jeudi, la direction a reçu les syndicats pour leur faire des propositions sur le thème du pouvoir ...  "
165,2018-04-26,Les Echos,440mots,THIBAUT MADELIN,Berlin affiche son optimisme sur la croissance,"    ...  de menace de guerre commerciale : celui d'un retournement conjoncturel. Mardi, l'indice Ifo du  climat des affaires a reculé pour le cinquième mois d'affilée et a touché son plus bas ...  "
166,2018-04-20,Les Echos,1096mots,LEILA DE COMARMOND|MATTHIEU QUIRET|RENAUD HONORE|SOLVEIG GODELUCK|INGRID FEUERSTEIN,Les embûches de l'an II,"    ...  début de 2019, après une vaste concertation avec les syndicats de fonctionnaires. Démarrée dans un  climat tendu début avril, elle doit se poursuivre jusqu'à l'automne sur quatre thématiques : dialogue social ...  "
167,2018-04-20,Les Echos,497mots,JACQUES HUBERT-RODIER,Le pari de la proximité avec Trump,"    ...  janvier 2017, est d'arriver à faire entendre raison au milliardaire américain, notamment sur le  climat, la défense du système multilatéral ou encore le respect de l'accord international conclu en 2015 ...  "
168,2018-01-26,Les Echos,978mots,LAURENCE BOCCARA,Faut-il toujours investir dans l'immobilier locatif ?,"    Selon un sondage réalisé début janvier par Empruntis.com, courtier en prêts immobiliers, les Français sont toujours aussi nombreux à vouloir se lancer dans un investissement locatif : 13 % en 2018 contre ...  "
169,2018-02-05,Les Echos,354mots,HERVE LE TREUT,Plaidoyer pour l'histoire,"    ...  régions de basses latitudes sont si vulnérables. L'histoire de la science et celle du  climat sont aussi fortement liées au fait social, comme l'ont montré les travaux d'Emmanuel Le ...  "
170,2018-02-08,Les Echos,516mots,ALEXANDRE COUNIS,Brexit : les sanctions imaginées par Bruxelles mal vécues à Londres,"    ...  transition est en cours à Bruxelles, la Première ministre britannique, Theresa May, réunit dans un  climat déjà tendu les 11 ministres impliqués dans le Brexit pour tenter d'arrêter une position commune ...  "
171,2018-01-10,Les Echos,1682mots,GABRIEL GRESILLON,"La Hongrie, l'autre pays de la dérive « illibérale »","    ... En Hongrie, on ne parle guère de politique. Année après année, un  climat un peu plus lourd s'installe. D'un côté, les partisans de Viktor Orbán, l'indéboulonnable Premier ministre depuis ...  "
172,2018-01-12,Les Echos,500mots,DEREK PERROTTE,Superordinateurs : Bruxelles promet 1 milliard d'euros pour rattraper son retard,"    ...  des supercalculateurs dans nombre de domaines d'avenir, comme l'intelligence artificielle, la santé, le  climat et la cybersécurité. Faute d'offres assez performantes, les scientifiques et les entreprises d'Europe effectuent ...  "
173,2018-01-02,Les Echos,83mots,,VOLKSWAGEN : Ralf Pfitzner,"        ...  School. Il possède une expérience dans les domaines du développement durable, de la protection du  climat et de la stratégie environnementale. Viceprésident du développement durable chez Siemens AG, il était chargé ...  "
174,2018-03-09,Les Echos,571mots,LEILA DE COMARMOND,"Egalité professionnelle : les syndicats satisfaits, mais vigilants sur l'application","    ... Le  climat social est tendu, notamment avec les réformes annoncées de la SNCF et de la fonction publique. Raison de plus pour Emmanuel Macron de capitaliser sur un train de mesures populaires ...  "
175,2018-03-05,Les Echos,1014mots,PIERRICK FAY,Trois menaces qui planent sur la Bourse,"    ...  croissance cesse sans doute d'accélérer »,  au vu de  « l'érosion des dernières enquêtes de  climat des affaires en Allemagne et en France. La remontée du prix du baril ces derniers mois ...  "
176,2018-02-23,Les Echos,374mots,PAUL MOLGA,Owlmo veut surfer sur la vague du coaching,"    ...  Un  climat de rêve, une ambiance multiculturelle propice aux échanges, des opportunités économiques à la pelle, de l'immobilier accessible ... » Avec de tels arguments, Charles Fournier n'a pas réfléchi bien longtemps ...  "
177,2018-03-21,Les Echos,680mots,AUDE VILLIERS-MORIAMé,Les pays du G20 peinent à désamorcer les tensions fiscales et commerciales,    ...  mesuré que les délégations présentes au Centre des expositions de Buenos Aires ont qualifié le  climat de ce G20 Finances. Et pour cause : les points de discorde ont été nombreux lors de ...  
178,2018-03-21,Les Echos,536mots,GUILLAUME DE CALIGNON,L'économie française reprend son souffle depuis le début de l'année,"    ...  Optimisme Enfin, en France comme dans la plupart des pays de la zone euro, le  climat des affaires s'est un peu tassé en janvier et février, même s'il reste à ...  "
179,2018-03-01,Les Echos,1796mots,THIBAUT MADELIN,Comment l'extrême droite veut s'imposer dans les usines allemandes,"    ...  élections, mais assez pour faire trembler l'IG Metall et le patronat. Et changer le  climat social outreRhin. Un passé sulfureux « Nous observons ce développement avec inquiétude,  a reconnu le patron ...  "
180,2018-04-30,Les Echos,527mots,CHANTAL HOUZELLE,Laurent Berger : « J'attends des garanties du Premier ministre pour la SNCF »,"    Voulant rester à l'écart du  « maelström »  provoqué par la CGT dans le  climat social qui agite la France depuis le début de la grève contre la réforme de la SNCF, la ...  "
181,2018-04-30,Les Echos,586mots,ALAIN RUELLO,Les économistes optimistes sur la croissance malgré le ralentissement de début d'année,"    ...  cherche sa vitesse de croisière, ce qui suggère que la croissance du PIB et le  climat des affaires sur le second semestre de 2017 n'étaient pas tenables »,  ajoutent les analystes de ...  "
182,2018-04-06,Les Echos,662mots,PIERRICK FAY,"Le rebond du yen, trublion des marchés","    C'est un peu la mouche du coche dans ce  climat favorable aux actions japonaises : le yen s'apprécie de 5,22 % face au dollar depuis le début de l'année. Une ...  "
183,2018-02-08,Les Echos,94mots,,Apprentissage : ultime bras de fer entre les régions et le gouvernement,"        ...  à Matignon n'est pas garantie. Ce regain de tensions apparent intervient alors que le  climat était plutôt à l'apaisement. Aux dernières nouvelles, le différend porterait sur la fraction de la ...  "
184,2018-01-03,Les Echos,500mots,EDOUARD LEDERER,Nouvelle panne en novembre pour l'assurance-vie,"    ... 'euros.  « La donne s'inverse une fois dépassée la période électorale. On entre dans un  climat économique plus favorable qui incite à des choix plus dynamiques, comme l'indique la hausse de ...  "
185,2018-03-23,Les Echos,38mots,,"-2,05 % / Fonds actions secteur biotechnologies","        ...  américaines sont à la peine, mais la tendance s'améliore avec la reprise des fusionsacquisitions dans le secteur. Dans ce  climat, les fonds dédiés perdent 2,05 % sur un an.  ...  "
186,2018-03-08,Les Echos,313mots,XAVIER FONTANET,A chacun son boulot !,"    ...  inférieur à 1 ! Revenons aux fondamentaux : permettre aux citoyens de déployer leurs initiatives dans un  climat de confiance et de liberté, disposer d'une défense efficace et d'une diplomatie active. Non ...  "
187,2018-03-30,Les Echos,32mots,,Le Grand entretien avec Philippe Donnet,        Le patron français de Generali évoque le  climat des affaires en Italie après les élections. Il salue les efforts de Macron pour « vendre » la France.  ...  
188,2018-03-27,Les Echos,1866mots,DENIS FAINSILBER,Vent de fronde contre l'éolien,"    ...  gens allant de l'extrême gauche à l'extrême droite. Sur des sujets comme le  climat ou le nucléaire, ils sont capables de s'écharper ! » Néoruraux venus s'installer à la campagne ...  "
189,2018-04-03,Les Echos,672mots,MICHEL DE GRANDI,Pourquoi l'Afrique peine à accélérer sa transformation économique,    ...  changement sans pour autant réussir à l'enclencher vraiment : le désir partagé d'améliorer le  climat des affaires; une nouvelle génération de leaders qui veulent stabiliser la vie politique et améliorer la ...  
190,2018-04-03,Les Echos,467mots,NICOLAS RAULINE,Trump veut assouplir les obligations antipollution,"    ...  les EtatsUnis de l'Accord de Paris et s'apprêtant à abroger le plan  Climat d'Obama.  « Nous allons revoir les standards  [sur les mesures antipollution, NDLR]  de façon à ce ...  "
191,2018-04-11,Les Echos,427mots,MICHEL DE GRANDI,Les craintes d'une guerre commerciale Chine - Etats-Unis montent dans les entreprises,"    ... Ce qui fait défaut actuellement, c'est la confiance. Ellemême entamée par le  climat protectionniste ambiant. Que l'on ne s'y trompe pas cependant : les craintes exprimées par les entreprises ...  "
192,2018-04-11,Les Echos,483mots,MYRIAM CHAUVOT,Suez négocie l'achat du saoudien Edco pour traiter les déchets pétrochimiques,"    ...  les entreprises françaises à s'implanter en Arabie saoudite.  « Le contexte saoudien est favorable, le  climat des affaires a changé,  estime Abdulwahab Al Ahmari.  Depuis  les mesures anticorruption de l'an dernier ...  "
193,2018-04-11,Les Echos,653mots,PIERRE-ALAIN FURBURY,Hollande admet des « erreurs » et fait la « leçon » à Macron,"    ...  le nom de l'ancien président de la République. Pour saluer son  « succès »  ... sur le  climat. Le service minimum.  « Nous avons déçu mais nous allons tirer les leçons de l'échec »  , avait ...  "
194,2018-02-06,Les Echos,562mots,LEILA DE COMARMOND,Les syndicats s'inquiètent des projets du gouvernement,    ...  cette divergence de ton ne peut suffire à faire retomber la pression alors que le  climat social s'est fortement dégradé ces dernières semaines dans la fonction publique avec la multiplication des ...  
195,2018-02-13,Les Echos,568mots,LEILA DE COMARMOND,Le gouvernement tente de faire retomber la pression,"    ...  sera laissée à la discussion, alors que l'enjeu électoral devrait contribuer à électriser le  climat social. Pour leur part, la CGT et FO n'ont pas manqué lundi d'envoyer des ...  "
196,2018-01-12,Les Echos,965mots,LAURENCE BOCCARA,Les bonnes affaires des enchères immobilières,"    ...  jours et horaires précis.  « Attention, dans les ventes judiciaires où il y a parfois un  climat conflictuel, il n'y a qu'un seul jour de visite possible »  , précise Florence Amsler, avocate ...  "
197,2018-01-11,Les Echos,574mots,PIERRICK FAY,La Bourse de Hong Kong accumule les records,    ...  immédiate sur l'économie locale malgré un niveau d'endettement qui inquiète le FMI. Ce  climat de faible aversion pour le risque favorise donc l'arrivée de flux de liquidité importants sur ...  
198,2018-01-24,Les Echos,531mots,THIERRY OGIER,Lula dans les cordes face à la justice,"    ...  vont désormais juger le recours en appel de Lula, alors que ses avocats dénoncent un  climat de  « persécution »  et de  « justice d'exception »  . Confirmation probable du verdict Lula joue gros : en cas ...  "
199,2018-02-05,Les Echos,647mots,,Le coût exorbitant de l'éolien offshore français,        Les énergies renouvelables bientôt toutes compétitives »  . C'est ainsi que « Les Echos » titraient un article sur une étude de l'Agence internationale des énergies renouvelables dévoilée mijanvier. La subtilité est ...  
200,2018-01-19,Les Echos,698mots,ROGER-POL DROIT,Notre Drame des Lois,"    ...  au motif qu'elles bafouent ces nouveaux droits  en saccageant la biodiversité, en déréglant le  climat, en épuisant les ressources, etc. La moralité, dès lors, consiste à défendre la nature, et les ...  "
201,2018-03-08,Les Echos,337mots,DOMINIQUE SEUX,Du grain à moudre à la SNCF,"    ...  très remontés contre la réforme qui se prépare et autant, voire plus exaspérés, par le  climat qui l'entoure que Guillaume Pepy a poussé mercredi ce qu'il appelle son  « coup de ...  "
202,2018-03-21,Les Echos,475mots,LAMIA BARBOT,Cergy-Pontoise se positionne en reine du vélo,"    ...  locationréparation de vélos de la Vélostation, dans le cadre de son « Agenda 21  Plan  climat énergie territorial » . Située devant les gares de CergyPréfecture et CergyleHaut, la Vélostation est ...  "
203,2018-03-19,Les Echos,618mots,VERONIQUE RICHEBOIS,"Le Salon du livre, vitrine d'un marché français en plein bouleversement","    ... La 38e édition du Salon Livre Paris s'est ouverte, jeudi soir, dans un  climat diplomatique polaire. Venu inaugurer le Salon, qui se tient du 16 au 19 mars, le président Macron ...  "
204,2018-03-14,Les Echos,171mots,VIRGINIE ROBERT,"Iran, Corée : Trump veut une diplomatie de choc","    ...  Corée du Nord, l'ingérence de la Russie, ou l'Accord de Paris sur le  climat. Or, selon la MaisonBlanche, le président souhaitait avoir un ministre à ses ordres pour préparer ...  "
205,2018-03-02,Les Echos,489mots,CATHERINE CHATIGNOUX,Comment l'immigration a été instrumentalisée durant la campagne,    ...  ces dernières semaines des étrangers pour que le dossier immigration domine la campagne électorale. Le  climat est devenu délétère depuis l'automne et le report par le gouvernement de l'adoption du ...  
206,2018-04-04,Les Echos,257mots,LES ECHOS,Quelles politiques économiques pour préserver les ressources naturelles ?,"    ... 'il faudrait une coordination internationale qui n'existe pas aujourd'hui. Prenons l'exemple du  climat. Il n'y a pas de prix mondial du CO2, il y a une multitude de ...  "
207,2018-03-29,Les Echos,569mots,ALEXANDRE COUNIS,"Un an avant le Brexit, les entreprises restent dans le flou","    ... Malgré quelques avancées tangibles, le  climat d'incertitude va continuer de peser sur le monde des affaires. Les dernières déclarations de Theresa May ravivent les inquiétudes.  ...  "
208,2018-04-03,Les Echos,995mots,YVES BOURDILLON,"Poutine IV, un nouveau règne à hauts risques","    ... 'enjeu de la succession déteint aussi sur la politique extérieure de la Russie, dans un  climat de quasiguerre froide aujourd'hui.  « La confrontation avec l'Ouest est un facteur de ralliement ...  "
209,2018-04-18,Les Echos,54mots,JULIE CHAUVEAU,Fondation RAJA-Danièle Marcovici : Ghislaine Tandonnet Guiran,    ...  sur les questions de l'économie de l'environnement a été consultante avant de rejoindre Ecofys puis Artelia. Elle interviendra aussi auprès des organisations internationales sur des projets  climat et développement.  ...  
210,2018-04-26,Les Echos,570mots,ELSA CONESA,Macron appelle les élus américains à « ne pas fermer la porte au monde »,"    ...  nouveau la position française sur les sujets sur lesquels les divergences demeurent : Iran, multilatéralisme, commerce,  climat... Ponctuant ses propos de «  that's my position  » ( «  voilà ma position  »), ou «  we have no choice ...  "
211,2018-01-05,Les Echos,447mots,ISABELLE COUET,Le Dow Jones atteint de nouveaux sommets,"    ...  clôturant à 25.075,13 points. Du jamaisvu. Wall Street démarre 2018 dans un  climat euphorique. Le S&amp;P 500 et le Nasdaq  qui a franchi le seuil des 7.000 ...  "
212,2018-02-20,Les Echos,561mots,GUILLAUME BENOIT,Euronext sort renforcé de l'année 2017,"    ...  du plan stratégique.  « Notre plan  'Agility for Growth'  a été conçu en 2016, dans un  climat très différent,  rappelle Stéphane Boujnah.  A l'époque, nous n'anticipions pas de nouvelles opportunités en ...  "
213,2018-03-14,Les Echos,384mots,RAPHAEL BLOCH,"Mike Pompeo, un ultra-conservateur écouté par le président","    ... 'a eu de cesse de dénoncer l'accord sur le nucléaire iranien, celui sur le  climat ou de critiquer la gestion par Hillary Clinton de l'attentat de Benghazi  une affaire sur ...  "
214,2018-03-09,Les Echos,791mots,HENRI GIBIER,Le livre choc sur le capitalisme français,"    ...  hexagonal, toutes les parties prenantes en retenant d'abord l'idée de conflit. Dans ce  climat, l'arrivée de la gauche au pouvoir en 1981 a vite démontré que la route de ...  "
215,2018-03-13,Les Echos,1689mots,BENJAMIN QUENELLE,Modernisation de la Russie : le défi de Poutine,"    ...  Avec un contrôle de l'Etat trop fort et un système judiciaire sous influence, le  climat d'affaires reste mauvais : le 'venture capital' ne vient pas investir ! »  s'inquiète un homme d ...  "
216,2018-03-21,Les Echos,392mots,MARTINE ROBERT,Guerre d'étoilés à la tour Eiffel,"    ...  Mais son concurrent Elior ayant signé un partenariat fin 2015 avec le chef étoilé, le  climat s'est tendu entre Ducasse et la firme de la famille Bellon, contrainte de monter une ...  "
217,2018-04-04,Les Echos,667mots,,"Benoît Vandermarcq, banquier de terrain","        ...  et à Nancy,  commentetil, car les mentalités sont différentes, à l'image du  climat, des traditions locales,  estimetil.  A Lille, on est chez les Ch'tis, et leur ...  "
218,2018-03-27,Les Echos,374mots,CECILE CORNUDET,"Terrorisme, S comme symbole","    ...  indigné Richard Ferrand, président du groupe LREM à l'Assemblée. Mais elle crée également un  climat, une pression sur un exécutif qui sait combien la peur peut rendre sourde l'opinion aux ...  "
219,2018-03-28,Les Echos,399mots,CECILE CORNUDET,Terrorisme : peut-on répondre autrement ?,"    ... Depuis les attentats de l'Aude, le chef de l'Etat tente de se démarquer de ses prédécesseurs, aidé par le  climat particulier suscité par le sacrifice d'Arnaud Beltrame.  ...  "
220,2018-03-30,Les Echos,1602mots,LAURENT THEVENIN|GUILLAUME MAUJEAN,Philippe Donnet : « Emmanuel Macron sait vendre la France »,"    ...  plein, mais aucun ne dispose d'une majorité absolue. Cela pèsetil sur le  climat des affaires dans le pays ? Cela n'a aucun impact sur les affaires. Il faut bien ...  "
221,2018-03-30,Les Echos,652mots,PIERRICK FAY,L'euphorie règne sur la monnaie sud-africaine,"    ...  progressive de l'économie et une stabilisation de sa situation fiscale »  , espère Moody's. Ce  climat favorable a permis à la banque centrale d'Afrique du Sud de baisser, pour la deuxième ...  "
222,2018-04-10,Les Echos,413mots,THIERRY OGIER,BNP Paribas surfe sur la reprise brésilienne,"    ...  Voltalia... elles sont toutes ici »  , expliquetelle. Après des années de vaches maigres, le  climat économique, caractérisé par une faible inflation et une chute importante des taux d'intérêt, est favorable ...  "
223,2018-02-07,Les Echos,616mots,MARC DELCOURT,Mobilité propre : l'utopie du tout électrique,"    Le 6 juillet 2017, dans son plan  climat, le ministre de la Transition écologique et solidaire, Nicolas Hulot, avait partagé sa vision à 2040 d'une France enfin débarrassée de ses voitures ...  "
224,2018-01-31,Les Echos,518mots,NICOLAS RAULINE,L'inflation et la déréglementation au menu du mandat de Powell,    ... Le nouveau président de la Fed prendra ses fonctions la semaine prochaine dans un  climat plus favorable que celui dont ont bénéficié ses prédécesseurs.  ...  
225,2018-01-08,Les Echos,680mots,EMMANUEL GRASLAND,"Sanjeev Gupta, le milliardaire qui défend l'acier européen","    ...  Que vient faire Sanjeev Gupta en France ? Sans surprise, l'homme dit vouloir profiter du  climat favorable à l'investissement depuis l'élection d'Emmanuel Macron. Son offre sur Ascometal, qui propose ...  "
226,2018-01-08,Les Echos,507mots,NICOLAS RAULINE,Une dérégulation tous azimuts depuis l'arrivée de Trump,"    ... 'Accord de Paris, Trump avait aussi décidé d'abroger le Clean Power Plan, le plan  climat d'Obama. Celuilà avait pour but d'accélérer la transition énergétique et impose aux centrales ...  "
227,2018-01-11,Les Echos,413mots,DEREK PERROTTE,La Belgique veut introduire Belfius en Bourse avant l'été,    ...  dans les stresstests européens. Belfius s'appuie sur de bonnes performances commerciales et un  climat macroéconomique porteur. La banque vise désormais une progression de 43 % sur cinq ans de son bénéfice ...  
228,2018-02-12,Les Echos,534mots,PAUL MOLGA,Le lin veut trouver sa place dans les résines écologiques,"    ...  cette herbacée qui représente 1 % des fibres textiles consommées sur la planète. Et grâce au  climat propice de la HauteNormandie, sa qualité figure aussi parmi les meilleures, avec un rendement 2 ...  "
229,2018-01-02,Les Echos,628mots,ANAIS MOUTOT,"En Californie, un gigantesquemarché s'ouvre pour le cannabis","    ...  a été légalisé le 1 er janvier. Avec près de 40 millions d'habitants et un  climat propice à l'agriculture, la Californie va devenir le premier marché pour les producteurs.  ...  "
230,2018-03-14,Les Echos,523mots,YVES BOURDILLON|BENJAMIN QUENELLE,La classe moyenne votera Poutine mais rêve de tourner la page,"    ...  de 5 % à 15 % de la population active dans certaines villes. «  Il suffirait d'un  climat d'affaires plus sain pour qu'on travaille légalement  », confie l'un de ces entrepreneurs de ...  "
231,2018-02-26,Les Echos,514mots,OLIVIER TOSSERI,Marco Damilano : « L'Italie est le miroir des difficultés des démocraties européennes »,    ...  une absence criante de projets que l'on constate dans l'actuelle campagne électorale. Le  climat politique est très tendu en Italie et beaucoup craignent un retour du fascisme. Estce une ...  
232,2018-02-21,Les Echos,467mots,PASCAL POGAM,Pourquoi il faut (enfin) donner un prix au carbone,"    ...  tout cas, pour espérer atteindre les objectifs inscrits dans l'Accord de Paris sur le  climat, qui supposeraient une diminution de l'ordre de 50 % de ces émissions dans les vingtcinq ...  "
233,2018-02-22,Les Echos,85mots,,Aide au développement : une mission confiée au député Hervé Berville,"        ...  consacrer 0,55 % du revenu national brut (RNB) en 2022, contre 0,38 % en 2016. Cinq grands domaines prioritaires ont été fixés : « stabilité internationale »,  climat, éducation, égalité femmeshommes et santé.  ...  "
234,2018-02-23,Les Echos,569mots,ELSA CONESA,Armes à feu : la responsabilité des entreprises dans le viseur,"    ...  appelant les grands patrons, prompts à prendre position sur l'immigration,le racisme ou le  climat, à également agir sur les armes à feu. Crainte d'un boycott ou de représailles « Les ...  "
235,2018-04-20,Les Echos,716mots,LEILA DE COMARMOND|ISABELLE FICEK|GREGOIRE POUSSIELGUE,"Avec Macron, une majorité docile et des contre-pouvoirs bousculés","    ...  de l'opération n'était donc pas de tous les changer, mais de créer un  climat d'incertitude chez ces hauts fonctionnaires, propre à obtenir une implication plus forte de ceux qui ...  "
236,2018-04-13,Les Echos,444mots,ANNE DRIF,Pragma se relance sous la bannière Sparring Capital,"    ...  et n'a réalisé qu'une seule cession sur son véhicule précédent. Résultat : dans un  climat de défiance des investisseurs internationaux envers la France, le nouveau fonds de 250 millions d'euros ...  "
237,2018-04-11,Les Echos,640mots,JEAN-PIERRE LAGARDE,La bascule massive vers l'essence rencontre encore des freins,    ...  reprendre leurs investissements. Les menaces d'interdiction faites aux véhicules carburant au gazole et le  climat pesant qui règne depuis l'affaire du « dieselgate » ont de quoi semer le doute dans les ...  
238,2018-01-30,Les Echos,385mots,JEAN-MARC JANCOVICI,La tête sans les jambes,"    ...  juin 1992, au Sommet de la Terre à Rio, là où fut lancée la Convention  Climat, François Mitterrand qualifia les objectifs environnementaux en discussion de  « condition de la survie même de l ...  "
239,2018-02-07,Les Echos,454mots,EDOUARD LEDERER|ETIENNE GOETZ,Les marchés peu sensibles aux performances 2017 de la première banque de la zone euro,    ...  sont réunies » . En ordre de marche La banque justifie cet optimisme par le changement de  climat dans la zone euro et la perspective  plus probable désormais  d'une remontée à moyen long ...  
240,2018-02-13,Les Echos,68mots,,La hausse des taux britanniques sera progressive,"        ...  de la BoE. Mais cette hausse devra être plus graduelle que prévu, étant donné le  climat d'incertitude que le Brexit fait peser sur l'économie du pays, atil déclaré ...  "
241,2018-01-05,Les Echos,449mots,DOMINIQUE SEUX,Permis de réformer prolongé,"    ...  de campagne. Ils saluent peutêtre aussi la visibilité redonnée à Paris avec le sommet  Climat, sur les sujets européens, voire la réception sans concession de Donald Trump le 14 juillet. Ce ...  "
242,2018-02-26,Les Echos,679mots,MICHEL DE GRANDI,Les nouvelles ambitions de l'aide publique au développement française,"    ...  domaines prioritaires Pour cette nouvelle approche, cinq grands domaines prioritaires ont été fixés : stabilité internationale,  climat, éducation, égalité femmeshommes et santé. La France mobilisera 500 millions d'euros pour la protection ...  "
243,2018-04-03,Les Echos,607mots,BASILE DEKONINK,"2018, le bon cru annoncé des IPO de la tech","    ...  Flamant.  Une IPO est une question de timing, et le facteur psychologique joue beaucoup. »  Le  climat actuel vatil freiner les ambitions des candidats à l'entrée en Bourse ? L'introduction ...  "
244,2018-03-13,Les Echos,458mots,NATHALIE HAMOU,L'ombre d'une élection anticipée plane sur Israël,"    ...  qu'en novembre 2019, le pays s'est retrouvé ce weekend plongé dans un  climat de campagne préélectorale, à la faveur d'une énième crise politique, dont personne ne sait si ...  "
245,2018-04-25,Les Echos,498mots,ELSA CONESA,Iran : Trump et Macron plaident pour un accord plus large,"    ...  pas à s'embrasser devant les caméras, sont entrés dans le dur des négociations, abordant des sujets sur lesquels leurs vues divergent fortement, comme l'Iran, le commerce, ou le  climat.  ...  "
