,date,publication,words,author,title,intro
246,2018-04-27,Les Echos,420mots,JOEL COSSARDEAUX,Cinq mesures pour inciter à faire des travaux,"    Le plan présenté par Nicolas Hulot déroule un chapelet de douze actions pour relancer la rénovation énergétique dans le bâtiment. Les cinq plus marquantes sont cellesci, destinées à faire passer ...  "
247,2018-01-19,Les Echos,562mots,PATRICK D'HUMIERES,Ne pas rejouer la guerre de l'entreprise,"    ...  évolutions technologiques, de la mondialisation, de la pression excessive sur les ressources, dont l'enjeu  climat prioritaire, ce qui appelle à faire remonter cette responsabilité sociétale des entreprises (RSE) plus haut dans ...  "
248,2018-02-07,Les Echos,560mots,PIERRICK FAY,Alain Pitous : « Il y a un risque de répliques »,"    ...  diminue, les salaires augmentent, la croissance commence à être autoentretenue... Autrement dit, c'est un  climat favorable à une remontée de l'inflation, ce qui pousse aussi à revoir la façon dont ...  "
249,2018-01-10,Les Echos,69mots,ISABELLE COUET,Le rand bondit sur un quiproquo autour de Zuma,    ...  la devise sudafricaine. Le rand a pris plus de 1 % en séance dans un  climat de confusion. Il a profité d'une fausse information selon laquelle le président sudafricain démissionnait ...  
250,2018-02-16,Les Echos,478mots,PIERRICK FAY,La Bourse salue la diminution du risque politique,"    ... La diminution du risque politique s'accompagne aussi d'une amélioration du  climat économique. La Bourse profite d'ailleurs du rebond massif des marchés émergents, soutenu par le repli généralisé du dollar ...  "
251,2018-01-08,Les Echos,728mots,PIERRICK FAY,Les Bourses mondiales démarrent l'année en fanfare,"    ...  décembre n'ont pas vraiment modifié les conditions de marché. Les actions profitent toujours du  climat de croissance économique mondiale synchronisée. Et, de ce point de vue, les premières statistiques de l ...  "
252,2018-01-17,Les Echos,566mots,LAURENCE ALBERT,L'Haÿ-les-Roses se branche sur le photovoltaïque,"    ...  d'une usine d'eau. Quelques semaines à peine après le vote de son plan  Climat Energie, la mairie de Paris a inauguré, fin 2017, la plus grande centrale photovoltaïque d'Ile ...  "
253,2018-03-20,Les Echos,607mots,YVES BOURDILLON|BENJAMIN QUENELLE,"Conforté politiquement, Poutine affronte des chantiers économiques délicats","    ...  des mastodontes Les chantiers sont en effet nombreux et ardus, d'autant plus que le  climat de quasiguerre froide risque d'isoler la Russie de l'Occident, de loin son principal ...  "
254,2018-02-28,Les Echos,87mots,EDOUARD LEDERER,S&amp;P très positif sur les banques espagnoles,"    ...  nous amener à envisager des relèvements de note », affirme l'agence. Seule ombre au tableau, la persistance des incertitudes politiques en Catalogne, rendant le  climat des affaires incertain dans la région.  ...  "
255,2018-04-27,Les Echos,49mots,,ALLEMAGNE : LE BLUES DES CONSOMMATEURS,"        ...  s'atténuer en mai à 10,8 points contre 10,9 points en avril en raison d'un  climat géopolitique anxiogène, selon l'étude mensuelle de l'institut GfK publiée jeudi.  ...  "
256,2018-02-12,Les Echos,493mots,GUILLAUME BENOIT,Un test pour le nouveau patron de la Fed,    ... Jerome Powell entame son mandat à la tête de la banque centrale américaine dans un  climat très agité. Les marchés seront très attentifs à sa réaction.  ...  
257,2018-02-16,Les Echos,1678mots,FRANCOIS VIDAL|NINON RENAUD|SHARON WAJSBROT,"Laurent Mignon : « Le seul risque systémique pour le secteur bancaire, c'est le risque cyber »","    ...  du « dumping », l'essentiel est d'assurer un cadre et une stabilité pour générer un  climat de confiance. Les mesures mises en place par le gouvernement me semblent aller dans ce sens ...  "
258,2018-02-14,Les Echos,649mots,PIERRICK FAY,Les moteurs et les freins,"    ...  l'extérieur, et la remontée du yuan font que le pays ne contribue plus au  climat déflationniste dans le monde. Mais les prix à la consommation ont ralenti en janvier (à 1 ...  "
259,2018-01-15,Les Echos,84mots,LAURANCE N'KAOUA,"En Allemagne, un accord de coalition fragile","    ...  ont rédigé un document portant sur des sujets allant de l'aide aux chômeurs au  climat, en passant par l'immigration ou les retraites. Mais, ce weekend, plusieurs poids lourds du ...  "
260,2018-01-10,Les Echos,397mots,NICOLE BUYSE,Pimkie : premier échec d'une rupture conventionnelle collective,"    ... d'Ascq lundi. Dès le début de la rencontre, qui s'est déroulée dans un  climat très tendu, la CFDT a rejoint la CGT et FO, se positionnant officiellement contre la rupture ...  "
261,2018-01-22,Les Echos,467mots,DOMINIQUE SEUX,Redonner de la fierté aux Français,"    ...  début de son quinquennat après l'invitation de Donald Trump à Paris et le sommet  Climat de la fin 2017, Emmanuel Macron prend ce lundi une initiative qui frappe joliment les esprits ...  "
262,2018-01-08,Les Echos,1015mots,DOMINIQUE SEUX,"Confiance, modestie, ambition : trois mots pour 2018",    ...  pas dans la même catégorie que la Chine. Moscou peut se réjouir de récréer un  climat de guerre froide à l'est et au nord de l'Europe. Pour autant le nouveau ...  
263,2018-03-12,Les Echos,76mots,,Le cacao au plus haut depuis plus d'un an,"        ...  de l'année, les prix ont gagné 31 %. Une hausse motivée par l'offre, le  climat étant assez chaud et sec en Afrique de l'Ouest pour perturber la production, dit un ...  "
264,2018-02-23,Les Echos,406mots,AUDE VILLIERS-MORIAMé,Le gouvernement argentin face à la grogne sociale,"    ...  a rassemblé plusieurs dizaines de milliers d'Argentins mercredi. Une marche qui intervient dans un  climat social déjà tendu, alors que les syndicats sont en train de négocier des hausses de salaire ...  "
265,2018-02-26,Les Echos,101mots,RICHARD HIAULT,Italie : des législatives décisives pour la stabilité politique du pays,"    ...  une dernière semaine tendue avant les législatives de dimanche. Ces derniers jours ont vu un  climat de plus en plus tendu avec une recrudescence de violences, notamment à l'égard d'un ...  "
266,2018-03-02,Les Echos,1629mots,DOMINIQUE SEUX,"Raymond Soubie : « La stratégie de Macron, c'est le principe de la bicyclette : tant qu'on avance, on ne [...]",    ...  déjà beaucoup un certain nombre de chefs d'entreprise. Mais il est manifeste que le  climat a là aussi changé. Emmanuel Macron a osé. Un autre train de réformes est prévu ce ...  
267,2018-04-10,Les Echos,596mots,ALAIN MILON|SOPHIE PRIMAS,Tirer des leçons concrètes de l'affaire Lactalis,    ...  rendront plus effectives les règles actuelles de protection des consommateurs et contribueront à atténuer le  climat de défiance que l'affaire Lactalis a pu installer chez les consommateurs. Alain Milon Sophie Primas ...  
268,2018-04-26,Les Echos,458mots,DOMINIQUE SEUX,Chômage : un (tout) premier résultat,"    ...  selon la formule consacrée : une croissance mondiale solide, qui soutient une bonne conjoncture française; un  climat positif dans les entreprises, conséquence d'un gouvernement « pro business » ; une batterie impressionnante de réformes lancées ...  "
269,2018-04-23,Les Echos,593mots,INGRID FEUERSTEIN,Des moyens pour mieux évaluer les politiques publiques,"    ...  les données sont  « conservées jalousement par les ministères »  , regrettent les signataires, ce qui  « crée un  climat de défiance institutionnelle malsain »  . Accès aux données « Si cet office voit le jour, il faudrait qu ...  "
270,2018-02-02,Les Echos,1621mots,DOMINIQUE SEUX|PIERRE-ALAIN FURBURY|CECILE CORNUDET,JEAN-PIERRE RAFFARIN : « Macron ne doit pas décevoir la France d'en bas pour satisfaire celle d'en haut »,"    ...  14 et 15 mai, nous organiserons une conférence à Paris pour débattre de quatre sujets (climat et guerre, la frontière tunisolibyenne et la frontière américanomexicaine) à partir du rapport rédigé ...  "
271,2018-01-25,Les Echos,398mots,ETIENNE LEFEBVRE,"Le chômage, défi de 2018 pour Macron","    Un  climat des affaires (indice Markit) toujours au plus haut pour démarrer l'année, des embauches en CDI en forte augmentation et des défaillances d'entreprise au plus bas depuis dix ans ...  "
272,2018-02-08,Les Echos,882mots,PAULINE HOUEDE,Les principaux points de l'accord de coalition,    ...  des poussins mâles doit également être stoppée d'ici le milieu de la nouvelle législature.  Climat et énergie L'Union et le SPD veulent accélérer le développement des énergies renouvelables et porter ...  
273,2018-02-08,Les Echos,586mots,CATHERINE DUCRUET,Les biotech attendent plus de la France,    ... La France bénéficie d'un  climat favorable à la création d'entreprises de technologies dans le secteur de la santé. Mais leur développement tient ensuite du parcours du combattant.  ...  
274,2018-03-16,Les Echos,860mots,DAVID BARROUX,Vignoble : l'incroyable boom de la Napa Valley,"    ...  prix. Telle est la nouvelle philosophie d'une Napa Valley bénie des dieux par son  climat et la richesse et la diversité de ses sols. Attraction touristique, la Napa attire chaque année ...  "
275,2018-02-28,Les Echos,566mots,LEILA DE COMARMOND,Le pari gouvernemental de l'isolement cheminot,    ...  dans les entreprises se traduisent par un regain de tension sociale... Cela changerait singulièrement le  climat lors de l'ouverture du dossier social le plus délicat du quinquennat : celui de la réforme ...  
276,2018-03-21,Les Echos,685mots,MARIE-JOSEE COUGARD,Les marges des entreprises agroalimentaires au plus bas depuis 40 ans,"    ...  quoi que ce soit à la déflation.  « Les négociations commerciales se sont déroulées dans un  climat catastrophique »,  affirme JeanPhilippe Girard, président de l'Association nationale des industries alimentaires (Ania). Une entreprise ...  "
277,2018-03-26,Les Echos,914mots,PIERRICK FAY,Ces cinq facteurs qui tourmentent la Bourse,"    ...  gros titres, masquée par l'omniprésence de Donald Trump, mais les dernières statistiques sur le  climat des affaires dans la zone euro ont été décevantes.  « Sur ces 17 indicateurs, 17 étaient en ...  "
278,2018-03-23,Les Echos,663mots,DOMINIQUE CHAPUIS,"Après deux années difficiles, l'horlogerie suisse retrouve des couleurs à l'export","    ...  est toujours en recul (4,4 %), alors que son économie se porte bien. «  Malgré le  climat d'incertitude politique, beaucoup de marques continuent de miser sur ce marché , indique Bénédicte Sabadie, associée ...  "
279,2018-03-28,Les Echos,403mots,VALERIE LEBOUCQ,Ne l'appelez plus Paca,"    ...  marketing territorial a pour objectif de vendre à l'international une destination touristique  et un  climat propice aux affaires  en associant acteurs publics et privés. La marque Bretagne,qui a réussi à ...  "
280,2018-04-13,Les Echos,1878mots,ANNE DRIF|GUILLAUME MAUJEAN|FRANCOIS VIDAL|NICOLAS BARRE,« Les gens de Wall Street sont généralement très mauvais pour prédire l'avenir »,"    ...  conséquence du Brexit ? Pas vraiment. Ce qui est vrai, en revanche, c'est que le  climat en France est devenu bien plus hospitalier. Quand j'ai créé Perella, nous avions voulu nous ...  "
281,2018-04-16,Les Echos,542mots,RENAUD HONORE,Le gouvernement veut une nouvelle baisse des contrats aidés en 2019,    ...  la prévision d'emplois  « est cohérente avec le niveau très élevé de l'indicateur du  climat de l'emploi dans les enquêtes de conjoncture de l'Insee »  . La tendance devrait rester similaire ...  
282,2018-04-16,Les Echos,431mots,PHILIPPE CHEVILLEY,Requiem vénézuélien,"    ...  agonie, Chávez passe du statut de combattant à celui de saint ou de dieu. Le  climat de religiosité dans le pays est surréaliste. La révolution bolivarienne apparaît alors plus que jamais comme ...  "
283,2018-04-20,Les Echos,819mots,VIRGINIE ROBERT,Pourquoi le regard sur la France a changé,"    ...  la durée »  , explique un conseiller. Chaque visite est aussi l'occasion de pousser l'agenda  climat porté par la France (comme la visite d'une centrale solaire en Inde et au Burkina ...  "
