,date,publication,words,author,title,intro
240,2019-05-02,Les Echos,552mots,,Logements : luttons contre les arnaques à la rénovation,"        ...  Conseil des ministres. Il doit répondre à cette double urgence : répondre au défi du changement  climatique, et répondre aux revendications sociales formulées par tout un pays. Nous voulons croire que cette loi ...  "
241,2019-05-15,Les Echos,478mots,SEBASTIEN DUMOULIN,Orange investit 100 millions d'euros dans deux data centers,"    ...  de sécurité. Et c'est un levier pour prendre toute notre part dans le défi  climatique. » Orange travaille en ce moment sur son prochain plan stratégique, dans lequel le groupe compte bien ...  "
242,2019-06-05,Les Echos,568mots,GABRIELLE SERRAZ,Rossignol se dote d'un site pilote en Haute-Savoie,"    Changement  climatique oblige, la station du Col du Corbier dans le Chablais, va inaugurer le 25 juin prochain la première « Station multiactivités Outdoor Experiences », du groupe Rossignol. Situé à 1.237 ...  "
243,2019-05-20,Les Echos,446mots,BRUNO TREVIDIC,Le secteur face au défi environnemental,"    ...  d'émissions (ETS) payés par les compagnies, et censés financer la lutte contre le réchauffement  climatique. Mais cette initiative s'est heurtée au refus d'un grand nombre de pays, et le ...  "
244,2019-07-03,Les Echos,507mots,GUY VALLANCIEN,Pourquoi il ne faut plus rembourser l'homéopathie,    ...  ne peut à la fois arguer des données scientifiques du GIEC pour défendre l'urgence  climatique et refuser les conclusions de la même science en vue de soutenir la vente de drogues ...  
245,2019-07-22,Les Echos,403mots,,« Le cycle de l'eau est complètement perturbé »,        ...  pour y remédier ? Il y a deux causes principales à la sécheresse actuelle. Le dérèglement  climatique d'abord et l'activité humaine qui l'aggrave. Le cycle de l'eau est complètement ...  
246,2019-07-04,Les Echos,585mots,GILLES ROUSSEL,"Entreprises, embauchez des doctorants !","    ...  société française doit tirer profit. Comment relever les défis du XXIe siècle autour du changement  climatique, de la sécurité alimentaire, des mobilités, mais aussi du vieillissement ou encore des matériaux, et bien ...  "
247,2019-08-28,Les Echos,1740mots,TRISTAN GASTON-BRETON,La viande synthétique de Sergey Brin,"    ... 'émission de CO2 sur la planète, l'élevage est également la principale cause du réchauffement  climatique. Quant aux projections, elles ne sont guère rassurantes : croissance de la population mondiale oblige, on estime ...  "
248,2019-08-02,Les Echos,746mots,PASCALE BRAUN,"En Argonne, l'eau potable se fait rare","    ...  sarin utilisé au cours de la Grande Guerre continue à polluer les sources. Le réchauffement  climatique n'arrange rien : cette année, la canicule a fait chuter le débit des cours d'eau ...  "
249,2019-08-16,Les Echos,52mots,ARNAUD LE GAL,Véhicule électrique : plus vite,"    ...  électrique est l'une des technologies les plus à même de répondre à l'urgence  climatique, écrit Frédéric Renaudeau. Pourquoi son usage progressetil moins vite en France que dans d ...  "
250,2019-05-09,Les Echos,461mots,MARIE-JOSEE COUGARD,Danone hésite entre son passé laitier et son futur végétal,"    ...  des vaches, diminuer les émissions de méthane des bovins et leurs effets sur le changement  climatique. Ils peuvent réduire les pertes de récolte en empêchant la prolifération de champignons et de virus ...  "
251,2019-05-29,Les Echos,29mots,DIDIER JULIEN,Le réchauffement climatique s'invite aux AG des pétroliers,    ... Le réchauffement  climatique s'invite aux AG des pétroliers  ...  
252,2019-05-10,Les Echos,587mots,,Europe de l'électricité : notre avenir est commun,"        ...  réseau électrique européen joue un rôle de premier plan dans la lutte contre le réchauffement  climatique. Avec l'ouverture et l'intégration du marché européen, il permet également aux Européens de bénéficier ...  "
253,2019-05-17,Les Echos,543mots,GREGORY PLESSE,Australie : les travaillistes misent sur l'écologie pour l'emporter,"    ...  est un sujet qui divise plus que dans tout autre pays occidental. Si le changement  climatique n'est plus vraiment remis en cause au sein des grandes formations politiques, elles ne sont ...  "
254,2019-06-03,Les Echos,479mots,GABRIEL NEDELEC,La fermeture des centrales nucléaires risque d'aggraver le réchauffement,"    ...  les experts du GIEC ne cessent de tirer la sonnette d'alarme sur le réchauffement  climatique. Deux raisons derrière cette chute brutale. L'une est politique : quelques Etats, comme l'Allemagne, ont ...  "
255,2019-06-13,Les Echos,953mots,JOSEPH STIGLITZ,Pour un autre capitalisme,    ...  aux autres sources réelles de richesse. Il doit protéger l'environnement et combattre le changement  climatique avec la même ardeur que les partisans d'un « Green New Deal » aux EtatsUnis ou ...  
256,2019-06-12,Les Echos,533mots,JOEL COSSARDEAUX,Une pollution qui vire au désastre écologique,"    ...  350 millions de tonnes, selon l'ONG. Un mauvais coup porté à la lutte contre le réchauffement  climatique et la montée des océans, ellemême provoquée par ce dérèglement. Joël Cossardeaux  ...  "
257,2019-06-21,Les Echos,432mots,DAVID BARROUX,Faire confiance à l'atome,"    ...  notre facture pétrolière tout en contribuant de manière efficace à la lutte contre le réchauffement  climatique, nous devons comme bien d'autres pays continuer de miser sur un socle atomique. Car même ...  "
258,2019-07-18,Les Echos,481mots,PIERRE-ALAIN FURBURY,Ceta : bataille rangée à l'Assemblée,"    ...  mis en garde Olivier Faure, le premier secrétaire du PS, qualifiant de  « supercherie »  le  « veto  climatique »  censé protéger les décisions environnementales des Etats. « Nos vies valent plus que quelques déciles de croissance ...  "
259,2019-06-28,Les Echos,547mots,DEREK PERROTTE,La Finlande veut poser les bases d'une « Europe durable »,"    ...  Politique agricole commune (PAC).  « Le temps de la politique du 'oui mais' contre le changement  climatique est révolu »  , a insisté Antti Rinne, qui reçoit un bon accueil.  « La Finlande, c'est du ...  "
260,2019-07-22,Les Echos,731mots,VIRGINIE ROBERT,Institutions de Bretton Woods : la réforme pour survivre,"    ...  mais aussi pour répondre aux défis posés à ces dernières par de nouvelles problématiques : réchauffement  climatique, numérisation de l'économie et montée des inégalités.  « Le bilatéralisme ne pourra pas répondre aux grands ...  "
261,2019-07-23,Les Echos,724mots,,Grand âge et autonomie : faciliter la coopération entre proches et soignants,"        ...  plus longtemps, aux aléas de la vie, mais aussi être tributaires de risques externes (changement  climatique, évolution des marchés financiers...) que nous ne pouvons, les uns comme les autres, souvent pas maîtriser ...  "
262,2019-08-01,Les Echos,617mots,JOEL COSSARDEAUX,La France est mal outillée pour faire face à l'érosion de ses côtes,"    ...  atelle bien pris la mesure de la montée des océans, inhérente au dérèglement  climatique, qui érode ses côtes et les expose à un risque de submersion croissant ? Le doute est ...  "
263,2019-07-31,Les Echos,736mots,MOHAMED EL ERIAN,Pourquoi les banques centrales sont dans l'impasse,"    ...  politique grossi des peurs suscitées par la vague technologique sur le travail, par le réchauffement  climatique et par les évolutions démographiques, mais aussi par les inquiétudes liées au creusement des inégalités, à ...  "
264,2019-05-09,Les Echos,96mots,MICHEL DE GRANDI,Arctique : les Etats Unis torpillent un accord,    ...  de signer une déclaration sur l'avenir de l'espace arctique qui définissait le changement  climatique comme une grave menace pour la région polaire. C'est la première fois que les membres ...  
265,2019-05-29,Les Echos,88mots,MARIE BELLAN,« Montagne d'Or » : Poirson réaffirme l'abandon du projet,"    ...  de protection de l'environnement, de préservation de la biodiversité, de lutte contre le changement  climatique, qui sont défendues par ce gouvernement et exigées par les Français  », a répondu Mme Poirson, qui ...  "
266,2019-05-20,Les Echos,969mots,DOMINIQUE MOISI,L'inquiétante perte des repères européens,"    ...  série de défis externes, de la protection des frontières à la lutte contre le réchauffement  climatique, de la nécessité de rester un sujet de l'histoire à celle de surmonter nos divisions ...  "
267,2019-05-06,Les Echos,486mots,GREGORY PLESSE,La livraison par drone aux particuliers prend son envol en Australie,"    ...  par drone pourraient permettre de réduire significativement la congestion des routes dans les grandes villes mais aussi le réchauffement  climatique, en retirant de la circulation les véhicules de livraison. Grégory Plesse  ...  "
268,2019-06-13,Les Echos,471mots,,De l'incertitude économique à l'incertitude politique,"        ...  la rapidité du progrès technique; une Europe incapable de relever le défi de l'urgence  climatique ou de répondre efficacement aux chocs migratoires et sécuritaires. Une Europe affaiblie et désunie, c'est ...  "
269,2019-06-25,Les Echos,413mots,LAURENCE BOISSEAU,Des normes européennes pour l'information extra-financière,"    ...  européen. Même si des efforts doivent être faits au niveau national. L'urgence, en matière  climatique notamment, conduit à envisager une première échéance dès 20212022 et des échéances ultérieures à horizon ...  "
270,2019-07-01,Les Echos,662mots,GABRIEL GRESILLON,L'accord de l'Union européenne avec le Mercosur ravive les inquiétudes du monde agricole,"    ...  de décision politique montre qu'on n'a aucune approche systémique, globale de la lutte  climatique. » La Commission a pourtant pris les devants en matière environnementale, obtenant des engagements du Mercosur sur ...  "
271,2019-07-04,Les Echos,590mots,HELENE REY,Ce que doit être l'ambition de l'Europe,    ...  contexte où une coopération internationale est plus que jamais nécessaire pour agir face au changement  climatique et pour gérer la montée en puissance de la Chine dans l'économie et la gouvernance ...  
272,2019-07-15,Les Echos,651mots,,Taux nuls : l'occasion d'un New Deal social et environnemental,"        ...  analyses socioéconomiques produites par les prévisionnistes. Dans son rapport sur l'économie du changement  climatique, publié en 2006, l'économiste Nicholas Stern a ouvert la voie en choisissant délibérément un taux ...  "
273,2019-07-09,Les Echos,907mots,GABRIEL GRESILLON,L'Europe face au diktat du court terme,"    ...  consistant à fustiger des dirigeants qui ne sont « pas à la hauteur de l'urgence  climatique » frise la malhonnêteté intellectuelle. Car, dans cette affaire, 24 pays ont fini par s'entendre sur ...  "
274,2019-07-12,Les Echos,712mots,ROGER-POL DROIT,Apprendre à regarder autrement,"    ... 'éthique des stoïciens pourraitelle nous aider à penser la GPA, ou Machiavel le réchauffement  climatique ? La  « boîte à outils »,  comme disait Michel Foucault, est bien garnie, et tous les tâtonnements sont ...  "
275,2019-07-26,Les Echos,471mots,ISABELLE FICEK,Canicule : le gouvernement affiche sa mobilisation,"    ...  loin  » . Et Matthieu Orphelin d'évoquer comme une «  priorité  » des plans d'adaptation au changement  climatique, avec des efforts accrus de recherche, la végétalisation des villes, la rénovation des bâtiments, etc. Un ...  "
276,2019-07-02,Les Echos,619mots,GUILLAUME DE CALIGNON,Le regard des économistes sur la dette évolue,    ...  de la dette devraient être consacrées à des investissements permettant de lutter contre le réchauffement  climatique au niveau européen »  . Il chiffre à 150 milliards d'euros l'économie annuelle faite par les ...  
277,2019-08-14,Les Echos,514mots,ETIENNE GOETZ,Les stratégies des établissements pour tenir leur rang,"    ...  les banques françaises sont loin d'être exemplaires en matière de lutte contre le réchauffement  climatique, les principaux établissements de l'Hexagone se situent loin devant les américains ou les chinois. Dans ...  "
278,2019-08-09,Les Echos,481mots,YVES BOURDILLON,La Sibérie étouffe sous des incendies records,"    ...  sur les glaces de l'Arctique, qui absorberaient alors davantage la lumière solaire. Les modèles ne permettent toutefois pas de chiffrer précisément l'impact éventuel sur le réchauffement  climatique. Yves Bourdillon  ...  "
279,2019-08-26,Les Echos,672mots,JOEL COSSARDEAUX,Jadot appelle à construire « un grand mouvement » pour 2022,"    ...  et plus puissant qu'Europe EcologieLes Verts »,  atil aussi prévenu. La crise  climatique et l'effondrement du vivant l'imposent. Au même titre que la défense des valeurs sociales ...  "
280,2019-08-28,Les Echos,52mots,DANIEL FORTIN,Faire face à l'urgence climatique,    ... Faire face à l'urgence  climatique  ...  
281,2019-05-27,Les Echos,586mots,DELPHINE IWEINS,Comment SPIE fait tomber les préjugés,"    En 2008, le groupe international SPIE, spécialiste des services en génie électrique, mécanique et  climatique, de l'énergie et des systèmes de communication, a signé avec ses partenaires sociaux une charte de ...  "
282,2019-06-03,Les Echos,558mots,PASCAL PERRI,Boycotter l'avion n'est pas forcément une bonne idée,    ...  en pratiquant des prix prédateurs. Elles produisent de la désutilité économique et de la destruction  climatique. Toute nouvelle taxe française frappant les compagnies communautaires augmenterait l'écart de prix avec ces compagnies ...  
283,2019-05-13,Les Echos,774mots,MURYEL JACQUE,"La guerre commerciale, ultime coup de massue pour les cours agricoles",    La promesse faite vendredi sur Twitter par Donald Trump d'acheter pour des milliards de dollars de produits agricoles aux fermiers américains  « pour les expédier aux pays pauvres et affamés »  n ...  
284,2019-05-03,Les Echos,1143mots,ETIENNE LEFEBVRE|ISABELLE FICEK|INGRID FEUERSTEIN,« La baisse d'impôts ne sera pas financée à crédit »,"    ...  est sûre : le capitalisme doit changer. Il doit être durable et lutter contre le réchauffement  climatique, il doit mieux rémunérer les salariés, et il doit mieux concilier efficacité et justice. Sinon, les ...  "
285,2019-05-07,Les Echos,93mots,GREGOIRE POUSSIELGUE,Entre 5 et 10 % du vignoble bordelais touché par le gel,"    ...  par le gel avec une perte de récolte estimée entre 5 et 10 %. Cet aléa  climatique ne devrait pas avoir de conséquences sur la récolte globale, selon l'interprofession.  « Certaines propriétés sont ...  "
286,2019-06-14,Les Echos,549mots,MATHILDE LEMOINE,"En Europe, la croissance n'est plus une ambition","    ...  la diminution de l'échec scolaire de 15 à 10 %, la lutte contre le changement  climatique et l'amélioration de l'efficacité énergétique de 20 %. Cette stratégie devrait, elle aussi, se solder ...  "
287,2019-06-18,Les Echos,403mots,ANTOINE BOUDET,"Les paquebots de croisière géants, symboles de pollution","    ... 'objectif de zéro émission »  , la Clia reconnaît que  « cela prendra du temps »  . Or du temps c'est précisément ce dont il manque le plus face à l'urgence  climatique. A. Bo.  ...  "
288,2019-07-17,Les Echos,749mots,CHLOE MORIN,Pourquoi la France est l'un des pays les plus pessimistes du monde,"    ...  pouvoir relever collectivement les défis immenses qui sont devant nous  de la mondialisation au réchauffement  climatique, en passant par la résorption des inégalités ou la lutte contre le terrorisme et les formes ...  "
289,2019-07-04,Les Echos,466mots,LAURENT THEVENIN,Agriculture : le secteur demande une réassurance publique,"    ...  par Groupama, environ 30 % des surfaces agricoles (hors prairies) seraient couvertes par un contrat multirisque  climatique sur récolte (MRC).  « Il faudrait que 60 à 65 % des surfaces soient assurées »  pour pouvoir mutualiser ...  "
290,2019-06-26,Les Echos,619mots,YANN ROUSSEAU,"Face à Washington et Pékin, Macron et Abe organisent la résistance","    ...  grande proximité encore sur les grands dossiers diplomatiques, tels que la lutte contre le réchauffement  climatique, la dénonciation des méfaits du protectionnisme ou encore l'épineuse question iranienne.  « Il y a, en ...  "
291,2019-06-27,Les Echos,908mots,KENNETH ROGOFF,"L'Amérique latine, laboratoire d'un populisme sans solutions","    ...  citoyens et raser de larges pans de l'Amazonie (ce qui accélérerait considérablement le réchauffement  climatique), est devenu un paratonnerre pour les manifestations étudiantes, les écologistes et les militants des droits des ...  "
292,2019-06-17,Les Echos,166mots,BRUNO TREVIDIC,Airbus aborde le Salon du Bourget en position de force face à Boeing,    ...  critiques de plus en plus virulentes contre le rôle du transport aérien dans le réchauffement  climatique. Autant de craintes que le Salon s'efforcera d'apaiser. La présentation du nouveau biréacteur d ...  
293,2019-08-23,Les Echos,402mots,GENEVIEVE THIBAUD|JULES GRANDIN,La banane victime de son succès,"    ...  coûte plus cher que 1 euro le kilo »  , selon Denis Loeillet, spécialiste de ce fruit au Cirad*. D'autant plus indispensable que le réchauffement  climatique risque de provoquer d'autres pandémies.  ...  "
294,2019-08-14,Les Echos,29mots,ETIENNE GOETZ,Pourquoi les banques se verdissent,"    Les établissements français prennent de plus en plus au sérieux la lutte contre le dérèglement  climatique. Par conviction, mais aussi par opportunité commerciale.  ...  "
295,2019-08-08,Les Echos,540mots,LAURENCE BOCCARA,Pourquoi les grands édifices fleurissent en région,"    ...  intelligente, capable d'afficher une exemplarité énergétique, avec une faculté de s'adapter au réchauffement  climatique. Des terrasses végétalisées sont prévues à plusieurs niveaux du bâtiment. Accessible aux habitants du quartier, le ...  "
296,2019-08-20,Les Echos,583mots,,"L'entreprise coopérative, un modèle d'avenir","        ...  fait figure d'alternative et de modèle d'avenir. A l'heure de l'urgence  climatique et des bouleversements sociaux sous l'influence notamment de la révolution numérique, les limites de l ...  "
297,2019-06-28,Les Echos,393mots,,La menuiserie Atulam marie fenêtres en bois et Usine du Futur,"        A l'heure de la lutte contre le réchauffement  climatique et les passoires thermiques, la menuiserie Atulam, à Jarnages (Creuse) a choisi de rester sur le marché de niche des fenêtres et ...  "
298,2019-07-02,Les Echos,923mots,JEAN-MARC VITTORI,La crise de la mondialisation impose une nouvelle gouvernance,"    ...  grand sujet sur lequel il y a eu accord est la lutte contre le réchauffement  climatique, sauf que les EtatsUnis n'ont pas signé. Les seules vraies avancées à Osaka ont ...  "
299,2019-05-14,Les Echos,669mots,PAULINE HOUEDE,L' industrie engage la bataille du CO2dans les usines,"    ...  Le changement  climatique n'attend pas. Nous devons réagir rapidement pour atteindre  les objectifs de Paris. » Pour limiter la hausse des températures à moins de 2 % d'ici à 2100, Volkmar Denner ...  "
300,2019-05-17,Les Echos,38mots,MARIE-JOSEE COUGARD,Les vignerons aux avant-postes du dérèglement climatique,    ... Les vignerons aux avantpostes du dérèglement  climatique  ...  
301,2019-06-03,Les Echos,605mots,LIONEL STEINMANN,La loi sur les mobilités à l'épreuve de ses ambitions multiples,"    ...  Les élus y ont ajouté en commission, au nom de la lutte contre le réchauffement  climatique, l'utilisation des excédents des recettes de la taxede solidarité sur les billets d'avion (dite ...  "
302,2019-05-16,Les Echos,542mots,NINON RENAUD,Européennes : les Verts en position de force en Allemagne,"    ...  de 20 %, contre 10,7 % il y a cinq ans. Leur légitimité sur la question  climatique est un atout clef dans la mesure où celleci nourrit un débat national et européen ...  "
303,2019-05-24,Les Echos,960mots,NINON RENAUD,Pourquoi le message est brouillé entre Paris et Berlin,"    ...  avril. Il avait alors fait état des dossiers qui fâchent, citant la politique énergétique et  climatique, le Brexit et les relations commerciales avec les EtatsUnis. Il aurait pu y ajouter la ...  "
304,2019-05-07,Les Echos,642mots,JOEL COSSARDEAUX,Les experts exhortent les politiques à sauver la biodiversité,"    ...  des changements d'utilisation des terres (agriculture, urbanisation), de la surexploitation des espèces, du changement  climatique, de la pollution et de la multiplication des espèces invasives. Le tout sur fond de croissance ...  "
305,2019-06-12,Les Echos,49mots,VINCENT EJARQUE,"Sports d'hiver : en France, la fréquentation a fondu","    ...  sur la saison 20182019 par rapport à l'hiver précédent. En cause, le manque de neige lié au réchauffement  climatique. Les professionnels de la montagne contestent la méthode de calcul.  ...  "
306,2019-05-22,Les Echos,539mots,AGNES BENASSY-QUERE,Quelles politiques budgétaires pour la zone euro ?,"    ...  carbone. Sans cela, quel sera le rendement des investissements verts ? La lutte contre le réchauffement  climatique peut fournir aux Européens un moyen de sortir de la nasse, à condition toutefois d'avoir ...  "
307,2019-07-02,Les Echos,1083mots,GUILLAUME DE CALIGNON|RENAUD HONORE,« Un peu plus de déficit n'empêchera pas les marchés de dormir »,"    ...  mesures qui améliorent la croissance à plus long terme, comme le combat contre le réchauffement  climatique. Le fait qu'Emmanuel Macron ait clairement mis au second plan la réduction des déficits depuis ...  "
308,2019-07-05,Les Echos,453mots,JOEL COSSARDEAUX,Reboiser les forêts tropicales serait une chimère,"    ...  Rétablies dans leurs fonctions de « poumons verts », elles contribueraient à atténuer les effets du changement  climatique, à préserver la ressource en eau et la biodiversité. Dans ces zones, ce « retour à la ...  "
309,2019-07-29,Les Echos,620mots,ANTOINE BOUDET,Suez au rendez-vous avant l'annonce de son plan stratégique à l'automne,"    ...  des eaux de pluie créé en France. Que ce soit sur le sujet du changement  climatique, qui impose la nécessité d'améliorer l'exploitation des réseaux d'eau, avec des besoins en ...  "
310,2019-06-28,Les Echos,672mots,,Les entrepreneures d'Afrique prêtes à relever de nouveaux défis,        ...  l'Amérique dans une nouvelle relation avec une Afrique plus visible; les sciences  le changement  climatique  et comment les femmes africaines ingénieurs et médecins sont agents du changement; et enfin une dernière ...  
311,2019-06-28,Les Echos,469mots,LAURENT THEVENIN,Les satellites révolutionnent l'assurance,"    ...  pour la souscription des contrats. Mais  « cela sera aussi très utile après un gros événement  climatique pour coordonner les expertises »,  anticipe son dirigeant. Les géants du secteur n'ont pas attendu pour ...  "
312,2019-07-11,Les Echos,44mots,DANIEL FORTIN,Pour une banque mondiale du carbone,"    Les grandes institutions internationales existantes ne sont pas en mesure de répondre au défi  climatique, estime Kenneth Rogoff. Il faut donc en créer une spécifique, de dimension planétaire, si l'on veut ...  "
313,2019-07-24,Les Echos,676mots,,Le réseau électrique français contraint de s'adapter,"        ...  d'habitude. « Depuis 2003, on anticipe ces situations, qui peuvent se multiplier avec le réchauffement  climatique. Installer des tours aéroréfrigérantes, ces grandes cheminées blanches, peut à l'avenir répondre au problème de ...  "
314,2019-05-14,Les Echos,664mots,VINCENT COLLEN,Les pétroliers s'attaquent à leurs émissions,    Les compagnies pétrolières et gazières sont des poids lourds du réchauffement  climatique. Elles sont responsables de plus de 40 % des émissions de gaz à effet de serre comme le CO2 et le ...  
315,2019-06-05,Les Echos,498mots,GABRIELLE SERRAZ,La mobilité électrique dynamise les stations de montagne,"    ...  technologies de l'électricité pour redynamiser la fréquentation estivale de sa station. Avant le réchauffement  climatique qui fait régresser son glacier de MontdeLans, le ski d'été constituait une attraction ...  "
316,2019-06-19,Les Echos,394mots,THIBAUT MADELIN,"« Taxonomie », le mot qui inquiète les assureurs","    ...  lister les activités économiques qui peuvent apporter une contribution substantielle à l'atténuation du changement  climatique. Un enjeu de taille pour les assureurs européens, dont les choix d'investissements peuvent s'en ...  "
317,2019-07-23,Les Echos,842mots,PIERRE-ALAIN FURBURY,« Ne dynamitons pas le système des retraites »,"    ...  Mais contrairement à M. Trump, je sais que nous devons lutter hardiment contre le réchauffement  climatique. Cela passe par des choix publics volontaristes, éclairés par des connaissances scientifiques, et un engagement concret ...  "
318,2019-07-16,Les Echos,392mots,ISABELLE FICEK,Ceta : la majorité resserre les rangs,"    ...  droit à légiférer ou le principe de précaution  » . Il a mis en avant le « veto  climatique », qui doit protéger le droit des 28 Etats membres et du Canada à légiférer sur les ...  "
319,2019-07-04,Les Echos,421mots,CHRISTOPHE PALIERSE,Paris 2024 se met à l'heure de l'innovation verte,"    ...  un budget de 80 millions d'euros, porte ainsi sur la ville intelligente, l'adaptation  climatique, l'économie circulaire, l'alimentation et enfin le numérique avec 4 thèmes concomitants : expérience du spectateur ...  "
