,date,publication,words,author,title,intro
80,2021-07-19,Les Echos,323mots,,Taxe carbone : imposer un prix mondial,"...  frontières »  pour taxer les importations les plus polluantes. Dans sa volonté de lutter contre le  réchauffement  climatique, l'UE veut imposer un prix du carbone sur des produits fabriqués par des entreprises ..."
81,2021-06-11,Les Echos,892mots,LEA DELPONT,Pollution : la Vallée de la Chimie et les élus écologistes de Lyon temporisent,  ...  territoire de neuf communes au sud de Lyon représente 26 % des émissions de gaz à  effet  de  serre de la métropole et un quart de sa consommation énergétique. Mais un autre constat ...
82,2021-05-05,Les Echos,582mots,VINCENT CHAMPAIN,Climat : ne faisons pas du numérique un bouc émissaire,"  La lutte contre le  réchauffement  climatique ne peut se résoudre à trouver un bouc émissaire. Elle suppose, au contraire, de rechercher les façons les moins pénalisantes de réduire notre empreinte carbone nette ..."
83,2021-05-06,Les Echos,504mots,MARION HEILMANN,Climat : la Bundesbank accusée d'empêcher la BCE de prendre des mesures ambitieuses,  ...  accentuent la pression sur la Banque centrale européenne (BCE) en matière de lutte contre le  changement  climatique. Des activistes ont décerné le prix de « best climate killer » dans la catégorie banques centrales ...
84,2021-06-01,Les Echos,600mots,MURYEL JACQUE,Les négociations reprennent pour préparer la COP 26,"  ...  en 2015 devront avoir rehaussé leurs engagements nationaux de réduction d'émissions de gaz à  effet  de  serre. En lançant la session, la responsable climat de l'ONU Patricia Espinosa a appelé ..."
85,2021-05-31,Les Echos,1372mots,PAUL MOLGA,La trop lente transformation des espèces,"  ... Le  réchauffement  climatique auratil raison de la biodiversité ? Tout dépend de la vitesse avec laquelle les différentes espèces, animales comme végétales, sauront s'y adapter. Une course contre la montre ..."
86,2021-08-30,Les Echos,930mots,ANTOINE BOUDET,Comment les entreprises préparent la rentrée,"  ...  relever : la santé des collaborateurs, le retour au bureau, l'institutionnalisation du télétravail, les tensions sur l'emploi et celles sur les approvisionnements. Sans oublier la lutte contre le  réchauffement  climatique.  ..."
87,2021-08-24,Les Echos,522mots,JOEL COSSARDEAUX,L'accord pour protéger l'ozone a freiné le réchauffement,"  ...  les chercheurs. Selon eux,  « le protocole de Montréal paraît également avoir contribué à atténuer le  changement  climatique en évitant une dégradation des puits de carbone terrestres »  (sols, forêts, cultures, etc.). Effets secondaires ..."
88,2021-06-01,Les Echos,365mots,CHRISTIAN DE PERTHUIS,Limiter la vitesse à 110 km/h : une urgence,"  ...  de cette loi estil bien d'accélérer la réduction des émissions de gaz à  effet  de  serre ? Depuis des mois, le débat public est focalisé sur le nombre de propositions de ..."
89,2021-08-03,Les Echos,507mots,,Ne faisons pas de l'écologie contre les plus modestes,...  que le transport est l'activité qui contribue le plus aux émissions de gaz à  effet  de  serre en France et que la pollution est un réel enjeu de santé publique. Malheureusement ...
90,2021-07-09,Les Echos,658mots,BRUNO BENSASSON,"Eoliennes, ne nous trompons pas de combat","  ...  en composites semblables à ceux des voiliers, peut être valorisé en énergie. Il aggraverait le  réchauffement  climatique : faux. Avec 20 kg/MWh en cycle de vie, il émet 20 fois moins de ..."
91,2021-07-05,Les Echos,1458mots,YANN VERDO,Cap sur Vénus et ses brûlants secrets,"  ...  CO2 atmosphérique a été capturé et séquestré, sous forme notamment de carbonates, faisant diminuer l'effet  de  serre exercé par ce gaz et baisser encore la température. Vénus, dont l'atmosphère irrespirable ..."
92,2021-08-06,Les Echos,1718mots,FRANK NIEDERCORN,Un big bang dans nos assiettes,"  ...  l'agriculture. Promettant d'enrayer la perte de la biodiversité, de réduire la progression du  réchauffement  climatique tout en faisant évoluer les pratiques alimentaires. Les sols continuent de s'épuiser et la ..."
93,2021-07-19,Les Echos,759mots,NINON RENAUD,Inondations en Allemagne : les candidats à la succession d'Angela Merkel sous pression,"  ...  leçons de la catastrophe, elle a appelé à accélérer les mesures de lutte contre le  changement  climatique.  « Nous devons être plus rapides et redoubler d'effort pour s'adapter au réchauffement de ..."
94,2021-07-07,Les Echos,562mots,DOMINIQUE CHAPUIS,Mode : les marques éthiques se mobilisent pour l'environnement,"  ...  Ce n'est pas comme ça qu'on va réduire la production de gaz à  effet  de  serre »  , affirmetelle. Pour ces marques engagées, il faut agir à la source. Car ..."
95,2021-07-01,Les Echos,566mots,SHARON WAJSBROT,"En France, l'approvisionnement en électricité tient le choc des canicules","  ...  pourrait toutefois devenir bien plus critique dans les années à venir, à mesure que le  réchauffement  climatique s'aggrave et que la production électrique française tourne le dos aux énergies fossiles. Comme ..."
96,2021-07-09,Les Echos,645mots,RICHARD HIAULT,Le G20 Finances de Venise prépare le monde d'après,"  ...  les ministres des Finances du G20 vont plancher sur trois chantiers prioritaires : la croissance, le  réchauffement  climatique et la fiscalité internationale. « Le défi de ce G20 est de montrer qu'il a ..."
97,2021-06-07,Les Echos,442mots,ETIENNE GOETZ,Le géant Cargill s'apprête à commercialiser des masques anti-méthane pour vaches,  ... Un geste barrière contre les gaz à  effet  de  serre. Le géant de l'agroalimentaire et du négoce de matières premières agricoles Cargill s'apprête à vendre des masques qui absorbent le ...
98,2021-05-18,Les Echos,388mots,YVES BOURDILLON,La Banque européenne d'investissement soutient les projets de l'économie verte,"  ... En 2020, l'institution a investi des sommes considérables au profit du continent africain. Parmi ses priorités : la lutte contre le  changement  climatique, la santé et les femmes.  ..."
99,2021-07-15,Les Echos,484mots,DEREK PERROTTE|MURYEL JACQUE,L'UE veut mettre sur les rails la première taxe carbone aux frontières,  ...  elle veut faire un des outils phares de la lutte de l'Europe contre le  réchauffement  climatique. Le principe est simple : imposer un prix du carbone sur certains produits importés fabriqués par ...
100,2021-07-30,Les Echos,617mots,INES LEONARDUZZI,Inondations : le vrai coupable,"  ...  éviter. La hausse des températures, provoquées par l'augmentation de la concentration des gaz à  effet  de  serre dans l'atmosphère (euxmêmes principalement générés par l'activité humaine), provoque un phénomène ..."
101,2021-07-21,Les Echos,592mots,ELSA DICHARRY,Les recettes des promoteurs pour limiter l'effet des fortes chaleurs,"  ... Façades aux teintes claires, orientation optimisée, balcons débordants, brisesoleil, terrasses végétalisées... Les promoteurs travaillent de plus en plus la conception de leurs immeubles pour s'adapter au  changement  climatique.  ..."
102,2021-08-10,Les Echos,420mots,JOEL COSSARDEAUX,"« La montée du niveau des océans est irréversible, il faut s'y adapter »",  ...  baisse ou sur leur hausse. Cela augmente nos capacités à cerner la façon dont le  réchauffement  climatique va évoluer dans les prochaines décennies et à mesurer les conséquences de chaque fraction de ...
103,2021-07-28,Les Echos,558mots,MURYEL JACQUE,Macron prône le « cas par cas » sur les éoliennes,"  ...  habitants en cas de cyclones dévastateurs, dont la fréquence et la violence augmentent avec le  réchauffement  climatique. C'est une première en France. Ca se passe sur l'atoll de Manihi, en ..."
104,2021-05-31,Les Echos,1039mots,DOMINIQUE MOISI,L'urgence de bâtir un nouveau système mondial de coopération,"  ...  se double aujourd'hui d'un nouvel impératif : celui de faire face au défi du  réchauffement  climatique. Dans ce contexte, la lutte féroce à laquelle se livrent les « grands » de ce monde ..."
105,2021-08-12,Les Echos,753mots,MURYEL JACQUE,Transition écologique : des réformes difficiles à faire accepter,"  ...  La crise des « gilets jaunes » puis celle du Covid plus tard, la lutte contre le  réchauffement  climatique est certes restée en ligne de mire de l'exécutif contrairement à d'autres gros ..."
106,2021-08-24,Les Echos,590mots,,La France encore démunie face aux épisodes climatiques extrêmes,"... Initiée en 2006, la politique nationale d'adaptation au  changement  climatique reste floue et manque de moyens.  ..."
107,2021-07-12,Les Echos,928mots,ETIENNE GOETZ,"« Pour les métaux, on peut parler de supercycle »","  ...  part, tous les gouvernements ou presque ont un plan « net zéro » de lutte contre le  réchauffement  climatique à un horizon plus ou moins lointain, qui se traduit notamment par une consommation accrue ..."
108,2021-07-16,Les Echos,785mots,ERIC LE BOUCHER,Bruxelles force la France à révolutionner sa politique écologique,  ...  par la Commission européenne :utiliser l'outil de la taxe carbone pour s'attaquer au  réchauffement  climatique. La première est essentielle pour mettre fin au dumping fiscal. La seconde est majeure pour ...
109,2021-08-10,Les Echos,596mots,ETIENNE GOETZ,Les cours du minerai de fer laminés par les ambitions environnementales chinoises,  ...  23 % en quelques semaines après avoir atteint des records. Pékin veut brider l'expansion du secteur de l'acier pour atteindre ses objectifs de réduction de gaz à  effet  de  serre.  ...
110,2021-05-19,Les Echos,659mots,SHARON WAJSBROT,L'AIE appelle à renoncer immédiatement à tout nouveau projet fossile,"  ... L'Agence internationale de l'énergie dresse sa feuille de route mondiale pour limiter le  réchauffement  climatique à 1,5 °C. Les mesures préconisées sont drastiques et inédites : renoncer dès à présent ..."
111,2021-05-31,Les Echos,977mots,MARION HEILMANN,Le marché européen du carbone à un tournant,"  ...  l'annonce de l'objectif européen de réduction de 55 % des émissions de gaz à  effet  de  serre d'ici à 2030, le prix des « droits à polluer » a pris près de ..."
112,2021-06-04,Les Echos,927mots,EMMANUEL SCHAFROTH,Prendre la vague des fonds verts,"  ...  les énergies renouvelables ont vécu un début d'année difficile, ils pourraient rebondir fortement à la faveur des objectifs bas carbone et des milliards investis pour lutter contre le  réchauffement  climatique.  ..."
113,2021-07-06,Les Echos,1430mots,LEILA MARCHAND,"Pour sauver son futur, la ville s'ouvre à la nature","  ... Face au  réchauffement  climatique qui menace de les transformer en fournaise, les villes cherchent à se « végétaliser » . Mais verdir quelques toitures et aligner des platanes ne suffira pas. Il s'agit maintenant ..."
