,date,publication,words,author,title,intro
75,2020-12-02,Libération,2685mots,"Charles delouche-Bertolasi, Fanny guyomard et Guillaume Launay (avec les services Société et Modes de vie)",«On ne peut pas grandir comme nos parents l'ont fait»,"  ...  l'avenir, de s'orienter dans ses études. Aujourd'hui, s'ajoutent le coronavirus, le  réchauffement  climatique, la montée de l'extrême droite C'est angoissant, on a du mal à avoir ..."
76,2020-04-22,Libération,966mots,Christophe Alix,"En France, les parapétrolières replongent dans la crise","  ...  remises du choc de 2014 et malgré le besoin de financement pour s'adapter au  changement  climatique, les entreprises du secteur vont devoir couper dans leurs investissements, fragilisant toute la chaîne.  ..."
77,2020-08-08,Libération,1481mots,Par Simon Blin et Sonya Faure,BERNARD STIEGLER La science des priorités,"  ...  inépuisable désir de transmettre à travers des collectifs intellectuels (comme le collectif «Internation» sur le  changement  climatique, avec l'historien de l'art HansUlrich Obrist, le mathématicien Giuseppe Longo, le sociologue ..."
78,2020-10-06,Libération,1776mots,Recueilli par LAURE EQUY et RACHID LAÏRECHE,«Il s'agit de voter pour réautoriser un poison»,"  ...  à un problème de jaunisse transmise par des pucerons qui prolifèrent avec l'accélération du  changement  climatique. Face à cette difficulté, que personne ne conteste, il y a d'autres solutions que ..."
79,2020-03-10,Libération,493mots,CLÉMENTINE Mercier Envoyée spéciale à Tourcoing,"Au Fresnoy, des lendemains qui changent","  ... Le studio des arts contemporains de Tourcoing propose une réflexion sur les mutations du monde actuel, entre robotique et  réchauffement  climatique.  ..."
80,2020-10-02,Libération,900mots,Recueilli par RACHID LAÏRECHE,«L'eau devient un produit financier»,"  ...  la hausse ou à la baisse sur le cours de l'eau. En situation de  réchauffement  climatique, nous allons à la catastrophe si nous appliquons à l'eau les recettes du capitalisme ..."
81,2020-08-03,Libération,1709mots,Par AURÉLIE Delmas et Aude Massiot,La France au compte-gouttes,"  ...  le long terme, si les accords climatiques sont respectés et les émissions de gaz à  effet  de  serre limitées (hypothèse peu probable à ce jour), les précipitations en métropole resteront assez stables ..."
82,2020-09-05,Libération,1672mots,Par JACKY DURAND Envoyé spécial à Mercurol (Drôme),Crozeshermitage Ainsi parle Natacha Chave,"  ...  2004 à Mercurol, dans la Drôme, elle cisèle la syrah et choie la marsanne et la roussane en blanc. Tout en s'interrogeant sur d'autres cépages face au  réchauffement  climatique.  ..."
83,2020-12-02,Libération,1848mots,Recueilli par FRÉDÉRIC AUTRAN,«Le moment que nous vivons menace le monde d'un grand renversement»,"  ... 'ONU à l'humanitaire, Mark Lowcock, lance un appel face aux effets de la pandémie de Covid19 dans des pays déjà en proie aux conflits et au  changement  climatique. Interview  ..."
84,2020-07-03,Libération,714mots,,Non à une nouvelle centrale au fioul en Guyane,...  une coûteuse centrale électrique alimentée par des hydrocarbures doit bientôt voir le jour à Larivot. Il existe pourtant à ce projet des alternatives peu émettrices en gaz à  effet  de  serre.  ...
