,date,publication,words,author,title,intro
155,2022-10-03,Le Monde,1717mots,Par Pascale Krémer,"Qu’elle était vert pâle, ma « copro »","    ...  le 24 août, on se paie une sécheresse historique et la copro maintient la tonte  de la pelouse complètement cramée?!?» (@VinDel44). «?Je suis dans une copro qui ne veut voter aucuns travauxd ...  "
156,2022-09-12,Le Monde,1840mots,Pascale Krémer,Des écoliers sur le bon chemin,"    ...  des roues. Depuis 2009, c’est en pédibus que se déplacent une vingtaine d’élèves  de MarollesenBrie, aux confins périurbains du ValdeMarne. Trois lignes serpentant entre quartiers pavillonnaires ...  "
157,2022-10-12,Le Monde,855mots,Benjamin Keltz,Le nouveau plan de lutte contre les algues vertes déjà contesté,"    ... ’ont plus confiance en l’Etat. Lundi 10 octobre, les dirigeants d’Eau et rivières  de Bretagne, association reconnue pour son travail sur la qualité  de l’eau, ont démissionné du comité ...  "
158,2022-10-29,Le Monde,719mots,,Résister au fatalisme mortifère,"        1 A quelques jours  de l’ouverture  de la 27e conférence mondiale sur le climat (COP27) à Charm ElCheikh, en Egypte, une nouvelle alerte sur le changement climatique est lancée par ...  "
159,2022-09-29,Le Monde,1123mots,Stéphane Mandard,Plastique : l’agroalimentaire mis en demeure,"    C’est une nouvelle brèche ouverte sur le front  de la lutte contre la pollution plastique. Une coalition d’organisations non gouvernementales (ONG) regroupant ClientEarth, Surfrider Foundation Europe et Zero Waste France ...  "
160,2022-10-25,Le Monde,728mots,P. M.,"Un an après la COP26, l’insuffisante lutte contre la déforestation","    C’était il y a un an, lors  de la COP26 pour le climat en Ecosse. Cent quarantecinq Etats s’engageaient, par le biais  de la «déclaration  de Glasgow», à mettre ...  "
161,2022-11-05,Le Monde,292mots,Ma. G.,"Coca-Cola, parrain encombrant","    L e «plus grand pollueur plastique au monde» , sponsor  de la COP27. L’annonce faite fin septembre du partenariat entre la multinationale des boissons sucrées CocaCola et le ministère des affaires ...  "
162,2022-10-28,Le Monde,1075mots,Delphine Roucaute,Les impacts du réchauffement climatique sur la santé humaine,"    Des centaines  de milliers  de personnes, dans tous les pays du monde, meurent chaque année des conséquences directes et indirectes du réchauffement climatique. Vagues  de chaleur, fortes précipitations, feux  de forêt, tempêtes ...  "
163,2022-10-01,Le Monde,827mots,Propos recueillis par B. Me.,« Jair Bolsonaro devra être rendu comptable de ses crimes »,"    ...  Silva est loin d’avoir abandonné la politique. Née en Amazonie, leader syndicale et défenseure  de la forêt, ministre emblématique  de l’environnement (20032008) du temps  de la gauche au pouvoir ...  "
164,2022-11-09,Le Monde,766mots,David Larousserie,"Les voyages en avion, signe extérieur de réussite pour les chercheurs ?","    Depuis la fin des restrictions  de circulation provoquées par la pandémie, des activités centrales du monde scientifique reprennent: les congrès, conférences et autres «workshops». Et, avec elles, les déplacements en avion. Mais ...  "
165,2022-10-28,Le Monde,1009mots,Marjorie Cessac,Reflux des prix du gaz sur le marché européen,"    ...  euros lundi, ce qui l’inscrit dans le sillage des prix atteints avant le début  de l’invasion en Ukraine par la Russie, le 24 février. Un niveau certes toujours bien au ...  "
166,2022-09-16,Le Monde,1264mots,Perrine Mouterde,Avenir des forêts : la position ambitieuse des eurodéputés,    ...  l’adoption d’une législation robuste pour lutter contre la déforestation importée a été saluée  de manière unanime. L’encadrement  de l’utilisation du bois non transformé – la biomasse primaire forestière – pour ...  
167,2022-09-13,Le Monde,1118mots,Nathalie Coulaud,Rénovation énergétique A l’aide !,"    En France, il y aurait 5,2 millions  de passoires énergétiques parmi les quelque 30 millions  de résidences principales que compte le pays, selon les dernières estimations publiées cet été par le ...  "
168,2022-10-06,Le Monde,659mots,Isabelle Hennebelle et Laetitia Van Eeckhout Isabelle Hennebelle et Laetitia Van Eeckhout,Vers une nouvelle ère urbaine,    Les aires urbaines produisent 70 % des émissions mondiales  de gaz à  effet  de  serre. Les réduire constitue un défi majeur pour les villes. D’autant que cette part pourrait augmenter rapidement avec ...  
169,2022-09-17,Le Monde,968mots,Marjorie Cessac,Bataille mondiale pour le GNL,"    ... ’Asie, ces méthaniers, naviresusines, aux larges cuves réfrigérées, servant à transporter le gaz sur  de longues distances, sont désormais souvent «reroutés»  de l’Asie vers un Vieux Continent assoiffé  de gaz ...  "
170,2022-11-05,Le Monde,407mots,Audrey Garric,Climat : un sommet entre ambition et fatalisme,"    ...  prend cette année pour décor une cité balnéaire paradisiaque, elle se déroule en réalité avec  de multiples crises en toile  de fond. A la COP27, qui se tient du 6 au 18 ...  "
171,2022-09-14,Le Monde,884mots,C. Di.,La destruction des récoltes met en péril la sécurité alimentaire du pays,    Les chèvres  de Muhammed Ismael Narejo broutent à pleines dents au milieu  de plants  de coton chétifs. Les animaux bêlent  de plaisir alors que leurs cloches tintent à travers champs. Ces scènes ...  
172,2022-12-01,Le Monde,242mots,,Ce qu’il faut savoir La grande tromperie des fonds d’investissement « verts » Un « greenwashing » favorisé par le [...],"        ...  Great Green Investment Investigation », cette enquête est le fruit d’une collaboration entre une dizaine  de médias européens, dont  Le Monde , fondée par les platesformes néerlandaises Investico et Follow the Money ...  "
173,2022-09-15,Le Monde,1057mots,Carole Delga,Carole Delga Il revient à la France de lancer enfin sa révolution ferroviaire,"    Le train reste une idée neuve. Près  de deux cents ans après la mise en service  de la première ligne  de chemin  de fer, en Angleterre, en 1825, une nouvelle révolution ferroviaire ...  "
174,2022-10-13,Le Monde,1010mots,Rémi Barroux,Ecologie : les zones d’ombre du « budget vert »,"    ...  dépenses budgétaires et fiscales favorables et défavorables à l’environnement, le gouvernement pouvait se féliciter  de certains chiffres. Dans le budget 2023, actuellement en discussion à l’Assemblée nationale, les dépenses favorables ...  "
175,2022-10-06,Le Monde,1025mots,Laetitia Van Eeckhout,Le patrimoine fluvial retrouve une place centrale,"    Lorsque l’on interroge le maire Nicolas MayerRossignol sur le souhait  de Rouen  de devenir Capitale européenne  de la culture 2028, il corrige aussitôt?: «?C’est le fleuve qui est candidat ...  "
176,2022-09-28,Le Monde,590mots,Sandrine Cabut,"Les transports actifs sont bons pour la planète, la santé et l’économie","    D’un côté, une urgence à agir pour limiter le réchauffement climatique.  De l’autre, une urgence tout aussi cruciale à lutter contre le manque d’activité physique et la sédentarité, fléaux ...  "
177,2022-09-30,Le Monde,814mots,propos recueillis par Au. G.,« C’est un investissement de survie pour l’humanité »,"    La diplomate mexicaine Patricia Espinosa, qui a quitté cet été son poste  de secrétaire exécutive  de la Conventioncadre des Nations unies sur les changements climatiques, explique que les financements des pays ...  "
178,2022-10-31,Le Monde,931mots,Émeline Cazi et Véronique Chocron,Rénovation énergétique : la mise en garde de la Cour des comptes,"    Une nouvelle fois, la manière dont la France mène le grand chantier  de la rénovation énergétique des bâtiments est montrée du doigt. Après le Haut Conseil pour le climat, fin 2020, la ...  "
179,2022-09-30,Le Monde,486mots,Audrey Garric,Fuites sur Nord Stream : le risque d’une « bombe climatique »,"    ...  le tour des médias et des réseaux sociaux. Elles montrent des bouillonnements à la surface  de la mer Baltique, d’un diamètre allant  de 200 mètres à 1 kilomètre. En cause: des ...  "
180,2022-09-30,Le Monde,1058mots,Audrey Garric,Climat : le manque de financements dénoncé,"    ...  annuelle, qui se tiendra à Charm ElCheikh, en Egypte, en novembre,  «devra être celle  de la mise en œuvre, pour passer des promesses aux actes» , a appelé l’ambassadeur Wael Aboulmagd ...  "
181,2022-10-07,Le Monde,589mots,,Des jeux d’hiver saoudiens anachroniques,        ...  saoudite a été retenu le 4 octobre pour l’organisation des Jeux panasiatiques d’hiver  de 2029. Que la somme  de ces deux informations produise une dissonance cognitive ne surprendra personne. Encore ...  
182,2022-10-06,Le Monde,718mots,Propos recueillis par Joséfa Lopez,« Les villes doivent éviter la “mal-adaptation” »,"    directrice  de recherche au Laboratoire des sciences du climat et  de l’environnement au Commissariat à l’énergie atomique et aux énergies alternatives (CEA), et coprésidente du groupe  de travail 1 du ...  "
183,2022-09-15,Le Monde,3989mots,Angeline Montoya,"En Argentine , un procès pour l’histoire","    ...  ce 30 octobre 1976, à Buenos Aires. Une explosion retentit devant la porte d’entrée  de la maison des familles Abriata et Dittmar, faisant voler les fenêtres en éclats. Dans un mégaphone ...  "
184,2022-09-13,Le Monde,280mots,Aurélie Blondel,Accrochez-vous !,"    En quelques années, la passoire est sortie du placard  de la cuisine pour désigner le nouvel ennemi public numéro un et pointer ces millions  de logements très (trop) consommateurs en énergie. Ce ...  "
185,2022-10-31,Le Monde,1567mots,"Bruno Meyerfeld, Angeline Montoya et Anne Vigna",Fin de campagne électrique entre Bolsonaro et Lula,"    C’est un duel au sommet, aussi  serré que périlleux, qui attend le Brésil. Dimanche 30 octobre, à l’occasion du second tour  de l’élection présidentielle, le chef d’Etat sortant ...  "
186,2022-10-24,Le Monde,1225mots,Audrey Tonnelier,L’exécutif peine à intégrer les enjeux climatiques dans l’horizon politique,"    Détermination et humilité. La première ministre, Elisabeth Borne, a présenté, vendredi 21 octobre, sa «méthode  de planification écologique». «Nous devons engager des changements radicaux dans nos manières  de produire,  de consommer, d ...  "
187,2022-10-15,Le Monde,1143mots,Audrey Garric,Le sursaut « fragile » des investissements pour le climat en France,"    Le financement  de la transition écologique n’a jamais semblé aussi urgent que sous la pression des crises climatique et énergétique, toutes deux liées à notre addiction aux énergies fossiles. Après une ...  "
188,2022-10-12,Le Monde,1100mots,Éléa Pommiers,Les lycéens boudent les cours de maths optionnels,"    ...  estiment que ce n’est  «pas un succès» , d’autres n’hésitent pas à parler  de  «flop absolu».  Le nouvel enseignement facultatif  de mathématiques en classe  de 1re, censé permettre  de réintroduire ...  "
189,2022-10-17,Le Monde,948mots,De Dominique Méda,Une politique de l’emploi obsolète,"    Conformément aux annonces du candidat Emmanuel Macron lors  de la campagne présidentielle en 2022, les trois réformes sociales à?l’agenda du second quinquennat (assurancechômage, RSA et retraites) sont lancées. La ...  "
190,2022-09-17,Le Monde,593mots,,Suède : le piège de l’alliance avec l’extrême droite,"        Le concept d’une Suède modèle  de démocratie scandinave tempérée jusqu’à l’ennui atil vécu? L’issue des élections législatives, qui s’y sont tenues le 11 septembre, est ...  "
191,2022-09-10,Le Monde,1076mots,Martine Valo,Ecologie : la France en retard par rapport à la moyenne de l’UE,"    De la pollution  de l’air et  de l’eau à la chasse aux oiseaux, en passant par les méfaits du bruit, l’état des forêts, le gaspillage alimentaire ou la lutte ...  "
192,2022-11-26,Le Monde,104mots,,Le profil Julia Faure,"        Diplômée en agronomie et en études  de genre, Julia Faure est la cofondatrice  de Loom, une marque  de vêtements durables. Elle participe également au collectif En mode climat, un mouvement d’entreprises ...  "
193,2022-10-29,Le Monde,1012mots,par Michel Guerrin,"Le public pollueur, un tabou","    Sontils stupides, lucides, nécessaires, ces écologistes qui, depuis quelques jours, brutalisent gentiment des tableaux  de Monet, Van Gogh, Vermeer? Inversons la question et demandonsnous ce que font les musées, salles ...  "
194,2022-10-22,Le Monde,122mots,,Planification écologique : Borne expose sa méthode,"        ...  La première ministre devait détailler, vendredi, un calendrier permettant  de réduire  de 55% les émissions  de gaz à  effet  de  serre, d’ici à 2030 ▶ Baptisé «France nation verte», ce programme contraint ...  "
195,2022-10-29,Le Monde,111mots,,Climat : la France face à de nouveaux extrêmes,        ...  Le pays est touché par une vague  de chaleur exceptionnelle par sa durée et son intensité. L’année 2022 pourrait être la plus chaude qu’il ait connue ▶ Le dérèglement causé par ...  
196,2022-10-28,Le Monde,126mots,,Climat : des efforts « terriblement insuffisants »,"        ...  pris par les Etats, même s’ils sont respectés, mettent la planète sur une trajectoire  de réchauffement dramatique  de 2,5°C à la fin du siècle ▶ A dix jours  de la ...  "
197,2022-09-07,Le Monde,941mots,Claire Gatinois,Energie : Macron s’en remet à l’Europe,"    C’est donc une «guerre» qui ouvre la rentrée d’Emmanuel Macron. Une  de plus. Lundi 5 septembre, lors d’une conférence  de presse liée à la crise énergétique provoquée par le ...  "
198,2022-09-06,Le Monde,1480mots,Propos recueillis parSandrine Morel Propos recueillis parSandrine Morel,Energie : « L’Europe doit prendre des mesures extraordinaires »,"    En poste depuis 2019, l’actuelle ministre  de la transition énergétique espagnole, Teresa Ribera, a obtenu  de Bruxelles, en mai, la reconnaissance  de l’ «exception ibérique»  et reçu le feu vert pour ...  "
199,2022-09-02,Le Monde,814mots,Ivanne Trippenbach,Le RN dans le flou face à l’urgence de la crise climatique,"    ...  tourné en un été. Après avoir tout misé sur le pouvoir d’achat, les lieutenants  de Marine Le Pen se cherchent un discours face à la crise du climat. L’ «écologie enracinée ...  "
200,2022-09-03,Le Monde,569mots,Harry Bernas,Harry Bernas La centrale nucléaire de Zaporijia est un avatar dramatique d’une crise énergétique mondiale,"    ...  des combustibles usagés. Quelles leçons pouvonsnous en tirer? La première est qu’en matière  de nucléaire, la distinction entre sûreté et sécurité, entre accident et intention, perd son sens. Une centrale ...  "
201,2022-09-02,Le Monde,798mots,Perrine Mouterde,Des gendarmes bientôt formés aux atteintes à l’environnement,"    ...  Les pistes pour mieux prévenir les incendies sont multiples. Il faut aussi, et peutêtre  de manière prioritaire, sensibiliser la population au risque et lutter contre les pyromanes?: au moins neuf incendies ...  "
