,date,publication,words,author,title,intro
78,2022-09-15,Le Monde,858mots,Estelle Brachlianoff,"Estelle Brachlianoff Aujourd’hui encore, il est plus simple de polluer que de dépolluer","    Canicules à répétition, feux  de forêts par dizaines, rivières à sec et pénuries d’eau historiques, violentes tempêtes et crues soudaines… La nécessité d’agir sans plus attendre contre le dérèglement climatique ...  "
79,2022-09-13,Le Monde,694mots,A. Fu,"Le label ISR, une opportunité pour l’immobilier","    ...  dans l’immobilier peuvent demander le label ISR (investissement socialement responsable). Cette possibilité était attendue  de longue date par les sociétés  de gestion, soucieuses  de démontrer leur prise en compte des questions ...  "
80,2022-09-13,Le Monde,644mots,N. Co.,Revendre ses économies d’énergie avec les CEE,"    ...  on pense aux aides à la rénovation énergétique, on pense généralement d’abord aux aides  de l’Etat. Mais il ne faudrait pas oublier les certificats d’économie d’énergie (CEE). «?Il ...  "
81,2022-10-17,Le Monde,729mots,Audrey Garric,Un nouvel épisode de chaleur arrive en France par le Sud-Ouest,"    ...  poursuivre la semaine suivante sur la quasitotalité du pays, selon MétéoFrance. Une vague  de douceur tardive rare à cette période, qui poursuit une année 2022 exceptionnellement chaude.  De nombreuses villes ...  "
82,2022-09-26,Le Monde,726mots,Nicolas Bauduceau,Nicolas Bauduceau Accroître la prévention,    L’augmentation probable  de l’intensité et  de la fréquence des catastrophes naturelles sous l’effet du dérèglement climatique est un défi majeur?: l’été 2022 pourrait devenir la norme à partir ...  
83,2022-09-13,Le Monde,914mots,A. Fu,Comment l’UE structure la finance dite « verte »,"    ...  en vigueur du premier niveau du règlement SFDR (pour Sustainable Finance Disclosure Regulation), le monde  de la finance durable fait face à un tsunami réglementaire en provenance  de l’Union européenne (UE ...  "
84,2022-09-28,Le Monde,1037mots,,Antoine Bondaz et Philippe Orliange L’Indo-Pacifique est incontournable pour faire face au défi climatique,"        Le terme IndoPacifique [qui qualifie la région allant des côtes  de l’Afrique  de l’Est au Pacifique oriental] est apparu dans le contexte  de l’émergence  de la Chine, et ...  "
85,2022-09-01,Le Monde,1136mots,Audrey Garric,Le deuxième été le plus chaud en France,"    Ce fut l’été  de tous les dangers. Ces trois derniers mois, la France a connu une succession  de canicules à rallonge, d’incendies ravageurs,  de sécheresses historiques et, dans le même ...  "
86,2022-09-07,Le Monde,3839mots,Audrey Garric,"Le sable, richesse et malédiction des Maldives","    Il suffit  de plonger la tête  de quelques centimètres, alors que l’eau n’arrive pas à la taille, pour les apercevoir baignés  de lumière?: des milliers  de coraux, jaunes, verts, bleus ...  "
87,2022-09-09,Le Monde,1011mots,Véronique Chocron,Immobilier : le nombre de biens à louer diminue,"    AStrasbourg, depuis la rentrée universitaire, début septembre, l’auberge  de jeunesse 2 Rives héberge provisoirement une vingtaine d’étudiants ayant fait chou blanc dans leurs recherches d’un logement pour l’année ...  "
88,2022-09-01,Le Monde,192mots,,Climat Le deuxième été le plus chaud en France,"        Ces trois derniers mois, la France a connu une succession  de canicules à rallonge, d’incendies ravageurs,  de sécheresses historiques et, dans le même temps, d’inondations majeures. Mardi 30août, Météo ...  "
89,2022-11-22,Le Monde,1592mots,"Pierre Barthélémy,Dominique Gallois etPhilippe Jacqué (à Bruxelles) Pierre Barthélémy,Dominique Gallois etPhilippe Jacqué (à Bruxelles) Pierre Barthélémy,Dominique Gallois etPhilippe Jacqué (à Bruxelles)",L’Europe spatiale veut mettre les moyens,"    ... ’exploration spatiale, où les projets privés se multiplient outreAtlantique, à commencer par la constellation  de satellites Starlink d’Elon Musk, pour diffuser l’Internet à haut débit, l’Europe fait pâle ...  "
90,2022-12-16,Le Monde,1374mots,Marjorie Cessac et Audrey Garric Marjorie Cessac et Audrey Garric,Les stratégies de survie de l’industrie du gaz,"    ...  documents stratégiques inédits révèlent comment l’Union internationale du gaz (UIG), qui rassemble les industriels  de la filière, a cherché à redéfinir le rôle  de cette énergie fossile face aux préoccupations croissantes ...  "
91,2022-11-16,Le Monde,1124mots,,Josef Aschbacher et Thomas Pesquet L’espace peut nous aider à relever les défis du climat,"        La France vient  de traverser l’été le plus chaud  de son histoire. Cette période estivale, avec des vagues  de chaleur écrasantes et des températures avoisinant les 40 °C pendant plus de ...  "
92,2022-11-26,Le Monde,1905mots,"Propos recueillis parStéphane Foucart, VirginieMalingre et Stéphane Mandard Propos recueillis parStéphane Foucart, VirginieMalingre et Stéphane Mandard Propos recueillis parStéphane Foucart, VirginieMalingre et Stéphane Mandard Propos recueillis parStéphane Foucart, VirginieMalingre et Stéphane Mandard","Climat : « L’objectif des 1,5 0 C est moribond »","    Frans Timmermans, le viceprésident néerlandais  de la Commission européenne chargé du Pacte vert, exprime sa  « grande déception »  après la conférence sur le climat (COP27)  de Charm ElCheikh, en Egypte, et ...  "
93,2022-11-24,Le Monde,1111mots,Audrey Garric,COP27 : les contours flous du fonds « pertes et dommages »,    C’est une avancée  de la COP27 qui a été unanimement saluée. Les 196 pays réunis à Charm ElCheikh (Egypte) pour la 27e conférence mondiale sur le climat ont décidé de ...  
94,2022-12-20,Le Monde,1619mots,Benoît Floc’h,« Un calendrier pas tenable pour les plus modestes »,"    Sur la cheminée du bureau du maire  de Rouen trône un buste  de Corneille, l’enfant du pays. Dans une formule devenue célèbre, le dramaturge a rappelé qu’il n’était pas ...  "
95,2022-11-10,Le Monde,876mots,Audrey Garric,"Sur les énergies fossiles, un « tabou brisé »","    ...  d’émotion que le premier ministre des Tuvalu, Kausea Natano, a annoncé, à la tribune  de la conférence mondiale sur le?climat (COP27), mardi 8 novembre, rejoindre l’initiative pour un traité ...  "
96,2022-11-14,Le Monde,1021mots,FannyHenriet FannyHenriet,Fanny Henriet Réussir la transition énergétique,"    Plus  de 80 %  de nos émissions  de gaz à  effet  de  serre proviennent  de la combustion des énergies fossiles : gaz, pétrole et charbon. Nous n’avons donc pas d’autre choix que ...  "
97,2022-11-25,Le Monde,1383mots,Camille Bordenet,"En Mayenne, dans la « jungle » des devis et des aides","    Gweltaz Ramel a quelque chose du médecin  de campagne lorsqu’il toque chez Martine et Joël Pottier, route du Tertre, à Désertines (Mayenne). Dans la malette du conseiller thermique, nul stéthoscope, mais ...  "
98,2022-11-09,Le Monde,1003mots,Jérémie Lamothe et Thibaud Métais,Assurance-chômage : la droite met la pression sur l’exécutif,"    La droite campe sur ses positions. Si la majorité sénatoriale, composée des Républicains (LR) et  de l’Union centriste (UC), a durci durant son examen au Sénat le projet  de loi ouvrant ...  "
99,2022-11-05,Le Monde,1952mots,Audrey Garric,Une COP pour garder le climat au premier plan,"    ...  cruel paradoxe. Jamais l’action climatique n’aura été si urgente qu’après cet été  de catastrophes en cascade. La crise climatique a frappé toutes les régions du monde, entraînant souffrances, désolation ...  "
100,2022-11-09,Le Monde,1006mots,Laure Stephan,L’enjeu de la justice climatique au cœur de la COP27,"    ...  novembre, à l’ouverture du sommet des dirigeants censé donner l’impulsion des deux semaines  de négociations  de la COP27 qui se tient à Charm ElCheikh, le secrétaire général  de l ...  "
101,2022-11-21,Le Monde,902mots,Dipak Dasgupta,Dipak Dasgupta Le salut viendra des efforts du Nord,"    La question du financement  de l’action climatique est la principale source  de méfiance entre pays du Nord et du Sud, mais aussi le plus grand obstacle à la limitation du réchauffement ...  "
102,2022-11-23,Le Monde,1240mots,Alexandre Pedro Alexandre Pedro,L’art du discours de Didier Deschamps,"    J’ai toujours admiré son sens inouï  de la langue  de bois » , disait, il y a près  de dix ans, Pape Diouf au sujet  de l’art  de l’esquive rhétorique de ...  "
103,2022-11-18,Le Monde,1081mots,Audrey Garric,COP27 : Lula promet un « leadership » sur le climat,"    ...  a donné un discours digne d’une rockstar à la conférence mondiale sur le climat  de Charm ElCheikh (Egypte), mercredi 16 novembre. Accompagné jusqu’à l’estrade par Sameh Choukri, président ...  "
104,2022-11-09,Le Monde,999mots,Audrey Garric (à Paris) et L. S.,Macron plaide pour une réforme des financements pour le climat,"    Comme à son habitude, Emmanuel Macron s’est présenté en grand défenseur  de la lutte contre le dérèglement climatique, vantant l’action  de la France et  de l’Union européenne (UE) dans ...  "
105,2022-11-19,Le Monde,847mots,Philippe Broussard,La Coupe du monde des excès,"    ...  ans que le Qatar s’y prépare, convaincu d’en faire sa vitrine, l’apothéose  de sa stratégie  de soft power sportif. Quoi  de mieux, pour couronner sa réussite géopolitique, que d ...  "
106,2022-12-06,Le Monde,1376mots,Clément Guillou,Ecologie : le RN pas près de changer de cap,"    Avec la condamnation pour violences conjugales  de son député européen Hervé Juvin, révélée en novembre par l’hebdomadaire  L’Obs , le Rassemblement national (RN) n’a pas seulement perdu la moitié des ...  "
107,2022-12-14,Le Monde,1140mots,,Tahar Ben Jelloun  Le temps est avec l’équipe du Maroc. Les peuples arabes et africains sont avec elle,"        ...  a conduit à l’indépendance du Maroc), et la qualification le 10 décembre des Lions  de l’Atlas pour la demifinale  de la Coupe du monde  de football. Deux événements qui ...  "
108,2022-12-02,Le Monde,1097mots,Clément Martel,Les Bleus héritent d’heureux Polonais,"    Difficile  de faire passer onze solides gaillards par le chas d’une aiguille. Et pourtant, l’équipe  de Pologne tout entière s’est faufilée en huitièmes  de finale  de la Coupe du ...  "
109,2022-12-22,Le Monde,1067mots,Isabelle Dellerba et Audrey Garric (à Paris),Le Vanuatu porte le climat devant la justice internationale,"    ...  le Vanuatu. L’archipel du Pacifique, en première ligne du réchauffement, veut obtenir un avis  de la Cour internationale  de justice (CIJ), la plus haute juridiction au monde. Si le processus aboutit ...  "
110,2022-12-07,Le Monde,1105mots,Carole Dieterich et Sophie Landrin,Inde : les projets nucléaires français dans l’impasse,    C’est le plus gros dossier  de la France à l’étranger. Jaitapur se trouve à l’agenda  de toutes les rencontres bilatérales entre l’Inde et la France depuis 2008. Mais ...  
111,2022-11-25,Le Monde,1044mots,Stéphane Foucart,Les « coûts cachés » des pesticides évalués,"    L’intérêt économique  de recourir aux pesticides en agriculture pourraitil être remis en cause par la simple prise en compte du coût  de leurs dégâts collatéraux ? A cette question récurrente, une ...  "
112,2022-12-02,Le Monde,857mots,Mathilde Gérard,Le recours à la bioénergie fait peser un risque sur l’usage des terres de l’UE,"    En matière  de lutte contre le dérèglement climatique et  de protection  de la biodiversité, certaines solutions sont à double tranchant. Une analyse publiée dans l’édition  de  Nature  du 1er décembre avertit ...  "
113,2022-11-18,Le Monde,927mots,Perrine Mouterde,La COP15 biodiversité en quête de soutien,"    La lutte contre le réchauffement climatique passe aussi par la protection  de la nature. Depuis la COP27 sur le climat, qui se poursuit à Charm ElCheikh en Egypte, les appels à ...  "
114,2022-11-19,Le Monde,1667mots,Jean-Baptiste Chastand,Les mafias balkaniques trahies par leurs messages,"    ... Le tribunal spécialisé dans le crime organisé  de Belgrade a été transformé en bunker, protégé par des policiers cagoulés et surarmés. Lundi 7 novembre, on juge dans ce bâtiment anonyme  de la ...  "
115,2022-11-22,Le Monde,758mots,Laure Stephan,Un bilan diplomatique mitigé pour l’Egypte,"    ...  le prix des sandwichs dans la zone officielle des négociations à la mise en cause  de la présence massive des lobbyistes des énergies fossiles. Toutefois, le pouvoir égyptien, qui accueillait la conférence ...  "
116,2022-11-15,Le Monde,511mots,Catherine Pacary,Cyril Dion part à la recherche d’« un monde nouveau »,"    Une bonne partie  de la planète pourrait devenir inhabitable à la fin du siècle »  , déplore le réalisateur et militant Cyril Dion dans l’introduction qui le met en scène, pédalant dans un ...  "
117,2022-11-21,Le Monde,1013mots,Irene Monasterolo,Irene Monasterolo Il devient urgent que la finance internationale fasse sa révolution,"    ...  réellement investis – ne cesse d’augmenter. Selon Climate Policy Initiative, une ONG d’analyse et  de conseil sur l’intégration du changement climatique dans les politiques économiques, les besoins annuels  de financement ...  "
118,2022-11-04,Le Monde,960mots,Lan Wei,Climat : les efforts d’adaptation insuffisants,"    ...  une catastrophe liée aux risques météorologiques, climatiques ou hydrologiques a eu lieu chaque jour, responsable  de la mort  de 115 personnes et  de 202 millions  de dollars  de pertes, selon une estimation ...  "
119,2022-12-09,Le Monde,1005mots,Thomas Saintourens,Crash Rio-Paris : pas de condamnation requise,"    ...  Brésil.  « Quatre minutes 23 secondes »,  rappelle le ministère public, durant lesquelles le vol AF447, parti  de Rio quelques heures plus tôt en direction  de Paris, décroche et chute dans les eaux de ...  "
120,2022-11-30,Le Monde,2152mots,Marjorie Cessac et Perrine Mouterde,Nucléaire : l’autre dépendance européenne à la Russie,"    ...  russes. Mais une autre dépendance a jusqu’ici été très peu évoquée : dans l’est  de l’Union européenne (UE) notamment, des Etats comptent sur l’industrie nucléaire russe pour faire tourner ...  "
121,2022-11-16,Le Monde,1730mots,"Frédéric Lemaître, Brice Pedroletti et Philippe Ricard",G20 : le grand retour diplomatique de Xi,"    Tel un sportif longtemps absent  de la compétition pour cause  de stratégie zéro Covid, le président chinois, Xi Jinping, a décidé  de faire sa rentrée internationale en deux temps cet automne. D ...  "
122,2022-12-01,Le Monde,1351mots,Emmanuelle Jardonnet,"A Grenoble, le Magasin reprend du service","    Le Magasin  Centre national d’art contemporain (CNAC)  de Grenoble seraitil un paquebot démesuré, dépassé, voire un peu maudit ? C’est ce qu’avait fini par se demander l’ancienne directrice ...  "
123,2022-11-15,Le Monde,1095mots,Philippe Dagen,Giacometti aura son musée au cœur de Paris,"    ...  nouvelle est enfin rendue publique : Alberto Giacometti (19011966) aura son grand musée au centre  de Paris. L’ouverture prévue est annoncée pour 2026. L’artiste suisse avait déjà un musée, depuis ...  "
124,2022-12-21,Le Monde,532mots,Jacques Mandelbaum,Camille opère un joyeux et émouvant retour dans le temps,"    ...  sortilèges d’un voyage dans le temps ? Noémie Lvovsky rend, avec  Camille redouble , un hommage  serré au beau film  de Coppola  Peggy Sue s’est mariée  (1986, histoire d’une femme revivant ...  "
125,2022-09-12,Le Monde,2289mots,"Éric Albert, Raphaëlle Bacqué, Cécile Ducourtieux, et Béatrice Gurrey",L’adieu d’une nation à sa souveraine,"    La reine est partie un jour  de pluie et le pays s’est réveillé orphelin. Vendredi 9 septembre, le ciel jette encore ses averses soudaines sur les milliers  de personnes venues rendre ...  "
126,2022-11-05,Le Monde,719mots,AU. G.,"Les COP, « caisses de résonance des débats du monde »","    Comme chaque année, la communauté internationale se retrouve au chevet  de la planète. Du 6 au 18 novembre, la 27e conférence des Nations unies sur le climat (COP27) se tiendra à Charm ...  "
127,2022-12-15,Le Monde,995mots,Jules Thomas,Les entreprises face à l’impératif de transition écologique,"    Où en sont les entreprises sur le climat ? Une vingtaine  de responsables des ressources humaines – et pour l’occasion, certains responsables  de la responsabilité sociétale des entreprises (RSE) – ont échangé sur leur ...  "
128,2022-12-29,Le Monde,1418mots,Audrey Garric avec Perrine Mouterde,"2022, année charnière pour la planète","    ...  l’Union européenne (UE) décrochait une série d’accords pour accélérer ses baisses d’émissions  de gaz à  effet  de  serre : la réforme  de son marché carbone, l’instauration d’une taxe ...  "
129,2022-10-01,Le Monde,1342mots,Véronique Lorelle,"Soucieux d’écologie, le design va droit aux rebuts","    ... vis du monde industriel», selon François Azambourg, designer et enseignant à l’Ecole nationale supérieure  de création industrielle (ENSCILes Ateliers).  «Ce n’est pas banal ce qui est en train de ...  "
130,2022-09-22,Le Monde,2776mots,Audrey Garric,"Valérie Masson-Delmotte, une climatologue au sommet","    En cette soirée  de fin d’été, la petite ville  de PerrosGuirec est prise d’une agitation inattendue. Ce 22 août convergent vers cette commune paisible des Côtesd’Armor une ...  "
131,2022-11-23,Le Monde,1368mots,Arnaud Leparmentier,Hydrogène : Plug Power compte sur le Niagara,"    Dans son usine  de piles à hydrogène flambant neuve, à Rochester, dans le nordouest  de l’Etat  de New York, Andrew Marsh rêve aux pionniers qui ont construit, dans les années ...  "
132,2022-11-14,Le Monde,933mots,Laure Stephan,Joe Biden juge les efforts pour le climat « plus urgents que jamais »,"    Cela a été une visite au pas  de course, pour celui qui se présente comme un champion  de la lutte climatique : le président Joe Biden a passé trois heures en Egypte, vendredi ...  "
133,2022-11-08,Le Monde,672mots,Laure Stephan,COP27 : le dossier des pertes et dommages inscrit à l’agenda officiel,"    ...  pertes et dommages provoqués par le réchauffement climatique a été inscrite à l’agenda officiel  de la conférence mondiale pour le climat (COP27), dont le coup d’envoi a été lancé à ...  "
134,2022-11-17,Le Monde,1395mots,Audrey Garric,COP27 : des progrès ténus,"    ...  mondiales sur le climat, le décalage est grand entre l’urgence climatique, martelée à longueur  de discours, et la réalité des avancées. Après une semaine  de négociations, la COP27, qui doit s ...  "
135,2022-11-18,Le Monde,3282mots,Nathalie Guibert,La jeunesse de la Guadeloupe ne veut plus tourner en rond,"    Un carrefour, encaissé dans un vallon verdoyant. Bordées  de maisons éparses, trois routes comme des lignes  de fuite. Ou plutôt, comme on les nomme en Guadeloupe, des  « chemins tichiens » , ces traverses empruntées ...  "
136,2022-09-10,Le Monde,1163mots,,Nicolas Baumard et Coralie Chevallier L’impact environnemental des jets privés est largement sous-estimé,"        Depuis quelques mois,  de nombreuses voix s’élèvent pour demander l’encadrement plus strict, la taxation, voire l’interdiction des jets privés. Cet été, le débat portait sur les jets privés des ...  "
137,2022-12-02,Le Monde,1171mots,Audrey Garric,"2022, « symptôme du dérèglement climatique »","    ...  sera la plus chaude jamais enregistrée en France, et ce quelles que soient les températures  de décembre, a assuré l’établissement public, mercredi 30 novembre, dans une évaluation provisoire. Ponctuée d’extrêmes ...  "
138,2022-09-22,Le Monde,880mots,Audrey Garric,Guterres plaide pour taxer les profits dans les énergies fossiles,"    ...  et que les dépenses des ménages s’envolent,  «l’industrie des combustibles fossiles se régale  de centaines  de milliards  de dollars  de subventions et  de bénéfices exceptionnels» . Une fois  de plus, Antonio ...  "
139,2022-12-14,Le Monde,1095mots,Émeline Cazi et Sophie Fay,Nouveau plan du gouvernement pour le covoiturage du quotidien,"    Trois millions  de trajets « covoiturés » quotidiennement en 2024. C’était l’objectif affiché fin 2019 par Elisabeth Borne et JeanBaptiste Djebbari, alors respectivement ministre  de la transition écologique et secrétaire d ...  "
140,2022-12-17,Le Monde,595mots,,Taxe carbone : L’UE au défi de sa politique industrielle,"        Après vingt ans d’efforts, la France a réussi à convaincre ses partenaires européens  de mettre en œuvre un mécanisme d’ajustement carbone aux frontières. L’idée consiste à taxer les émissions ...  "
141,2022-11-21,Le Monde,756mots,Audrey Garric,Les grands équilibres géopolitiques vacillent à la COP27 de Charm El-Cheikh,"    Qui doit payer pour les impacts grandissants  de la crise climatique ? La conférence mondiale sur le climat (COP27)  de Charm ElCheikh, en Egypte, continuait  de buter sur cette question épineuse, samedi ...  "
142,2022-11-29,Le Monde,703mots,St. M.,Début des négociations pour un traité international contre la pollution plastique,    Ce jour marque le triomphe  de la planète Terre sur les plastiques à usage unique. Il s’agit  de l’accord multilatéral sur l’environnement le plus important depuis l’accord de ...  
143,2022-10-07,Le Monde,1099mots,Audrey Garric,Climat : la sécheresse de cet été liée au réchauffement,"    Le Rhin à sec, des communes sans eau potable en France, des pierres  de la faim qui refont surface en République tchèque, une aridité et une chaleur exceptionnelles en Chine déclenchant une ...  "
144,2022-10-07,Le Monde,1260mots,Denis Cosnard,"Françoise Frenkel, une vie empêchée","    ...  seul livre. Pas tout à fait. Soixantedixsept ans après la parution en Suisse  de Rien où poser sa tête,bouleversant récit  de sa vie dans la France  de Vichy, un ...  "
145,2022-10-10,Le Monde,3957mots,"Benjamin Barthe, Rémi Dupré et Stéphane Mandard Benjamin Barthe, Rémi Dupré et Stéphane Mandard",Qatar : les dossiers qui alimentent la polémique,"    A un mois et demi  de l’ouverture  de la Coupe du monde  de football, le 20 novembre, dans le stade d’AlKhor, au Qatar, un sentiment  de malaise gagne la ...  "
146,2022-09-13,Le Monde,906mots,Jean-Michel Normand,La voiture électrique commence à séduire les Etats-Unis,"    L’automobile américaine s’est trouvé une nouvelle frontière.  De la patrie des  gas guzzlers , ces grosses voitures au moteur gavé d’hydrocarbures, proviennent des signaux convergents, révélateurs d’une électrification accélérée ...  "
147,2022-11-10,Le Monde,1337mots,Audrey Tonnelier,Climat : l’alerte de Pisani-Ferry à l’exécutif,"    La transition écologique va occasionner un  «changement profond  de modèle  de développement»  et induire des  «chocs négatifs»  sur la croissance, l’emploi, l’investissement l’inflation ou encore les inégalités. C’est ...  "
148,2022-11-24,Le Monde,628mots,par Pierre-Cyrille Hautcœur,A qui faut-il donner les clés du futur ?,    ...  tous à penser concrètement la possibilité même d’une rupture par rapport à nos conditions  de vie actuelles est l’un des plus grands obstacles aux politiques nécessaires pour faire face au ...  
149,2022-12-19,Le Monde,685mots,Magali Cartigny,"Céline Dion, Laeticia Hallyday : le noir leur va si bien Magali Cartigny","    ...  qui se confondent et s’opposent. Laeticia Hallyday, la discrète, et Céline Dion, la bête  de scène, ont toutes les deux épousé très jeunes un homme beaucoup plus âgé, qui les a ...  "
150,2022-09-21,Le Monde,4048mots,Raphaëlle Bacqué et Ariane Chemin,"Mélenchon , ses lieutenants et les féministes « insoumises »","    ...  doit avoir lieu dans l’aprèsmidi du jeudi 22 septembre, à Paris. C’estCaroline  De Haas qui officiera. La militante féministe, dont la PME  de trentecinq personnes, Egaé, vend aux ...  "
151,2022-11-23,Le Monde,504mots,,Une lettre de Xavier Moreno et du Cérémé,"        A la suite  de la publication  de l’article « Derrière les antiéoliennes, une galaxie influente et pronucléaire » (Le Monde du mercredi 29 juin), nous avons reçu, au titre du droit de ...  "
152,2022-10-11,Le Monde,833mots,,Non au pipeline géant de Total en Afrique de l’Est !,"        ...  le reste du monde, l’été 2022 fut un été meurtrier. Canicules à répétition, feux  de forêt, inondations d’une ampleur jamais vue… Plus personne ne peut en douter, le bouleversement climatique ...  "
153,2022-11-08,Le Monde,1266mots,Piotr Smolar,"Biden, un réformateur qui peine à convaincre","    ...  où les deux démocrates étaient venus apporter leur soutien à John Fetterman, candidat au poste  de sénateur. Joe Biden n’a ni le charisme ni les mots aiguisés  de Barack Obama, orateur ...  "
154,2022-10-24,Le Monde,591mots,,La transition écologique en manque de récit,"        France nation verte». L’intitulé  de l’outil  de planification écologique dévoilé, vendredi 21 octobre, par la première ministre, Elisabeth Borne, annonce la couleur. Reste à inventer le modèle  de société qui ...  "
