,date,publication,words,author,title,intro
161,2013-08-05,La Croix,696mots,DESCAMPS Elise,"La religion, préoccupation croissante des défenseurs des droits de l'homme","    ... 'hui, je suis sûr que la CEDH défendrait la liberté de l'expression artistique. Le  climat a changé. La liberté religieuse est aujourd'hui davantage considérée comme une question personnelle, dès lors ...  "
162,2013-08-06,La Croix,642mots,BLETRY Nadia,"En Tunisie, la ville de Sidi Bouzid entre en dissidence","    ...  est l'une des rares femmes présentes sur place.  « Le gouvernement actuel est responsable du  climat de violence en Tunisie »,  explique la cinquantenaire, la voix cassée à force d'avoir manifesté. Autour ...  "
163,2013-08-31,La Croix,858mots,PEIRON Denis,"Enseigner, ça s'apprend",    ...  qu'à leur  apprendre à ne pas se méfier des élèves et à bâtir un  climat de confiance ».  Elle se sent d'autant plus à l'aise dans ce rôle qu'elle ...  
164,2013-08-23,La Croix,52mots,,Nouveau procès autour de l'emploi du terme « Allah »,"        Le gouvernement malaisien a obtenu, hier, dans un  climat très tendu, le droit d'interjeter appel auprès de la Haute Cour de justice, qui avait permis à la minorité non musulmane du ...  "
165,2013-08-07,La Croix,641mots,THOMASSET Flore,Les tensions dans les prisons sont plus fortes en été,"    « Chaque année, l'administration pénitentiaire est très inquiète en juin et très soulagée en septembre. »  Pour Christophe Régnard, président de l'Union syndicale des magistrats, la période estivale est  « évidemment »  particulière ...  "
166,2013-08-08,La Croix,917mots,BOYER Paula,Les dégâts d'une vie « au jour le jour ». Kuummiut. Reportage de notre envoyée spéciale,"    ...  la moitié des familles ont des problèmes d'alcool ».  Comment surviventils, alors, dans un  climat si rude? Les maisons sont construites par l'État, les loyers bas, les aides sociales nombreuses ...  "
167,2013-05-14,La Croix,60mots,,PHILIPPINES. Le camp du président Aquino favori des élections de mi-mandat,        Les Philippins ont voté hier dans un  climat de violences pour des élections parlementaires et locales de mimandat: cellesci font office de test pour le président Benigno Aquino et ses ...  
168,2013-05-13,La Croix,682mots,FRANCOIS Jean-Baptiste,"A Sevran, le rugby relance les joueuses dans le monde du travail","    ...  début de l'année 2010. Les bailleurs sociaux, en recherche d'initiative pour changer le  climat des quartiers populaires de SeineSaintDenis, font appel à l'association Drop de béton qui ...  "
169,2013-05-16,La Croix,470mots,GIULIANI Emmanuelle,"Kate Morton, une plume du bout du monde. La Scène des Secrets de Kate Morton. Traduit de l'anglais par Anne-Sylvie [...]","    ...  racontées par Kate Morton tiennent le lecteur en haleine par leur habile suspens et leur  climat psychologique intranquille. Elle excelle à imaginer des caractères féminins complexes, insaisissables. Telle la très troublante Dolly ...  "
170,2013-05-18,La Croix,453mots,BESMOND DE SENNEVILLE Loup,L'Eglise cherche comment s'adresser aux jeunes catholiques engagés,"    ...  la métropole lilloise. Dans son aumônerie, il a tenté de maintenir, depuis six mois, un  climat d'apaisement, entre des jeunes majoritairement opposés au « mariage pour tous », et quelquesuns favorables au ...  "
171,2013-07-11,La Croix,309mots,THOMASSET Flore,La justice saisit une partie des biens de Bernard Tapie,"    ...  probable, où la sentence serait annulée,  explique Thomas Clay.  Jusqu'ici, il y avait un  climat de scepticisme quant à la possibilité que Bernard Tapie rembourse. Désormais, la justice dispose de la ...  "
172,2013-07-16,La Croix,369mots,BEVILACQUA Arnaud,Le Britannique Christopher Froome peut voir l'avenir en jaune,"    ...  faceàface, il prend le large. »  Sa domination a plongé le Tour dans un  climat de suspicion. Les années Lance Armstrong ont laissé des traces et chaque performance est désormais observée ...  "
173,2013-07-01,La Croix,388mots,BEVILACQUA Arnaud,La Corse se rêve en nouvelle terre promise du cyclisme,"    ... 'île est une terre idéale pour faire du vélo, avec son relief vallonné et son  climat »,  explique PierreJean Orsini, secrétaire général du comité corse de cyclisme.  « Et elle possède de nombreux ...  "
174,2013-07-11,La Croix,52mots,,TOGO Mgr Barrigah obtient un accord entre le gouvernement et l'opposition,"        ...  mettre d'accord le pouvoir et l'opposition au Togo, ce qui devrait apaiser le  climat politique du pays  (lire  La Croix  du 11 juin) . Cet accord intervient après quatre jours de ...  "
175,2013-06-14,La Croix,300mots,SERROU Bruno,La « Cléopâtre » de Massenet à l'Opéra de Marseille,"    ... 'oeuvre est sans doute un peu inégale mais on y retrouve, à la fin, le  climat de  Manon  et de  Werther . Massenet connaissait parfaitement les voix et écrivait merveilleusement pour elles. Si ...  "
176,2013-07-24,La Croix,665mots,LEGRAND Christine,Le Champagne Taittinger fait pétiller l'esprit des moines.,"    ... Le  climat qui règne dans cette maison, où on se sent vite comme chez soi, tient beaucoup à la personnalité de cet homme, à l'élégante générosité et que tout le monde ...  "
177,2013-07-24,La Croix,49mots,,Contrats avec les Émirats arabes unis,"        ...  période de froid. L'entourage du ministre de la défense, JeanYves Le Drian, espère que ce nouveau  climat renforcera les chances de vendre aux Émirats l'avion de combat Rafale.  ...  "
178,2013-08-26,La Croix,1028mots,VERDIER Marie,« On n'est pas sorti de l'auberge ». Lanarce (Ardèche). Reportage de notre envoyée spéciale,"    ... Sur ces terres reculées, l'inhumanité du  climat n'avait d'égal que la sauvagerie des moeurs. C'est du moins ce qu'a retenu l'histoire depuis près de deux siècles ...  "
179,2013-08-09,La Croix,1150mots,,"Pendant tout l'été, en partenariat avec les éditions Omnibus, La Croix vous emmène marcher avec les meilleurs auteurs. Pèlerinages, promenades, [...]","        ...  les autres membres de l'ordre, néanmoins leur vêtement n'est pas fait pour ce  climat. Il était monté d'Airolo par une route très glissante, ayant le vent contraire. Sa barbe ...  "
180,2013-07-31,La Croix,280mots,ERNENWEIN François,Ce qu'il reste à faire au Mali,"    ...  à ce vaste travail de reconstruction. Si le processus électoral se poursuit dans le même  climat, il aura été le socle d'un changement qui pourra aussi s'appuyer sur les 3 ...  "
181,2013-08-01,La Croix,230mots,MEUNIER Marianne,L'horloger de la forteresse,"    ... til, ajoutant:  « Je ne sais pas expliquer pourquoi je fais cela. Sinon, elle tomberait en ruine. Le  climat socioéconomique est tel que la ville ne s'en préoccupe pas. »  ...  "
