,date,publication,words,author,title,intro
157,2015-03-16,La Croix,752mots,SERGENT Denis,SABRINA KRIEF. Dans le secret des grands singes,"    ...  constituent à la fois une réalité et un symbole fort de la biodiversité. «  Ils sont menacés d'extinction, mais, un peu comme le  climat, nous pouvons encore les sauver  », conclutelle.  ...  "
158,2015-03-11,La Croix,870mots,PEIRON Denis,Une réforme du collège a minima,"    ...  soient davantage présents dans les établissements. Alors que nombre de collèges pâtissent d'un mauvais  climat scolaire, peutêtre auraiton pu passer d'une logique d'instruction à celle bien plus ...  "
159,2015-03-21,La Croix,972mots,HUARD François-Xavier,"François-Xavier Huard. Cofondateur de « Chrétiens changeons ». Aux côtés du Christ, en route vers une sobriété joyeuse","    « N ous choisissons un mode de consommation qui permette aux producteurs de vivre décemment... Nous consommons une nourriture autant que possible biologique. La dégradation de notre santé, l'épuisement avéré et ...  "
160,2015-04-14,La Croix,503mots,GILLES BIASSETTE,"Associations, et a conduit à l'oppression et à la ruine de tous les pays où il a été mis en [...]","    ...  prise de conscience des droits du citoyen, et des devoirs de l'État. » Dans ce  climat de tension croissante, l'Église ne compte pas s'en tenir au rôle de critique. La ...  "
161,2015-04-16,La Croix,752mots,CARASCO Aude,La grève à Radio France laissera des traces,"    ...  les tranches » . Les tensions entre grévistes et nongrévistes ont parfois été vives et le  climat social ne sera pas facile à apaiser, sur fond de division syndicale, à l'heure où ...  "
162,2015-04-16,La Croix,888mots,JACOB Antoine,Nokia n'est plus le poids lourd de l'économie finlandaise,"    ...  financière de 2008. Résultat,  « depuis plus de trois ans, le pays est empêtré dans un  climat de récession » , constate Vesa Vihriälä, le directeur de l'institut de recherche économique Etla. Cette morosité ...  "
163,2015-04-17,La Croix,911mots,,COURRIER,"        Antisémitisme Après les attentats qui ont ensanglanté la France au mois de janvier, puis le Danemark en février, force est de constater la résurgence de l'hydre malfaisante qu'est l ...  "
164,2015-04-07,La Croix,719mots,MICHELON Luc,"FORUM. Brésil : menaces sur la démocratie. Luc Michelon, président de Frères des hommes","    ...  brésiliens, le Mouvement des travailleurs ruraux sans terre (MST) est le plus visé par ce  climat délétère car il occupe une vraie place dans la vie politique brésilienne et est proche idéologiquement ...  "
165,2015-04-01,La Croix,560mots,LESEGRETAIN Claire,"Le consentement des familles, une condition indispensable pour les religions","    ...  familles »,  estime le P. Verspieren, en rappelant combien de telles décisions se prennent «  dans un  climat très spécial »  de souffrance pour les proches.  « Estce vraiment respecter la seule volonté de chaque ...  "
166,2015-01-15,La Croix,739mots,KECHICHIAN Patrick,"La violence, comme réalité et fiction","    ...  jamais quels sont les motifs et enjeux de ce conflit. Qu'importe: c'est  « un  climat d'urgence ou d'inquiétude »  qui domine, et ni l'analyse géopolitique ni les efforts de ...  "
167,2015-01-07,La Croix,350mots,QUINIO Dominique,Un pays rayé de la carte,    ...  qu'elle ne favorisait pas la recherche de la paix et l'établissement d'un  climat de confiance. L'affaire conforte les Israéliens dans leur certitude que les pays arabes voisins souhaitent ...  
168,2015-01-05,La Croix,455mots,REJU Emmanuelle,"Quel sera le coût total de l'abandon de l'écotaxe ? Dominique Bussereau, député UMP de Charente-Maritime, secrétaire d'État aux transports [...]","    ...  pollueurpayeur au moment où nous nous préparons à accueillir une grande conférence sur le  climat ne me paraît pas d'une grande cohérence. Enfin, j'ai alerté le gouvernement sur le ...  "
169,2015-01-31,La Croix,658mots,BESMOND DE SENNEVILLE Loup,CULTURE. Une source d'inspiration pour les écrivains,"    ...  Le Nom de la rose , roman dans lequel Umberto Eco construit une intrigue dans un  climat de conflit théologique entre les franciscains et le pape, remporte un succès planétaire. C'est aussi ...  "
170,2015-02-26,La Croix,763mots,DANA Jean-Yves,"Avishai Cohen, en osmose vers la lumière","    ... 'elle est, sans besoin d'un éclairage partant de la vie du compositeur, expliquant le  climat dramatique de tel morceau ou la douceur de tel autre » , plaidetil. Son dernierné ...  "
171,2015-03-09,La Croix,256mots,CARASCO Aude,Illustration du plafond de verre,"    ...  des postes d'encadrement, donnent pleinement satisfaction, tant au niveau de la rentabilité que du  climat social.  « Au début, j'étais gêné d'être commandé par une femme. Avec du recul, c ...  "
172,2015-03-06,La Croix,701mots,GREILSAMMER Ilan,La cassure de juin 1967,"    ...  juif français se sent agressé ou même simplement très mal à l'aise face au  climat délétère antijuif qui se développe, il peut très bien quitter la France pour s'établir en ...  "
173,2015-03-12,La Croix,482mots,CASTAGNET Mathieu,"Chez les écologistes, le spectre de la scission prospère",    Même les écologistes les plus habitués aux turbulences commencent à trouver le  climat inquiétant. Car si la vie interne d'Europe ÉcologieLes Verts n'a jamais été un long fleuve tranquille ...  
174,2015-03-23,La Croix,513mots,FRANCOIS Jean-Baptiste,"A Calais, une faible diminution du nombre des migrants","    À Calais, l'ancien centre de loisirs JulesFerry, reconverti en asile de jour pour migrants, ouvre progressivement ses portes. Ce site installé dans la zone industrielle des Dunes est l ...  "
175,2015-03-17,La Croix,138mots,,REPÈRES. La loi santé. Les principales mesures du texte,"        Outre la généralisation du tiers payant, le texte prévoit diverses mesures Un médecin traitant pour les enfants: l'objectif est de permettre la désignation d'un médecin traitant pour les patients ...  "
176,2015-03-13,La Croix,471mots,FERRE Jean-Luc,"Dans le Tarn-et-Garonne, Jean-Michel Baylet divise","    ...  Baylet accusant les socialistes de n'avoir pas joué le jeu de l'alliance. Le  climat s'est un peu apaisé depuis, mais la tentative d'accord négociée en décembre n'a ...  "
177,2015-04-01,La Croix,720mots,MOREAU Michel,"Michel Moreau, réseau des Amap (Associations pour le maintien d'une agriculture paysanne) en Yvelines Une nouvelle agriculture ! Oui, mais [...]",    ...  bien le poids du productivisme mercantile face au respect de la nature. La situation du  climat de notre planète en est un exemple édifiant. Nous espérons que le monde paysan retrouvera la ...  
178,2015-04-15,La Croix,448mots,CARASCO Aude,Patrick Eveno. Historien des médias. Pourquoi un conflit si long à Radio France ?,"    « Le conflit dure longtemps parce qu'il est mal parti, avec d'un côté les revendications catégorielles de quatre syndicats (contre la mutualisation des programmes des locales de France Bleu, la ...  "
179,2015-04-08,La Croix,449mots,ROTIVEL Agnès,PIERRE SERVENT. Spécialiste des questions de défense et de stratégie. Peut-on protéger militairement les chrétiens d'Orient ?,"    « En théorie, il pourrait y avoir trois possibilités. Premièrement, on envoie les chrétiens d'Orient au Liban, en Turquie ou ailleurs. Cela paraît impossible, y compris si l'on considère les ...  "
180,2015-04-24,La Croix,1137mots,LAURANT Sophie,"La grotte Chauvet : un passé si loin, si proche","    ...  visible. Comme s'il avait été allumé hier. À cette époque, en Europe méridionale, le  climat est à peu près celui du sud de la Suède aujourd'hui. Ces hommes du paléolithique ...  "
181,2015-04-25,La Croix,894mots,LUCAS Emmanuelle|PAGNEUX Florence,EN FAMILLE. Des petites marionnettes devenues grandes,"    ...  Hommage au film de Tod Browning,  Freaks  de la compagnie Les Rémouleurs laisse planer un  climat de suspense.  « Vous voulez voir des monstres? Vous allez en voir »,  lance la marionnettiste Anne Bitran ...  "
182,2015-01-09,La Croix,91mots,,Alors que la police traquait les deux principaux suspects de l'attaque qui a fait douze morts mercredi contre « Charlie [...],"        ...  François Hollande, a été marquée par de nouvelles mobilisations un peu partout en France. Le  climat est resté tendu. En banlieue parisienne, une fusillade a fait une victime tandis que plusieurs lieux ...  "
183,2015-01-05,La Croix,335mots,COURET Florence,Au risque du courage,"    ...  qu'un événement international, programmé à la fin de cette année 2015, la conférence Paris  Climat 2015, pourrait lui fournir une occasion spectaculaire de rebond si celleci aboutissait à un accord ...  "
184,2015-01-27,La Croix,553mots,HEBDING Rémy,"Sortir l'exégèse coranique des dogmatismes. Rémy Hebding, journaliste et essayiste, ancien rédacteur en chef de l'hebdomadaire protestant « Réforme »","    ...  deux attentats commis au nom de Dieu, il est temps de se dégager de ce  climat émotionnel. Les sursauts populaires fondés sur le ressenti courent toujours le risque d'être éphémères. D ...  "
185,2015-02-17,La Croix,519mots,LE TALLEC Camille,"VU D'ALLEMAGNE. Henrik Enderlein , directeur de l'Institut Jacques Delors de Berlin et professeur d'économie politique à la Hertie School [...]",    ...  nous avons souligné la nécessité d'une coordination entre employeurs et employés pour atteindre un  climat de confiance : les grèves ne doivent plus être au coeur des négociations entre partenaires sociaux. C ...  
186,2015-02-03,La Croix,560mots,QUILLE Florence,Les diocèses du Nord ont la même vision de la paroisse du futur,"    ...  pour inventer une nouvelle hospitalité. Au terme du scrutin, les évêques se sont félicités du  climat d'écoute qui a présidé durant tout ce synode.  « Les chrétiens des trois diocèses se sont ...  "
187,2015-03-07,La Croix,393mots,CHAZAL Cyrielle,"Catherine Billet, une nomade pour la paix","    Demander à Catherine Billet de parler d'elle revient à marcher sur des sables mouvants.  « Je ne me dérobe pas » , affirmetelle pourtant, tout en envoyant les curieux sur le ...  "
188,2015-03-05,La Croix,944mots,DE CHALUS Aglaé,"Au Brésil, le scandale Petrobras fragilise le pouvoir","    ...  da Silva, formation qui vient de fêter le 10 février ses 35 ans dans un  climat délétère. «  Le volume d'argent détourné chez Petrobras est en proportion beaucoup plus important que dans ...  "
189,2015-03-14,La Croix,372mots,VIALARD Noémie,Tailler les hortensias et autres « Hydrangea »,"    Les hortensias ne se taillent pas obligatoirement avant l'hiver, au contraire. Leur somptueux feuillage d'automne, les fleurs séchées, qui habillent le jardin à la mauvaise saison et protègent les ...  "
190,2015-03-24,La Croix,996mots,MOUNIER Frédéric,Le polar régional détrône le roman de terroir ,"    ...  son jardin chauffé par un doux soleil d'hiver, pour  « la bouffe, le vin, le  climat, l'Histoire, les grottes... ».  Vite lié d'amitié avec Pierrot, unique policier municipal et pilier de ...  "
191,2015-03-31,La Croix,739mots,BOETON Marie|THOMASSET Flore,"Loi sur le renseignement, bientôt tous surveillés ?","    ...  Conseil de l'Europe, Nils Muiznieks, est sorti de sa réserve: le texte crée, selon lui,  « un  climat social dangereux au sein duquel chacun pourra être considéré comme un potentiel suspect ».  ...  "
192,2015-04-15,La Croix,1213mots,SOYEUX Marie,"REPORTAGE. A Novossibirsk, un festival de musique au coeur de la Sibérie","    ...  Chine), son dynamisme économique, ses pôles universitaires et de recherche, sa vie culturelle et... son  climat: l'air sec permettant de s'accommoder des températures hivernales pouvant descendre en deçà des  20 ...  "
193,2015-04-09,La Croix,1103mots,HOYEAU Céline,"En Martinique, l'eglise prend un coup de jeune","    Au rythme des percussions et des chants créoles, les choristes se balancent tandis que la foule frappe des mains. Endimanchés, pour certaines un voile de dentelle sur la tête, les catholiques ...  "
194,2015-04-29,La Croix,1230mots,LEPLATRE Simon,Fin de cycle pour l'économie chinoise,"    ...  rapport à l'année précédente, la plus forte baisse depuis 2009. Bonne nouvelle pour le  climat, mais moins pour l'économie: Pékin ne prévoyait pas de plafonnement de la consommation d'énergie ...  "
195,2015-04-30,La Croix,837mots,,COURRIER,"        ...  la pollution constatée. La réduction des émissions de CO2 n'a aucun impact direct sur la qualité de l'air, mais concerne le sujet du  climat, qui est un autre problème.  ...  "
196,2015-01-09,La Croix,589mots,CASTAGNET Mathieu,Une policière tuée et des lieux de culte dégradés,"    ...  n'y avait  « pas de lien établi avec l'attentat de  Charlie Hebdo  » . Dans ce  climat délétère, les appels des responsables politiques ou religieux à éviter les provocations n'ont pas suffi ...  "
197,2015-01-15,La Croix,334mots,,Le temps de l'action,"        ...  Le curé des Minguettes s'inquiète également d'une montée de l'antisémitisme. Dans ce  climat de forte tension, le polémiste Dieudonné a été placé en garde à vue pour apologie du ...  "
198,2015-02-05,La Croix,1164mots,BERLAND Lucile,Des consultations gratuites pour débarrasser les ados de leurs addictions,"    ...  Pour rassurer ses patients, Olivier Phan devance leurs angoisses dès leur arrivée et crée un  climat de confiance: «  Dès le départ, on fixe ensemble un cadre et des objectifs clairs. Je leur ...  "
199,2015-03-04,La Croix,521mots,FERRE Jean-Luc,"Barrage de Sivens, dernières tractations avant la décision","    ...  sur l'avenir du barrage de Sivens qui empoisonne depuis plus d'un an le  climat politique local. En fin de semaine dernière, le président (PS) du conseil général Thierry Carcenac a ...  "
200,2015-04-14,La Croix,789mots,THOMASSET Flore,"Jean-Jacques Urvoas, l'homme qui a porté le texte sur le renseignement","    ...  derrière son bureau. Fils d'un pharmacien de centre droit, élevé  « sur une terre au  climat politique tempéré » , il choisit le Parti socialiste après le lycée.  « En pensionnat, j'ai découvert un ...  "
201,2015-04-08,La Croix,594mots,BLANCHET Sylvie,Quand les parents refusent l'aide du Rased,"    ...  des motivations moins avouables. Elles surviennent en particulier volontiers lorsque les enfants grandissent dans un  climat violent, voire lorsqu'ils sont euxmêmes victimes de violence. Dans ce cas, ce que craignent ...  "
202,2015-03-18,La Croix,320mots,DURIEZ Julien,Superlatifs,"    ...  Bourget, où seront accueillis les participants à la prochaine conférence de l'ONU sur le  climat, du 30 novembre au 15 décembre prochain.  « La SeineSaintDenis est un territoire très stigmatisé ...  "
203,2015-03-20,La Croix,341mots,MIGLIORINI Robert,Propos de saison,    ...  son immersion dans un gang familial semant la terreur. Il ne faut pas s'étonner que certains téléspectateurs souhaitent changer de  climat médiatique. Et ainsi revenir à l'alternance des saisons.  ...  
204,2015-03-21,La Croix,227mots,,« Tous responsables de la Création » avec le CCFD-Terre solidaire,"        ...  nature et contribuer à la mobilisation du public, notamment catholique, dans la perspective de la conférence de l'ONU sur le  climat (COP21) qui se tiendra à Paris en décembre 2015 » .  ...  "
205,2015-03-21,La Croix,313mots,VIALARD Noémie,JARDINER. Les euphorbes de jardin,"    Oublions les euphorbes exotiques, qui dépassent parfois 5 m de haut ou se développent en coussins épineux, et contentonsnous des innombrables rustiques, capables d'habiter nos jardins avec opulence. Ravissants ...  "
206,2015-03-26,La Croix,309mots,GOUBERT Guillaume,Avancer plus vite,"    ... 'économie, notamment l'excès de réglementation ou l'usage médiocre des crédits de la formation professionnelle. Ce sera, peuton espérer, plus facile à réaliser dans un  climat empreint d'optimisme.  ...  "
207,2015-03-16,La Croix,866mots,LAMOUREUX Marine,Ces « lieux qui comptent »,"    ...  archaïque, poursuitil: des odeurs, des saveurs, les couleurs et les lumières des paysages, un  climat... «  Lorsqu'on revient à l'endroit où l'on a passé ses premières années, quelque chose ...  "
208,2015-03-30,La Croix,1101mots,LIEVEN Samuel|SENEZE Nicolas,"Entretien. Cardinal Gerhard Ludwig Müller, préfet de la Congrégation pour la doctrine de la foi : « La mission du [...]","    ...  universelle. La prochaine encyclique sur l'écologie va souligner cette responsabilité globale par rapport au  climat, à l'accès universel aux biens communs. N'estce pas là un discours proche de ...  "
209,2015-01-09,La Croix,268mots,CARASCO Aude,Dans la tête des bébés,"    ... t Notre avis.  Quel bonheur, dans le  climat actuel, de voir ces bambins, magnifiquement filmés, prendre autant de plaisir à découvrir la vie! Ce documentaire scientifique, très didactique et commenté avec beaucoup ...  "
210,2015-01-16,La Croix,21mots,,[Sur www.la-croix.com t La conférence...],"        Sur <a href=""https://www.lacroix.com"" target=""_blank""> www.lacroix.com t La conférence  climat a son logo t Le centre d'accueil des migrants de Calais a ouvert  ...  "
211,2015-01-22,La Croix,27mots,,Sur www.l,"        Sur <a href=""https://www.lacroix.com"" target=""_blank""> www.lacroix.com t Un concert mondial pour le  climat le 18 juin t Premiers temps forts du Fipa  ...  "
212,2015-01-29,La Croix,295mots,GIULIANI Emmanuelle,L'édition 2015 du baromètre réalisé par TNS Sofres pour La Croix se colore d'une tonalité toute particulière.,"    ... (2)  s'inscrit néanmoins dans une tendance observée depuis deux ans et un  « retournement du  climat »  depuis décembre qu'attestent d'autres indicateurs, souligne TNS Sofres. Il n'empêche, les médias doivent ...  "
213,2015-01-31,La Croix,717mots,JURGENSEN Geneviève,« Toute l'histoire de l'homme est là »,"    ... 'être évadés du ghetto. Survivre plusieurs hivers, sans la protection d'aucun adulte, dans un  climat comme celuilà, pieds nus dans la neige, en chantant de petites chansons tristes pour récolter ...  "
214,2015-02-20,La Croix,634mots,MEUNIER Marianne,L'antisémitisme s'aggrave en Europe,"    ...  que son appel visait  « seulement les juifs ayant tué des gens à Gaza » . Un tel  climat entraîne des réactions variées. En Allemagne, Benjamin Weinthal déplore la  « vacuité »  des prises de position des ...  "
215,2015-03-06,La Croix,231mots,,REPERES. Barrage de Sivens. Dix-huit mois d'occupation,        2004: Un plan de gestion des étiages prévoit de construire une retenue dans une zone parcourue par la rivière Tescou. 2017: Le conseil général du Tarn vote un premier projet de ...  
216,2015-02-19,La Croix,1232mots,BEVILACQUA Arnaud,"REPORTAGE. À Doha, les chrétiens prient ensemble, à l'écart","    ...  unité entre les communautés, notamment lors de la période de Noël.  « Pour les enfants, ce  climat est très profitable afin de s'ouvrir l'esprit,  affirme Christophe.  Ils peuvent se rendre compte ...  "
217,2015-04-01,La Croix,763mots,LEPLATRE Simon,La Chine ferme les centrales à charbon situées à Pékin,"    Le ciel de Pékin n'est pas encore bleu mais, après l'arrêt de deux centrales à charbon majeures, la capitale chinoise devrait un peu mieux respirer. Le weekend dernier ...  "
218,2015-03-13,La Croix,932mots,DE CHALUS Aglaé,L'affaire Petrobras attise le mécontentement au Brésil,"    ...  Il y a une réelle insatisfaction » , continue l'analyste. L'affaire Petrobras renforce donc ce  climat social déjà délétère et consolide le  « fort rejet du PT pour les Brésiliens qui se trouvaient ...  "
219,2015-03-28,La Croix,1082mots,REVOL Fabien,"Fabien Revol. Chaire Jean Bastaire, Université catholique de Lyon. Sauvegarde de la création et salut",    La création atelle besoin d'être sauvée ? La question se pose dans un contexte de crise écologique et de l'idée de « sauvegarde de la création » développée par les ...  
220,2015-03-30,La Croix,557mots,ROUDEN Céline,"VU D'AVANT. En 1992, le PS au plus bas","    ...  le reflux socialiste dans l'opinion » , souligne Pierre Bréchon. La mauvaise conjoncture économique et le  climat marqué par des « affaires » (sang contaminé, financement du PS, prêt sans intérêt consenti à Pierre Bérégovoy ...  "
221,2015-03-18,La Croix,174mots,,La presse jeune se mobilise sur l'énergie,"        À quelques mois de la conférence Paris  Climat 2015, les éditeurs de presse jeunesse Bayard et Milan (qui appartiennent au même groupe qui édite  La Croix ) ont décidé de sensibiliser les enfants ...  "
222,2015-04-17,La Croix,684mots,CESAR Nicolas,"A la prison de Mont-de-Marsan, de nouvelles relations de confiance","    ...  Varignon. Pour l'heure, seuls quinze personnes ont été exclues de l'expérimentation. Surtout,  « le  climat dans la prison n'a plus rien à voir. Nous sommes passés de relations de conflit ...  "
223,2015-01-12,La Croix,215mots,,La visite du pape en France plus probablement en 2016,"        ...  cette semaine. L'encyclique sortirait au plus tard  « avant l'été »,  en amont de la tenue à Paris, fin novembre et début décembre 2015, de la conférence intergouvernementale sur le  climat.  ...  "
224,2015-01-05,La Croix,792mots,DE KERMEL Eric,"« La Mémoire des champs ». Éric de Kermel, éditeur de « Terre sauvage »","    ...  mais aussi en Provence et en Corse. Il est né de l'alliance d'un  climat, d'un milieu propre à une géologie calcaire et d'une activité humaine. Sans hommes, pas ...  "
225,2015-01-09,La Croix,1344mots,CHARRIER Pascal|GORCE Bernard|PEIRON Denis,Alors que la police traquait les deux principaux suspects de l'attaque qui a fait douze morts mercredi contre « Charlie [...],"    ...  François Hollande, a été marquée par de nouvelles mobilisations un peu partout en France. Le  climat est resté tendu. En banlieue parisienne, une fusillade a fait une victime tandis que plusieurs lieux ...  "
226,2015-01-23,La Croix,1396mots,VERDIER Marie|JACOBI Thomas,La crise grecque est tapie dans les maisons,"    ...  cercle vicieux »,  s'inquiètetil. Certes, il fait beau...  « Bien sûr on profite du  climat. Mais je suis en colère quand j'entends dire que les Grecs sont paresseux »,  s'énerve ...  "
227,2015-01-21,La Croix,485mots,RASPIENGEAS Jean-Claude,Glissements progressifs d'une tragique manipulation,"    ...  Foxcatcher  est un film fascinant par sa beauté formelle, l'ambiance d'affrontement psychologique, le  climat ambigu de ce glissement progressif vers la chute. Après  Truman Capote  (2008) sur l'écrivain américain ...  "
228,2015-03-02,La Croix,935mots,QUENELLE Benjamin,Des milliers de Russes marchent pour l'opposant assassiné,"    ...  d'assassiner l'un des principaux leaders de l'opposition. Mais cela fait partie du  climat de peur que son régime s'efforce d'orchestrer »,  temporise Dmitri qui, manifestant modéré parmi d ...  "
229,2015-03-05,La Croix,1653mots,BEVILACQUA Arnaud|BIRCHEM Nathalie|FERNEY Jeanne|ROUDEN Céline,"JO ou Expo universelle, les termes du choix","    ...  Jeux réussis peuvent aussi, à l'instar du Mondial de football en 1998, instaurer un  climat de confiance dans le pays bénéfique pour l'économie en général. Tous ces arguments laissent de ...  "
230,2015-03-31,La Croix,133mots,JIRA Nathalie,BLOC-NOTES,"    ...  Paris I PanthéonSorbonne et élisabeth Lévy, fondatrice et directrice de la rédaction de  Causeur. Institut de France, 23, quai Conti, Paris 6e. Inscription obligatoire: 01.49.49.03.30. <a href=""https://www.institutthomasmore.org"" target=""_blank""> www.institutthomasmore.org  ...  "
231,2015-04-02,La Croix,544mots,DREYFUS Stéphane,"France Télévisions, l'autre présidence à remous","    ...  Reste qu'un tel afflux de candidatures peut paraître paradoxal si l'on considère le  climat social de France Télévisions. Certes moins tendu qu'à Radio France, il est ponctué de mouvements ...  "
232,2015-04-17,La Croix,89mots,HOYEAU Céline|PEILLON Antoine,La laïcité sous haute tension,"    ...  lois, les redéfinitions éclairées de la laïcité ont du mal à être entendues. Dans ce  climat de tension, «La Croix» se tourne vers une historienne et deux philosophes qui, bien que d ...  "
233,2015-04-03,La Croix,458mots,CASTAGNET Mathieu,Les écologistes se débattent en pleine tourmente,"    ...  Rossignol, proche de JeanVincent Placé. Tous les protagonistes s'accordent sur un point: le  climat interne n'a jamais été aussi délétère. Les tensions se sont déjà transmises au groupe à ...  "
234,2015-04-08,La Croix,546mots,BEVILACQUA Arnaud,"A Saint-Etienne, les finances du club sont au vert","    ... (65 millions d'euros de budget) de réduire sa masse salariale, une gageure dans un  climat pourtant fortement inflationniste. Grâce à leur politique rigoureuse, les Verts ont même dégagé des bénéfices: 1 ...  "
235,2015-04-30,La Croix,466mots,DELACLOCHE Laure,Confusion sur l'identité de 293 femmes libérées dans le nord-est du Nigeria,"    ...  2014 , rappelle Aymeric Elluin, d'Amnesty International.  Ces enlèvements sont un moyen d'instaurer un  climat de terreur et de contrôler la population. » Disposer de membres de la famille donne au groupe ...  "
236,2015-01-02,La Croix,356mots,QUINIO Dominique,Un brin d'humanité,"    ... 'humanité »,  qu'il voudrait voir écrite, à l'occasion du sommet de Paris sur le  climat, à la fin de l'année. Ces « droits de l'humanité » ainsi évoqués aurontils une ...  "
