,date,publication,words,author,title,intro
237,2015-01-30,La Croix,799mots,DE BOISSIEU Laurent,Une élection législative partielle aux multiples enjeux dans le Doubs,"    ...  que nous chérissons » , a lancé le premier ministre. Car le PS espère bien bénéficier du  climat d'unité nationale et de la hausse de la cote de popularité de François Hollande et ...  "
238,2015-03-09,La Croix,442mots,QUINIO Dominique,"Violence, violences","    ...  culte, dans les gares et les aéroports, patrouillent des hommes armés, policiers ou militaires. Ce  climat, dont ceux qui ont la charge de la sécurité de leurs concitoyens ne sont pas responsables ...  "
239,2015-03-19,La Croix,184mots,,Médias. Appels à la grève dans l'audiovisuel public,"        Le  climat social se dégrade dans l'audiovisuel public sur fond de restrictions budgétaires.  Quatre syndicats de France Télévisions (CFDT, CGT, SNJ, FO) ont appelé à la grève aujourd'hui pour dénoncer ...  "
240,2015-04-21,La Croix,315mots,Jean de Bodman (Paris),La responsabilité des entreprises,"    ...  formes variées, un appel à la responsabilité des « entreprises »,  pour que cellesci  dans le  climat économique général un peu meilleur (pétrole, euro...) que nous connaissons  aient une vision plus positive de ...  "
241,2015-04-07,La Croix,212mots,,Mathieu Gallet présente demain son plan stratégique,"        ...  son plan stratégique, à l'occasion d'un Comité central d'entreprise extraordinaire. Dans un  climat de défiance, après qu'une motion de censure a été votée contre lui, vendredi dernier, lors ...  "
242,2015-04-23,La Croix,1197mots,CLISSON Michel,La mémoire niée du camp de concentration de Flossenbürg,"    ...  comme étant  « le fils de Maurice »,  je me sens très à l'aise dans ce  climat amical très spontané. Ce moment de témoignage me permet aussi de connaître ce qu'a été ...  "
