,date,publication,words,author,title,intro
0,2017-01-20,Le Monde,1704mots,Stéphane Foucart,Le premier président vert,"    ...  du se­crétaire d'Etat américain paraphant, le 22 avril 2016, l'accord sur le  climat conclu quelques mois plus tôt à Paris qui résumera l'action du président Obama en faveur ...  "
1,2017-02-08,Le Monde,1069mots,Collectif,"Sur le climat, les décideurs politiques doivent aussi dénoncer le discours de la « post-vérité » !","    Chercheurs en science du  climat et de ses impacts, nous sommes inquiets de la multiplication des prises de position qui témoignent d'un affaiblissement du pacte entre scientifiques et décideurs politiques. Depuis ...  "
2,2017-04-21,Le Monde,968mots,Propos recueillis par David Stoleru,Michael Mann : « Donald Trump met les sciences en péril »,    ...  Michael Mann est un éminent climatologue américain. Il a démontré qu'un rapide réchauffement du  climat avait débuté dès les années 1950. Ses travaux font référence et lui valent d'être la ...  
3,2017-01-07,Le Monde,1017mots,Stéphane Foucart,Climat : le réchauffement ne s'est pas arrêté en 1998,"    ...  fameuse  « pause du réchauffement »,  entre 1998 et 2012, était surtout le fait d'un biais de mesure, plutôt que d'un ralentissement substantiel de la cadence du changement  climatique en cours.  ...  "
4,2017-03-22,Le Monde,925mots,Stéphane Foucart,Climat : la planète entre en « territoire inconnu »,"    ... Toutes les institutions dévolues à l'observation du  climat l'ont déjà affirmé, avec leurs chiffres, en ordre dispersé; l'Organisation météorologique mondiale (OMM) le confirme. Selon le dernier bilan  climatique annuel ...  "
5,2017-03-30,Le Monde,1005mots,Gilles Paris,Donald Trump enterre le plan climat d'Obama,    ... 'essentiel de la réglementation mise en place par son prédécesseur pour lutter contre le réchauffement  climatique. Ce thème a d'ailleurs disparu des discours présidentiels depuis l'arrivée à la Maison Blanche ...  
6,2017-02-09,Le Monde,1220mots,Par et,"Donald Trump, champion du capitalisme fossile","    ...  d'année en année, sont de plus en plus accessibles sous l'effet du changement  climatique et de la fonte des glaces, sont aussi extrêmement attractives pour les entreprises américaines : en 2012 ...  "
7,2017-03-14,Le Monde,1222mots,Pierre Le Hir,Climat : Paris vise la « neutralité carbone » en 2050,"    ...  ressembler la Ville Lumière au milieu du siècle, si elle se conforme au futur plan  climat qui doit être soumis, à partir de l'automne, à ses élus. Le document est encore ...  "
8,2017-03-21,Le Monde,1111mots,Pierre Le Hir Pierre Le Hir,Climat et réactions en chêne,"    ...  prenant en compte deux des scénarios du Groupe d'experts intergouvernemental sur l'évolution du  climat (GIEC). Le premier scénario conduit à une hausse modérée du thermomètre, de 1,8 °C d ...  "
9,2017-02-14,Le Monde,749mots,Rémi Barroux,"Le CETA, un accord commercial à haut risque climatique","    ...  Economic and Trade Agreement), estil compatible avec les objectifs de lutte contre le réchauffement  climatique? Oui, à la condition que nombre de recommandations soient encore prises en compte, indique un rapport ...  "
10,2017-01-14,Le Monde,752mots,Par Lucile Schmid,l'inaction Écologique a un coût,"    ...  rendu de plus de 700 pages sur les conséquences économiques à long terme du changement  climatique. Financé par le gouvernement du RoyaumeUni, le rapport Stern (« Stern Review on the Economics of ...  "
11,2017-03-28,Le Monde,1058mots,Pierre Le Hir,"La forêt, nouvel enjeu de la politique climatique de l'Europe","    Mieux protéger les forêts, en confortant la politique  climatique de l'Union européenne (UE), ou au contraire les exploiter davantage? La question est au coeur des négociations entre la Commission de Bruxelles ...  "
12,2017-04-19,Le Monde,2531mots,"Corine Lesnes (San Francisco, correspondante), Pierre Barthélémy et David Larousserie",Des chercheurs entrent en résistance,"    ... ­météo, à préparer les populations aux catastrophes naturelles (ouragans, pollutions...), à les protéger du changement climatique ou à assurer la qualité de l'air et de l'eau »  , rappelle Eric Rignot, un ...  "
13,2017-02-08,Le Monde,2555mots,"Nathaniel Herzberg Nathaniel Herzberg, (Au Col du Lautaret (Hautes-Alpes), ­et à Grenoble (Isère))",Les avalanches détraquées par le climat,"    ...  Notre connaissance avance. Et les conditions ne sont plus les mêmes, notamment avec le changement  climatique. » Mettre la science au service de la sécurité des personnes et des biens. Apprendre à toujours ...  "
14,2017-02-21,Le Monde,944mots,par Stéphane Foucart,"Trump, les pieds dans l'eau","    ...  peut donc sembler paradoxal que le président américain fasse si peu de cas du dérèglement  climatique, jusqu'à nier son existence même. En réalité, il est tout à fait avisé du problème ...  "
15,2017-01-30,Le Monde,1216mots,Stéphane Foucart,Les scientifiques américains entrent en résistance,"    ...  entrés  « en résistance »  . Le 24 janvier, la découverte que des Tweet anodins sur le changement  climatique, émis par le compte du parc national des ­Badlands (Dakota du Sud), avaient été effacés a ...  "
16,2017-03-28,Le Monde,943mots,Simon Roger,Ségolène Royal convoite une agence de l'ONU,"    ...  précisé ses intentions, jeudi 23 mars, à l'issue d'une réunion sur le changement  climatique et le développement durable, au siège newyorkais de l'ONU.  « C'est une candidature dans ...  "
17,2017-01-25,Le Monde,154mots,,"L'homme, et non le climat, a eu raison de la mégafaune australienne","        ...  plus de 50 kilos avaient disparu. Leur ­extinction a longtemps été ­attribuée à un changement  climatique, mais une étude ­relève la responsabilité de l'homme, ­arrivé il y a 45 000 ans ...  "
18,2017-04-01,Le Monde,560mots,,Climat : Trump désavoué par le marché,"        ...  28 mars, en annonçant le début du démantèlement du plan de lutte contre le réchauffement  climatique mis en place par son prédécesseur à la Maison Blanche, Barack Obama. Même si la mesure ...  "
19,2017-02-21,Le Monde,1177mots,Bruno Meyerfeld,Les Seychelles veulent faire de l'océan un atout,"    ...  petits Etats insulaires en développement dépendants aussi de leur océan et menacés par le changement  climatique, comme Maurice, les îles Marshall, la Grenade, la Jamaïque et Cuba. Pour financer leur vaste réserve ...  "
20,2017-04-12,Le Monde,47mots,,Pas d'accord au G7 sur le changement climatique,"        ...  sont pas parvenus à se mettre d'accord sur une déclaration commune sur le changement  climatique, lors d'une réunion, lundi 10 avril à Rome, en raison du blocage des EtatsUnis ...  "
21,2017-03-14,Le Monde,655mots,Caroline Taïx,"A Sydney, l'été 2017 le plus chaud jamais enregistré","    ... ,9 degrés. « C'est du charbon » Des scientifiques relient directement cette météo exceptionnelle au changement  climatique.  « Nous avons au moins cinquante fois plus de chances de connaître cette chaleur extrême dans le ...  "
22,2017-04-25,Le Monde,979mots,Stéphane Lauer,Les scientifiques marchent contre Donald Trump,"    ...  contestées au sein de l'agence de protection de l'environnement et du ministère de l'énergie, mépris affiché pour la lutte contre le réchauffement  climatique... les griefs ne manquent pas.  ...  "
23,2017-03-31,Le Monde,982mots,Laurence Caramel,Quatre pays minés par les conflits et l'insécurité,"    ...  Pourtant, dans la plupart des pays où hommes et femmes luttent contre la faim, le  climat apparaît comme une cause secondaire. Dans les pays du Sahel, la récolte de céréales a par ...  "
24,2017-03-30,Le Monde,520mots,"Brice Pedroletti (Pékin, correspondant)","A Pékin, investissements en hausse, émissions en baisse","    ...  devant les EtatsUnis  un rôle moteur, et modèle, dans la bataille contre le réchauffement  climatique et la course aux énergies renouvelables. Mais en prétendant préserver l'emploi aux EtatsUnis, elle ...  "
25,2017-02-17,Le Monde,842mots,,"Le 22 avril, marchons pour défendre les sciences","        ...  favorisant les grands lobbys industriels ou religieux sur des sujets aussi divers que le changement  climatique, la vaccination, l'économie, le port d'arme, l'interruption de grossesse, les mouvements migratoires ou ...  "
26,2017-04-21,Le Monde,245mots,Camille Labro,Les livres,"    ... Manger pour sauver la planète ? Changer le  climat par nos assiettes ? Réduire son empreinte carbone à coups de fourchette ? C'est possible, et le monde de la gastronomie s'éveille à la ...  "
27,2017-02-16,Le Monde,808mots,,"Les "" faits alternatifs "" de la politique économique de Trump","        ... L'exemple le plus évident est le changement  climatique. Une écrasante majorité des scientifiques conviennent que le  climat est en train de changer  et que l'activité humaine, y compris les émissions ...  "
28,2017-03-24,Le Monde,950mots,par Jacques Treiner,Le nucléaire n'est pas incompatible avec la transition énergétique,"    ... 'efficacité énergétique. Tout candidat à la présidentielle devrait motiver ses propositions sur l'articulation énergieclimat. Peser l'alternative entre nucléaire et renouvelables, c'est peser l'alternative entre la gestion de ...  "
29,2017-04-01,Le Monde,144mots,,Décision sur l'accord climat d'ici à fin mai,"        La position américaine sur l'accord de Paris sur le  climat sera ­dévoilée d'ici à la fin mai, a annoncé la Maison Blanche jeudi 30 mars.  « Nous sommes en train d ...  "
30,2017-02-16,Le Monde,935mots,,L'Europe réforme son marché carbone,"        ...  lutte contre le réchauffement, pour être en phase avec l'accord de Paris sur le  climat issu de la COP21. La toile de fond est connue. L'UE est le troisième plus ...  "
31,2017-02-03,Le Monde,1332mots,Propos recueillis par Marie de Vergès et Marie Charrel,Joseph Stiglitz : « Les perdants de la mondialisation seront les premières victimes de Trump »,    ...  parler du ­financement de la transition énergétique. Mais les républicains ne croient pas au changement  climatique... G. G. : Un grand programme d'investissement en faveur de la transition écologique est pourtant une ...  
32,2017-01-14,Le Monde,1311mots,Elvire Camus,"Au pic Saint-Loup, le bonheur est dans l'AOC","    ...  chose que du vin de table avec ce terroir »,  territoire de garrigues, sols calcaires, et  climat à la fois continental et méditerranéen. Peu à peu, les agriculteurs parviennent à produire un vin ...  "
33,2017-04-04,Le Monde,879mots,par Stéphane Foucart,La guérilla des archivistes,"    ...  heures qui ont suivi l'investiture de Donald Trump, des déclarations officielles sur le changement  climatique anthropique ont disparu de sites gouvernementaux, dont celui de la Maison blanche et de l'Agence ...  "
34,2017-02-20,Le Monde,1023mots,Sandrine Morel,Madrid entame sa révolution urbaine,"    ...  peu sensible à l'écologie, au point de nier l'influence humaine dans le réchauffement  climatique ou de mettre en doute les niveaux de contamination de la ville. L'arrivée d'Ahora ...  "
35,2017-04-22,Le Monde,529mots,Damien Leloup,Le pouvoir et la licorne magique,"    Imagineton, en France, un candidat à la présidentielle niant la réalité du réchauffement  climatique? Le scandale serait immédiat. A droite comme à gauche, et malgré quelques allusions fleurant ici ou ...  "
36,2017-04-27,Le Monde,562mots,Rémi Barroux,Axa interpellé sur ses investissements dans le charbon,"    ...  continue d'investir dans des entreprises qui parient contre l'accord de Paris sur le  climat [adopté en décembre 2015] et ses objectifs en construisant de nouvelles centrales à charbon... », dénonce Lucie ...  "
37,2017-01-07,Le Monde,1310mots,,En bref,"        ... 'y aura plus de ski à Borée "" , constate Laurent Chanut, le maire du village. Réchauffement  climatique oblige, il ne tombe plus assez de neige sur les pentes du mont Mézenc. Et le ...  "
38,2017-03-23,Le Monde,679mots,M. V.,Les forêts boréales disparaissent,"    ...  pour leur capacité à stocker des grandes quantités de carbone et leur résistance au changement  climatique supérieure aux autres types de milieux forestiers, les forêts du Grand Nord subissent des coupes claires ...  "
39,2017-03-10,Le Monde,778mots,Gilles Paris,Trump s'attaque au bilan d'Obama sur l'environnement,"    ...  remise en cause complète du bilan de Barack Obama : l'accord de Paris sur le  climat, qui engage les EtatsUnis à réduire considérablement leurs émissions de gaz à effet de serre ...  "
40,2017-01-17,Le Monde,519mots,Sandrine Morel,"A Lanzarote, invitation à une plongée dans l'art",    ...  c'est aussi une façon de traiter de questions d'actualité comme celles du changement  climatique ou du drame des migrants. Sa sculpture baptisée  Le Radeau de Lampedusa  est ainsi une sorte ...  
41,2017-03-04,Le Monde,975mots,par Pascal Canfin,Pour un nouveau pacte agricole,"    ...  certains sols français sont considérés par les scientifiques comme tout simplement morts. Et le dérèglement  climatique en cours ne fera qu'aggraver l'inadaptation profonde de l'agriculture industrielle, fortement consommatrice d ...  "
42,2017-03-31,Le Monde,1002mots,Valérie Cabanes,La Terre doit être une personne juridiquement protégée Faut-il accorder un droit à la nature?,"    ...  naturels en occupant l'espace et en perturbant les équilibres de l'écosystème terrestre. Le  climat s'est emballé, la biodiversité s'est effondrée, la pollution est omniprésente, et les conditions mêmes ...  "
43,2017-02-03,Le Monde,818mots,Audrey Garric,"Les mystérieux canyons sous-marins, trésors en péril","    ...  nombreux, au premier plan desquels la contribution au fonctionnement des pêcheries et la régulation du  climat. Mais ces zones, pourtant difficiles d'accès, sont de plus en plus exploitées et menacées par ...  "
44,2017-02-28,Le Monde,642mots,par édouard martin,Non aux quotas gratuits de CO 2 pour les industriels,"    ... 'accord de Paris en décembre 2015, oubliée la préservation de la planète et le réchauffement  climatique : les lobbyistes sont ­passés par là et obligent la classe politique à ­regarder ailleurs. Après le ...  "
45,2017-04-26,Le Monde,756mots,P. L. H.,Climat : réduire de moitié les émissions de CO2 en 2040 est possible,"    ...  ses membres l'ancien viceprésident américain Al Gore, veut réconcilier développement économique et action  climatique. C'est dans ce cadre qu'il publie, mardi 25 avril, un rapport de 120 pages ...  "
46,2017-02-28,Le Monde,561mots,,La famine menace une nouvelle fois l'Afrique de l'Est,"        ...  qu'en pensent les EtatsUnis de Donald Trump  en plein négationnisme scientifique , le réchauffement  climatique frappe l'Afrique en première ligne. Et plus durement qu'ailleurs.  « Les sécheresses y seront nombreuses ...  "
47,2017-03-14,Le Monde,781mots,Charles A. KupcHan,"La défense, clé d'une entente entre Merkel et Trump","    ... 'immigration, le commerce international, la Russie, l'accord nucléaire avec l'Iran et le changement  climatique. Les sources de ces divergences sont profondes. Trump se plaît à ébranler l'establishment, à déstabiliser ...  "
48,2017-04-01,Le Monde,916mots,Isabelle Mandraud,La Russie place ses pions dans l'Arctique,"    ...  Niinisto insistait sur la  « menace grave »  que fait peser sur l'Arctique le chan­gement  climatique, Vladimir Poutine a paru balayer l'impact de l'homme sur la question. « Le réchauffement a ...  "
49,2017-01-14,Le Monde,688mots,Par Dominique Bourg,Une « assemblée du long terme » face aux défis environnementaux,"    ...  et à taux zéro, pour les ­investissements de long terme comme l'adaptation au changement  climatique. Si un projet de loi entre en contra­diction avec ces deux principes, l'assemblée du ...  "
50,2017-03-22,Le Monde,1285mots,,« Quel président voulez-vous être? »,"        ...  président écologiste, dont on a besoin pour relever les défis de notre époque, le défi  climatique et le danger qui pèse sur l'écosystème. Donc nous sortirons du nucléaire, donc nous passerons ...  "
51,2017-02-13,Le Monde,874mots,Audrey Garric,Les manchots d'Afrique australe victimes d'un piège écologique,"    ...  manchots en ­Afrique; ensuite, pour les autres, qu'ils sont gravement menacés par le changement  climatique et la surpêche. Les jeunes individus, faute de comprendre les transformations que subissent les océans sous ...  "
52,2017-03-31,Le Monde,1201mots,Propos recueillis par P. ES. et V. GR.,Patrick Pouyanné : « Trump ne pourra pas sortir du traité de Paris »,"    ... Trump, le  climat et le charbon aux EtatsUnis « Aujourd'hui, toute l'Europe est mobilisée contre Donald Trump sur le  climat. Mais ce n'est pas le bon sujet car il ...  "
53,2017-03-30,Le Monde,369mots,,Arracher pour mieux replanter,"        ...  des tendances longues "". Ecologiste dans l'âme, le scientifique ne nie pas que  "" le changement  climatique pose un vrai problème ""  pour le vin et ce qu'il deviendra à long terme. Mais ...  "
54,2017-01-13,Le Monde,686mots,Paul Magnette,L'Europe doit inventer une nouvelle mondialisation,"    ...  capacité de négociation de l'Union, mais les accords internationaux de lutte contre le réchauffement  climatique démontrent l'inverse. Objets de vastes délibérations ouvertes, ces accords ont été négociés dans un délai ...  "
55,2017-04-14,Le Monde,565mots,propos recueillis par C.La.,Rob Hopkins : « Jardiner et faire à manger nous reconnecte à notre humanité »,"    ...  Un jour, cela m'est tombé dessus, j'ai réalisé ce que signifiait le changement  climatique. Ce fut un profond bouleversement intérieur. En comprenant qu'il fallait, dès à présent, laisser 80 ...  "
56,2017-01-24,Le Monde,744mots,Par ALEXANDRA DE HOOP SCHEFFER et MARTIN QUENCEZ,"Avec Donald Trump, la fin de la grande stratégie américaine","    ...  risque est alors de privilégier les accords bilatéraux quand les grands enjeux du siècle (réchauffement  climatique, prolifération nucléaire, migration, Etats faillis) nécessitent au contraire des approches multilatérales et une vision stratégique cohérente ...  "
57,2017-04-10,Le Monde,479mots,,King Coal n'a pas encore perdu sa couronne,"        ...  pour lui demander de respecter les accords de Paris sur la lutte contre le réchauffement  climatique. Colin Marshall écrit que sa société  "" ne veut pas ignorer les deux tiers des Américains qui ...  "
58,2017-04-22,Le Monde,825mots,Marie de Vergès,FMI et Banque mondiale face à l' « America first »,"    ...  au sein de la Banque mondiale, qui a fait de la lutte contre le changement  climatique un pilier de son action : le scepticisme proféré par M. Trump quant à la réalité même ...  "
59,2017-02-20,Le Monde,608mots,Ophélie Neiman,Les clés du château,"    ...  ses nombreux climats. Ah oui : ne dites pas à un producteur bourguignon que seul le  climat semicontinental s'applique chez lui, il pourrait vous écarteler. En vérité, la Bourgogne en compte ...  "
60,2017-03-01,Le Monde,494mots,D. Dq,Un Refuge pour les données en danger,"    ...  la volonté affichée par Donald Trump et son entourage de casser les lois de protection de l'environnement et du  climat mises en place par les administrations Clinton et, surtout, Obama.  ...  "
61,2017-01-26,Le Monde,725mots,G. P.,Deux projets d'oléoducs controversés sont relancés,"    ...  une première tentative de ciblage des employés de l'agence ayant travaillé sur la question  climatique ou sur les énergies renouvelables, ces mesures restrictives ont été immédiatement défiées par le compte Twitter ...  "
62,2017-02-28,Le Monde,1025mots,Bruno Meyerfeld,La famine menace de nouveau l'Afrique de l'Est,"    ...  abattant les dernières têtes de bétail et fragilisant les communautés locales. En plus du réchauffement  climatique, qui frappe le continent plus durement que le reste du monde, l'Afrique de l'Est ...  "
63,2017-02-01,Le Monde,896mots,Martine Valo,Les parlementaires tentent de remodeler la loi littoral,"    ...  en deuxième lecture la proposition de loi sur  « l'adaptation des territoires littoraux au changement  climatique »,  initialement déposée par les députés socialistes Chantal Berthelot (Guyane), Pascale Got (Gironde) et Bruno Le Roux ...  "
64,2017-03-14,Le Monde,142mots,,Pas de sortie des énergies fossiles,"        Le Réseau Action  Climat  « salue le rôle moteur de Paris avec cette démarche prospective autour d'un objectif ambitieux pour 2050, qui montre l'ampleur des changements à venir pour respecter ­l ...  "
65,2017-03-28,Le Monde,825mots,,Le pari ambitieux de l'émergence en Côte d'Ivoire,"        ...  mondialisation industrielle, comme l'Ethiopie avec le textile. "" Pour cela, il faudra vraiment améliorer le  climat des affaires "" , insiste un expert étranger basé à Abidjan. Le pays s'enorgueillit d'avoir gagné ...  "
66,2017-04-24,Le Monde,1768mots,,A la paix comme à la guerre,"        ...  la DDay Race réunit quelque 4 000 néoguerriers survoltés et s'inscrit dans un  climat de remilitarisation, où l'esprit de corps, les plongeons dans la boue et l'imprimé camouflage ...  "
67,2017-01-13,Le Monde,1175mots,Martine Valo,Le littoral français recule de manière accélérée,"    ...  première lecture, d'une proposition de loi sur  « l'adaptation des territoires littoraux au changement  climatique »  . Ce texte, initialement déposé par les députés socialistes Chantal Berthelot (Guyane) et Pascale Got (Gironde), ainsi ...  "
68,2017-03-07,Le Monde,921mots,Patricia Jolly,"Les enfants, premières victimes de la pollution","    ...  tels que l'exposition aux polluants, aux déchets électriques et électroniques, ainsi qu'au changement  climatique. Il note que la toxicité des produits chimiques d'usage courant n'est pas toujours comprise ...  "
69,2017-01-04,Le Monde,860mots,propos recueillis par S. Ca. et N. H.,Jean-François Toussaint « la survie de notre espèce est en jeu »,    ...  croissance et le développement font apparaître à retardement des effets secondaires. Les conséquences du réchauffement  climatique sur la santé commencent à peine à se faire sentir : les canicules provoquent des décès chez ...  
70,2017-03-14,Le Monde,988mots,Clémentine Thiberge,"Ecologie : aux actes, citoyens!","    ...  de peinture, bouteilles de whitespirit...). Les rapports alarmistes sur les conséquences directes du changement  climatique ont beau se multiplier, la mobilisation citoyenne reste marginale.  « Les gens sont au courant aujourd'hui ...  "
71,2017-04-14,Le Monde,756mots,Marie de Vergès,"L'économie turque, entre défiance et résilience","    ...  marché de 75 millions d'habitants, une situation géographique stratégique, des institutions modernisées et un  climat des affaires assaini sous la houlette d'un président réputé pour son pragmatisme.  « Ces taux de ...  "
72,2017-02-22,Le Monde,679mots,,"Le réalisateur Lucas Belvaux monte au front politique, mais y perd son cinéma","        ...  des personnalités publiques qu'à mettre en évidence une certaine "" logique d'appareil "" et le  climat délétère que celleci instaure dans le corps social. Logique, tout d'abord, d'une vaste ...  "
73,2017-02-03,Le Monde,610mots,Bastien Bonnefous et Solenn de Royer,Quand les socialistes se remettent à y croire,"    ...  droite. Hamon peut devenir président de la République »,  renchérit un proche du président. « Un tel  climat profitera à Le Pen » Alors que la gauche semblait inévitablement éliminée en avril prochain, la possibilité ...  "
74,2017-04-12,Le Monde,1304mots,Anne-Françoise Hivert,"A Oslo, un horizon sans voitures ni carbone","    ...  de l'adjointe à l'environnement.  Mais si on veut que l'accord sur le  climat de Paris devienne une réalité, on n'a plus le choix. »  Avec ses presque 700 000 ...  "
75,2017-03-31,Le Monde,1838mots,Bruno Meyerfeld,"Au Somaliland, mortelle sécheresse","    ...  somalienne et qui survivait tant bien que mal à la mondialisation. Mais le changement de  climat a signé la fin des illusions.  « Pour nous, le nomadisme, c'est terminé,  se jure Abokor ...  "
76,2017-01-27,Le Monde,543mots,"Jérôme Marin (San Francisco, correspondance)",Les « FANG » propulsent le Nasdaq vers de nouveaux sommets,"    ...  par le dépôt d'une plainte par Apple, l'un de ses principaux clients. Le  climat s'est apaisé En novembre 2016, le sentiment autour des entreprises hightech était bien moins ...  "
77,2017-01-27,Le Monde,789mots,par Audrey Tonnelier,"2017, année politique","    ...  de 107 400 personnes ( 3 %) en métropole. Reste à savoir ce que réserve 2017. Le  climat des affaires s'est légèrement dégradé en janvier en France, après la nette amélioration de décembre ...  "
78,2017-02-25,Le Monde,1644mots,Henri Seckel,L'empereur du tennis français,"    ...  à la minute où Giudicelli est entré en fonction.  « Vous ne pouvez pas imaginer le  climat de peur , témoigne Dartevelle.  Là, il ne va pas en virer d'autres, mais il a ...  "
79,2017-02-04,Le Monde,700mots,Matthieu Goar,"François Fillon « Je me sens comme un homme attaqué, mais prêt à se défendre »","    ...  beaucoup plus profonde. De retour de leur circonscription, les parlementaires ont été refroidis par le  climat de défiance visàvis de leur candidat. Un  climat qui ne va pas s'améliorer ...  "
