,date,publication,words,author,title,intro
324,2017-01-06,Le Monde,863mots,JP Géné,On dégoupille la grenade,"    ...  flot des migrants végétaux, attirés par les lumières de l'Occident et la douceur du  climat méditerranéen. Chargé des mystères de l'Orient, réputé pour ses vertus médicinales, il s'est enrichi ...  "
325,2017-02-02,Le Monde,799mots,Cécile Chambraud,Les actes antimusulmans ont fortement reculé en 2016,"    ...  de signalement »  de radicalisation de la part de certains professionnels, au point  « d'installer un  climat de suspicion généralisée »  dont témoignerait par ailleurs le  « phénomène de délation qui ne cesse de s ...  "
326,2017-02-02,Le Monde,771mots,Marc Semo et Thomas Wieder (à Berlin),Les purges menées par Erdogan aggravent le malaise entre l'UE et la Turquie,"    ...  l'arrestation et instaurant une commission de recours pour les fonctionnaires limogés. Dans un tel  climat, la visite de la chancelière suscite de nombreuses critiques et interrogations.  « Pourquoi maintenant? »  , titre par exemple ...  "
327,2017-01-30,Le Monde,149mots,,Deux minutes trente avant l'apocalypse,"        ... 'heure de minuit. Cette fois, c'est devant les déclarations de Donald Trump sur le  climat ou la prolifération nucléaire, que le Bulletin est passé de trois minutes à deux minutes trente ...  "
328,2017-01-30,Le Monde,435mots,S. Fo.,La montée des eaux met en péril la Côte est,    ... 'environ un mètre  ce que prévoit le Groupe d'experts intergouvernemental sur l'évolution du  climat pour 2100 dans le cas d'une poursuite des émissions de gaz à effet de serre ...  
329,2017-02-27,Le Monde,947mots,Sylvia Zappi,Dur d'être macroniste en terre de gauche,"    ...  qui s'en mettent plein les poches »  . La sortie du supermarché n'offre pas un  climat plus favorable.  « Surtout pas lui, on sait pas s'il est à droite ou à gauche ...  "
330,2017-03-01,Le Monde,850mots,Stéphane Foucart,Réduire les pesticides n'altère pas les rendements,"    ...  d'intrants chimiques et les rendements d'exploitations voisines, produisant la même culture sous un  climat identique. Ils en ont ainsi déduit la relation  faible à inexistante dans la majorité des cas ...  "
331,2017-03-02,Le Monde,768mots,Luc Leroux,Policier tué à Vitrolles : les braqueurs qui avaient fait feu jugés aux assises,"    ...  pouvez comprendre que j'ai peur pour ma famille. »  Selon le juge d'instruction,  « ce  climat de peur semblait, après les faits, affecter la communauté »  des gens du voyage dont les accusés ...  "
332,2017-02-28,Le Monde,784mots,Propos recueillis par De. C.,Patrick Artus : « La France taxe plus les revenus du capital que ceux du travail »,"    ... 'environnement, des intérêts des salariés, des clients, des fournisseurs, des collectivités. Regardez les questions de  climat. De nombreux groupes, comme SaintGobain, s'appliquent en interne un prix du carbone, alors que ...  "
333,2017-03-07,Le Monde,700mots,Jérôme Marin,Uber utilisait un logiciel secret pour berner la police,"    ...  Le mois dernier, une ancienne employée l'a accusée d'avoir laissé s'installer un  climat sexiste et d'avoir systématiquement ignoré ses plaintes pour harcèlement sexuel. Une enquête interne a été ...  "
334,2017-03-15,Le Monde,1010mots,Ali Bayramoglu,Turcs et Européens sont responsables de la crise diplomatique,    ...  turc interdits de séjour aux PaysBas? Ce comportement ne contribuetil pas au  climat politique que le leader populiste Geert Wilders cherche à répandre dans son propre pays avant le ...  
335,2017-03-11,Le Monde,596mots,,rue des Casseroles,"        ...  entre autres, ces manifestations, François Fillon a reproché au gouvernement de laisser  "" se développer un  climat de quasiguerre civile "".  Ce type de protestation sonore, pourtant, n'est ni violent ni très ...  "
336,2017-03-31,Le Monde,1019mots,Propos recueillis par Marie Maurisse et Harold Thibault,Chito Gascon : « Duterte ne respecte ni les droits de l'homme ni la Constitution »,"    ...  cas des usagers ou des vendeurs de drogue, mais il y a aussi ensuite un  climat de peur, une crainte des représailles. Dans certains cas, les tueurs reviennent sur zone et n ...  "
337,2017-03-31,Le Monde,691mots,Éric Béziat,Paris va noter les voitures selon leur degré de pollution,    Le projet porte le joli nom d' « Air'volution . Et il constitue un pas sup­plémentaire dans la volonté des pouvoirs publics du monde entier de faire reculer la pollution automobile ...  
338,2017-04-07,Le Monde,810mots,Florence Bouchy,"Mostar, de père en fille",    ...  histoire d'amour aussi fusionnelle entre une ville et ses habitants. Estce dû au  climat enchanteur? A la lumière qui semble irradier des êtres et des choses? Ou encore à la ...  
339,2017-04-29,Le Monde,485mots,Philippe Escande,"Europe en hausse, Amérique en baisse","    ...  pour le client et détestable pour le vendeur. De plus, comme Ford le souligne, ce  climat plus mitigé s'accompagne d'une hausse du coût des matières premières et des frais de ...  "
340,2017-01-07,Le Monde,111mots,,La SNCF devrait afficher un résultat financier positif pour 2016,"        ...  qui ont touché la France ( 400 millions d'euros sur l'activité), des grèves ( 250 millions d'euros), des mauvaises récoltes céréalières ( 50 millions d'euros) et du  climat économique général.  ...  "
341,2017-01-18,Le Monde,977mots,G. P.,Six formules pour une politique étrangère,"    ...  à prendre sa part du fardeau mondial par M. Obama, sur l'Iran ou le  climat. En septembre 2016, Barack Obama a convenu qu'un  « pilier central »  manquait à son projet : la ...  "
342,2017-01-18,Le Monde,607mots,N. Pi.,un label hôpitaux « aimants »,"    ...  Le management participatif, lui, les place en capacité d'agir sur leur travail. Quant au  climat relationnel entre les médecins et les soignants, il doit permettre une collégialité dans la prise de ...  "
343,2017-01-17,Le Monde,1057mots,Jean-Michel Bezat,Transitions sous haute tension chez Engie,"    ...  activités gazières, coeur de métier historique de l'exGDF Suez. « C'est vrai, le  climat n'est pas bon »,  reconnaît un cadre de la multinationale aux 150 000 salariés et aux ...  "
344,2017-01-20,Le Monde,611mots,Macha Séry,Elle avait un coeur d'hirondelle,"    ...  à une écriture vibrante. Acuité aux bruits, ­sensibilité aux couleurs, attention à la ­lumière, au  climat... Comme si, dans leurs univers romanesques, tout conspirait, par osmose ou contraste, à produire ­l'essence ...  "
345,2017-01-31,Le Monde,576mots,Alexis Delcambre et Alexandre Piquard,Europe 1 : Arnaud Lagardère veut agir,"    ...  reçus des équipes d'Europe 1 qui témoignent de leur angoisse »  et  « sait combien le  climat est lourd et incertain en interne »  . Mais audelà, l'actionnaire estil disposé à réinvestir ...  "
346,2017-02-02,Le Monde,631mots,par Françoise Fressoz,Dans la centrifugeuse des affaires,"    ...  République en obtenant 82,2 % des suffrages exprimés face à JeanMarie Le Pen. Le  climat était pourtant pourri. Les juges traquaient l'ancien maire de Paris et ancien patron du RPR ...  "
347,2017-02-17,Le Monde,345mots,,Quand les docteurs Catastrophe pénalisent la croissance,"        ...  crise, les révisions successives à la baisse des prévisions de croissance relayées par le  climat généralisé de sinistrose économique ont pesé sur la consommation des ménages et l'investissement des entreprises ...  "
348,2017-02-15,Le Monde,1035mots,,Première démission à la Maison Blanche,"        ...  les EtatsUnis à un pays étranger? Avaitil assuré à son interlocuteur que le  climat changerait du tout au tout avec l'arrivée de Donald Trump à la Maison Blanche, ce ...  "
349,2017-02-09,Le Monde,992mots,Mirel Bran et Jean-Baptiste Chastand,"En Roumanie, la lutte anticorruption a fait naître une société civile","    ...  que les sondages m'étaient favorables »  .  « Cette campagne anticorruption a semé la peur »  et un  climat de  « haine »  qui lui rappelle  « la révolution de 1989 »,  défendil avec un air outré. Comme ...  "
350,2017-03-11,Le Monde,703mots,Marie de Vergès,L'Afrique du Sud en proie au ralentissement et à la grogne sociale,"    ...  réformes et plus de transparence sur le fonctionnement des institutions pour arriver à recréer un  climat favorable à la reprise de l'investissement »  , estime aussi JeanMichel Six, chef économiste Europe, Afrique ...  "
351,2017-03-13,Le Monde,870mots,Jérôme Marin,"Aux Etats-Unis, Lyft profite des déboires d'Uber pour accélérer","    ...  l'entreprise a été accusée par une ancienne employée d'avoir laissé s'installer un  climat sexiste et d'avoir systématiquement ignoré ses plaintes pour harcèlement sexuel. Puis une vidéo, publiée par ...  "
352,2017-03-04,Le Monde,720mots,Claude d'Aspremont (Université catholique de Louvain) et Alain Trannoy (EHESS et école d'économie d'Aix-Marseille),Kenneth Arrow,    ...  des politiques face aux irréversibilités (raréfaction des ressources) et à l'incertitude à long terme (climat) concernant l'environnement. Chacun de ces travaux est à la racine d'un domaine qui a ...  
353,2017-03-09,Le Monde,118mots,,Le Canada ne respectera pas ses engagements,        L'objectif de réduction de 30 % de ses émissions de gaz à effet de serre d'ici à 2030 pris par le Canada dans le cadre de l'accord de Paris ...  
354,2017-03-10,Le Monde,894mots,Piotr Smolar,Israël cherche le soutien de la Russie contre l'Iran,    ...  fois à Moscou et une fois à Paris en marge de la conférence sur le  climat (COP 21).  « Le premier ministre rêve d'un ­engagement russe sur un futur ­retrait du Hezbollah ...  
355,2017-02-25,Le Monde,121mots,,Parcours givré,"        ...  plus ­surprenants, sa dernière production, publiée le 21 février, le montre dans cette ville au  climat ­extrême qui organise depuis trentetrois ans un festival international de sculptures sur glace. On le ...  "
356,2017-02-27,Le Monde,1062mots,Corine Lesnes,"Aux Etats-Unis, la détresse des sans-papiers","    ...  prépare. Déjà, le consulat a été saisi de plusieurs cas qui témoignent du changement de  climat. Normalement, les polices locales ne collaborent pas avec les agents fédéraux chargés de l'immigration. Des ...  "
357,2017-02-28,Le Monde,1375mots,Fethi Benslama,"Non, la déradicalisation n'est pas un échec!","    ...  avait à peine trois mois lorsque le déchaînement des détracteurs a commencé, fait partie du  climat émeutier que nous vivons. Le projet du centre de Pontourny a fait l'objet d'un ...  "
358,2017-03-28,Le Monde,856mots,,La série noire continue pour Uber,"        ...  importante crise de gouvernance, provoquée notamment par des accusations d'une ancienne salariée sur le  climat sexiste que la direction a laissé s'installer. Les controverses à répétition ont déjà provoqué plusieurs ...  "
359,2017-04-15,Le Monde,708mots,par Annie Kahn,"Dirigeant modeste, une espèce essentielle en voie de disparition","    ...  actuelle, ponctuée de crises économiques et sociales, expliquerait ce phénomène, selon la chercheuse. Car ce  climat anxiogène incite chacun à se rac­crocher à des êtres au charisme ­nocif, dont on pense ...  "
360,2017-04-15,Le Monde,530mots,par Françoise Fressoz,"Hollande-Mélenchon, le dernier combat","    ...  assurance les enjeux du prochain quinquennat : Europe, terrorisme, dialogue social. Mais il dénonce aussi le  climat de «  suspicion »  qui  « mine la démocratie  » et fait prospérer  « le populisme  », sans reconnaître une once de ...  "
361,2017-04-01,Le Monde,636mots,propos recueillis par Alexis Duval,Mikaa Mered « On se croirait de retour à l'ère soviétique »,"    ...  modifications des législations environnementales ou encore la fin de l'Accord de Paris sur le  climat  [signé à l'issue de la COP21 en décembre 2015] . Le secrétaire d'Etat américain, Rex ...  "
362,2017-03-25,Le Monde,1112mots,,Comptes publics : un timide redressement,"        ...  en charge de la taxe carbone. Dans tous les domaines, les signes d'amélioration du  climat sont notables. A commencer par les créations d'emplois. Sur les deux dernières années, près de ...  "
363,2017-04-12,Le Monde,1692mots,Propos recueillis par Nicolas Truong,Nonna Mayer : « Marine Le Pen fait encore peur »,"    ...  second tour FillonLe Pen n'est pas totalement à exclure. Et, dans un tel  climat d'incertitude, on a tendance à se fier malgré tout aux sondages, avec des effets imprévisibles ...  "
364,2017-04-19,Le Monde,1306mots,,La campagne tardive des patrons,"        ...  économique de François Fillon, se retrouve accusé d'être antiIVG et homophobe. Dans ce  climat délétère, il faut donc une bonne dose de courage ou d'indépendance pour s'exposer à ...  "
365,2017-04-07,Le Monde,3238mots,Annick Cojean,"Au Québec, l'onde de choc post-attentat","    ...  de ­signes religieux à certains fonctionnaires (le voile est dans tous les esprits) créerait un  climat favorable au basculement dans la violence d'esprits fragiles ou dérangés, comme l'était apparemment celui ...  "
366,2017-03-29,Le Monde,742mots,Laure Stephan,"En Egypte, les ONG sont sous surveillance","    ...  mise au ban de M. AlSadate, neveu de l'ancien président, a ajouté au  climat de peur. Cela n'empêche pas des militants de refuser d'abdiquer : avec ses collègues du ...  "
367,2017-04-07,Le Monde,734mots,François Godement (directeur du programme Asie du European Council on Foreign Relations-ECFR) et Manuel Lafont Rapnouil (directeur du bureau de Paris de l'ECFR),Présidentielle 2017 : le marqueur européen,"    ...  l'indépendance n'empêche pas une coopération étroite, non seulement à l'ONU, sur le  climat par exemple, mais d'abord et surtout au sein d'une Europe devenue plus complexe. Une ...  "
368,2017-04-28,Le Monde,847mots,Laure Stephan,"En Egypte, les tensions religieuses à vif avant la visite du pape","    ...  de la jeunesse, contre une hiérarchie religieuse jugée trop passive. Venant s'ajouter à ce  climat déjà lourd, des violences sectaires ont éclaté durant la semaine sainte dans la province de Minya ...  "
369,2017-01-16,Le Monde,328mots,"Brice Pedroletti (Pékin, correspondant)","En Chine, un universitaire coupable de lèse-Mao","    ...  le président chinois, qui se trouve être le fils d'un révolutionnaire, a instauré un  climat peu propice à la remise en question du désastreux héritage de Mao : M. Xi a déclaré ...  "
370,2017-01-07,Le Monde,911mots,Gaëlle Dupont,Une mission sur la prescription des crimes sexuels sur les mineurs,"    ...  Ces crimes sont commis sur des enfants, le plus souvent par des proches, dans un  climat d'emprise,  explique ­Muriel Salmona, psychiatre et présidente de l'association Mémoire traumatique et victimologie.  La ...  "
371,2017-01-07,Le Monde,725mots,Guy Dutheil,"Chez Air France, nouveau round de négociations avec les syndicats","    ... 'empêche, l'arrivée du 787 ne devrait pas contribuer, à elle seule, à alléger le  climat social au sein de la compagnie aérienne, où les négociations entre salariés et direction viennent de ...  "
372,2017-01-06,Le Monde,593mots,Amir Akef,"En Algérie, Béjaïa théâtre d'émeutes dans un contexte de crise économique","    ...  sociaux. Des tensions ont également été rapportées dans plusieurs autres localités des environs. Dans ce  climat, certains habitants ne cachaient pas leur inquiétude de voir se répéter les événements de 1988, lorsque ...  "
373,2017-02-01,Le Monde,966mots,Stéphane Lauer,"Aux Etats-Unis, la fronde anti-Trump des entreprises","    ...  l'élection du 8 novembre 2016, elles se félicitent de ses grandes orientations favorables au  climat des affaires  baisse d'impôts, déréglementation, investissements dans les infrastructures , l'application de mesures protectionnistes et ...  "
374,2017-02-13,Le Monde,1316mots,Gilles Paris,Les hommes du président Trump,"    ...  accusations de racisme. franctireur La procédure de confirmation, qui s'est déroulée dans un  climat tendu, a ravivé ce souvenir, mais ce sont les positions de M. Sessions sur l'immigration ...  "
375,2017-02-03,Le Monde,776mots,par Vincent Giret,"Trump, Montesquieu et Clausewitz","    ...  les industries en surproduction ou subventionnées dans les pays émergents, de même qu'une taxe  climat à l'entrée du grand marché unique européen. L'Europe et la France doivent s'armer ...  "
376,2017-02-02,Le Monde,438mots,Benoît Vitkine,Embrasement sur le front ukrainien,"    ...  gel partiel du conflit, les éruptions de violence sont récurrentes dans le Donbass, mais le  climat international rend la situation volatile. Après la prise de contact entre les présidents russe et américain ...  "
377,2017-03-16,Le Monde,781mots,Éric Béziat,« Dieselgate » : le rapport qui accable Renault,"    ...  fait 7 700 morts en France »,  ajoute Lorelei Limousin, représentante de l'ONG Réseau Action  Climat à la commission Royal. Renault, de son côté, indique dans un communiqué avoir  « pris connaissance d ...  "
378,2017-03-04,Le Monde,1909mots,matthieu goar et Alexandre Lemarié,Le jour où les juppéistes ont lâché Fillon,"    ...  notre candidat puisse porter sereinement notre projet et nos valeurs »  .  « Dans ce contexte et ce  climat délétère, nous, élus de la droite et du centre, demandons solennellement à François Fillon de prendre ...  "
379,2017-02-25,Le Monde,989mots,par Michel Guerrin,Le double alibi de Mehdi Meklat,"    ... 'un Dieudonné. Possible. Mais des indices dérangent. D'abord, ses cibles s'inscrivent dans un  climat trop repéré. Les juifs, les femmes, les gays. Pas les agriculteurs, les chasseurs ou les camionneurs ...  "
380,2017-03-28,Le Monde,877mots,Luc Leroux,"Pressions à l'embauche, contrats de sécurité : à Marseille, le procès du racket des chantiers","    ...  d'avoir utilisé la mauvaise réputation des quartiers nord de la ville pour établir un  climat de peur, afin de mieux imposer leur entreprise de gardiennage. En 2014, alors que le chantier ...  "
381,2017-03-29,Le Monde,773mots,Bertrand Bissuel,Quand la Cour des comptes s'émeut d'une plaisanterie du chef de l'Etat,"    ...  Mais à ses yeux, elle s'inscrit dans un air du temps, une sorte de  climat de  « décomposition institutionnelle »  où les piliers de la République sont tournés en dérision ou cloués au ...  "
382,2017-03-29,Le Monde,640mots,Frédéric Saliba,Les meurtres de journalistes se succèdent au Mexique,"    ...  et de candidats aux élections locales de juin proches de narcotrafiquants.  « Ces meurtres instaurent un  climat d'autocensure »  , déplore Mme Ruelas, qui souligne que l'impunité des assassins de journalistes atteint 99 ...  "
383,2017-04-11,Le Monde,724mots,Blaise Gauquelin,"En Hongrie, Orban s'en prend aux ONG","    ...  en grande partie de l'OSF :  « Cette activité politique génère une émulation médiatique créant un  climat défavorable pour nous. La semaine dernière, des enseignants n'ont pas voulu coopérer avec TASZ sur ...  "
384,2017-04-12,Le Monde,589mots,,""" Elles viennent chercher les valeurs et les vertus du monde militaire ""","        ...  militaires perdent le droit de vote, qu'ils ne retrouveront qu'en 1945. Dans le  climat du débat sur le rapport entre l'armée et la République, la question de la formation ...  "
385,2017-04-03,Le Monde,919mots,Marie de Vergès,Le retour à meilleure fortune des pays émergents,"    ...  reprise prévue pour 2017. Afflux de capitaux Un peu partout, et notamment en Asie, le  climat des affaires s'améliore. Ces pays affichent eux aussi des indices PMI en hausse et une ...  "
386,2017-04-07,Le Monde,913mots,Philippe Pons,L'équation nord-coréenne se complique,"    ...  chinois, Xi Jinping, en Floride, les 6 et 7 avril, de régler militairement le problème nordcoréen tient plus de la bravade que de la menace. Mais elle électrise le  climat.  ...  "
387,2017-01-26,Le Monde,784mots,Paul Barelli et Mattea Battaglia,"A Nice, la « surenchère » sécuritaire fait polémique","    ...  cela montre bien le passage à une société de la peur, l'installation d'un  climat de crainte dont l'école n'est pas tenue à l'écart. » Pour le SNUippFSU ...  "
388,2017-01-26,Le Monde,1027mots,Bastien Bonnefous et Solenn de Royer,"Valls durcit le ton, au péril du rassemblement","    ...  secrétaire du PS, JeanChristophe Cambadélis, de dénoncer ces attaques qui installent, selon lui,  « un  climat nauséabond »  contraire à la Charte éthique de la primaire. Dans le cas contraire, l'équipe Hamon ...  "
389,2017-01-20,Le Monde,1120mots,Macha Séry,Corruption au sommet,"    ...  qui voit s'affronter le président sortant et un candidat d'extrême droite. Dans un  climat de fortes tensions, le scandale menace d'éclater lorsque le ministre de l'industrie se suicide ...  "
390,2017-01-21,Le Monde,1132mots,Carine Bizet,L'ère du luxe-réalité,"    ...  rares dans la vie, mais ils existent, et on aimerait en croiser plus souvent. Ce  climat réaliste ne peut que mettre à l'aise Christophe Lemaire et SarahLinh Tran, auteurs des ...  "
391,2017-01-16,Le Monde,675mots,Frédéric Bobin,"A Tripoli, le gouvernement d' « union nationale » ouvertement défié","    ... 'aisance avec laquelle M. Ghwell nargue à Tripoli son ­rival révèle en tout cas un  climat, celui de la montée générale du ­désenchantement face à l'incurie du Conseil présidentiel (la direction ...  "
392,2017-01-16,Le Monde,2970mots,Propos recueillis par Christophe Ayad et Marc Semo,Hubert Védrine « La tragédie d'Alep symbolise l'effondrement des politiques occidentales guidées par la morale et l'éthique »,"    ...  ou quatre ­dirigeants qui pèsent, devraient dire : « Vous voulez sortir de l'accord sur le  climat? C'est une erreur. Nous continuerons à l'appliquer y compris avec la société civile et ...  "
393,2017-01-16,Le Monde,656mots,Pascale Robert-Diard,Le quotidien des Sisyphe judiciaires,"    ...  l'infinie variété des dérèglements des ­comportements humains. « Je fais de l'engueulothérapie » Quand le  climat est moins tendu, les voilà encore, éphémères professeurs d'instruction civique   « je fais de l'engueulothérapie ...  "
394,2017-01-23,Le Monde,1271mots,Nicolas Bourcier et Stéphanie Le Bars,Trump galvanise partisans et opposants,"    Les organisateurs avaient vu un peu grand. Les écrans géants installés à l'une des extrémités du National Mall, à Washington, ont diffusé la cérémonie d'investiture du 45e président des ...  "
395,2017-01-28,Le Monde,684mots,Jean-Michel Bezat,Le trop-plein d'or noir n'est pas près de se résorber,"    ...  la planète : les mouvements écologistes et le Groupe d'experts intergouvernemental sur l'évolution du  climat (GIEC) ont prévenu qu'il faudrait laisser en terre 80 % du charbon, du pétrole et du ...  "
396,2017-01-28,Le Monde,763mots,Pierre Le Hir,Les députés votent l'interdiction d'exploiter le gaz de schiste,"    ... 'activité minière et de démocratie participative. En référence à l'accord de Paris sur le  climat, la politique minière devra tenir compte de la  « raréfaction des ressources »  et traduire  « le respect des ...  "
397,2017-01-18,Le Monde,1168mots,Pierre Le Hir,Le code minier à l'Assemblée pour enterrer le gaz de schiste,"    ...  La proposition de loi ne fait référence ni à l'accord de Paris sur le  climat ni à la loi de transition énergétique »  , s'étrangle l'eurodéputée Michèle Rivasi (EELV). Les scientifiques ...  "
398,2017-02-11,Le Monde,470mots,françoisE fressoz,La peur du loup FN,"    ...  secrétaire du Parti socialiste (PS), JeanChristophe Cambadélis. Et d'ajouter :  « Nous sommes dans un  climat qui ressemble à ce qui s'est passé aux EtatsUnis, avec Marine Le Pen dans ...  "
399,2017-02-11,Le Monde,1563mots,Clarisse Fabre,Polanski la Toile pris dans,    ...  organisée en riposte aux insultes sexistes de Donald Trump pendant la campagne présidentielle américaine... Le  climat était propice à la colère. Que Polanski ait pu continuer à faire ses films et mener ...  
400,2017-02-16,Le Monde,533mots,,Constitution : la désinvolture du Parlement,"        ...  lieu de protéger nos libertés et de garantir nos droits, serait une entrave. Alimenter ce  climat en surfant sur les peurs des électeurs est dangereux, voire irresponsable, dans une période où l ...  "
401,2017-02-27,Le Monde,787mots,Joan Tilouine,"En RDC, l'opposition désunie après la mort de son chef","    ...  le leader de l'opposition est mort. Mais elles se poursuivent en coulisses dans un  climat tendu. Selon la Constitution, le second et dernier mandat de Joseph Kabila a pris fin le ...  "
402,2017-03-01,Le Monde,808mots,Alexandre Lemarié,"Peu audible, François Fillon tente de durcir sa campagne","    ...  électorat. Après avoir accusé dimanche 26 février au soir le gouvernement de laisser perdurer un  «  climat de quasiguerre civile »  , M. Fillon a enfoncé le clou, lundi. « Je ne peux pas accepter ...  "
403,2017-03-23,Le Monde,942mots,,Les enseignes se convertissent au travail dominical,"        ...  cette ""  volonté d'appliquer l'accord de branche qui prévoit un salaire moindre ""  par  "" le  climat concurrentiel qui règne dans le secteur, notamment avec Leroy Merlin et Castorama "" . Si l'ouverture du ...  "
404,2017-03-06,Le Monde,931mots,Thomas Doustaly,T 'as le bonjour du printemps,"    ...  Enfant à partir de 6 ans, 7,50 euros; adulte, 11,50 euros. Rés. obligatoire : <a href=""mailto:ateliers.saintcloud@monumentsnationaux.fr""> ateliers.saintcloud@monumentsnationaux.fr ou 01 41 12 02 95. Domainesaintcloud.fr Le plus graphique Visiter la maison ...  "
