,date,publication,words,author,title,intro
80,2017-03-15,Le Monde,786mots,Laurence Boccara,L'immobilier d'entreprise reste dynamique,"    ... vous annuel et international de l'immobilier d'entreprise (Mipim) s'est ouvert dans un  climat plutôt optimiste mardi 14 mars à Cannes. Certes, en 2016, le volume s'est contracté de ...  "
81,2017-04-17,Le Monde,85mots,,"Washington doit "" sortir "" de l'accord de Paris","        ...  considère que les EtatsUnis doivent se retirer de l'accord de Paris sur le  climat.  "" L'accord de Paris est quelque chose que nous devons vraiment examiner de près "",  at ...  "
82,2017-01-25,Le Monde,1155mots,Pascale Santi,De nouvelles préconisations nutritionnelles,"    ...  véritable enjeu de santé publique »,  souligne Cyrielle ­Denhartigh, responsable agriculture et alimentation du Réseau action  climat. L'Anses encourage aussi de consommer les produits céréaliers les moins raffinés possible (farine, pain, riz ...  "
83,2017-02-20,Le Monde,538mots,Nicolas Santolaria,Prenez un chewing-gum Emile,"    ...  anecdote illustre bien toute la complexité d'une problématique qui pourrit parfois en profondeur le  climat général. Car le collègue qui sent mauvais n'est pas un, mais multiple. Il peut avoir ...  "
84,2017-03-13,Le Monde,2209mots,Alexis Delcambre et Alexandre Piquard,Les médias pris dans la bataille de la présidentielle,"    ...  journaliste du  Figaro  de  « spécialiste de la dentelle et du dialogue sincère . « C'est un  climat général. On sent que les politiques ne veulent plus se soumettre au questionnement des journalistes »,  estime ...  "
85,2017-03-18,Le Monde,898mots,Audrey Tonnelier,L'économie française poursuit son lent redressement,"    ...  venir aux EtatsUnis et à l'approche d'élections cruciales en Europe,  [mais]  le  climat conjoncturel reste favorable »  , a résumé Vladimir Passeron, chef du département de la conjoncture à l'Insee ...  "
86,2017-04-15,Le Monde,1225mots,Oya Baydar,La Turquie est à un tournant de son histoire,"    ...  l'hiver de nos espoirs démocratiques, lesquels n'étaient peutêtre que des illusions. Un  climat nauséabond Le coup d'Etat avorté du 15 juillet, attribué à la communauté güleniste (confrérie sunnite ...  "
87,2017-04-21,Le Monde,792mots,par Audrey Tonnelier,L'élection présidentielle et la « décennie perdue »,"    ...  PMI a connu une forte croissance, à son plus haut niveau depuis 70 mois. « Le  climat d'incertitude lié à la prochaine élection présidentielle semble avoir peu de prise sur l'activité ...  "
88,2017-03-22,Le Monde,491mots,Isabelle Chaperon,Les patrons rappellent l'Europe à ses engagements climatiques,"    ...  mars, un manifeste enjoignant aux gouvernements européens de maintenir leur vigilance sur les enjeux du  climat :  « Nous, ­signataires du présent manifeste pour décarboner l'Europe, appelons les Etats européens à lancer dès ...  "
89,2017-02-07,Le Monde,1674mots,Corine Lesnes,Le réveil de l'Amérique de la dissidence,"    ...  le maintien de l'Obamacare, contre le retrait de l'accord de ­Paris sur le  climat... « 1984 » en tête des ventes Jamais, depuis le Vietnam, les EtatsUnis n'ont connu un ...  "
90,2017-03-23,Le Monde,843mots,Mattea Battaglia,Les établissements d'élite s'interrogent sur leur plus-value,"    ...  cette recherche d'une orientation ambitieuse s'ajoute la quête du  « bon »  accompagnement, du  « bon »   climat de travail.  « C'est un état d'esprit que les familles recherchent. Et nous mettons tout ...  "
91,2017-02-08,Le Monde,842mots,,Science et technologie : nos questions aux candidats à l'élection présidentielle,"        ...  accessibles sur le site; elles sont déclinées en cinq thèmes : santé et environnement, énergie et  climat, informatique et technologies numériques, éducation scientifique, recherche et innovation. Citons néanmoins quelques exemples afin d'illustrer ...  "
92,2017-03-14,Le Monde,968mots,Zahra Chenaoui,"A Rouiba, l'inquiétude des ouvriers algériens monte","    ...  avancer l'Algérie, réclament le respect de leurs droits, on les envoie en prison. » Le  climat social à Rouiba est scruté avec d'autant plus d'attention que la ville a une ...  "
93,2017-04-01,Le Monde,947mots,Patrick Roger,"En Guyane, les excuses de la ministre","    ...  à un gradé. En fin de matinée, les discussions sont au point mort, dans un  climat de tension croissant. Les ministres, en liaison permanente avec Matignon, tiennent un point presse improvisé, à ...  "
94,2017-04-08,Le Monde,1002mots,Christian Estrosi,Christian Estrosi : « Relever la hauteur de cette campagne »,"    C'est ma sixième campagne présidentielle. Jamais, au grand jamais, le  climat entourant une campagne électorale, tant sur le terrain que dans les commentaires, ne m'aura paru aussi exécrable. Tous les ...  "
95,2017-04-04,Le Monde,539mots,,Misère carcérale,"        ...  inhumain »  des détenus à la maison d'arrêt de Fresnes (taux d'occupation de 193 %).  Climat d'extrême violence, discipline brutale, tension permanente. Et prolifération des rats :  « L'odeur persistante de leur ...  "
96,2017-02-04,Le Monde,541mots,é. V.,Les autorités face à une zone grise juridique et un climat sensible,"    ...  établissement qui fonctionne désormais clandestinement. Au coeur du litige : une zone grise juridique et un  climat tendu. Comment contraindre à fermer ses portes une école hors contrat sur laquelle, par définition, l ...  "
97,2017-03-24,Le Monde,1038mots,Propos recueillis par Raphaëlle Besse Desmoulières et Simon Roger,Nicolas Hulot : « Nous devons être les garde-fous de la tentation extrémiste »,"    ...  les affaires polluent la campagne présidentielle? Notre campagne est un appel d'air dans un  climat pollué par les affaires, les préjugés et les idées reçues qui risquent de nous emmener dans ...  "
98,2017-02-04,Le Monde,1022mots,Alexandre Piquard,L'arrivée de « Breitbart » en France repoussée,"    ...  contacts. Cet auteur et blogueur anglais de droite, actif notamment sur le thème du réchauffement  climatique, a expliqué aux possibles recrues vouloir  « raconter les histoires que les médias mainstream ont souvent peur ...  "
99,2017-02-04,Le Monde,976mots,Al. P.,"Mensonges, militantisme et provocation au menu du site","    ...  utilisée à mauvais escient, dans le but de remettre en cause les effets du réchauffement  climatique. Dans un autre cas, le site a fait une présentation jugée trompeuse d'une polémique autour ...  "
100,2017-02-20,Le Monde,1851mots,"Propos recueillis par François Bougon, Anatole Kaletsky et Sidin Vadukut (dans le cadre d'un partenariat avec Project Syndicate)",Minxin Pei « La campagne anticorruption de Xi ne fait que gratter la surface du problème »,"    ...  Chine puisse jouer un rôle de leader beaucoup plus positif dans le domaine du changement  climatique, car cela coïncide avec ses propres intérêts nationaux. En ce qui concerne le respect des droits ...  "
101,2017-01-20,Le Monde,1247mots,Alain Beuve-Méry,"Les pages Débats, « un relais de la vie intellectuelle »","    ...  de la post­vérité, les suites de la bataille d'Alep, le terrorisme, le réchauffement  climatique, etc. « Nous sommes entrés dans une période de plus grande imprévisibilité, poursuit Nicolas Truong. Le monde ...  "
102,2017-03-21,Le Monde,548mots,Jean-Pierre Tenoux,Promenade en forêt numérique,"    ... 'Institut national de la recherche agronomique et l'Office national des forêts, sur le changement  climatique par exemple, y seront intégrés après  « simplification »,  en raison de la finalité  « concrète »  du simulateur, précise ...  "
103,2017-03-21,Le Monde,578mots,Gilles Rof,La façade méditerranéenne à la merci de l'homme,"    ...  Anne Ganteaume,  avec une végétation en stress hydrique important en raison des effets du réchauffement  climatique et d'une sécheresse prolongée. »  Les conditions de la journée du 10 août, avec un vent ...  "
104,2017-04-06,Le Monde,90mots,,"1,6 %","        ...  la baisse de 40 % de la demande chinoise, les économies africaines s'essoufflent. "" En outre, ces pays sont affectés par la baisse des investissements directs étrangers et par le changement  climatique.  ...  "
105,2017-04-28,Le Monde,582mots,Cécile Boutelet,"En Allemagne, le « diesel propre » a du plomb dans l'aile","    ...  établi désormais que les voitures diesel les plus récentes ne respectent même pas, en situation  climatique réelle, la vieille norme Euro 3, adoptée en 2000, date à laquelle une limite d'émissions ...  "
106,2017-01-12,Le Monde,1085mots,Gilles Paris,Obama appelle à défendre la démocratie,"    ...  être que  « des dialogues de sourds »  , atil estimé, pointant l'enjeu du réchauffement  climatique. Sans nier par ailleurs les menaces venant de l'extérieur, et notamment celle représentée par le ...  "
107,2017-01-21,Le Monde,672mots,Antoine Flandrin,Tribus meurtries,"    ...  la Bolivie, dans des conditions souvent précaires. Leur avenir est incertain. En raison du réchauffement  climatique, les glaciers de la cordillère des ­Andes ont perdu 40 % de leur ­surface. D'année en ...  "
108,2017-01-20,Le Monde,109mots,,Nos cousins les singes menacés d'extinction,"        ... 'agriculture, l'exploitation forestière et minière, ou encore la construction routière et ferroviaire, qui font disparaître leur habitat. Sans oublier la chasse et le braconnage, la pollution ou le changement  climatique.  ...  "
109,2017-01-06,Le Monde,402mots,,Lionel Shriver « Tempérer l'idéalisme par du pragmatisme »,"        ...  les ­déficits par des augmentations d'impôts frapperait inévitablement les classes moyennes. Quant au changement  climatique, la gauche doit trouver des arguments positifs : ceux qui maîtriseront la prochaine génération des technologies des ...  "
110,2017-01-06,Le Monde,1437mots,"Cécile Ducourtieux (« Le Monde »), Thomas Kirchner, Alexander Mühlauer (« Süddeutsche Zeitung »), Jennifer Rankin (« The Guardian »)",Bruxelles en panne d'idées,"    ...  1996, le conseil européen de l'environnement avait adopté l'objectif de limitation du réchauffement  climatique à 2 °C, sur l'insistance d'une ministre allemande alors assez peu connue, Angela Merkel ...  "
111,2017-01-26,Le Monde,220mots,,Comment Wikipedia démêle le vrai du faux,"        ...  sources reste primordiale dans la rédaction des articles. «  Sur des sujets importants comme le réchauffement  climatique, l'encyclopédie donne, bien sûr, toutes les données, explique tous les enjeux, mais présente aussi, en ...  "
112,2017-01-25,Le Monde,721mots,Morgane Tual,La transition numérique agitée de Donald Trump,"    ...  la Maison Blanche qui ont fait bondir de nombreux internautes. Les pages consacrées au changement  climatique et aux droits des lesbiennes, gays, bisexuels et transgenres (LGBT) ont disparu, provoquant un vent de ...  "
113,2017-02-09,Le Monde,131mots,,Washington relance l'oléoduc contesté dans le Dakota,"        ...  le 24 janvier, en même temps qu'il redonnait vie au projet du gigantesque oléoduc Keystone XL, bloqué par l'administration Obama au nom de la lutte contre le changement  climatique.  ...  "
114,2017-02-06,Le Monde,460mots,Propos recueillis par Raphaëlle Besse Desmoulières,"Yannick Jadot : « Je suis accro aux tomates, même l'hiver »","    ...  complot ou une fausse rumeur... Les écologistes, financés par le nucléaire, ont inventé le dérèglement  climatique et, financés par l'industrie ­pétrolière, ont inventé ­Tchernobyl et Fukushima. Vous êtes la fonction ­d ...  "
115,2017-03-02,Le Monde,1214mots,Gilles Paris,Donald Trump adoucit le ton sans changer de cap,    ...  Le président n'a pas évoqué une seule fois mardi la lutte contre le réchauffement  climatique et ses défis. Il a évoqué un plan de modernisation des infrastructures de 1 000 milliards ...  
116,2017-04-15,Le Monde,817mots,Thomas Sotinel,Quatre fois Nicole Kidman au Festival de Cannes,"    ...  l'exviceprésident américain a donné, dix ans plus tard, une suite à An Inconvenient Truth, documentaire qui joua un rôle important dans la prise de conscience du changement  climatique.  ...  "
117,2017-03-29,Le Monde,616mots,Par Armand Hatchuel,"Le prix unique du carbone, une fausse bonne idée","    ...  l'effet escompté : le prix du carbone est resté désespérément bas, alors que la menace  climatique est avérée. L'ampleur de ce décalage entre faits et théorie impose d'interroger les fondements ...  "
118,2017-04-11,Le Monde,742mots,Harry Bellet,"A Bâle, la Fondation Beyeler dans le « Monet time »","    ...  peints en 1897. Dixsept ans plus tôt, la Seine ici paisible connaissait un événement  climatique rare, un hiver si rigoureux que le fleuve gela. Au matin du 5 janvier 1880, un ...  "
119,2017-01-19,Le Monde,673mots,Éric Béziat,Trains régionaux : la carte de France des retards,"    ...  des trains en retard) et le mois de novembre  habituellement délicat en raison du changement  climatique saisonnier ,particulièrement médiocre l'année dernière (14 % des trains en retard). Ces statistiques ne vont certainement ...  "
120,2017-01-11,Le Monde,117mots,,Un plan pour protéger les ours polaires,        ...  en danger d'extinction dont la survie à long terme est menacée par le réchauffement  climatique. Ce plan établit les grandes lignes des actions nécessaires et des engagements concrets du Bureau américain ...  
121,2017-02-17,Le Monde,1364mots,,""" Le monde a changé, il est plus dangereux ""","        ...  aborder les causes profondes : un développement durable et inclusif, et répondre au problème du changement  climatique. Il faut investir dans la cohésion sociale de sociétés qui deviennent multiethniques, multireligieuses, multiculturelles. Il faut ...  "
122,2017-02-17,Le Monde,1432mots,,"Dans le luxe, la tendance est au vert","        ...  complexeRépondre à ce programme qui vise à éradiquer la pauvreté, à lutter contre le changement  climatique et à protéger l'environnement,  "" devrait coûter entre 5 000 et 7 000 milliards de dollars ...  "
123,2017-02-28,Le Monde,2417mots,,Notre sélection spéciale Alpes,"        ...  Fils, persan, « Cuvée ­Prestige », 2014 Le persan est un cépage oublié qui profite du réchauffement ­­climatique pour renaître. Ce vin ­rubis clair évoque la framboise, le poivre et la pivoine. La bouche ...  "
124,2017-03-21,Le Monde,624mots,Caroline Taïx,"En Nouvelle-Zélande, le fleuve Whanganui est devenu quelqu'un","    ... 'Occidentaux s'engagent dans cette démarche »  , explique Valérie Cabanes. Elle met en avant  « la crise  climatique et environnementale »  pour expliquer cette évolution :  « Depuis le judéochristianisme et la suprématie de l'Occident ...  "
125,2017-03-21,Le Monde,537mots,,Répondre au repli américain,"        ...  Steven Mnuchin, a refusé que toute référence soit faite à la lutte contre le réchauffement  climatique. Surtout, il s'est opposé à ce que soit mentionné, comme c'est systématiquement le cas ...  "
126,2017-04-20,Le Monde,651mots,Stéphane Foucart,"Dans l'Arctique aussi, les déchets plastiques s'accumulent","    ...  d'une grande fragilité car tous les stress qu'elle subit s'ajoutent au changement  climatique. » En outre, la contamination des eaux de surface de l'Arctique n'est sans doute que ...  "
127,2017-04-24,Le Monde,689mots,,"L'Opéra de Paris fond pour "" La Fille de neige ""","        Il aura fallu attendre le réchauffement  climatique de l'ère Lissner pour qu'éclose  La Fille de neige , de RimskiKorsakov, jamais revue sur une scène parisienne depuis 1929. Une jolie entrée ...  "
128,2017-03-31,Le Monde,526mots,Jean-Michel Caroit,Une « marche verte » anticorruption en République dominicaine,"    ...  corruption de l'histoire dominicaine »,  ce projet est critiqué par les écologistes, qui fustigent le recours au charbon dans ce pays insulaire, l'un des plus menacés par le réchauffement  climatique.  ...  "
129,2017-04-17,Le Monde,535mots,,Crise de nerfs nationale,"        ...  leurs desiderata. Comme si la France pouvait mieux affronter les grands défis de demain (dérèglement  climatique, crise migratoire, menace terroriste...) en comptant sur ses seules forces plutôt que sur un effort commun ...  "
130,2017-01-13,Le Monde,2585mots,Nicolas Bourcier et Harold Thibault,Un tour du monde des conflits d'intérêts,"    ...  Pour défendre ses golfs, Donald Trump est prêt à tout, même à arguer du changement  climatique  qu'il avait qualifié sur Twitter de  « création de et pour les Chinois »   pour obtenir un ...  "
131,2017-01-17,Le Monde,1539mots,Isabelle Chaperon,Klaus SchwabLe maître de Davos,"    ...  création des Young Global Leaders). On y défriche les thèmes d'entrepreneuriat social, de changement  climatique, de révolution technologique.  « J'ai rencontré beaucoup de dirigeants, mais ce qui est fascinant chez Klaus ...  "
132,2017-01-03,Le Monde,329mots,,Comment l'Etat nous influence,"        ...  comportements individuels au nom de l'intérêt collectif : les luttes contre l'obésité, le réchauffement  climatique ou encore le surendettement. Comment analyser ces gouvernements de conduites? Quels en sont les acteurs et ...  "
133,2017-01-27,Le Monde,837mots,Audrey Garric,Le maïs pousse le grand hamster à l'infanticide,"    ...  des renards, la fragmentation de l'habitat du fait de l'urbanisation ou le changement  climatique. Ces conclusions étonnantes ont été publiées dans la dernière édition de la revue britannique  Proceedings of ...  "
134,2017-01-03,Le Monde,938mots,Emmanuel Macron,"M. Macron : « Nous sommes tous berlinois, nous sommes tous européens »","    ...  la crise, éprouvées par le fracas du monde  guerres, migrations, ouverture rapide aux échanges, changement  climatique ou bouleversement numérique  sont tentées de chercher le mal à l'extérieur. Il suffirait alors de ...  "
135,2017-02-06,Le Monde,1955mots,"Propos recueillis par Bastien Bonnefous, Nicolas Chapuis, Cédric Pietralunga et Solenn de Royer",Benoît Hamon : « Je ne serai pas un candidat ligoté! »,"    ...  parler de la protection sociale du XXIe siècle, de la VIe République ou du réchauffement  climatique ne les concerne pas. Je ne suis pas entré dans la campagne de la primaire en ...  "
136,2017-02-23,Le Monde,930mots,Par Frank Appel,"A l'heure du protectionnisme, un grand pas pour le libre-échange","    ... 'attention s'est portée, à juste titre, sur l'accord de Paris sur le changement  climatique. Il y a eu un compte à rebours jusqu'au jour où le nombre requis de ...  "
137,2017-02-04,Le Monde,1343mots,JeanPierre Stroobants,Maastricht pour mémoire,"    ...  déboucheratil sur une véritable Europepuissance? La mondialisation de l'économie, le péril  climatique, le phénomène migratoire ou la forte demande de ­sécurité ­intérieure semblent à l'évidence imposer des ...  "
138,2017-03-14,Le Monde,270mots,Annie Kahn,Changer ses habitudes,"    ...  l'océan. De s'émouvoir des ­ravages d'un cyclone et autres méfaits du changement  climatique. Mais de là à changer ses habitudes pour participer au sauvetage de la planète, il y ...  "
139,2017-04-08,Le Monde,897mots,Raphaëlle Besse Desmoulières,"Pour Mélenchon, « chacun doit pouvoir vivre dans son pays »","    ...  d'origine, privilégiant l'arrêt des guerres, le codéveloppement et la lutte contre le changement  climatique.  « Le premier devoir est de tarir le flux et nous devons avoir comme mot d'ordre ...  "
140,2017-04-04,Le Monde,779mots,Jean-Michel Bezat,Les candidats à la présidentielle face à un défi industriel et social,"    ...  partisan du nucléaire  « parce qu'il est au coeur de la stratégie industrielle, énergétique et  climatique qui est la nôtre »  . Mais sa part sera réduite à 50 % d'ici à 2025 pour ...  "
141,2017-03-28,Le Monde,87mots,,Ségolène Royal convoite une agence de l'ONU - Les Chiffres,"        ...  nombreux pays grâce à un effectif de quelque 8 000 agents. Il poursuit trois missions : favoriser le développement durable, lutter contre le dérèglement  climatique et améliorer la gouvernance démocratique. 4,5  ...  "
142,2017-03-30,Le Monde,681mots,,Un pépiniériste en colère,"        ...  négligé la préparation des sols avant les replantations "",  ajoutetil. Pour répondre au changement  climatique et éviter les maladies, la solution passe donc par une bonne implantation du système racinaire des ...  "
143,2017-04-28,Le Monde,831mots,Propos recueillis par Béatrice Jérôme et Solenn de Royer,Anne Hidalgo : « Cette élection n'est pas jouée d'avance »,"    ...  pouvoir. Je poserai également plusieurs sujets majeurs pour Paris et pour la France : le défi  climatique, la lutte contre la pollution de l'air, l'aide à apporter aux sansabri et ...  "
144,2017-01-11,Le Monde,944mots,Ar. Ch.,La seconde jeunesse d'Alain de Benoist,    ...  comme s'il plongeait dan un bain de jouvence . Je sens comme un léger réchauffement  climatique après les années de plomb. Une banquise est en train de fondre : des jeunes talentueux ont ...  
145,2017-01-18,Le Monde,2180mots,GIlles Paris,"L'accord avec l'Iran, miroir de la diplomatie","    ... 'appuiera sur cet acquis pour obtenir de Pékin un engagement à lutter contre le réchauffement  climatique en novembre 2014. En revanche,Barack Obama doit compter en mai 2010 avec une initiative du ...  "
146,2017-01-23,Le Monde,905mots,par Sylvie Kauffmann,Un monde nouveau,"    ... 'est Pékin qui défend la mondialisation, le libreéchange, et la lutte contre le changement  climatique. La Chine est désormais un acteur international. Ses entreprises sont parties à la conquête du monde ...  "
147,2017-01-25,Le Monde,727mots,Stéphane Foucart,Environnement Une fracture majeure,"    ...  Sur la trentaine de pointsclés de son programme, un seul   « répondre à l'urgence  climatique »   traite des questions environnementales. Parmi les mesures proposées sous cette thématique, figurent la réunion, au sein ...  "
148,2017-01-03,Le Monde,407mots,Véronique Cauhapé,La débâcle des glaciers filmée en temps réel,"    ...  depuis, sa vie à informer, à alerter sur les conséquences et les dangers du réchauffement  climatique. Cette aventure menée pour le magazine américain, qui l'a bouleversé à jamais  lui, demeuré si ...  "
149,2017-02-07,Le Monde,387mots,Jean-Pierre Stroobants,Le Belge Magnette prône le rétrécissement de l'UE,"    ...  ainsi qu'un effort massif pour assurer l'indépendance énergétique et lutter contre le réchauffement  climatique. Il propose, enfin, la mutualisation d'une partie des dettes nationales et un vaste plan d ...  "
150,2017-03-21,Le Monde,1513mots,Solenn de Royer,"Le Foll, dernier grognard de Hollande","    ... 'Union internationale des sciences du sol lui a décerné pour son action contre le réchauffement  climatique. Après le roi du Cambodge, il est le deuxième  « non scientifique »  à l'avoir reçu, depuis ...  "
151,2017-03-29,Le Monde,685mots,par Mireille Bruyère,"Quel contrat entre les générations? - Préserver la solidarité, c'est aider la jeunesse","    ... 'engager l'urgente transition écologique et nous approchons à grande vitesse du point de rupture  climatique. Nous léguons donc aux plus jeunes un monde bien plus riche économiquement, mais cet héritage est ...  "
152,2017-03-15,Le Monde,1381mots,Bruno Meyerfeld,"Au Kenya, la guerre de l'eau ravage la vallée du Rift","    ...  Kényans, les 700 000 habitants de Baringo subissent de plein fouet les conséquences du réchauffement  climatique et du phénomène météorologique La Niña. Comme la moitié du pays, le comté a été placé ...  "
153,2017-03-21,Le Monde,930mots,Marie de Vergès,G20 : pas de consensus sur le libre-échange,    ... 'est conclu sur une impasse entre les EtatsUnis et leurs partenaires : celui du changement  climatique dont il n'est plus question dans le communiqué. Toute référence à l'accord de Paris ...  
154,2017-04-14,Le Monde,881mots,Raphaëlle Leyris,Ian McEwan joue les innocents,"    ...  de se pencher avec acuité et puissance sur des sujets contemporains graves, tels le réchauffement  climatique, la liberté de conscience, la guerre en Irak... Quand son nom n'était pas le synonyme ...  "
155,2017-03-31,Le Monde,1775mots,Emre Sari,Clipperton tristes tropiques,"    ...  plus de moyens scientifiques suffisants pour exprimer tout son ­potentiel.  « Pour l'étude du changement  climatique, c'est un point d'intérêt majeur,  affirme Christian Jost, géographe à l'université de ­Papeete ...  "
156,2017-04-08,Le Monde,3461mots,Pascale robert-diard,"Ma petite France - 4. Tignes, sur la route de l'or blanc","    ...  a plus de quarante ans. Du ski « 365 jours par an »  ,  en dépit du réchauffement  climatique qui a déjà fait perdre près de la moitié de son domaine skiable l'été au ...  "
157,2017-01-26,Le Monde,942mots,Gilles Paris,Trump détricote l'héritage de la présidence Obama,"    ... 'instant des absences de taille : l'accord de Paris concernant la lutte contre le réchauffement  climatique, et celui relatif au nucléaire iranien. Leur dénonciation avait garanti au candidat des succès lors de ...  "
158,2017-01-26,Le Monde,770mots,propos recueillis par Damien Leloup,« Chaque article de Wikipedia est transparent »,"    ...  de présenter les différentes visions d'une question. Sur des sujets importants comme le réchauffement  climatique, l'encyclopédie donne, bien sûr, toutes les données, explique tous les enjeux, mais vous présente aussi ...  "
