,date,publication,words,author,title,intro
159,2017-01-20,Le Monde,539mots,,une planète sans singes,"        ...  de l'élevage, de l'exploitation du soussol , chasse et braconnage, pollution et réchauffement  climatique forment un cocktail mortel. L'impact de l'homme sur les milieux naturels ne va cesser ...  "
160,2017-01-23,Le Monde,1090mots,Carine Bizet,Libertés de tons,"    ...  de luxe, cette modelà peut en agacer certains, mais elle est consciente du réchauffement  climatique et des données écologiques. La maison Loewe s'offre depuis trois ans une nouvelle vie grâce ...  "
161,2017-01-11,Le Monde,145mots,,Hidalgo s'adresse aux candidats,        ...  Elle estime que « le premier défi » à relever doit être « la lutte contre le changement  climatique . Elle appelle à « s'attaquer aux inégalités territoriales » en proposant que soient consacrés « 40 milliards d ...  
162,2017-02-18,Le Monde,915mots,par Aureliano Tonet,De « Seinfeld » et Stephen Bannon,"    ...  Il compte y diffuser des spots sur l'armement nucléaire, le chômage ou le réchauffement  climatique, dans l'espoir  « d'éduquer »  le chef de l'Etat. Quid de  Seinfeld , au milieu de ...  "
163,2017-02-16,Le Monde,871mots,,Quand le monde oscille entre géo-économie et géopolitique,"        ...  la réforme de la gouvernance de l'Internet et dans la lutte contre le réchauffement  climatique. Tous deux notent avec tristesse que, à l'approche du 60e anniversaire du traité de Rome ...  "
164,2017-03-17,Le Monde,1324mots,Alexis Delcambre et Alexandre Piquard,RT et SputnikNews étendent leur influence en France,"    ...  2 licencié après la publication d'un livre contestant le ­consensus scientifique sur le réchauffement  climatique, la couverture de la COP21. Le lancement de sa chaîne est aussi ­synonyme d'un changement ...  "
165,2017-02-28,Le Monde,48mots,,"Domaine Grisard - Jean-Pierre &amp; Fils, persan, "" Cuvée -Prestige "", 2014","        Le persan est un cépage oublié qui profite du réchauffement climatique pour renaître. Ce vin rubis clair évoque la framboise, le poivre et la pivoine. La bouche est tendue, salivante. Un vin ...  "
166,2017-03-21,Le Monde,1006mots,Rémi Barroux,Un improbable récif corallien au large de l'Amazone,"    ...  car la menace contre les récifs coralliens n'a cessé d'augmenter avec le réchauffement  climatique et les activités humaines.  « La situation est très préoccupante dans certaines régions, comme le SudEst ...  "
167,2017-03-21,Le Monde,253mots,,"Au G20, le libre-échange ne fait plus consensus","        ... 'est conclu sur une impasse entre les EtatsUnis et leurs partenaires : celui du changement  climatique dont il n'est plus question dans le communiqué. Malgré ces tensions, ce G20 n'aura ...  "
168,2017-04-04,Le Monde,1094mots,Par SANDRA LAUGIER et NICOLAS MATYJASIK,Le PS de demain sera le parti de l'intelligence et des idées,"    ...  comme si ces élites vieillissantes ne voyaient pas les  « transformations du monde »  : ­justice globale et  climatique, santé environnementale et sécurité humaine, protection des biens communs et démocratisation de l'Europe... Les idées ...  "
169,2017-04-05,Le Monde,176mots,,La leptospirose en hausse en France,        ...  où son incidence peut être 50 fois plus élevée qu'en métropole. La leptospirose est aussi considérée comme une maladie émergente en raison du changement  climatique et de l'urbanisation croissante.  ...  
170,2017-03-25,Le Monde,1411mots,,l'Europe du non-asile politiques migratoires,"        ...  plus en plus de réfugiés  on en prévoit un milliard en 2050 avec le réchauffement  climatique , il n'y a pas 36 perspectives : soit on accompagne le changement et ça se passe ...  "
171,2017-01-27,Le Monde,970mots,Dominique Méda,Quel candidat pour quel Parti socialiste? Benoît Hamon veut repenser le travail,"    ...  Mieux : en lieu et place des discours tantôt lénifiants, tantôt catastrophistes qui nient le changement  climatique ou sont tétanisés par celuici, le député des Yvelines a rappelé sans relâche que la ...  "
172,2017-01-13,Le Monde,414mots,,Un site exposé aux séismes et aux tsunamis,"        ...  davantage, Satyajit Chavan a écrit au ministère de l'environnement, des forêts et du changement  climatique. Le 19 août 2016, il lui a été opposé une fin de nonrecevoir, s'agissant ...  "
173,2017-02-14,Le Monde,733mots,Collectif,Créons ensemble une Union européenne plus démocratique,"    ...  création d'une gouvernance mondiale plus efficace et démocratique et gérer les enjeux du changement  climatique, de la paix, de la pauvreté mondiale et de la transition vers une économie durable. Nous ...  "
174,2017-02-25,Le Monde,1394mots,Clément Brault,Les forçats du cross,"    ... 'été 1912, 1920 et 1924 (à Paris), avant d'être retiré par manque de cohérence  climatique. Il a même failli se retrouver au programme des JO d'hiver. Mais aujourd'hui, il ...  "
175,2017-02-15,Le Monde,637mots,,"La Chine, seul espoir du monde?","        ...  avait été prouvée par les scientifiques : tabagisme et cancer, fumées industrielles et pluies acides, gaz fluorocarbonés et trou dans la couche d'ozone, carburants d'origine fossile et réchauffement  climatique, etc.  ...  "
176,2017-03-08,Le Monde,951mots,Collectif,L'industrie doit être au coeur de notre projet de société,"    ...  avec ses partenaires un projet d'Europe industrielle solide et concret pour répondre au défi  climatique et énergétique, et tenir son rang face à la rude concurrence de géants comme la Chine ...  "
177,2017-02-28,Le Monde,662mots,Laurence Caramel,Une aide d'urgence pour la région du lac Tchad meurtrie et oubliée,"    ...  délaissée depuis longtemps par les pouvoirs centraux.  « L'extrême pauvreté, la pression démographique, le changement  climatique : nous avons les composants d'un désastre total,  a rappelé le commissaire européen aux affaires humanitaires ...  "
178,2017-03-01,Le Monde,880mots,"Feriel Alouti (oise et eure), Marion Degeorges (jura et Haute-Saône) et Manon Rescan (Pyrénées-orientales)","« A force de se flinguer, il n'y aura plus d'agriculteurs »","    ...  années que l'on dit qu'il nous faut une assurance en cas d'incident  climatique. Pouvoir, par exemple, mettre de l'argent de côté qui ne soit pas imposable. »  Nicolas Jugelet ...  "
179,2017-04-11,Le Monde,849mots,,"En Inde, les vieux ordinateurs polluent massivement l'air et les sols","        ...  à l'ampleur du problème, le ministère de l'environnement, des forêts et du changement  climatique oblige, depuis 2016, les fabricants de produits électroniques à recycler les déchets de leur filière, dans ...  "
180,2017-01-13,Le Monde,830mots,Propos recueillis par J. Cl.,Nicolas Delalande : « La France s'est longtemps pensée comme un Etat-nation ancien et unique en son genre »,"    ...  des migrations d'hommes, de biens, d'idées, de symboles; ou bien encore le changement  climatique, les pandémies, les ­révolutions technologiques. Le deuxième élément important est qu'on entend aussi souvent, par ...  "
181,2017-01-13,Le Monde,1193mots,Propos recueillis par Nicolas Chapuis et Béatrice Jérôme,"Anne Hidalgo : « Hollande, Valls et Macron sont responsables du gâchis »",    ... 'aime beaucoup. J'apprécie le courage avec lequel il a entrepris de relever le défi  climatique. Mais il a un positionnement politique qui n'est pas le mien. Je n'ai jamais ...  
182,2017-01-11,Le Monde,872mots,N. T.,La critique obstinée du progressisme,"    ...  toi! »  en un plus conservateur  « Cours moins vite, camarade, le nouveau monde  celui du réchauffement  climatique, de Goldman Sachs et de la Silicon Valley  est devant toi! .  Une invitation à la décroissance ...  "
183,2017-01-12,Le Monde,2491mots,,Barack Obama : « Notre démocratie est menacée à chaque fois que nous la considérons comme acquise »,"        ...  nous écouter, rendant tout terrain commun et tout compromis impossibles.  (...) Prenez le défi du réchauffement  climatique. En huit ans, nous avons réduit de moitié notre dépendance à l'égard du pétrole étranger ...  "
184,2017-03-18,Le Monde,717mots,Thomas Wieder,"En Allemagne, l'AfD traverse une passe difficile","    ...  voir l'Allemagne s'affranchir de ses engagements en matière de lutte contre le réchauffement  climatique. Un programme qui doit être détaillé lors de son prochain congrès, le 22 avril, à la ...  "
185,2017-03-30,Le Monde,637mots,Rosita Boisseau,"Hip-hop ou contemporain, entre les danses d'Amala Dianor","    ...  la langue. Mission accomplie un an plus tard, le voilà à Paris. Choc émotionnel et  climatique. Pour se faire des copains à la récré, il imite Michael Jackson, reproduit ses cris, s ...  "
186,2017-03-30,Le Monde,884mots,Gilles Paris,Le retour au réel de Donald Trump,"    ...  matière est l'ensemble des mesures prises par son prédécesseur pour lutter contre le réchauffement  climatique, comme il l'a encore montré mardi 28 mars. Cette contrerévolution fait les affaires du ...  "
187,2017-04-01,Le Monde,760mots,Frédéric Joignot,La faim dévore l'Afrique,"    ...  proie à une malnutrition endémique.  « La combinaison du conflit armé, de la sécheresse, du changement  climatique, des maladies et du ­choléra est un cauchemar »  , a déclaré M. Guterres. La Somalie est déchirée ...  "
188,2017-04-10,Le Monde,875mots,,"Avec les guerres, le retour de la famine","        ... Après deux cycles agricoles ruinés par le phénomène  climatique El Niño, la saison des pluies qui commence traditionnellement en avril sera déterminante. La sécheresse a déjà poussé des centaines de milliers de ...  "
189,2017-01-14,Le Monde,834mots,Gilles Paris,Confusion sur la ligne diplomatique de Trump,"    ...  de campagne du magnat de l'immobilier. Convaincu des  « risques sérieux posés par le changement  climatique »  , M. Tillerson a jugé  « important que les EtatsUnis maintiennent leur siège à la table des ...  "
190,2017-01-24,Le Monde,739mots,Nicolas Chapuis,"Hamon, le revenu universel au coeur du débat","    ...  de nombreuses reprises sur les plateaux télévisés. Le candidat a préempté la thématique du réchauffement  climatique, s'imposant rapidement dans les commentaires comme le plus sincère sur la question et le plus ...  "
191,2017-01-20,Le Monde,1316mots,Audrey Garric,Les singes pourraient disparaître d'ici 25 à 50 ans,"    ...  quoi il faut encore ajouter des périls émergents, tels que la pollution et le changement  climatique. Première incriminée, la demande effrénée de produits agricoles (soja, huile de palme, sucre de canne, riz ...  "
192,2017-02-22,Le Monde,645mots,,"Au Bangladesh, des palmiers contre la foudre","        ...  la déforestation accélérée des campagnes pour étendre la culture du riz, d'autres le réchauffement  climatique. Une chose est sûre, ce sont les tempêtes de printemps, connues dans cette région d'Asie ...  "
193,2017-03-18,Le Monde,958mots,Gilles Paris,Le premier budget « America first » de Trump,    ...  que M. Mulvaney a assuré que toutes les mesures visant à lutter contre le réchauffement  climatique constituaient  « un gaspillage »  de fonds publics (notamment les études de la NASA qui y sont rattachées ...  
194,2017-03-27,Le Monde,938mots,Sandrine Blanchard,Une histoire d'humour qui continue,"    ...  de Borat. Ce serait  « à la recherche de Xavier Dupont de Ligonnès »  pour Madénian,  « le réchauffement  climatique dans le Grand Nord »  pour VDB. Et pourquoi pas, un jour,  « présenter les Césars .  ...  "
195,2017-04-01,Le Monde,150mots,,International Vladimir Poutine veut s'imposer dans l'Arctique,"        ...  énorme potentiel »,  notamment en hydrocarbures. Vladimir Poutine a relativisé l'impact humain sur le réchauffement  climatique. Il a estimé  « impossible »  de lutter contre ce phénomène.  « La question est de s'y adapter ...  "
196,2017-04-03,Le Monde,1296mots,Maryline Baumard,Immigration : les vraies-fausses solutions,"    ...  d'origine, privilégiant l'arrêt des guerres, le codéveloppement et la lutte contre le dérèglement  climatique.  « Le premier devoir est de tarir le flux et nous devons avoir comme mot d'ordre ...  "
197,2017-01-21,Le Monde,1078mots,corine lesnes,Un président geek,"    ...  d'Air Force One, le 2 septembre 2015). Il s'agissait d'illustrer le changement  climatique en Alaska. Il a été le premier à se soumettre au bombardement de questions des internautes ...  "
198,2017-02-23,Le Monde,746mots,"par Kaushik Basu, François Bourguignon, Justin Yifu Lin et Joseph E. Stiglitz",Huit grands principes pour guider l'économie mondiale,"    ...  à l'environnement n'est pas durable. Il est impératif que l'atténuation du changement  climatique et les politiques d'adaptation ne soient pas un simple additif. Quatrièmement, il doit exister un ...  "
199,2017-02-08,Le Monde,686mots,Albert Lévy,Il faut adapter la ville aux énergies renouvelables,"    ...  par an, multiplication et aggravation des maladies chroniques cardiaques, respiratoires, etc.). De même, le dérèglement  climatique en cours, avec les conséquences économiques, sociales et sanitaires catastrophiques attendues, a conduit à une prise ...  "
200,2017-02-02,Le Monde,787mots,Bruno Meyerfeld,Les Seychelles veulent sauver le « coco-fesses »,"    ...  de Mai, avec ses 19,5 petits hectares, est particulièrement vulnérable.  « A cause du changement  climatique, il y a moins de pluie, plus de sécheresse : les risques de feu sont accrus,  s ...  "
201,2017-03-15,Le Monde,670mots,par Paul Jorion,"Lord Adair Turner, ou l'épiphanie du banquier","    ...  la ­Confédération de l'industrie bri­tannique ainsi que le Comité britannique sur le changement  climatique; il avait été, de 2000 à 2006, ­viceprésident pour l'Europe de la banque d ...  "
202,2017-04-27,Le Monde,1359mots,Propos recueillis par Laure Gasparotto,"Sting : « La musique n'est pas une détente. Un verre de vin, oui »",    ...  meilleurs terroirs. Le vermentino donne de bons résultats. Avezvous constaté des effets du dérèglement  climatique sur votre production? Il y a de plus en plus de différences d'une saison à ...  
203,2017-02-09,Le Monde,1150mots,Julia Pascual,Aulnay : l'affaire prend un virage politique,"    ...  Frédéric ­Gabet, l'avocat de ce gardien de la paix de 27 ans, dénonce un  «  climat malsain »  quand Pascal Rouiller, conseil d'un autre fonctionnaire mis en examen, parle d'une  « hystérisation ...  "
204,2017-02-13,Le Monde,353mots,Audrey Garric,La revue « Billebaude » sur les traces de l'ours,"    ...  500 exemplaires, a consacré ses précédentes explorations au loup, au lapin, à la forêt, au  climat ou encore à la ruralité. Le prochain numéro de cette revue semestrielle, qui sortira en juin ...  "
205,2017-02-21,Le Monde,852mots,Philippe Dagen,"A Genève, la petite boutique des horreurs",    ...  et Herculanum. Le phénomène projette dans l'atmosphère de telles quantités de cendres que le  climat en est gravement affecté sur l'ensemble du globe. Ces nuées faisant obstacle au rayonnement solaire ...  
206,2017-02-28,Le Monde,963mots,par Lakshmi Mittal,Lakshmi Mittal : « Assurer l'avenir de la sidérurgie »,    ...  nous sommes parfaitement d'accord avec les objectifs de l'Union européenne en matière de  climat. Mais nous ne sommes pas d'accord avec la méthode sur le point d'être mise ...  
207,2017-02-18,Le Monde,787mots,Philippe Bernard et Maryline Baumard (à Paris),Tensions entre Londres et Paris sur l'immigration,"    ...  Cazeneuve devait demander à Theresa May que soit donné un  « coup d'accélérateur . Dans le  climat de xénophobie accentué par le référendum sur le Brexit, la première ministre britannique joue la carte ...  "
208,2017-01-13,Le Monde,930mots,par Alain Frachon,"Obama, bilan complexe",    ...  d'Obama .  Le président a été plus heureux avec l'accord de Paris sur le  climat et celui de Vienne sur le nucléaire iranien. Les stratèges reconstruisent volontiers une ligne de causalité ...  
209,2017-01-14,Le Monde,1456mots,Propos recueillis par Jean-Baptiste de Montvalon,Gérard Grunberg « La gauche n'a jamais théorisé sa pratique du pouvoir »,"    ...  le plus souvent partagé une idéologie prônant la rupture plutôt que le compromis. Dans le  climat idéologique des années 1960 et 1970, François Mitterrandavait pu donner au PS l'objectif politique d ...  "
210,2017-01-20,Le Monde,1627mots,Gilles Paris (avec nos correspondants),Le monde bipolaire de Donald Trump,"    ...  le Mexique, dont 80 % des exportations sont destinées aux EtatsUnis. D'autant qu'un  climat d'incertitude ébranle l'économie mexicaine. Depuis le 8 novembre, le peso a chuté de 20 ...  "
211,2017-01-26,Le Monde,833mots,Par Caroline de la Marnierre,Pour un capitalisme de la réciprocité et de la responsabilité,    ...  ont de plus en plus de difficultés à jouer leur rôle de repères. Dans un  climat généralisé de défiance visàvis de ce qu'il est convenu d'appeler le « système ...  
212,2017-01-30,Le Monde,1002mots,Marie Bourreau et gilles paris,Donald Trump amorce le repli des Etats-Unis,"    ...  mondiales, car nous avons besoin de l'Amérique »,  notetil. C'est dans ce  climat que la nouvelle représentante des EtatsUnis à l'ONU, Nikki Haley, est entrée en fonctions ...  "
213,2017-01-06,Le Monde,1003mots,Propos recueillis par Martine Jacot,Laure Coudret-Laut : « Créons un nouvel élan européen »,"    ...  positionnement de ­l'Espagne (39 277 étudiants reçus), il s'explique bien sûr par son  climat très agréable et son faible coût de la vie  surtout depuis la crise de 2008  mais ...  "
214,2017-03-20,Le Monde,515mots,Nicolas Santolaria,La lutte des lattes,"    ...  alloué au repos, débouchant sur l'idéal d'une vie perpétuellement industrieuse, baignant dans un  climat d'insomnie permanent.  « L'insomnie est l'état dans lequel les ­activités de produire, de consommer ...  "
215,2017-03-21,Le Monde,395mots,"Philippe Mesmer (Tokyo, correspondance)",Le favori de la présidentielle coréenne prône le dialogue,    ... 'aide humanitaire et de promotion des échanges économiques et culturels devait permettre d'établir un  climat de confiance et d'évoluer vers une plus grande ouverture de la Corée du Nord. La ...  
216,2017-03-31,Le Monde,994mots,Laure Stephan,"Au Liban, Tripoli tente de panser les plaies du conflit syrien","    ...  qui ont fait plus de 200 morts, ont été alimentés par le conflit voisin.  « Un  climat quasi insurrectionnel régnait en 2011 dans la région. La guerre en Syrie a réveillé les peurs ...  "
217,2017-03-07,Le Monde,73mots,,Une performance d'art-activisme au Louvre,"        Une quarantaine de militants vêtus de noir ont pénétré dans le Musée du Louvre, dimanche 5 mars, pour y dénoncer le partenariat entre le musée et le groupe Total. Ils ont ...  "
218,2017-03-14,Le Monde,640mots,Catherine Quignon,Le burn-out lié au nouveau management,"    ...  ou la gestion des relations humaines au travail, cet enseignement  « est en décalage avec le  climat de compétition et d'hypersélection »  qui accompagne l'entrée dans ces grandes écoles, note le rapport ...  "
219,2017-04-01,Le Monde,88mots,,Recours contre l'oléoduc géant Keystone XL,"        ...  vers les raffineries du golfe du Mexique.  « L'oléoduc est une menace directe pour le  climat, la propreté de notre eau, la faune et les milliers de propriétaires terriens et de communautés ...  "
220,2017-04-03,Le Monde,404mots,Alain Constant,Le mal-être et l'angoisse des classes moyennes,"    ...  ces deux heures consacrées aux difficultés des classes moyennes françaises ne vont pas améliorer le  climat ambiant. Paupérisés, déclassés, endettés, débordés, épuisés, les hommes et les femmes suivis durant des mois par ...  "
221,2017-04-15,Le Monde,975mots,,Environnement,        ...  courts. S'assurer de la mise en oeuvre de l'accord de Paris sur le  climat. Réécrire le principe de précaution pour favoriser l'innovation responsable. Renforcer le contrôle des ­abattoirs. Lever ...  
222,2017-04-06,Le Monde,898mots,Rémi Barroux,« Dieselgate » : le vote mitigé des eurodéputés,"    ...  est partagée par le groupe socialiste au Parlement européen et par les ONG, Réseau Action  Climat (RAC), France Nature Environnement et l'association de consommateurs UFCQue choisir qui, dans un communiqué ...  "
223,2017-01-14,Le Monde,660mots,,Agenda,"        ...  à Melbourne. (9 h 30, Eurosport 2Eurosport Player.) Saut à skis Retour à un  climat plus hivernal avec la Coupe du monde du saut individuel, grand tremplin, à Wisla, en Pologne ...  "
224,2017-01-17,Le Monde,324mots,,Une journée de débats sur les crises migratoires,"        ... Uni; Laurence Tubiana, ­ancienne représentante ­spéciale pour la Conférence de ­Paris de 2015 sur le  climat 16 h 30. Les crises des migrations : dynamiques économiques et démographiques Débat modéré par Serge ­Michel ...  "
225,2017-01-04,Le Monde,1050mots,Olivier Faye,Marine Le Pen repart en campagne,"    ...  ces considérations stratégiques, la présidente du parti d'extrême droite doit faire face à un  climat incertain en interne, à la suite de la  « petite friction »  qu'elle a reconnue avec sa ...  "
226,2017-01-05,Le Monde,905mots,,Les constructeurs automobiles sous la pression de M. Trump,        ...  conditions de marché avaient évolué. Il a expliqué que le constructeur comptait désormais profiter du  climat probusiness que M. Trump a promis d'instaurer. Les entreprises américaines attendent beaucoup de la réforme ...  
227,2017-01-23,Le Monde,1147mots,Isabelle Chaperon,"A Davos, les émergents défendent la mondialisation","    ...  les multinationales prennent la température des affaires, signent des contrats. Mais pas seulement. Dans ce  climat politique électrique, face à l'inquiétante montée des populismes, les patrons reconnaissent de plus en plus ...  "
228,2017-01-18,Le Monde,1555mots,Adéa Guillot,"A Mannheim, année zéro pour les réfugiés","    ...  établi une sorte de charte, que nous appelons la ""Déclaration de Mannheim"", qui rappelle le  climat de tolérance et de vivreensemble que nous voulons pour notre ville. Avec cette déclaration, nous ...  "
229,2017-01-23,Le Monde,801mots,Emmanuel Schafroth,"Derrière le bruit politique, de bonnes surprises pour les marchés","    ...  pointent dans la même direction. Je ne pense pas que le cycle électoral modifiera ce  climat. » « Contexte favorable » L'incidence économique des événements politiques n'est, en effet, pas toujours à la ...  "
230,2017-01-10,Le Monde,1031mots,Jakub Iwaniuk,Série de violences racistes en Pologne,"    ...  les violences à caractère xénophobe, pourtant en hausse en Pologne. Les ONG parlent d'un  «  climat d'impunité .  Le ministre de l'intérieur, Mariusz Blaszczak, un des « faucons » du gouvernement, a rétorqué ...  "
231,2017-02-16,Le Monde,723mots,,Incertitude sur l'avenir du camp de migrants de Grande-Synthe,"        ... 'euros), souhaite que l'Etat y installe  "" des nouveaux abris, plus pérennes; plus adaptés au  climat et aux familles "".  Cet hiver, il a dû faire face à 29 intoxications au CO2 à ...  "
232,2017-02-11,Le Monde,788mots,Philippe Mesmer,Les cadeaux de Shinzo Abe pour amadouer Trump,"    ...  parties ont, sembletil, tout fait pour que le sommet se déroule dans un  climat favorable. Jeudi, l'entourage de M. Trump a laissé entendre que le nouveau président allait confirmer ...  "
233,2017-02-06,Le Monde,460mots,Olivier de Vleeschouwer,Le camélia sans son apparat,"    ...  de loin pour un descendant de l'églantier, sauf que c'était en novembre. Le  climat breton aime le camélia, puisque ces arbustes à floraison d'automne ou d'hiver supportent mal ...  "
234,2017-02-20,Le Monde,2505mots,Frédéric Bobin,"Libye. Zinten, entre guerre et paix","    ...  l'insurrection antiKadhafi de 2011, sait de quoi il parle quand il évoque ce  climat d'entredeux, ce gris du temps, ce flou du moment. Paix? Guerre? Zinten est à ...  "
235,2017-02-20,Le Monde,1354mots,Isabelle Regnier,"De Sundance à Berlin, la marche du cinéma afro-américain","    ...  fait attendre, il fallait juste qu'il sonne. »  Parmi les éléments qui ont créé un  climat favorable à la réception de ces films, la présidence de Barak Obama a évidemment compté. La ...  "
236,2017-02-24,Le Monde,1019mots,Charlotte Marchandise-Franquet,Charlotte Marchandise : « Abandonner le culte de la personnalité »,"    ... ­sastre écologique touche à présent tous les aspects d'une nature dont notre société dépend : climat, biodiversité, énergie, ­ressources, pollutions, dégradations du patrimoine naturel... avec la cohorte de drames humains qui l ...  "
237,2017-02-09,Le Monde,726mots,éric Albert,Les riches étrangers quittent le Royaume-Uni peu à peu,"    ... 'occupant de quatre multimillionnaires, qui réclame l'anonymat.  Elles ne sont pas là pour le  climat ou la gastronomie. Alors aujourd'hui, elles me disent : ""quitte à payer, autant aller dans un ...  "
238,2017-02-02,Le Monde,916mots,par Arnaud Leparmentier,Monter au front contre Trump,"    ...  taxer les multinationales américaines qui ne payent pas leurs impôts, comme Apple. Enfin, sur le  climat, il faut en finir avec l'Europe naïve : il ne suffit pas d'être exemplaire. Il ...  "
239,2017-03-15,Le Monde,245mots,,Mercredi 15 mars,"        ...  Avec Chiwetel Ejiofor, Casey Affleck. (EU, 2016, 115 min). France 5 20.50 Quand le  climat écrit l'histoire Documentaire de Sigrun Laste (All., 2014, 85 min). 23.50 Une carotte presque ...  "
