,date,publication,words,author,title,intro
247,2014-04-08,Les Echos,431mots,PATRICK DE JACQUELOT,Le Bangladesh se fait sa place dans le club des émergents,"    ...  ceux qui le peuvent y vont en avion » , s'étonne un observateur occidental. Quant au  climat politique, il se caractérise par la violence des affrontements entre les deux partis qui alternent au ...  "
248,2014-04-14,Les Echos,398mots,FABIENNE SCHMITT,Ligue des champions : avantage pour BeIN Sports,"    ...  les trois meilleures affiches par journée de la Ligue 1 de football (20162020). Le  climat semble s'apaiser Enfin, BeIN Sport monte en gamme sur la Ligue des champions. De plus ...  "
249,2014-01-23,Les Echos,63mots,PIERRICK FAY,Le blues des millionnaires de la villa Montmorency,"    ...  sécurisée. Du jamaisvu, de mémoire d'agent immobilier. Entre la pression fiscale et le  climat antiriches, la « sinistrose » semble avoir gagné ce quartier privilégié, dont les habitants sont de plus en ...  "
250,2014-01-21,Les Echos,231mots,PIERRE DE GASQUET,La Banque d'Italie reste réservée sur les signaux de reprise,"    ... Investissements dans le rouge « Malgré l'amélioration du  climat de confiance des entreprises, la fragilité du marché de l'emploi, qui freine l'expansion du revenu disponible et l'évolution du crédit ...  "
251,2014-02-11,Les Echos,311mots,LES ECHOS,Météo et marché : gare à l'excès de confiance,"    ...  l'évolution des cours de Bourse est censée suivre une marche aléatoire, alors que le  climat est de nature nettement plus cyclique, même si parfois on pense qu'il n'y a ...  "
252,2014-02-11,Les Echos,409mots,DOMINIQUE CHAPUIS,"En dépit de l'euro fort, L'Oréal enregistre une rentabilité record","    ...  Inde, et marquent le pas en Corée. L'Europe de son côté reste dans un  climat difficile, surtout dans les pays du Sud. Mais le champion de la beauté parvient à gagner ...  "
253,2014-01-31,Les Echos,480mots,,"Divisés sur l'Europe, Paris et Londres avancent sur la défense","        ...  les deux leaders vont se rencontrer sur la base militaire de Brize Norton. Malgré le  climat de défiance historique entre les deux pays pour tout ce qui touche à la défense, malgré ...  "
254,2014-02-25,Les Echos,357mots,PATRICK DE JACQUELOT,Naissance dans la douleur d'un vingt-neuvième Etat en Inde,"    ...  capitale soit choisie pour l'AP. Une situation complexe, lourde de difficultés potentielles vu le  climat conflictuel qui prévaut à la scission de l'Andhra Pradesh, qui inquiète fort les milieux d ...  "
255,2014-02-26,Les Echos,344mots,GUILLAUME DE CALIGNON,Une reprise encore « timide » dans l'Hexagone,"    ...  il n'a pas été pris en compte par Bruxelles, mais l'annonce rapide de son contenu précis pourrait  «améliorer le  climat des affaires, avec un impact positif sur l'investissement» .  ...  "
256,2014-03-17,Les Echos,360mots,ELSA FREYSSENET,Les électeurs de gauche moins mobilisés que ceux de droite,"    ...  l'opinion chez CSA : la tendance structurelle, la crise, le bilan décevant du gouvernement, le  climat délétère...  « A ce stade, on va battre un nouveau record »,  abonde Brice Teinturier, directeur général délégué ...  "
257,2014-03-10,Les Echos,316mots,CECILE CORNUDET,"Juppé, Fillon : le duel des numéros deux","    ... Dans un  climat politique qui les favorise, les deux anciens Premiers ministres tentent discrètement d'avancer leurs pions.  ...  "
258,2014-03-20,Les Echos,386mots,JOEL COSSARDEAUX,Affaire Tapie : Lagarde reste témoin assisté,"    ...  ministère de l'Economie.  « Cela m'a permis de confirmer mes déclarations précédentes dans un  climat serein et courtois » , atelle déclaré aux journalistes avant d'ajouter :  « Cet acte de procédure ...  "
259,2014-03-05,Les Echos,82mots,LES ECHOS,Réformes économiques : l'heure de vérité pour le pouvoir chinois,"    ...  plus équilibré, l'autre qui veut maintenir le statu quo pour éviter une dégradation du  climat social. L'Assemblée est une opportunité pour Li Keqiang de retrouver un peu de lumière alors ...  "
260,2014-03-24,Les Echos,452mots,PIERRE-ALAIN FURBURY,La formation de Marine Le Pen crée la surprise,"    ...  la promesse de François Hollande d'inverser la courbe du chômage en 2013 et du  climat délétère créé par les « affaires » qui secouent la droite. Le FN, qui avait présenté moins de ...  "
261,2014-03-21,Les Echos,338mots,NESSIM AIT-KACIMI,Le billet vert sort de quarantaine,"    ...  A court terme, le dollar devrait bénéficier de son statut de monnaie refuge, si le  climat de guerre froide persiste. Les opérateurs se réfugieront alors vers ce qui leur est le plus ...  "
262,2014-03-04,Les Echos,369mots,ANNE FEITZ,Poussée de fièvre sur les marchés du pétrole et du gaz européens,"    ...  menacée en cas de blocage total. Pas d'inquiétude à court terme, toutefois. Car le  climat, très doux cet hiver, a permis aux principaux pays européens de reconstituer leurs stocks, qui atteignent ...  "
263,2014-04-22,Les Echos,346mots,BENJAMIN QUENELLE,Moscou accuse Kiev de saper l'accord de Genève,"    ...  russes près de la frontière ukrainienne  « en raison de la situation »  . C'est dans ce  climat de tensions, loin des espoirs d'apaisement de Genève, qu'est arrivé hier à Kiev le ...  "
264,2014-04-01,Les Echos,436mots,ELSA CONESA|ANNE FEITZ,La « taxe carbone » entre en vigueur aujourd'hui,"    C'est aujourd'hui qu'entre officiellement en vigueur la contribution  climat énergie ou « taxe carbone », votée dans la loi de Finances 2014. A partir du 1er avril, la fiscalité sur le ...  "
265,2014-01-13,Les Echos,306mots,CECILE CORNUDET,Le pacte de responsabilité... médiatique,"    ...  l'appartement prêté à François Hollande. Des révélations, des rumeurs, une presse aux abois. Le président tente cette semaine de relancer son quinquennat dans le  climat le plus incertain qui soit.  ...  "
266,2014-01-10,Les Echos,278mots,DIDIER HUGUE,Vin : le négociant Joseph Drouhin rachète 112 hectares de vignes aux Etats-Unis,"    ...  bourguignon des vins rouges.  « Cette exploitation entièrement bio, bien plantée et cultivée, bénéficie d'un  climat très favorable » , indique Véronique DrouhinBoss, responsable de la production.  « C'était aussi une opportunité pour ...  "
267,2014-01-08,Les Echos,1220mots,MARIE BELLAN,Medef contre CGPME : les dessous d'une bataille,"    Mon ami Pierre » . C'est ainsi que JeanFrançois Roubaud, le président de la CGPME (Confédération générale du patronat des petites et moyennes entreprises), appelait encore tout récemment son homologue du ...  "
268,2014-01-23,Les Echos,301mots,YVES BOURDILLON,Dialogue de sourds sur la Syrie,    ... La conférence de paix s'est ouverte à Genève dans un  climat tendu  ...  
269,2014-01-28,Les Echos,325mots,EMMANUEL GRASLAND,La France ouvre de moins en moins d'usines,    ...  a un âge moyen supérieur à celui de nos grands concurrents européens. L'amélioration du  climat des affaires dans le reste de la zone euro ne semble pas les faire changer d ...  
270,2014-01-27,Les Echos,485mots,LAURENCE ALBERT,La jeune garde du PS veut mettre la main sur la banlieue rouge de Paris,"    ...  de gauche (70 % des suffrages), l'élection n'est pas jouée d'avance et le  climat tendu.  « La campagne est dure »,  reconnaît aussi Razzy Hammadi à Montreuil. Député de SeineSaintDenis ...  "
271,2014-01-31,Les Echos,228mots,FRANK NIEDERCORN,Finoptim améliore le rendement de votre cheminée de 30 %,"    ...  on estime à 3 millions le nombre de cheminées dans les foyers français, qui se trouvent dans le viseur de la réglementation et des plans d'amélioration du  climat. Frank Niedercorn  ...  "
272,2014-02-19,Les Echos,233mots,THIBAUT MADELIN,L'Airbus de l'énergie attendra,"    ...  volet de coopération, la politique énergétique. Paris, qui accueille en 2015 la conférence sur le  climat, et Berlin négocient avec la Commission les objectifs européens pour 2030. Les deux capitales plaident en ...  "
273,2014-02-19,Les Echos,418mots,VERONIQUE CHOCRON,Crédit Agricole : les contours de la future gouvernance se précisent,"    ...  SA n'ont souhaité faire de commentaires. Si les discussions se déroulent désormais dans un  climat apaisé, le projet n'est toutefois pas encore scellé.  « Le schéma est tracé, mais il n ...  "
274,2014-02-28,Les Echos,380mots,VERONIQUE LE BILLON,GDF Suez prend acte de la bérézina du marché européen,"    ...  depuis près d'un an, avec une dizaine d'autres énergéticiens  le groupe « Magritte » , des alertes sur le  « triple échec »  (compétitivité, sécurité d'approvisionnement et  climat) de la politique énergétique européenne.  ...  "
275,2014-02-28,Les Echos,108mots,VINCENT COLLEN,Pacte de responsabilité : syndicats et patronat face à face,"    ...  un terrain d'entente (Medef, CGPME, CFDT, CFTC, CGC) ?  « Rien n'est moins sûr. Le  climat reste très tendu, cela ne facilite pas le dialogue » , souligne l'un des participants. Les partenaires ...  "
276,2014-02-20,Les Echos,58mots,LES ECHOS,La préférence pour la stagnation,"    ...  de politiques affirmées, qui font la part trop belle à l'austérité. Et dans le  climat actuel d'autosatisfaction des élites, il n'y a pas lieu d'espérer un changement rapide ...  "
277,2014-02-11,Les Echos,272mots,BRUNO BONNELL,Des robots made in Africa,"    ...  l'association Women Technology, qui a construit ces machines conçues pour résister aux rigueurs du  climat équatorial et dont l'autonomie est assurée par des panneaux solaires, dans des quartiers qui ne ...  "
278,2014-02-04,Les Echos,60mots,LES ECHOS,DANEMARK : Le gouvernement remanié après le tollé Goldman Sachs,"    ...  ThorningSchmidt et la Gauche radicale. Changements notables : l'arrivée de l'ancien ministre du  Climat et de l'Energie Martin Lidegaard aux Affaires étrangères, et la nomination d'un ministre des ...  "
279,2014-02-04,Les Echos,764mots,DANIEL FORTIN,L'inquiétant vieillissement de l'outil industriel français,    ...  plus rapidement sa loi à tous les secteurs d'activité. C'est donc dans un  climat appelé à devenir de plus en plus hostile que les patrons français vont devoir accomplir leur ...  
280,2014-03-13,Les Echos,263mots,ISABELLE FICEK,L'UMP tente de retourner la situation à son avantage,"    ... Marc Ayrault. Renvoyant ainsi sur l'exécutif le doute et la suspicion distillés dans le  climat actuel. Retournant vers le gouvernement les projecteurs, JeanFrançois Copé n'a pas hésité à dénoncer ...  "
281,2014-03-04,Les Echos,555mots,ISABELLE FICEK,La contre-attaque de Copé suscite l'embarras à l'UMP,"    ...  que cet épisode  « n'est bon pour personne, sauf pour le FN »  et dénonce un  «  climat d'amalgame » . Signe que les rivalités à l'UMP sont toujours prêtes à éclater, Laurent Wauquiez ...  "
282,2014-03-21,Les Echos,85mots,ELSA FREYSSENET,François Rebsamen Dijon,"    ...  grâce à une alliance avec les centristes du Modem. Alliance rééditée cette année, mais le  climat national est, cette fois, nettement moins favorable à la gauche. S'il réussit son pari, le ...  "
283,2014-03-06,Les Echos,291mots,PHILIPPE BERTRAND,Conforama se joue d'un marché du meuble en crise,"    ...  l'Hexagone.  « Le problème,  regrette Thierry Guibert,  est que nos actionnaires sudafricains, face au  climat politique français, hésitent à investir en France. » Conforama tire aussi profit du fait que, dans le ...  "
284,2014-04-03,Les Echos,594mots,NOURIEL ROUBINI,La nonchalance des marchés face à la montée des risques,"    ...  nouveaux dangers émergent, qui menacent l'économie mondiale. Mais rien ne semble vouloir entamer l'optimisme des investisseurs. Problème : le même  climat prévalait juste avant la grande crise financière de 2008.  ...  "
285,2014-04-17,Les Echos,348mots,LAURENCE BOISSEAU,Comment la Bourse évalue la qualité des dirigeants,"    ...  plus elle est efficace. avec un nombre limité de matrice et de niveaux de hiérarchie. Dernier point, les entreprises au  climat social apaisé ont un niveau de productivité élevé. Laurence Boisseau  ...  "
286,2014-04-17,Les Echos,387mots,DOMINIQUE MALECOT,Philippe Yvin mobilise les énergies pour le Grand Paris,"    ...  de Philippe Yvin à la tête de la Société du Grand Paris a créé un  climat de suspicion, voire d'inquiétude chez les élus d'IledeFrance. Le conseiller du Premier ...  "
287,2014-04-02,Les Echos,367mots,DOMINIQUE SEUX,"Valls, le profil et la ligne",    ... (avec un résultat limité) pendant la primaire socialiste. Il devra en réalité donner des gages dans le sens inverse. Mais on peut espérer un meilleur  climat de confiance avec les entreprises.  ...  
288,2014-03-31,Les Echos,27mots,,réchauffement du climat : la carte dES risques,        ... réchauffement du  climat : la carte dES risques  ...  
289,2014-04-09,Les Echos,460mots,CATHERINE CHATIGNOUX|ANNE BAUER,Ukraine : la bataille du gaz russe,"    Dans le  climat d'extrême tension qui règne depuis quelques jours entre la Russie, l'Ukraine et, indirectement, l'Union européenne, les enjeux énergétiques se font plus pressants. Deux réunions techniques se ...  "
290,2014-04-29,Les Echos,405mots,SHARON WAJSBROT|VERONIQUE CHOCRON,Banques françaises : les enjeux des trimestriels,"    ...  suscite ainsi des inquiétudes.  « La visibilité est très faible et le rouble pâtit lourdement du  climat d'incertitude »  , souligne Xavier de Buhren, gérant chez Mirabaud. La crise ukrainienne risque de peser sur ...  "
291,2014-04-29,Les Echos,286mots,BENJAMIN QUENELLE,Le Kremlin serre la vis contre une industrie Internet russe en plein essor qui craint une censure accrue,"    ...  russes. « Le pays va entrer en récession. Avec les sanctions occidentales et la détérioration du  climat d'affaires, les sources de financement vont se tarir » , confie Alexandre Panov, qui a une grande ...  "
