,date,publication,words,author,title,intro
83,2014-01-22,Les Echos,413mots,ANNE BAUER,Bruxelles veut encore réduire les émissions de CO2,"    ...  la désindustrialisation de l'Europe ont pris le pas sur la lutte contre le réchauffement  climatique. Les ONG réclament un effort de 55 %, les industries gourmandes en énergie se seraient bien contentées ...  "
84,2014-01-31,Les Echos,632mots,LAURENT THEVENIN|NINON RENAUD,Jacques Richier : « Le consommateur exige de plus en plus de payer le prix qui correspond à son risque [...],"    ...  événements climatiques ? C'est notre métier d'anticiper et de gérer les conséquences du changement  climatique. Après, je crois que l'assurance a aussi un rôle de régulation à travers la prévention ...  "
85,2014-03-11,Les Echos,223mots,DAVID BARROUX,Trois leçons nucléaires,    ...  espoir de faire des économies. On parie sur l'atome pour lutter contre le réchauffement  climatique et pour doper son indépendance énergétique. La dernière leçon est qu'en dépit de ses handicaps ...  
86,2014-04-10,Les Echos,427mots,MICHEL DE GRANDI,Paris reste un partenaire de second rang à Mexico,    ...  à l'automobile. Dans le développement durable des perspectives se dessinent aussi. Une opportunité à un moment où les deux pays coopèrent dans la lutte contre le réchauffement  climatique. M. G.  ...  
87,2014-04-02,Les Echos,61mots,JOEL COSSARDEAUX,56 % des chefs d'entreprise s'inquiètent des prix de l'énergie,"    ...  préoccupés par la possibilité d'une rupture de leur « supply chain ». Globalement, 46 % sont convaincus que la pénurie de ressources naturelles et le changement  climatique auront un impact sur leurs activités.  ...  "
88,2014-01-23,Les Echos,354mots,MURYEL JACQUE,Vers un effritement des prix des matières premières,"    ...  La baisse anticipée des prix agricoles peut être remise en cause par un nouvel accident  climatique et il faudra mesurer, par exemple, l'impact réel de la vague de froid qui a ...  "
89,2014-01-22,Les Echos,295mots,THIBAUT MADELIN,"Climatisation : après la France, Bruxelles part en guerre contre Mercedes","    ...  de Mercedes non équipés du nouveau gaz réfrigérant homologué dans l'Union européenne.  « La politique  climatique devient une obsession pour la Commission, qui néglige la politique industrielle et la sécurité des véhicules ...  "
90,2014-01-28,Les Echos,915mots,FRANK NIEDERCORN,Les nouvelles promesses de la météorologie,"    ...  dernier dans le Sud Ouest. Ces progrès peuvent être cruciaux dans le contexte de changement  climatique prévu par les experts du Giec qui outre la monté du niveau des océans, prévoient aussi ...  "
91,2014-02-14,Les Echos,466mots,NICOLAS MADELAINE,Inondations en Grande-Bretagne : Cameron sous pression,"    ...  Owen Paterson, est un sceptique avoué sur l'impact des activités humaines sur le changement  climatique. Il n'est pas prouvé que la météo actuelle soit une conséquence directe des gaz à ...  "
92,2014-02-26,Les Echos,398mots,GABRIEL GRESILLON,Pékin face au défi politique de la pollution atmosphérique,"    ...  vivable »  pour les êtres humains. Et le conseiller du gouvernement pour la question du réchauffement  climatique, Li Junfeng, a estimé que la pollution avait atteint un degré « intolérable », rendant la situation comparable ...  "
93,2014-04-07,Les Echos,489mots,JEAN-PIERRE CLAMADIEU,"« Créer, c'est vivre deux fois »","    ...  s'impose plus que jamais pour trouver des réponses à l'explosion démographique, au réchauffement  climatique ou, conséquence immédiate, à l'incontournable transition énergétique. Cette dernière nous concerne tout particulièrement : en tant ...  "
94,2014-02-06,Les Echos,324mots,VALERIE LEBOUCQ,Les précollections jouent un rôle moteur,    ...  que les vitrines des marques de luxe démontrent à leur manière les effets du réchauffement  climatique et donnent l'impression qu'il n'y a plus de saison. Machine à susciter le ...  
95,2014-02-21,Les Echos,339mots,LAURENT THEVENIN,"Revenu dans le vert, Groupama est vigilant sur l'assurance agricole","    ...  couverte »,  ajoutetil. Groupama espère notamment obtenir, enfin, un mécanisme de réassurance d'Etat pour la multirisque  climatique sur récolte, un dossier qu'il pousse depuis des années. L. T.  ...  "
96,2014-03-11,Les Echos,304mots,,Infrastructures flexibles,"        ...  à Paris en 2015 avec un accord global ambitieux sur la lutte contre le changement  climatique. En Europe, la Commission a présenté ses nouveaux objectifs de réduction des émissions de gaz à ...  "
97,2014-03-18,Les Echos,25mots,,Des cours exposés à cet événement climatique majeur,        ... Des cours exposés à cet événement  climatique majeur  ...  
98,2014-03-14,Les Echos,605mots,GERARD MOATTI,"Entre l'homme et la machine, une lutte vieille de deux siècles","    ...  Glorieuses, mais renaît à partir des années 1970, renforcée par les inquiétudes sur le changement  climatique. Enfin, les contestations visent aussi, plus fondamentalement, les effets « déshumanisants » des techniques. De Rousseau (« Discours sur ...  "
99,2014-03-25,Les Echos,200mots,,Steeve Briois,"        ...  tout. La météo économique étant aussi morose dans le PasdeCalais que la météo  climatique, la récolte fut aisée pour le jeune Steeve. Dès l'âge de seize ans, il s ...  "
100,2014-02-12,Les Echos,484mots,MATTHIEU QUIRET,Le pressing profite de la loi « anti-perchlo » pour se réinventer,"    ...  avec l'Ademe qui relativise l'impact de chaque technologie sur 9 indicateurs (écotoxicité, réchauffement  climatique, acidification des eaux, etc.). L'aquanettoyage confirme sa supériorité écologique, mais reste dans quatre domaines moins ...  "
101,2014-02-05,Les Echos,270mots,CHRISTIAN LIENHARDT,Cooltech industrialise le froid magnétique,"    ... 'affranchit également des compresseurs à gaz réfrigérants, qui ont l'inconvénient de contribuer au réchauffement  climatique. Christian Muller estime son marché à quelque 6 millions d'appareils par an en Europe. Des ...  "
102,2014-02-04,Les Echos,718mots,LIONEL STEINMANN,Barbara Dalibard : « Il n'y a pas de remise en cause du modèle économique du TGV »,    ...  de la transition énergétique qu'il va falloir mener si on veut contenir le changement  climatique à des niveaux supportables. Où en est la concurrence entre le TGV et l'avion ? Elle ...  
103,2014-03-17,Les Echos,326mots,YANN VERDO,Des particules qui s'infiltrent dans les voies respiratoires,    ...  élèves de l'Europe pour la qualité de l'air  est lié à la situation  climatique qui prévaut depuis quelques semaines. L'anticyclone ancré audessus de notre pays se traduit par ...  
104,2014-03-10,Les Echos,154mots,YANN VERDO,Un virus inconnu congelé dans le pergélisol sibérien,"    ...  proche, les ressources minières et énergétiques des régions circumpolaires, rendues plus accessibles par le réchauffement  climatique, font l'objet d'une véritable ruée de la part des multinationales; mais, lors d'un ...  "
105,2014-04-25,Les Echos,264mots,CHRISTIANE PERRUCHOT,Active3D dynamise la gestion d'immeubles,"    ...  2003 de Benoît Vervandier, informaticien de production chez Thomson, interpelle Olivier Gaudard, ingénieur en génie  climatique qui arpente les chantiers, des piles de plans et documents sous le bras. Ainsi naît Active3D ...  "
106,2014-02-20,Les Echos,168mots,NEILA BEYLER,José Bové Député européen EELV,"    ... 'Union européenne est en dessous des mesures qu'il faudrait prendre pour limiter le réchauffement  climatique de 2 degrés. Quand les chefs d'Etat et de gouvernement s'endorment, il faut les ...  "
107,2014-02-10,Les Echos,672mots,DOMINIQUE MOISI,L'Afrique trouvera la prospérité si elle oublie ses démons,"    ...  l'Afrique est comme un résumé des défis auxquels le monde se trouve confronté : réchauffement  climatique, désertification entraînant des phénomènes migratoires, risques de pandémies, mais aussi espoir de nouvelles formes de croissance ...  "
108,2014-01-30,Les Echos,463mots,VERONIQUE LE BILLON,Nucléaire : l'ASN renforce les normes post-Fukushima,    ...  associations antinucléaires ont notamment pointé la nécessité de prendre davantage en compte le changement  climatique. Une enveloppe de 10 milliards Ce durcissement des normes de sûreté pour les futurs équipements a ...  
109,2014-04-15,Les Echos,471mots,REJANE REIBAUD,Virginie Maisonneuve relève l'immense défi de la diversification,"    ...  petites filles chinoises. Pour Pimco, elle perçoit les grands thèmes à développer comme le changement  climatique, le vieillissement de la population et bien sûr, la poursuite du développement des pays émergents.  « Les ...  "
110,2014-04-03,Les Echos,398mots,ANNE BAUER,François Hollande et Angela Merkel promettent d'agir ensemble pour la sécurité en Afrique,"    ...  ensemble autour de trois enjeux : la sécurité, le développement et la lutte contre le changement  climatique » , a déclaré François Hollande, tandis qu'à ses côtés, Angela Merkel promettait un doublement du budget ...  "
111,2014-01-27,Les Echos,716mots,JACQUES HUBERT-RODIER,"Avec les JO, Poutine joue la place de la Russie dans le monde","    ...  son pouvoir en créant de toutes pièces des Jeux qui sont comme un défi au  climat, à la géographie sinon à la géopolitique, compte tenu de la proximité de Sotchi des « hauts ...  "
112,2014-01-24,Les Echos,320mots,,Le président iranien poursuit son offensive diplomatique,"        ...  signe. Turban blanc, regard doux et ton vigoureux, Hassan Rohani s'est inscrit dans le  climat « social » qui règne sur Davos cette année, du message papal aux réflexions sur l'emploi des ...  "
113,2014-02-19,Les Echos,364mots,DANIEL FORTIN,"De Sochaux à Wuhan, le destin de Peugeot","    ...  Europe, ni son retard en Amérique du Sud, ni sa taille trop petite dans le  climat actuel de course au gigantisme qui sévit dans l'industrie automobile mondiale ne sont traités par ...  "
114,2014-02-10,Les Echos,411mots,FABIENNE SCHMITT,Bras de fer entre la rédaction de « Libé » et ses actionnaires,"    ...  Pour les salariés, le plan ne tient pas la route »,  affirme un autre, soulignant un  «  climat très nerveux » . Audelà du contenu du plan, les salariés contestent la méthode.  « Il ne correspond ...  "
115,2014-02-12,Les Echos,334mots,JOEL COSSARDEAUX,Etat d'urgence pour l'apiculture française,    ...  de la « période faste » des années 1990. La profession met en cause le dérèglement du  climat. Mais continue surtout de montrer du doigt l'usage par l'agriculture intensive des insecticides néonicotinoïdes ...  
116,2014-02-14,Les Echos,70mots,CHRISTOPHE PALIERSE,Jeux Olympiques quasi estivaux à Sotchi,"    ...  balnéaire de la mer Noire, à la même latitude que Nice, étant réputée pour son  climat clément. Mais le phénonème est également observé en montagne. A Rosa Khutor, où se déroulent les ...  "
117,2014-03-21,Les Echos,750mots,PIERRE-ALAIN FURBURY,Municipales : Hollande affronte sa première épreuve électorale,"    ...  résultat. Et qu'il lui faudra en tirer des enseignements.  « Une élection, ça génère un  climat politique » , rappelle un ténor de la majorité.  « Si c'est la catastrophe, il sera obligé d ...  "
118,2014-03-11,Les Echos,415mots,ISABELLE FICEK,"Sarkozy silencieux, ses proches à l'offensive","    ...  nos candidats aux municipales, qui se battent comme des chiens, voient leurs efforts menacés par toutes ces histoires , observe un ancien ministre de Nicolas Sarkozy.  Le  climat est délétère.  » Isabelle Ficek  ...  "
119,2014-03-12,Les Echos,280mots,PHILIPPE LEGUELTEL,"A Saint-Lô, Pascal Baisnée ne voulait plus « être spectateur »","    ...  qui a toute sa confiance.  « Je vois en lui l'entrepreneur susceptible de créer un  climat favorable au développement économique. »  L'économie, c'est le créneau de Pascal Baisnée.  « Ma priorité est ...  "
120,2014-03-13,Les Echos,469mots,LAURENCE BOISSEAU,"L'AMF réclame 2,2 millions d'euros à Nicolas Miguet","    ...  l'AMF, le gendarme boursier. Alors que les audiences se déroulent en général dans un  climat feutré, Nicolas Miguet, dont l'un des faits d'armes est d'avoir tenté à trois ...  "
121,2014-03-12,Les Echos,468mots,JEAN-PHILIPPE LACOUR,Audi se prépare à conquérir la « Ligue des champions » de l'auto premium,"    ...  opérationnelle est une obligation chez Audi. Celleci a pâti l'an dernier d'un  climat de guerre des prix, en reculant d'un point, à 10,1 %. Cela reste audessus ...  "
122,2014-03-05,Les Echos,359mots,PIERRE-ALAIN FURBURY,Une étape politiquement cruciale pour « donner corps au pacte »,"    ...  pour financer la baisse des charges. Le tout sur fond de rumeurs de remaniement.  « Un  climat bizarre »,  concède un ministre. Cette impression de flottement est d'autant plus grande que les Français ...  "
123,2014-03-18,Les Echos,709mots,FRANK NIEDERCORN,« Les robots auront un impact sur la société »,"    ...  peu le rôle qu'a eu l'ordinateur dans le domaine de la prédiction du  climat. Cela peutil avoir des conséquences sur l'industrie ? Oui, car l'apprentissage des robots est ...  "
124,2014-03-28,Les Echos,163mots,JULIEN DAMON,Le droit à l'eau pour tous,"    ...  sujets aussi divers que l'autonomie économique des femmes, les liens entre pauvreté et stratégie  climat, la conciliation entre croissance et travail décent. Il en va ainsi de cette idée et de ...  "
125,2014-04-01,Les Echos,458mots,,"Dérembourser les lunettes, c'est fragiliser le made in France","        ...  en réussissant même parfois des relocalisations. Ce ne sont pas non plus des victimes du  climat économique. Elles exportent aujourd'hui le savoirfaire français dans des domaines comme la plasturgie, les ...  "
126,2014-03-26,Les Echos,449mots,VERONIQUE LE BILLON|EMMANUEL GRASLAND|BRUNO TREVIDIC,Paris et Pékin amplifient leur partenariat avec un accord pour produire 1.000 hélicoptères,"    ...  prévue l'an prochain, estime un proche du dossier. Ces signatures interviennent alors que le  climat s'améliore entre Pékin et Paris. Le gouvernement chinois a annoncé la semaine dernière l'abandon ...  "
127,2014-04-25,Les Echos,386mots,OLIVIER DUCUING,"Stéphane Tranier, une volonté en béton chez Alkern","    ...  Capital, qui emploie 750 personnes et réalise 151 millions d'euros de ventes. Malgré le  climat morose, Alkern, dont le siège est à Harnes, près de Lens, revendique une politique constante de ...  "
128,2014-01-22,Les Echos,243mots,FAVILLA,"Les Britanniques, l'immigration et l'europhobie","    ...  parce que les sentiments antiimmigration et antieuropéens y sont étroitement liés, dans un  climat de fébrilité attisé par l'approche d'élections décisives. Ruse de l'histoire : les dirigeants britanniques ...  "
129,2014-01-16,Les Echos,219mots,ANNE FEITZ,Carburants : nouveau recul de la consommation en 2013,"    ...  celle de l'essence, devrait être alourdie à compter de 2015, par le biais de la contribution  climaténergie instaurée dans le projet de loi de Finances pour 2014. Anne Feitz  ...  "
130,2014-01-31,Les Echos,135mots,MARIE-SOPHIE RAMSPACHER,Bruno Mettling (Orange),"    ...  du travail progressent, contre 79 % en octobre 2010. Seuls 2 % des sondés estiment que le  climat interne est plus mauvais, alors qu'ils étaient 16 % à le penser en 2010.  « Ce chiffre ...  "
131,2014-01-08,Les Echos,343mots,,2014 : sept élections présidentielles prévues en Amérique latine,"        ...  Amérique centrale (Salvador, Costa Rica et Panama) seront plus disputées, mais se dérouleront dans un  climat économique favorable puisque la croissance devrait s'accélérer cette année grâce à une stabilisation de la ...  "
132,2014-02-28,Les Echos,581mots,ISABELLE COUET,Dette : les Etats de la zone euro en avance sur leurs plans de financement,"    ... Les DixHuit doivent emprunter 900 milliards d'euros sur les marchés financiers cette année.Ils ont financé près d'un quart de leurs besoins, dans un  climat de taux propice.  ...  "
133,2014-02-11,Les Echos,1343mots,MARIE-CHRISTINE CORBIER,Quand l'école part à la rencontre de l'entreprise...,"    ...  mener le combat pour l'emploi, pour la compétitivité, pour l'innovation ».  Et évoque un  «  climat de confiance peu à peu trouvé entre l'école et l'entreprise ».  Un sondage publié le ...  "
134,2014-02-21,Les Echos,676mots,ERIC LE BOUCHER,Cachez cette Europe que je ne saurais voir,"    ...  chef de l'Etat, qui a redit sa foi dans la construction européenne, mais le  climat général est très malsain. Les Français n'entendent plus que le lamento quotidien des plaintes : l ...  "
135,2014-02-03,Les Echos,275mots,EDOUARD LEDERER,L'épargne des Français plie mais ne s'effondre pas,"    ...  nombreux Français de soutenir leur pouvoir d'achat, voire de régler leurs impôts, dans un  climat de stagnation des revenus et de pression fiscale renforcée. L'arme est puissante pour les ménages ...  "
136,2014-03-04,Les Echos,233mots,,Péril rouge,"        ...  en tout cas joué de malchance. Quand les BRIC avaient la cote, sa filiale était en pleine restructuration. Ses efforts commençaient à mieux payer quand le  climat géopolitique s'est tendu.  ...  "
137,2014-03-05,Les Echos,369mots,BENJAMIN QUENELLE,"Face à la crise, la communauté d'affaires à Moscou s'interroge","    ... 'augmenter les rentrées budgétaires. « Vue à court terme ! », réplique un observateur européen, inquiet pour le  climat des affaires. « La Russie offre encore moins de visibilité », prévientil. « Un coup dur pour la ...  "
138,2014-03-20,Les Echos,375mots,CATHERINE CHATIGNOUX,Les ratés de l'Europe de l'énergie,"    ... 'Union sur la table des négociations ne manquent pas, cependant. Car l'actuel paquet énergieclimat, adopté en 2008, qui visait à réduire de 20 % d'ici à 2020 les émissions de ...  "
139,2014-03-11,Les Echos,388mots,GABRIELLE SERRAZ,Paraboot se construit une usine pour le XXIe siècle,"    ...  au crédit d'impôt recherche a déclenché l'investissement, c'est certain ».  Pour lui, un  climat de confiance est en train de s'instaurer, une condition nécessaire,  « car il suffit d'un ...  "
140,2014-04-04,Les Echos,425mots,ANTOINE BOUDET,PwC a finalisé l'acquisition de Booz &amp; Co,"    ...  les perspectives que donne cette opération. » En France, Bernard Gainnier perçoit d'ailleurs que  « le  climat des affaires est meilleur » . Les activités du bureau français  « vont bien et progressent depuis décembre » . S ...  "
141,2014-03-17,Les Echos,385mots,BENJAMIN QUENELLE,L'inquiétude monte dans les milieux d'affaires russes,"    ... Chute du rouble et regain d'inflation : à Moscou, le  climat économique vire à la franche morosité.  ...  "
142,2014-03-17,Les Echos,253mots,HERVé LE TREUT,Les leçons de l'hiver,"    ...  directement liée au réchauffement global de notre planète, et au dérèglement qu'il engendre. Le  climat de notre planète est marqué par la présence de grands « objets » météorologiques, organisés à l'échelle ...  "
143,2014-03-17,Les Echos,433mots,VERONIQUE LE BILLON|ANNE FEITZ,EDF et GDF Suez pénalisés par la douceur de l'hiver,"    ...  millions d'euros et de résultat net de 178 millions. Pour EDF aussi, l'effet  climat avait généré un surplus d'Ebitda de 353 millions d'euros l'an dernier et un ...  "
144,2014-03-14,Les Echos,185mots,LES ECHOS,"Sophie Quatrehomme, Nicolas Chung",    ...  services au département du développement numérique des territoires de la direction du développement territorial et du réseau. Il était chef de projets d'investissement à CDC  Climat de 2010 à 2013.  ...  
145,2014-04-23,Les Echos,388mots,BENJAMIN QUENELLE,"Derrière le discours musclé du Kremlin, la récession menace la Russie","    ...  atteint plus de 46 milliards d'euros au premier trimestre, reflète à elle seule l'inquiétude croissante sur la stabilité financière et sur l'ensemble du  climat des affaires. Benjamin Quénelle  ...  "
146,2014-04-10,Les Echos,387mots,YVES BOURDILLON,Ali Benflis : « Il faut libéraliser massivement l'économie »,"    Quel diagnostic portezvous sur votre pays ? Le pays est en panne. Le  climat des affaires est mauvais, notamment du fait que nous vivons dans une économie administrée. Il faut permettre aux ...  "
147,2014-01-15,Les Echos,60mots,LES ECHOS,400 euros / de subvention pour un vélo électrique à marseille,"    ...  Marseille Provence Métropole s'est en effet donné un objectif de diminution du gaz à effet de serre sur son territoire, fixé lors de l'adoption du Plan  climat énergie territorial.  ...  "
148,2014-01-28,Les Echos,88mots,LES ECHOS,"Transition énergétique : syndicats, ONG et élus veulent une accélération","    ...  être votée d'ici à fin 2014. Les signataires de cet appel (FNE, Réseau action  climat, ARF, Unsa, CFDT, Cler, Energy cities, Syndicat des énergies renouvelables, Orée, etc.) ont fait part de ...  "
149,2014-01-10,Les Echos,844mots,ETIENNE LEFEBVRE|JACQUES HUBERT-RODIER,"Laurent Fabius : « Pour diminuer durablement le chômage, il faut davantage de croissance »","    ...  Jean Lévy; la transition énergétique, parallèlement à la préparation de la Conférence mondiale sur le  climat fin 2015 à Paris; enfin, le tourisme, qui peut être une véritable mine d'or et ...  "
150,2014-01-24,Les Echos,333mots,PIERRE DE GASQUET,Hollande au Vatican sur fond de réforme de l'Eglise,"    ...  municipales françaises, la première visite de François Hollande au Vatican intervient aujourd'hui dans un  climat tendu. Certes, le pape jésuite  très critique sur le capitalisme débridé et la « globalisation de l ...  "
151,2014-02-18,Les Echos,340mots,DANIEL FORTIN,Alstom ou le mauvais remake,"    ... Estce si grave, docteur ? Dans le  climat de pessimisme actuel où se complaît la France, il faut garder son sangfroid. Dix ans après, la crise vécue par Alstom a laissé ...  "
152,2014-02-07,Les Echos,343mots,PIERRE DONADIEU,"L'Afrique du Sud, nouvelle destination de l'industrie du cinéma","    ...  atouts majeurs Outre sa grande variété de paysages,  « l'Afrique du Sud bénéficie d'un  climat idéal. Quel que soit le moment de l'année où vous tournez, vous pouvez avoir du ...  "
153,2014-02-04,Les Echos,309mots,PIERRE DE GASQUET,Beppe Grillo et la tactique du « bordel ambiant »,"    ...  n'a aucune chance d'aboutir, c'est une pierre dans le jardin du Quirinal qui se déclare de plus en plus préoccupé par la montée du «  climat empoisonné » au Parlement.  ...  "
154,2014-02-28,Les Echos,462mots,ISABELLE FICEK,Copé accusé de favoritisme au détriment de l'UMP,"    ...  dont la droite se serait bien passée, à un mois des municipales et dans un  climat de défiance croissante des Français envers les politiques. Dans son édition d'hier, « Le Point » accuse ...  "
155,2014-03-05,Les Echos,437mots,GABRIEL GRESILLON,"A Pékin, un grand show politique pour clarifier les projets du pouvoir","    ...  essentiel de maintenir l'activité économique à son niveau actuel pour éviter toute dégradation du  climat social. Jusqu'à présent, ce sont eux qui semblent avoir obtenu gain de cause. Au printemps ...  "
156,2014-03-07,Les Echos,347mots,GUILLAUME MAUJEAN,La question à 50 milliards,"    ...  uns de déménager leur siège social. Inutile d'aller chercher très loin leurs motivations : le  climat des affaires en France, l'instabilité fiscale, l'hostilité à l'égard des chefs d'entreprise ...  "
157,2014-03-27,Les Echos,383mots,HUBERT VIALATTE,Les divisions de la gauche peuvent faire basculer Montpellier à droite,"    ...  gare TGV, 5.000 logements neufs par an... Mais son avance est ténue. La faute, laissetil entendre, au  climat national et à la candidature socialiste dissidente de Philippe Saurel.  ...  "
158,2014-04-29,Les Echos,772mots,CECILE CORNUDET,Hollande et sa gauche : histoire d'un rendez-vous raté,"    ...  Sur les symboles (taxe à 75 %) et sur les effets de manches. Il crée un  climat, plus qu'il ne dévoile ses intentions. Il dit des mots, redressement, économies, efforts. Pas question ...  "
159,2014-04-22,Les Echos,291mots,JOEL COSSARDEAUX,La délicate gestion de « l'après-Morelle »,    ...  la majorité. Le départ précipité d'Aquilino Morelle est venu tendre un peu plus le  climat quasi explosif qui y règne à la veille de la présentation du plan d'économies budgétaires ...  
160,2014-01-09,Les Echos,376mots,ANNE FEITZ,"Energies vertes : Bruxelles table sur la création de 1,2 million d'emplois","    ...  possibles afin de préparer les discussions, qui doivent démarrer au printemps, sur le paquet énergieclimat à l'horizon 2030. La Commission doit présenter le 22 janvier ses recommandations, encore en discussion ...  "
161,2014-02-06,Les Echos,207mots,JACQUES HUBERT-RODIER,L'Italie et le « mirage » des pays du Golfe,    ...  la scène d'un opérabouffe. L'Italie n'estelle pas classée pour le  climat des affaires au 65e rang par la Banque mondiale derrière le Rwanda ? La péninsule paie simplement ...  
162,2014-02-04,Les Echos,36mots,,éTATS-UNIS : L'INDUSTRIE RALENTIT EN JANVIER,"        ... 'enquête Markit auprès des directeurs d'achat. L'indice PMI est revenu à 53,7 contre 55,0 en décembre. Les entreprises interrogées ont attribué ce ralentissement au  climat anormalement rigoureux.  ...  "
163,2014-02-06,Les Echos,169mots,LES ECHOS,Baisse des charges : Hollande veut aller vite,"    Surtout, ne pas laisser les sujets de société empoisonner le  climat politique et dévier de l'objectif numéro un : relancer l'économie pour favoriser la création d'emplois. François Hollande est résolu ...  "
