,date,publication,words,author,title,intro
164,2014-02-24,Les Echos,520mots,BENJAMIN QUENELLE,Sotchi s'interroge sur son avenir post-Olympique,"    ...  de ce genre en Europe. Le coût de l'entretien de cette neige sous un  climat estival, hier justifié pour le succès des Jeux, ne risquetil pas à lui seul ...  "
165,2014-03-06,Les Echos,366mots,CATHERINE CHATIGNOUX,Les faiblesses du candidat Juncker,"    ...  crise, il a, à nouveau, abandonné le leadership à Paris et à Berlin dans le  climat de panique ambiant. Cet hommelà sauratil incarner l'intérêt supérieur de l'Europe ...  "
166,2014-03-04,Les Echos,335mots,VIRGINIE ROBERT,"L'économie russe, première victime des menaces militaires du Kremlin","    ...  cause, notamment, le manque d'enthousiasme des investisseurs étrangers, faute de réelle diversification industrielle, de programme concret de privatisations, d'un bon  climat des affaires et d'un système judiciaire transparent.  ...  "
167,2014-03-07,Les Echos,400mots,PIERRE-ALAIN FURBURY,Popularité : Hollande reprend des couleurs à gauche,    ...  lui aura peutêtre donné un peu de baume au coeur. Non pas que le  climat ait changé du tout au tout. Mais la mise sous surveillance  « renforcée »  de la France par ...  
168,2014-03-06,Les Echos,315mots,MICHEL DE GRANDI,L'ombre de Chávez plane toujours sur le Venezuela,    ...  ailleurs. Le gouvernement ne peut espérer un retour des capitaux sans avoir auparavant apaisé le  climat social. Or cela semble une tâche bien difficile quand Caracas apparaît comme la troisième ville la ...  
169,2014-04-18,Les Echos,597mots,JEAN-FRANCIS PECRESSE,Pourquoi aimer les bordeaux 2013,"    ...  réduire à un jugement aussi rédhibitoire. De fait, bien plus que les aléas d'un  climat vraiment capricieux  puisqu'entre ce printemps froid et cette automne maussade s'intercala l'un des ...  "
170,2014-03-31,Les Echos,324mots,MICHEL DE GRANDI,Les humanitaires pris pour cibles en Birmanie,    ...  de la Birmanie à la suite de ces attaques. Ces nouvelles émeutes interviennent dans un  climat déjà dégradé par ces rivalités interethniques. Human Rights Watch (HRW) a appelé quelques jours plus ...  
171,2014-03-31,Les Echos,344mots,GUILLAUME DE CALIGNON,La faible consommation va peser sur la reprise,"    ...  qui avaient conduit les consommateurs à anticiper leurs achats fin 2013. Ensuite, la douceur du  climat n'avait pas incité les Français à consommer de l'énergie. Ces températures clémentes se sont ...  "
172,2014-04-03,Les Echos,45mots,LES ECHOS,Bordeaux : le 2013 mobilise peu,"    Aquitaine :  La mauvaise réputation du millésime 2013 des vins de Bordeaux, desservi par un  climat pluvieux au printemps et des grêles d'été, se confirme. La dégustation des 200 crus bourgeois du ...  "
173,2014-04-25,Les Echos,466mots,,La fin des « petits chefs »,"        ...  porté, ou au minimum suivi avec bienveillance, par le management supérieur et piloté dans un  climat de confiance. L'équipe est par ailleurs constituée de profils légitimes, voire experts, prenant plaisir à ...  "
174,2014-01-13,Les Echos,297mots,PAUL MOLGA|SHARON WAJSBROT,Pourquoi les PME renâclent à adopter le nouveau standard Sepa,"    ... 'approche du 1er février, les entreprises ont vu les sollicitations de prestataires se multiplier. Un  climat d'urgence propice aux fraudes :  « Certains acteurs utilisent le prétexte de la migration pour proposer des ...  "
175,2014-01-14,Les Echos,287mots,CECILE CORNUDET,L'homme qui voulait restaurer la confiance,"    ...  ses grandes interventions, afin de se ménager une marge de surprise. L'actualité et le  climat l'en empêchent aujourd'hui : il est condamné à surprendre. <a href=""mailto:ccornudet@lesechos.fr""> ccornudet@lesechos.fr Cécile Cornudet  ...  "
176,2014-01-21,Les Echos,492mots,MAXIME AMIOT,Comment le scénario Dong feng a fini par s'imposer pour Peugeot,"    ...  a même pris son propre conseil, JP Morgan, pour étudier des scénarios alternatifs, signe du  climat de défiance au sein de l'instance. Des contacts auraient été pris avec l'italien Fiat ...  "
177,2014-01-23,Les Echos,461mots,,"Nous, grandes écoles, avons notre mot à dire sur l'avenir du pays","        ...  universitaires au meilleur niveau. Ils cultivent la diversité des acteurs, valorisent leurs pépites, entretiennent un  climat de confiance et de liberté qui dynamise l'innovation. Et la France ? Nos grandes écoles doivent ...  "
178,2014-01-13,Les Echos,52mots,MASSIMO PRANDI,Turquie : Erdogan réitère sa promesse de réformer la justice,"    ...  de voix au chapitre dans la nomination des juges et des procureurs, rend incandescent le  climat au Parlement. Samedi, la réunion de la commission parlementaire de la Justice s'est achevée sur ...  "
179,2014-01-03,Les Echos,373mots,ELSA CONESA,Des effets incertains sur l'emploi,"    ...  explications sont multiples : volonté des employeurs de préserver la motivation de leurs salariés et le  climat social, structure du marché du travail en France, effet du salaire minimum sur l'échelle des ...  "
180,2014-01-29,Les Echos,317mots,ETIENNE LEFEBVRE,Impôts des entreprises : il faut harmoniser,    ...  qui s'est tenu lundi a montré que l'arrivée en force du SPD au sein du gouvernement Merkel avait permis de réchauffer le  climat entre les deux grands pays européens.  ...  
181,2014-01-29,Les Echos,420mots,PIERRE DE GASQUET,Baisse des salaires : Electrolux met le feu aux poudres en Italie,"    ...  syndicats, convoqués d'urgence au siège du ministère du Développement économique à Rome. En plein  climat d'incertitude sur la sortie de crise italienne, l'annonce par le groupe suédois Electrolux d ...  "
182,2014-01-29,Les Echos,494mots,VINCENT CHAMPAIN,Les six clefs d'une bonne réforme fiscale,"    ...  30 euros. Une taxe de ce montant rapportera à l'Etat, tout en bénéficiant au  climat. Ces prélèvements sont les seuls dont l'augmentation peut, en soi, améliorer le bienêtre. D ...  "
183,2014-01-30,Les Echos,273mots,XAVIER FONTANET,Des contreparties contre-productives,"    ...  demande qu'à embaucher, il faut simplement qu'il bénéficie d'un terreau fertile et d'un  climat de travail où il n'est pas jalousé et harcelé tous les jours.  ...  "
184,2014-01-31,Les Echos,910mots,MARIE-SOPHIE RAMSPACHER,"DRH, un métier plus risqué qu'il n'y paraît","    ...  leurs résultats, mais plus souvent à un changement de gouvernance ou à une dégradation du  climat, ils deviennent alors la cible idéale »,  éclaire un consultant. Chez Accor, qui a vu passer quatre ...  "
185,2014-01-08,Les Echos,101mots,LES ECHOS,"Medef contre CGPME, les vraies raisons de la querelle patronale","    ...  adhésions et aux cotisations, alors que se profilent de nouvelles règles de représentativité. Dans le  climat actuel, certains redoutent un affaiblissement de la CGPME, qui laisserait le champ libre à des mouvements ...  "
186,2014-02-04,Les Echos,372mots,YANN ROUSSEAU,Tokyo s'inquiète des tergiversations américaines,"    ...  Abe a réalisé que sa stratégie venait d'être fragilisée par une soudaine dégradation du  climat politique américain. Très motivée par la finalisation rapide du TPP, qui implique douze nations et recouvre ...  "
187,2014-02-28,Les Echos,726mots,JACQUES HUBERT-RODIER,"L'Ukraine, la Russie et les nouvelles fractures en Europe","    ...  se sont effondrées depuis la crise de 2008. »  Reste qu'en dépit de ce nouveau  climat, tous les ponts ne sont pas rompus.  « La bonne nouvelle c'est que l'Otan a ...  "
188,2014-03-10,Les Echos,339mots,BENJAMIN QUENELLE,Les sanctions russes auraient aussi un effet boomerang sur Moscou,"    ...  de trouver des devises étrangères de refuge assez viables. Et, faute de visibilité suffisante, le  climat d'investissement peinera à attirer les capitaux et technologies essentiels aux projets d'infrastructure et de ...  "
189,2014-03-17,Les Echos,57mots,LES ECHOS,Municipales : un climat délétère pèse sur le scrutin,    ... Municipales : un  climat délétère pèse sur le scrutin  ...  
190,2014-04-15,Les Echos,613mots,REJANE REIBAUD,Comment la machine Pimco se remet en question,"    ...  en mai, accueille des personnalités de premier plan pour parler de thématiques mondiales, comme le  climat. Et le Cyclical Forum analyse trois fois par an les marchés et les classes d'actifs ...  "
191,2014-04-09,Les Echos,418mots,THIBAUT MADELIN,L'Allemagne fanfaronne avec un budget à l'équilibre,"    ...  qu'on s'est données,  a déclaré le ministre des Finances, Wolfgang Schäuble.  Nous ne créerons pas un  climat de confiance en Europe si nous enfreignons encore et toujours les règles. »  ...  "
192,2014-04-09,Les Echos,195mots,,"Frédéric Saint-Geours, président de l'UIMM","        ...  travail de simplification des normes et en améliorant le dialogue social, qui est un facteur de compétitivité, on crée le  climat pour une reprise de l'investissement industriel dans le pays. »  ...  "
193,2014-04-22,Les Echos,385mots,MARTINE ROBERT,Le patron de Studyrama achète les fleurons des puces à Grosvenor,"    ...  pourquoi les choses auraient traîné alors que Grosvenor, développeur immobilier international, souhaitait se désengager depuis deux ans. D'ailleurs JeanCyrille Boutmy entend s'employer à rétablir un  climat de  « sérénité »  .  ...  "
194,2014-04-03,Les Echos,421mots,MICHEL DE GRANDI,Le Chili secoué par un fort tremblement de terre,"    ...  pendant plusieurs années sous le mandat de Sebastian Piñera, le précédent président. Soucieuse d'un  climat social apaisé, la nouvelle présidente est consciente de la bombe à retardement que représente ce mouvement ...  "
195,2014-01-17,Les Echos,318mots,BENJAMIN QUENELLE,La Russie en manque de moteurs de croissance,"    ...  Audelà des beaux discours, il manque toujours l'essentiel pour attirer les investisseurs étrangers et rassurer les entrepreneurs russes : un bon  climat économique et un système judiciaire transparent. » Benjamin Quénelle  ...  "
196,2014-01-14,Les Echos,368mots,THIERRY OGIER,Brésil : l'inflation élevée alimente les craintes du marché,    ...  au dessus de l'« investment grade ») si les finances publiques ne se redressent pas. Un  climat de défiance s'est déjà installé sur les marchés financiers. Le Trésor brésilien a été contraint ...  
197,2014-01-17,Les Echos,451mots,INGRID FEUERSTEIN,Le marché automobile européen termine l'année par un rebond,"    ...  âgées en moyenne de sept à huit ans, ce qui devrait suffire à créer un  «  climat de remplacement » , atil souligné.  « C'est ce qui nourrit notre scénario d'une reprise ...  "
198,2014-01-27,Les Echos,397mots,GABRIEL GRESILLON|MICHEL DE GRANDI,La France et la Chine populaire célèbrent 50 ans d'une relation inégale,"    ...  Tibet, qui a perturbé le passage de la flamme Olympique à Paris en 2008, le  climat n'a jamais été totalement serein. Nouveau départ La France a fait des écarts, mais  « chaque ...  "
199,2014-01-06,Les Echos,755mots,PAUL MOLGA,"« SeaOrbiter », future sentinelle des mers","    ...  promesses, il pourrait être le premier d'une  « flotte sentinelle de la mer et du  climat »  maillant les cinq océans et les grandes mers intérieures d'une dizaine de navires. Paul Molga ...  "
200,2014-02-06,Les Echos,324mots,ANNE FEITZ,"L'essence va flamber, le lobby du pétrole le regrette","    ...  à la pompe au cours des trois prochaines années, suite aux nouvelles dispositions : la contribution  climat énergie (dite taxe carbone), les obligations  « multipliées par trois »  en matière de certificats d'économie d ...  "
201,2014-02-03,Les Echos,111mots,LES ECHOS,La croissance française privée de son dernier moteur,"    ...  ne devrait guère voir d'amélioration, avec une hausse attendue de 0,6 %. Dans un  climat de stagnation des revenus et de pression fiscale renforcée, les Français ont été amenés à puiser ...  "
202,2014-02-05,Les Echos,306mots,MICHEL DE GRANDI,"En Thaïlande, l'opposition engage une bataille judiciaire contre le pouvoir","    ...  se félicitent de l'avoir fragilisée. Même si l'élection s'est déroulée dans un  climat relativement normal, le Premier ministre, dont le parti n'a pu présenter de candidats dans 28 ...  "
203,2014-02-12,Les Echos,315mots,CATHERINE CHATIGNOUX,Chypre : le projet de réunification relancé,"    ... Cette fois, le  climat est différent et les chances de succès s'annoncent plus élevées que jamais. Un élément nouveau est en effet venu bouleverser le contexte des relations entre Chypre et ...  "
204,2014-02-20,Les Echos,308mots,GAELLE LUCAS,Le patronat catalan inquiet de l'instabilité politique,"    ...  espagnole et catalane (Ceoe et Foment del Treball) ont appelé à cesser de charger le  climat des affaires d'incertitudes. Sur le fond, les grands patrons catalans refusent de prendre position malgré ...  "
205,2014-02-07,Les Echos,559mots,GUILLAUME DE CALIGNON,L'industrie française en manque d'investissements,"    ...  se remettent à investir » , décrypte Eric Dubois.  « La reprise est progressive en France et le  climat des affaires dans l'industrie est meilleur que dans d'autres secteurs en raison de son ...  "
206,2014-04-15,Les Echos,418mots,SANDRINE CASSINI,Un espace de stockage en Europe pour le cloud,"    ...  où l'affaire d'espionnage de la NSA, dévoilée par Edward Snowden, a créé un  climat de suspicion à l'égard de l'hébergement des données, les deux industriels suggèrent comme principale ...  "
207,2014-04-17,Les Echos,311mots,DENIS FAINSILBER,"Pour les entreprises, un climat des affaires peu attractif","    ... Pour les entreprises, un  climat des affaires peu attractif  ...  "
208,2014-04-17,Les Echos,327mots,PIERRE DE GASQUET,"Sur le marché obligataire, l'Italie bénéficie encore de l' « effet Matteo Renzi »","    ...  record (à 13 %), la troisième économie de la zone euro bénéficie d'une amélioration du  climat de confiance des ménages. Malgré quelques doutes persistants sur la distribution du bonus fiscal de 80 ...  "
209,2014-04-18,Les Echos,465mots,VERONIQUE CHOCRON,"Michel Mathieu, le banquier anti- « Loup de Wall Street »","    ...  la crise financière se tourne, et le livre « Nouvelles Banques » est sorti jeudi dans un  climat plus apaisé.  « Le gouvernement remet l'entreprise au centre du jeu, tout le monde prend conscience ...  "
210,2014-03-06,Les Echos,344mots,VINCENT COLLEN,Les médecins modèrent leurs tarifs,"    ...  la modération » , assure Frédéric Van Roekeghem, le directeur de la Cnam. Pression psychologique Et le  climat général joue probablement un rôle aussi. Depuis plusieurs années, la droite comme la gauche ont régulièrement ...  "
211,2014-03-05,Les Echos,527mots,JACQUES MISTRAL,"Le logement, un désastre de politique économique","    ...  ministre un « czar » du logement, temporairement doté de pouvoirs exceptionnels; il faut enfin créer un  climat propice au réengagement durable des investisseurs institutionnels privés. Le tout formerait, dans le langage d'aujourd ...  "
212,2014-04-24,Les Echos,299mots,LEILA DE COMARMOND,Pouvoir d'achat : Manuel Valls ne convainc pas,"    ... 'améliorera pas beaucoup le pouvoir d'achat des ménages modestes »  . Il faut dire que le  climat économique ne pousse pas à l'optimisme, entre poursuite de la progression du chômage et salaires ...  "
213,2014-04-25,Les Echos,240mots,DENIS FAINSILBER,Essilor renforce sa recherche en France,"    ... 'investir dans la recherche à Créteil  « a été prise en 2011. A l'époque, le  climat n'était pas le même... » ,  affirme au « Monde » Paul du Saillant, le numéro deux du groupe ...  "
214,2014-04-04,Les Echos,312mots,CATHERINE CHATIGNOUX,"Orban, le nationaliste bien placé pour rempiler","    ...  permis d'occuper les deux tiers des sièges de l'Assemblée nationale. En dépit du  climat de franche défiance et de guérilla politicojuridique engagée avec ses partenaires européens, le Premier ministre ...  "
215,2014-03-19,Les Echos,427mots,MARIE-CHRISTINE CORBIER,Les grandes écoles accueillent de plus en plus d'étudiants étrangers,"    Le  climat est  « au beau fixe »  pour les étudiants étrangers dans les grandes écoles, s'est félicité hier le président de leur Conférence (CGE) Philippe Jamet. Les résultats de l'enquête de ...  "
216,2014-04-02,Les Echos,523mots,,Les professionnels évoluent vers plus de services,"        ...  décentralisation leur a aussi confié des compétences, comme la mise en place d'un plan  Climat... En Allemagne, RWE, qui doit s'adapter à l'annonce de l'arrêt du nucléaire, se ...  "
217,2014-04-01,Les Echos,552mots,ALAIN RUELLO,Airbus Group : climat tendu dans le pôle défense et espace,    ... Airbus Group :  climat tendu dans le pôle défense et espace  ...  
218,2014-01-14,Les Echos,243mots,PIERRE-ALAIN FURBURY,Le grand oral de François Hollande en dix questions,"    Il avait repoussé l'exercice, initialement prévu en novembre, dans l'attente d'un  climat un peu apaisé. Las. C'est un François Hollande sous très forte pression qui aborde, cet après ...  "
219,2014-01-15,Les Echos,226mots,LES ECHOS,"Le Brésil, futur champion du soja","    ...  une surface arable de 60 millions d'hectares, de larges disponibilités en eau douce, un  climat tropical qui lui permet de réaliser deux voire trois récoltes par an et l'utilisation des ...  "
220,2014-01-10,Les Echos,312mots,ETIENNE LEFEBVRE,La notion désuète du cadeau aux entreprises,    ...  voie de la reprise. Les mauvais chiffres du commerce extérieur publiés hier vont alimenter ce  climat. Il paraît loin le temps où le candidat à la présidentielle François Hollande expliquait que la ...  
221,2014-01-09,Les Echos,386mots,LUCIE ROBEQUAIN,Chaos dans le ciel américain,"    ...  perdre 5 milliards de dollars à l'économie américaine, estime Evan Gold, un spécialiste du  climat. Les factures d'électricité devraient atteindre des sommets historiques pour quelque 200 millions d'Américains.  ...  "
222,2014-01-09,Les Echos,458mots,MICHEL DE GRANDI,La crise thaïlandaise va se durcir avec le blocus de Bangkok,"    ...  fabrication de composants électroniques. Ces derniers ne représentent plus que 10 % des exportations, ce qui limite les risques de pénurie en cas de dégradation durable du  climat des affaires. M. G.  ...  "
223,2014-01-27,Les Echos,500mots,MICHEL DE GRANDI,Benoît Vermander : « Il y a toujours eu une incompréhension »,"    ...  préjugeait pas de récompenses économiques mais qui en revanche, menaçait de sanctions économiques si le  climat venait à se dégrader. En même temps, quand la France cherche à imposer ses grands contrats ...  "
224,2014-01-28,Les Echos,360mots,VIRGINIE ROBERT,Le couple franco-allemand retrouve du tonus à l'approche du scrutin européen,"    ...  troisième gouvernement Merkel allié au nouveau discours « socialdémocrate » du président Hollande réchauffe sensiblement le  climat entre l'Allemagne et la France. Pour preuve, à l'issue hier d'un conseil économique ...  "
225,2014-01-23,Les Echos,67mots,ANNE BAUER,Climat : la France satisfaite de la copie de la Commission européenne,    ... Climat : la France satisfaite de la copie de la Commission européenne  ...  
226,2014-01-31,Les Echos,343mots,GREGOIRE POUSSIELGUE,Guerre ouverte avec les radios sur les quotas francophones,"    Communiqués rageurs, prises de position multiples, pétition et, au final,  climat particulièrement pesant... Entre les radios et la filière musicale, le ton est brusquement monté depuis le début de l'année. La ...  "
227,2014-02-20,Les Echos,1431mots,HENRI GIBIER,"PME pour l'éternité, un maléfice très français","    ...  Ce sont les travaux conduits par ce dernier au sein du Laboratoire des sciences, du  climat et de l'environnement, à ParisSaclay, qui leur ont permis de créer leur société. Une ...  "
228,2014-02-20,Les Echos,237mots,,Les principales décisions du Conseil des ministres,"        ...  Wiederaufbau feront des propositions d'ici l'été sur le soutien à la transition énergétique.  Climat D'ici 2030, réduction d'au moins 40 % des émissions de gaz à effet de serre ...  "
229,2014-02-07,Les Echos,153mots,DANIEL FORTIN,Redéfinir le rôle de l'Etat,"    ...  Il admet aussi la nécessité de la concertation, à condition qu'elle ne dégénère pas en grandmesse théâtralisée. Quelques bonnes leçons qui sonnent juste dans le  climat de gouvernance actuel.  ...  "
230,2014-02-10,Les Echos,296mots,CECILE CORNUDET,Le pacte et le risque d'effet « pschitt »,"    ...  avec attention ce qui se dit en France. Ce 14 janvier 2014, François Hollande surprend, déplace les lignes,  « prend son risque »,  comme il dit. Le  climat politique change... pendant quelques jours.  ...  "
231,2014-02-14,Les Echos,303mots,MARIE-SOPHIE RAMSPACHER,"NAO, des négociations prudentes et tendues","    ...  chez les mutualistes »,  analyse Céline Ingremeau. Cet hiver, autour de la table des négociations, le  climat social s'est donc révélé très tendu, comme le souligne Altedia : 50 % des entreprises interrogées ont ...  "
232,2014-02-06,Les Echos,485mots,,La France amère,        La France est aujourd'hui gagnée par un  climat de défiance. Cette défiance est d'abord verticale et oppose la « France d'en haut » à la « France d'en bas ». Elle se ...  
233,2014-02-26,Les Echos,286mots,STEPHANE DUPONT,"Courbe du chômage, saison 2","    ...  emploi n'en revêt pas moins une certaine importance. Parce qu'il influera sur le  climat des affaires, toujours très attentiste, et la confiance, sans laquelle aucune franche reprise ne sera possible ...  "
234,2014-02-03,Les Echos,248mots,EMMANUEL GUIMARD,"A Angers, Christophe Béchu veut profiter d'une succession difficile","    ...  moyenne (150.000 habitants) à gauche depuis trentesept ans. L'envie d'alternance, le  climat national, mais aussi une dissidence à gauche lui sont favorables. Encore fautil compter sur la ...  "
235,2014-03-12,Les Echos,270mots,THIBAUT MADELIN,Réforme dans un climat tendu à l'Office européen des brevets,    ... Réforme dans un  climat tendu à l'Office européen des brevets  ...  
236,2014-03-17,Les Echos,137mots,MARIE-JOSEE COUGARD,L'allemand RWE vend ses activités pétrolières,    ...  Seconde Guerre mondiale. Reste à savoir si la cession annoncée sera effectivement concrétisée dans un  climat de tensions avec la Russie après le référendum en Crimée. LetterOneGruppe est en effet ...  
237,2014-03-18,Les Echos,365mots,JOEL COSSARDEAUX,Une initiative à forte valeur pédagogique,"    ...  d'autres chantiers visant à réduire la part du diesel dans les transports. La contribution  climat énergie, qu'ils ont arrachée au gouvernement lors de l'adoption de la dernière loi de ...  "
238,2014-03-25,Les Echos,426mots,ISABELLE FICEK,L'UMP ne veut pas se faire « voler sa victoire »,"    ...  mettre un bulletin pour le PS. »  Voilà, espère l'UMP, de quoi passer dans ce  climat de vote sanction pour le « vote utile » contre la gauche tant auprès de l'électorat du ...  "
239,2014-04-10,Les Echos,340mots,PIERRE DE GASQUET,Le sursaut fragile du design italien,"    ...  et designers du monde entier, le Salone del Mobile s'ouvre cette année dans un  climat de relatif optimisme. Malgré un nouveau recul de 2,5 % du chiffre d'affaires global du ...  "
240,2014-04-11,Les Echos,1427mots,DENIS FAINSILBER,JO 2024 : la longue marche de Paris,"    ...  directeur associé du cabinet de conseil Bibaïsport, qui prône des nouvelles pistes, comme  « des Jeux  climat, des Jeux très orientés numérique » ,  et la fin d'un certain angélisme sur le plan financier ...  "
241,2014-04-10,Les Echos,427mots,FREDERIC SCHAEFFER|ANNE BAUER,Déficit : explications au sommet entre Paris et Bruxelles,"    ...  les 3 % de déficit, mais a besoin de temps pour y arriver compte tenu du  climat économique et social difficile. Ils argueront aussi que l'arrivée de JeanPierre Jouyet à l ...  "
242,2014-04-09,Les Echos,297mots,INGRID FEUERSTEIN,La mécanique française tire le signal d'alarme,"    ...  de cinq à sept ans avec l'Allemagne, estime le Groupe des Fédérations Industrielles. Ce  climat n'a pas permis au secteur de reprendre les embauches, comme la fédération l'espérait il ...  "
243,2014-04-17,Les Echos,1355mots,NICOLAS MADELAINE,"A Londres, le calme trompeur de la communauté russe des affaires","    Ales entendre, les agents immobiliers londoniens qui dénichent des petits palaces pour les oligarques russes sont  « plus occupés que jamais »  depuis l'annexion de la Crimée par la Russie. Les diplomates ...  "
244,2014-04-03,Les Echos,477mots,JOEL COSSARDEAUX,Ségolène Royal joue son grand retour sur la transition énergétique,    ...  exploitation ultérieure. Ségolène Royal a d'autres dossiers sensibles à gérer. Celui de la contribution  climaténergie laborieusement négociée avec les écologistes et à laquelle elle n'a jamais été favorable. La ...  
245,2014-04-04,Les Echos,724mots,ISABELLE FICEK,La vérité sur la percée municipale du Front national,    ... 'élection présidentielle. Ne pas avoir exercé le pouvoir constituait pour elle une force dans ce  climat de défiance visàvis des partis de gouvernement. Mais redresser la barre de municipalités souvent ...  
246,2014-03-27,Les Echos,378mots,VERONIQUE LE BILLON,Nucléaire : le gouvernement lève le tabou de la fermeture de réacteurs,"    ...  à) 50 % vers 2025 » , a indiqué Laurent Michel, directeur général de l'énergie et du  climat (DGEC) au ministère de l'Energie.  « Ce qui veut dire qu'en termes de ""nonbesoin ...  "
