,date,publication,words,author,title,intro
158,2021-02-10,Libération,839mots,Par Juliette Delage,#SciencesPorcs : les étudiants des IEP dénoncent la «culture du viol»,    ...  en 2019 des agressions de clientes du service de VTC Uber par leurs chauffeurs. Le  climat est à la mobilisation. Voilà plus d'un mois que les élèves de SciencesPo Paris ...  
159,2021-02-26,Libération,1862mots,Par BERNADETTE SAUVAGET,Désertion des fidèles : les curés souffrent dans leurs chaires,"    ...  en tout cas à un très mauvais moment pour l'archevêque. Depuis l'automne, un  climat de crise larvée s'est installé à l'archevêché. Déjà sans cathédrale depuis l'incendie de ...  "
160,2021-03-25,Libération,431mots,Fabrice Drouzy,"«Carpates», le génie de l'aventure","    ...  bien pour lui avoir consacré une thèse. JeanLouis Michelot propose ensuite une promenade le long des berges du Rhône, dissertant sur la flore, la faune, l'histoire ou le  climat.  ...  "
161,2021-03-26,Libération,2364mots,Par BERNADETTE SAUVAGET Envoyée spéciale à Chavagnes-en-Paillers (Vendée),"Au petit séminaire de Chavagnes, retour en souffrance","    ...  des lumières, ou tel directeur d'études qui venait lorgner les douches. «C'était un  climat malsain», appuie JeanRené. Dominique, lui, a été agressé à plusieurs reprises par son directeur de ...  "
162,2021-03-29,Libération,42mots,,MACRON ET LES ÉCOLOS Çça chauffe,"        ...  texte à l'Assemblée, des milliers de personnes manifestaient dimanche pour exiger une «vraie» loi  climat. Une mobilisation qui intervient alors que la majorité multiplie les attaques contre EELV. pages 2 ...  "
163,2021-03-30,Libération,331mots,Élisabeth Franck-Dumas,Le musée d'Orsay rebaptisé «VGE» : un truc qui ne sert à rien,"    ...  il y a deux semaines se pschitter en échantillons de parfum chez Sephora dans un  climat de ligne 8 station Concorde à l'heure de pointe), les musées sont proches de la ...  "
164,2021-04-29,Libération,798mots,Par ÉRIC JOSZEF Correspondant à Rome,L'Italie espère panser sa «blessure ouverte»,    ...  de l'extradition des anciens est revenue sur le devant de la scène. Dans un  climat de lutte générale contre le terrorisme après les attentats du 11 Septembre et du renforcement de ...  
165,2021-04-29,Libération,4007mots,Par JULIE BRAFMAN,Scandale du don des corps : autopsie des responsabilités,"    ...  celui qui les prépare en vue des dissections  soit traditionnellement le chef d'équipe. Le  climat est alors délétère, certains collègues souffrent de problèmes d'alcool, de santé, des épisodes de violences ...  "
166,2021-01-13,Libération,1850mots,ÉDOUARD DROPSY,"«Même sous Nasser et Moubarak, ce n'était pas aussi répressif»","    ... Depuis l'arrivée d'AlSissi au pouvoir, les Egyptiens vivent dans un  climat plus oppressant que jamais. Retour auprès d'«anciens de la place Tahrir» qui, dix ans après le soulèvement ...  "
167,2021-01-14,Libération,716mots,Par JÉRÔME LEFILLIÂTRE,"Affaire Duhamel Ils ignoraient, mais ils démissionnent","    ...  installée le mois dernier par le secrétaire d'Etat à l'Enfance, Adrien Taquet. «Le  climat actuel ne me permet pas de conduire cette mission avec la sérénité nécessaire», a justifié Elisabeth ...  "
168,2021-02-24,Libération,54mots,,"Menus sans viande dans les cantines : Pompili, poil à gratter de l'exécutif ?","        La ministre de la Transition écologique, attendue sur le projet de loi  climat, s'oppose à Gérald Darmanin et Julien Denormandie sur la récente polémique des menus sans viande dans les cantines ...  "
169,2021-02-26,Libération,1955mots,Par ANAÏS COIGNAC,Les plaies à vif de l'unité médico-judiciaire,"    ...  au torisée à recruter. Mais la tâche s'avère ardue. Qui vien drait dans un  climat aussi flou et délétère ? A Bondy, on rappelle que les sollicitations ne manquaient pas il y ...  "
170,2021-01-22,Libération,1738mots,Par OLIVIER LAMM,Hakken Le kick mains libres,"    ...  le hakken actuel les influences de danses traditionnelles mais qui auraient été assujetties à un  climat ambiant capitaliste, et accélérées par le club. L'idée est de tenir le rythme à tout ...  "
171,2021-03-22,Libération,292mots,Par ALEXANDRA SCHWARTZBROD,Mini-ZAD,"    ...  mais aussi de la CGT, des étudiants, de la Confédération paysanne, des jeunes pour le  climat, des soignants ou des victimes de plans sociaux. On en compte au moins une soixantaine sur ...  "
172,2021-02-10,Libération,608mots,Recueilli par A.V.,«Les prochains jours vont être plus violents»,"    ... Le militant Thet Swe Win, recherché par les militaires, revient sur le  climat de tension croissant à Rangoun.  ...  "
173,2021-02-16,Libération,1068mots,Par JULIETTE VERLIN Correspondance à Rangoun,"A Rangoun, des ordres et désobéissance","    ...  murmureton dans les rues, manifestants blessés dans d'autres villes du pays: le  climat d'incertitude et de tension, peu à peu instauré par le gouvernement militaire, accroît la nervosité ...  "
174,2021-02-18,Libération,321mots,Par ALEXANDRA SCHWARTZBROD,Police politique,"    ...  sécuritaire et droitière de Gérald Darmanin face à Marine Le Pen, s'inscrivent dans un  climat. Même s'il a semblé désavouer sa ministre, Emmanuel Macron est bel et bien parti en ...  "
175,2021-02-17,Libération,51mots,,Une ressortissante japonaise a-t-elle été [...],        ...  été agressée à l'acide à Paris ? Les Verts allemands soutiennentils le projet de loi  climat du gouvernement français ? Quel est le programme politique de l'opposant russe Alexeï Navalny ?  ...  
176,2021-03-27,Libération,483mots,Recueilli par Alexis Bernier,Fabio Viscogliosi : «Une sorte de modernité antique»,"    ...  disque et cette image, avec son atmosphère entre chien et loup. Je pensais aussi au  climat de certaines photos balnéaires de Luigi Ghirri, ou aux décors dans les films néonoirs. Une ...  "
177,2021-04-20,Libération,1536mots,Par MARIA MALAGARDIS,Un génocide avec la bienveillance de la France,"    ...  militaires français dans ces événements tragiques. Mais ces précédentes enquêtes avaient été publiées dans un  climat tendu, pollué par des offensives judiciaires qui brouillaient la vérité, multipliant les polémiques. Ce n'est ...  "
178,2021-03-10,Libération,1033mots,Recueilli par Charlotte Belaïch,«La gauche doit offrir une perspective de sortie de crise»,"    ...  s'opposer aux réformes nécessaires pour faire la transition écolo. Beaucoup de jeunes des mouvements  climat, que j'admire, pensent que c'est une question de bon sens. Malheureusement non, c'est ...  "
179,2021-04-28,Libération,1132mots,DOMINIQUE ALBERTINI,"A un an de la présidentielle, LR va à la pêche à la ligne","    ...  députés du parti présenteront leur «contreprojet» en matière d'environnement, réponse à la loi  climat que vient d'adopter l'Assemblée en première lecture. Le document compilera les me sures que ...  "
180,2021-01-26,Libération,357mots,,À LA TÉLÉ CE SOIR,        ...  satan de l'occupation. 23h20. Les dessous secrets de Paris. Documentaire. LCP 20h30. Sommets : dans les secrets des négociations européennes. Épisode 1  Time to Act (climat). 22h00. Pourvu que ça dure.  ...  
181,2021-01-25,Libération,279mots,J.G.,Barbara Carlotti dans le labo bleu de Christophe,"    ...  ce régime de huis clos, en comité feutré, se révèle sans doute plus propice au  climat de rite invocatoire que ne l'eût été une bonne vieille communion avec la foule de ...  "
182,2021-01-27,Libération,939mots,Nathalie Dray,Les années de plomb passées à l'argentique,"    ... Si le giallo et ses meurtres graphiques ne laissait affleurer ce  climat d'angoisse généralisée que sur un mode allégorique, un autre fleuron du cinéma d'exploitation transalpin allait, lui, s'en ...  "
183,2021-01-29,Libération,1071mots,Par RACHID LAÏRECHE,L'hiver discret des Verts,"    ...  nuage sur lequel ils planaient depuis les municipales, les écologistes peinent à imposer leur parole dans un paysage médiatique où le  climat est passé au second plan en raison du Covid.  ...  "
184,2021-01-30,Libération,354mots,ALEXIS BERNIER,Buzzy Lee souffle de soie,"    ...  d'étranges nappes synthétiques. Parfois, le tempo s'accélère, les arrangements s'enrichissent, mais le  climat reste au gris. On songe à une Lana Del Rey neurasthénique qui aurait croisé la route ...  "
185,2021-01-29,Libération,821mots,Par François Carrel Envoyé spécial à Valence (Drôme),"A Valence, choc et émotion après l'équipée meurtrière d'un ingénieur au chômage","    ...  syndicaliste. «Tout le monde est bouleversé», ajoutetil. Le délégué CFDT explique que le  climat au sein de l'entreprise était «un peu tendu depuis quelque temps», avec «une politique sociale ...  "
186,2021-02-23,Libération,1771mots,Rania Hamdi Correspondance à Alger,«La prison a été un lieu de solidarité et de formation politique»,"    ...  ne serions pas ici», rétorquent les autres. Généralement, la cohabitation se déroulait pourtant dans un  climat apaisé. «On échangeait les amabilités d'usage, sans plus. Lorsqu'un des frères Kouninef [famille de ...  "
187,2021-03-20,Libération,648mots,Recueilli par Virginie Ballet,Santé mentale : «Le gouvernement a sans doute compris que les gens souffrent»,"    ...  génération citoyenne, engagée, inquiète, avec une intelligence sociale surdéveloppée, notamment autour des questions liées au  climat ou au genre, ce qu'on voit à travers des figures comme Greta Thunberg. Je préfère ...  "
188,2021-04-13,Libération,712mots,Recueilli par JULIETTE DELAGE,"«Avant, les gangs se contentaient de s'en prendre aux civils»","    ...  lieu quelques mois après les grandes mobilisations sociales de l'été 2018. Grâce à ce  climat de violence, le Président, très contesté pour son autoritarisme et son implication dans des affaires de ...  "
189,2021-03-23,Libération,1624mots,Par ISABELLE HANNE Correspondante à New York,"En Alabama, Amazon veut fédérer contre les syndicats","    ...  défendu le droit des «travailleurs de l'Alabama» à se syndiquer, et a dénoncé le  climat «d'intimidations, de coercition, de menaces et de propagande antisyndicats», sans citer nommément Amazon. «JUSTICE ...  "
190,2021-02-11,Libération,622mots,Par CÉCILE BOURGNEUF et MARIE PIQUEMAL,Des profs entre plaisir et burn-out,"    ...  vivre des situations difficiles, comme s'ils avaient intégré de ""nouveaux standards"" en matière de  climat scolaire et de violences, sans que cela n'entame  pour le moment leur état d'esprit ...  "
191,2021-04-14,Libération,998mots,C.P.-R.,"Face au projet de loi, défiance d'entrée",    ...  Mais le garde des Sceaux éviteratil le courtcircuit ? C'est dans un  climat quelque peu électrique qu'Eric DupondMoretti présentera ce mercredi matin en Conseil des ministres son ...  
192,2021-04-19,Libération,1018mots,Par Rachid Laïreche,"Faure et Jadot, pressés de s'unir pour 2022","    ...  de débats publics autour des programmes, et la mobilisation collective autour de sujets fédérateurs  le  climat, la lutte contre la réforme de l'assurance chômage, ou contre la réforme des retraites. Imbroglio ...  "
193,2021-03-30,Libération,1958mots,Recueilli par SIMON BLIN,"«La demande de justice ne divise pas la République, elle prend ses promesses au mot»","    ... Que vous inspire le  climat délétère qui règne à l'université ? On le rend délétère en mettant en scène un affrontement binaire entre l'universalisme et le racialisme, le principe d'égalité ...  "
194,2021-04-23,Libération,12mots,,CLIMAT Les Etats-Unis de retour au chevet de la planète,        ... CLIMAT Les EtatsUnis de retour au chevet de la planète  ...  
195,2021-04-24,Libération,2130mots,Par FRÉDÉRIQUE ROUSSEL,Quarante ans de prix unique Mon livre ma bataille,"    ...  elle protège tout un écosystème. Dans ce domaine, on aura été plus percutant que pour le  climat. ? (1) Que vive la loi unique du prix du livre! Association Verbes, 127 pp.  ...  "
196,2021-04-28,Libération,112mots,,Pécresse Légitimes dépenses ?,        ...  les manuels scolaires à la rentrée 2020 ; les dépenses de la «COP» régionale sur le  climat lancée en septembre Autant de choses qui brouilleraient les pistes entre les dépenses d'une campagne ...  
197,2021-03-15,Libération,1627mots,ANAÏS MORAN Envoyée spéciale à Cervens,"A l'Ehpad de Cervens, la vie après le vide","    ...  Olga, est tout aussi soulagée : «Ma mère ne supportait plus l'isolement et tout ce  climat anxiogène. Elle ne mangeait plus. Elle n'avait plus goût à rien. Elle me disait qu ...  "
198,2021-01-27,Libération,1558mots,ANNE PROENZA Envoyée spéciale à Doima (Colombie),La vague verte atteint la blanche Colombie,"    ...  à la ronde, les paysans du département du Tolima ont plutôt l'habitude, dans ce  climat chaud et sur ces sols riches en eau, de travailler dans les rizières pour de grands ...  "
199,2021-02-19,Libération,752mots,Recueilli par Thibaut Sardier,«Frédérique Vidal risque d'alimenter une police de la pensée qui serait dramatique»,"    ...  susceptible de s'apparenter à une «menace islamogauchiste». Cette généralisation crée une dramatisation, un  climat anxiogène qui ne peut qu'alimenter le rejet. Quels sont les faits initiaux à partir desquels ...  "
200,2021-01-28,Libération,617mots,Fabienne Brugère,Le soutien est une affaire publique,"    ... 'il faut prendre soin des malades, des vieux, des jeunes, des pauvres mais aussi du  climat, de la biodiversité et des institutions. ESBY Toutefois, ces activités sont en crise dans la mesure ...  "
201,2021-01-29,Libération,678mots,MAÏTÉ DARNAULT Correspondante à Lyon,"Auvergne-Rhône-Alpes, un laboratoire plein d'espoir","    ...  a fait un casse incroyable aux municipales, il y a cet élan pour protéger le  climat. Si on met en face un ou une inconnue, comme à Lyon, Strasbourg ou Bordeaux, on ...  "
202,2021-03-19,Libération,1027mots,Par CÉCILE BOURGNEUF,"Le harcèlement, phénomène majeur chez les mineurs","    ...  Il existe de grosses différences selon les établissements. Dans les plus difficiles, là où le  climat scolaire est dégradé, le nombre d'élèves harcelés ne cesse d'augmenter. «Ce n'est pas ...  "
203,2021-01-18,Libération,809mots,FRÉDÉRIC AUTRAN Envoyé spécial à New York,"Honnis à New York, les Trump réfugiés sous les palmiers","    ...  n'est pas prête à pardonner. Du retrait de l'accord de Paris sur le  climat à la séparation des familles à la frontière mexicaine, du «Muslim Ban» aux accointances avec les ...  "
204,2021-01-16,Libération,408mots,,À LA TÉLÉ DIMANCHE,"        ...  Le flan : un succès époustouflant !. Documentaire. 21h40. C'est pas de la tarte. Documentaire. 22h40.  Climat, une guerre américaine. Documentaire. PARIS PREMIÈRE 20h55. Le Titanic (1/2). Téléfilm. Avec Catherine ZetaJones ...  "
205,2021-01-20,Libération,1557mots,Par FRÉDÉRIC AUTRAN Envoyé spécial à Washington et ISABELLE HANNE Correspondante à New York,"ÉTATS-UNIS Pour Joe Biden, une investiture dans le dur","    ...  décisions emblématiques de son prédécesseur  comme le retrait de l'accord de Paris sur le  climat  et s'attaquer à la crise sanitaire, sociale et économique qui secoue le pays. Pour y ...  "
206,2021-01-20,Libération,1107mots,ISABELLE HANNE Correspondante a New York,"Kamala Harris, libre arbitre","    ...  lui embrassé ces derniers mois des politiques plus à gauche qu'auparavant. Notamment sur le  climat, l'éducation ou l'augmentation du salaire minimum fédéral à 15 dollars de l'heure. Mais ...  "
207,2021-01-22,Libération,560mots,Par Laure Equy Journaliste au service politique,Les amendements sont-ils des saucisses ?,"    ...  mauvais législateurs». Les macronistes redoutent par ailleurs l'examen du projet de loi inscrivant le  climat dans la Constitution, présenté mercredi en Conseil des ministres. Révision constitutionnelle oblige, il n'y a ...  "
208,2021-02-27,Libération,968mots,Recueilli par Olivier Lamm,«On a oublié le rôle joué par la musique dans les luttes politiques de l'époque»,"    ...  social et économique dans laquelle elle est née, y compris le racisme institutionnel, et le  climat d'insécurité qui ont défini l'expérience de ces communautés ? Ça apparaît de manière évidente comme ...  "
209,2021-02-12,Libération,1038mots,Recueilli par C.Gé.,«On pourrait tomber sur une preuve irréfutable de vie»,"    ...  Donc on peut aller sur cette planète voisine et apprendre plein de choses sur le  climat à cette époque. Avec les orbiteurs, on a trouvé des vestiges de lacs, de vallées fluviales ...  "
210,2021-02-13,Libération,1262mots,Par ÉRIC FAVEREAU,«En thérapie» La psychanalyse sur le divan de la scène,"    ...  avec des pratiques variées et des théories différentes. Seraiton désormais sorti de ce mauvais  climat, comme semblerait l'indiquer le succès d'En thérapie ? «Peutêtre, lâche Patrick Landman. Mais cela ...  "
211,2021-02-13,Libération,711mots,Par Thomas Clerc,Libéralisme antilibéral,"    ...  désoeuvrés, enrichissement garanti, baisse de l'insécurité et des féminicides, moindre pression sur la police,  climat de bienêtre augmenté : je ne vois là que des bénéfices, qui permettront à l'Etat ...  "
212,2021-02-17,Libération,609mots,Par Simon Blin Journaliste au service Idées,"Sur CNews, Vidal fait du Zemmour",    ...  pas définies. Ce qui ouvrirait la porte à des décisions arbitraires et alimenterait un large  climat de suspicion sur ce que sont en droit de dire ou de ne pas dire les ...  
213,2021-04-17,Libération,614mots,Par Mathieu Lindon,Prenez garde à la vieille garde,"    ...  la Syrie qu'il l'a eu, le prix Nobel de la paix). Mais question  climat et paradis fiscaux, l'Europe qui se voulait à la pointe voit apparaître un concurrent sur ...  "
214,2021-03-29,Libération,1666mots,Par Christophe Conte,MUSTANG En selle contre tous,"    ...  Sur Memento Mori, après les coups de baïonnette qu'il distribue à l'envi, le  climat se fait plus étrange, plus réflexif, avec comme point de bascule une très belle adaptation de ...  "
215,2021-03-29,Libération,767mots,Par Daniel Schneidermann,"Pierre Ménès, Patrick Poivre d'Arvor, deux dinosaures","    ... On aurait tout le temps de s'adapter, comme pour le  climat. Le cataclysme serait pour les enfants, les petitsenfants, le prochain siècle, disons 2050 à la limite. Là, non. C'est ...  "
216,2021-04-20,Libération,363mots,Stéphane Roland (à Berlin),"En Allemagne, l'écolo Baerbock fait un pas vers la chancellerie","    ...  derniers mois, le rapport de force s'est lentement renversé. Baerbock s'est affirmée par ses connaissances en matière de  climat, sur l'Europe, l'énergie, les migrations et la sécurité.  ...  "
217,2021-03-29,Libération,829mots,Recueilli par R.La.,«Jean-Luc Mélenchon a basculé dans un autre monde»,    ... 'y a évidemment pas de lien entre les deux situations. Mais je constate que le  climat en France est de plus en plus inquiétant et menaçant pour la République. Ce pays ...  
218,2021-03-31,Libération,1276mots,Recueilli par JUSTINE DANIEL,«Nous n'avons ni un problème de dette ni un problème de déficit»,"    ...  le déficit ne sont pas les priorités, quelles sontelles ? Qu'il s'agisse du  climat, du logement, des soins de santé, des inégalités ou de la pandémie, cette série de crises ...  "
219,2021-04-24,Libération,1177mots,ISABELLE HANNE (à New York),La crise migratoire pousse Joe Biden à un premier recul,"    ...  accéder en quelques années à la citoyenneté. «La proposition de Reagan avait reçu un soutien bipartisan, conclut Randy Capps. Le  climat politique, sur les affaires d'immigration, était alors bien différent.»  ...  "
220,2021-04-24,Libération,1415mots,Recueilli par F.Rl,"«C'était sauver la librairie, l'édition, les écrivains»","    ...  Netflix, ça existe. Le streaming, ça existe. Mais quand on voit qu'avec la loi  climat, on parle d'une exception au profit d'Amazon pour la construction d'entrepôts sur des ...  "
221,2021-01-25,Libération,1114mots,"Par Étienne Balibar Ancien professeur à l'université de Paris-Nanterre, Anniversary Chair in Modern European Philosophy, Kingston University, Londres et Zeynep Gambetti Ancienne professeure de théorie politique à l'université du Bosphore à Istanbul.","Sur le Bosphore, enseignants et étudiants en lutte pour la liberté",    ...  nommé un professeur n'ayant même pas posé sa candidature aux élections internes. Dans le  climat de chaos et de peur suscité par le putsch et la déclaration de l'état d ...  
222,2021-04-28,Libération,2529mots,Par EMMANUEL FANSTEN,"DÉPENSES, OPACITÉ, DÉMISSIONS La Francophonie en perd son latin","    ... «Du jamais vu à l'OIF», assurent plusieurs témoins interrogés par Libération, qui dénoncent le «climat délétère» qui s'est installé ces derniers mois. Si Louise Mushikiwabo est décrite par ses soutiens ...  "
223,2021-01-14,Libération,550mots,Alain Auffray,"Pour Macron, un ambitieux utile","    ...  pour renouer avec les élus locaux. Ralliement. Si l'opération a permis d'apaiser le  climat, elle est loin d'avoir totalement rétabli la confiance. Tous les talents politiques qu'on lui ...  "
224,2021-01-20,Libération,164mots,Hala Kodmani,Jen Psaki La Porte-Parole aguerrie,"    ... 'à l'investiture de Donald Trump. Auparavant, elle était porteparole du Département d'Etat, dirigé par le futur envoyé pour le  climat John Kerry, pendant le second mandat de Barack Obama.  ...  "
225,2021-02-10,Libération,906mots,Laure Equy et Jérôme Lefilliâtre,"Mercedes Erra, la VRP de la publicité","    ...  été étonnée de découvrir le volet «publicité» du rapport de la Convention citoyenne pour le  climat (CCC): interdiction de la pub sur les produits les plus polluants, mentions du type «la surconsommation ...  "
226,2021-02-27,Libération,2666mots,Recueilli par FRÉDÉRIQUE ROUSSEL,Ce que «Parle» veut dire Rencontre avec Noémi Lefebvre,"    ...  double dans le discours d'un inventaire sur les sujets de la vie courante, le  climat, les migrants, le chômage, la surveillance, l'argent, les animaux mais aussi les Verdurin, Marx, Rousseau ...  "
227,2021-02-13,Libération,992mots,Par FRANÇOIS MUSSEAU Correspondant à Madrid,"Salvador Illa, il l'aura ?","    ...  contexte à l'opposé de la tension maximale de 2017. La confrontation a baissé, le  climat est plus serein, et l'électorat séparatiste est fatigué d'être dans une impasse.» Reste que ...  "
228,2021-01-23,Libération,1563mots,FLORIAN BARDOU Envoyé spécial à Lorient (Morbihan),"A Pont-Scorff, du zoo au sanctuaire","    ...  des hordes de visiteurs pas toujours respectueux. Ne restent que les enclos inadaptés et le  climat breton. «La panthère des neiges a abandonné ses allersretours devant la vitre, on retrouve des ...  "
229,2021-04-14,Libération,1836mots,Par JÉRÔME LEFILLIÂTRE ET SIMON BLIN,"A Sciences-Po, une succession tourmentée et des jeux d'influence","    ...  avant d'être officiellement candidate, elle faisait partie du comité de recherche Mais dans un  climat ultratendu, le profil de Laurence Bertrand Dorléac, qui ne souhaite pas s'exprimer avant le vote ...  "
230,2021-04-15,Libération,920mots,Arnaud Vaulerin,"«'Ndrangheta», sur la route de la «pieuvre»","    ...  Il sait capter l'air du coin : «La 'Ndrangheta est avant tout une atmosphère, un  climat qui imprègne les silences et les sousentendus, les regards et les actions.» C'est le ...  "
231,2021-02-16,Libération,771mots,"Par Anne-Laure Delatte Chargée de recherches au CNRS (Leda, université Dauphine)",Etre de gauche et ne pas soutenir l'annulation de la dette,"    ...  contre les crises à venir, et installer un régime de croissance inclusif et respectueux du  climat. Dès lors, qu'il est difficile de ne pas complètement les soutenir! Pour autant, j'ai ...  "
232,2021-04-16,Libération,1565mots,Par Thibaut Sardier,Racisme environnemental : mêmes victimes pour deux fléaux,"    ...  En France, dans le sillage de la mobilisation née aux EtatsUnis, les collectifs Génération  climat et Génération Adama organisent On veut respirer, un rassemblement commun en juillet 2020 pour que «les ...  "
233,2021-02-18,Libération,832mots,Recueilli par Cécile Daumas,"«C'est irresponsable, la ministre doit partir»",    ...  la logique du bouc émissaire à courte vue. Pensezvous qu'il y a un  climat antiintellectuels en France ? Les diatribes antiintellectuels sous Sarkozy avaient marqué une première étape. Mais ...  
234,2021-03-01,Libération,761mots,Par ALBANE GAILLOT Députée sans étiquette et VIOLAINE DE FILIPPIS,Il faut repenser l'index de l'égalité salariale,"    ...  Présidente de Parité Assurance, Christiane Marty Fondation Copernic, Minetou Ndiaye Présidente de Energie Femmes, Louisa Re noux Présidente de Femmes, Santé,  Climat, et Isa belle Sthemer Présidente de Protéine «au féminin».  ...  "
235,2021-03-03,Libération,971mots,Par Benjamin Delille Envoyé spécial à Reims,"Agression de Christian Lantenois: «l'Union», une rédaction en souffrance","    ... 'attendais pas à ce que ce soit un collègue, c'est dur. Mais vu le  climat dans certaines zones du quartier, ça ne pouvait que finir par mal tourner.» Depuis une violente ...  "
