,date,publication,words,author,title,intro
79,2016-11-22,Libération,3490mots,Nathalie Raulin|Alain Auffray|Catherine Mallaval|Célian Macé|Sylvain Mouillard|Marie Piquemal|Coralie Schaub|Amandine Cailhol|Frantz Durupt|Julie Brafman,La France selon Fillon,"    ...  sa vision dans un document de douze pages. Il insiste sur  «l'accélération du changement  climatique et son cortège de dérèglements»,  cite la COP 21, parle d' «urgence».  Dans une vidéo du ...  "
80,2016-12-22,Libération,1012mots,Laure Murat,"Donald Trump : «L'Etat, c'est moi», par Laure Murat","    ... «Je n'y crois pas.» Ça doit être un canular, en effet. Comme le changement  climatique. Dans un entretien avec Barbara Walters, présentatrice vedette de la télévision américaine, Trump confiait juste avant ...  "
81,2016-12-26,Libération,416mots,Marisa Endicott,"Environnement : «Face à Trump, redoublons d'efforts»",    ...  énergies renouvelables et les technologies propres. Les progrès environnementaux et l'action contre le changement  climatique aux EtatsUnis sontils voués à l'échec avec l'arrivée de Donald Trump ?  ...  
82,2016-11-14,Libération,699mots,Daniel Schneidermann,Et si Donald Trump était une bonne nouvelle pour la presse ?,"    ...  11 Septembre (qui est, par ailleurs, c'est bien connu, un complot américain); le réchauffement  climatique est une mystification inventée par les Chinois, etc. Il a flirté avec toutes ces «vérités» que ...  "
83,2016-10-26,Libération,1053mots,Elodie Boissard,Peter Wagner : «La crise est un appel à la réflexion collective et au progrès»,"    En ces temps pessimistes et de remise en cause des idéologies passées, il est presque devenu un gros mot. Parler de progrès, c'est passer au pire pour un vieux stal ...  "
84,2016-12-13,Libération,100mots,,-12 %,"        ...  énorme»,  s'alarme un des auteurs. Pour les chercheurs, ce rabougrissement est lié au réchauffement  climatique. Des hivers plus chauds signifient d'avantage de pluie. Elle tombe sur la neige, où elle ...  "
85,2016-09-01,Libération,240mots,Johanna Luyssen,«On s'est tapé quinze jours de burkini sur tous les médias avec une surenchère qui était vraiment insupportable. Ça vaut [...],"    ...  d'août le C40, réseau rassemblant 83 villes mondiales destiné à lutter contre le dérèglement  climatique, a confirmé la mise en place à la fin de l'été de deux camps de ...  "
86,2016-09-28,Libération,1131mots,Sylvain Mouillard,Kenneth Roth : Machine de paix,"    ...  et poussent des millions de personnes sur les routes de l'exil, ou le changement  climatique. Mais il garde le contrôle. «Quand j'ai commencé à travailler dans ce milieu, il y ...  "
87,2016-09-28,Libération,901mots,Thomas Coutrot,"La RTT, cible de bobards idéologiques",    ...  dans une tribune publiée dans  Libération le 19 septembre. Prétendre que la RTT crée des emplois serait donc aussi absurde que nier l'existence du génocide juif ou du réchauffement  climatique.  ...  
88,2016-12-28,Libération,816mots,Laurent Joffrin,Le dangereux procès des démocraties,"    ...  maux qui nous assaillent, reliant entre eux les phénomènes apparemment disparates que sont la crise  climatique, le terrorisme et l'explosion des inégalités. Il voit leur origine dans le grand tournant de ...  "
89,2016-12-30,Libération,1022mots,Laurence Defranoux,Jean-Christophe Victor voyage sans retour,"    ...  plusieurs autour du Groenland ( «à cause de l'histoire familiale»), cet endroit où  «le réchauffement  climatique est bien réel». L'Espace des mondes polaires, un musée dont il a porté le projet ...  "
90,2016-12-30,Libération,1844mots,Catherine Calvet,"Francis Hallé «Une plante n'a ni queue ni tête, c'est pour cette altérité que je suis devenu botaniste»","    ...  si on ne faisait toujours pas le lien entre la forêt tropicale et le changement  climatique. Alors que ces forêts travaillent douze mois sur douze pour la photosynthèse, pour produire de l ...  "
91,2016-09-07,Libération,860mots,Stéphane Le Foll,Pour quelle France nous battons-nous ?,"    ... 'est aussi préparer l'avenir de nos enfants. A ce titre, lutter contre le réchauffement  climatique est un enjeu majeur. A droite, pas un mot, pas une proposition, comme si l'avenir ...  "
92,2016-09-14,Libération,150mots,,Engie traîne sa vieille centrale australienne,"        ... 'entreprise veut se présenter comme vertueuse, alors qu'en réalité ces centrales continueront de fonctionner, contribuant inexorablement à la crise  climatique» , explique Malika Peyraut, des Amis de la Terre. A.Mt.  ...  "
93,2016-10-03,Libération,258mots,Judicaël Lavrador,Les rescapés du quotidien d'Apostolos Georgiou,"    Estce le réchauffement  climatique et la montée du niveau des océans, la guerre, une crise financière, un naufrage qui a contraint ce trio d'hommestroncs à se jeter à l ...  "
94,2016-11-04,Libération,82mots,,Sur Libération.fr,"        ...  de Paris, qui vise à contenir la hausse des températures et lutter contre le dérèglement  climatique, entre en vigueur. Soit trente jours après que la barre des ratifications par 55 pays représentant ...  "
95,2016-12-24,Libération,1360mots,Jacky Durand|Pierre Carrey,"«On verra des copies gastronomiques de plus en plus sophistiquées, des kits»","    ...  seule semence capable d'accompagner la hausse de la population mondiale ainsi que le changement  climatique.» Ã%ric Roux , porteparole de l'Observatoire des cuisines populaires «Plus on parle mondialisation et ...  "
96,2016-12-16,Libération,976mots,Frédéric Worms,Un certain sentiment d'irréalité,"    ...  face à un fléau réel. Vous avez le choix, prenez n'importe lequel (et même  climatique, social, moral), près de chez vous, mais luttez contre. Sans céder sur les mots, sur leur ...  "
97,2016-12-16,Libération,2228mots,SERVICE ETRANGER,"Très riches, très à droite et très blancs, les vingt lieutenants de Trump","    ...  Diminuer le pouvoir d'action de l'EPA. La phrase «Ce débat  [sur le réchauffement  climatique]  est loin d'être réglé.» Reince Priebus, 44 ans, chef de cabinet Le président du Parti ...  "
98,2016-12-10,Libération,361mots,,Le pire des nouveaux ministres de Trump,"        ...  et prospérité aux salariés américains»,  s'est enthousiasmé Donald Trump. «Ce débat [sur le réchauffement  climatique] est loin d'être réglé.»   Trump n'a jamais caché ses velléités climatosceptiques. La nomination de ...  "
99,2016-10-07,Libération,738mots,Arnaud Vaulerin,"Aux Philippines, le grand remue-ménage","    ...  les Philippines n'étaient pas régulièrement victimes de catastrophes naturelles, on filerait bien la métaphore  climatique pour décrire le tourbillon qui s'est emparé de ce grand archipel d'Asie. Depuis cent ...  "
100,2016-09-08,Libération,382mots,Simon Blin,"En 2015, 48 millions d'enfants «déracinés» dans le monde","    ...  dernières années, notamment de la part de la coalition internationale. Outre les guerres, le dérèglement  climatique, surtout en Asie, mais aussi l'extrême pauvreté, les violences perpétrées par des gangs et les ...  "
101,2016-09-14,Libération,1757mots,Eric Favereau|Amandine Cailhol,Infirmiers : dans les couloirs du désespoir,"    ...  n'empêche, ils se sont répétés. Et ces gestes désespérés semblent faire écho à un  climat lourd et pesant que l'on ressent dans le monde des soignants. «C'est au minimum ...  "
102,2016-10-01,Libération,938mots,Natalie Levisalles,"José Carlos Llop : «Quand le paradis disparaît, souvent la littérature apparaît»","    ...  j'essaie de mener une vie aussi austère que celle de  Solstice . L'âpreté du  climat m'aide à me souvenir de l'atmosphère que je décris dans  Solstice,  malgré la différence ...  "
103,2016-10-11,Libération,39mots,,Sur Libération.fr,"        ...  une ville Front national Plusieurs élues et militantes de gauche dans des communes FN dénoncent un  climat d'intimidation permanent à leur égard, et appellent à «ne plus rien laisser passer».  ...  "
104,2016-10-27,Libération,1358mots,Elise Godeau,Cité du Val-Fourré : «Ce n'est pas en cassant du bâti qu'on fait de l'humain»,"    ...  la plupart du temps. Il suffit parfois d'une  «goutte d'eau»  pour que le  climat soit électrique. Cette fois, l'histoire implique du maïs et de la musique classique.  «Rien à ...  "
105,2016-10-29,Libération,311mots,Christian Godin,à l'infini,"    ...  un coin perdu du Massif central, le plateau du Cézallier, aux formes douces et au  climat rude, au mois d'octobre lorsque le ciel hésite déjà entre l'automne et l'hiver ...  "
106,2016-11-03,Libération,692mots,Alain Franck,La méthode Janaillac : faire le vide et ménager les pilotes,"    ...  leur mouvement de grève contre une reprise des négociations quelques mois plus tard dans un  climat apaisé. Ça marche. Alors, ce camarade de promotion de François Hollande  Janaillac s'agace lorsqu'on ...  "
107,2016-11-03,Libération,1144mots,Jérôme Lefilliâtre,«L'Obs» est un loup pour «l'Obs»,    ...  Les négociations sur les conditions de départ sont en cours. Elles ont débuté dans un  climat d'extrême tension entre Croissandeau et la rédaction. Celleci a voté une motion de défiance ...  
108,2016-11-10,Libération,467mots,Veronika Dorman,"Le «style Obama» ébranlé, son héritage menacé","    ...  a aussi prévu de s'en prendre aux engagements internationaux d'Obama, notamment sur le  climat (le républicain menace d'annuler l'accord de Paris), la nonprolifération nucléaire (Iran), les traités ...  "
109,2016-12-21,Libération,1409mots,Julien Gester,"«Paterson», bouquet de prose","    ...  que les contingences conjugalolaborieuses de son existence lui en concèdent le loisir, mais le  climat du récit, oscillant doucement entre ravissements terre à terre et fantaisies évaporées, enrobe la chose avec ...  "
110,2016-12-23,Libération,1345mots,Lucie Tanneau,La forêt française a la gueule de bois,"    ...  l'automne 2015, juste après l'adoption du label, se sont déroulées dans un vrai  climat de tension. Mais la mesure commence quand même à produire ses effets, sans effondrement des prix ...  "
111,2016-12-30,Libération,1613mots,Pierre Carrey,"Odos : Jacquie et Michel, le porno né sous X","    ...  Internet, vieilles traces qui subsistent, il n'est pas si simple de disparaître totalement. Le  climat d'Odos y contribue plus ou moins. Au fond, la population du village se porte bien ...  "
112,2016-09-23,Libération,1577mots,Rachid Laïreche,EE-LV : quatre candidats sur le zinc,"    ...  par exemple, je vais plus facilement mettre en avant la mondialisation, l'Europe et le  climat, des combats que je mène depuis vingtcinq ans.»  Il ajoute :  «Mais notre parti est, et ...  "
113,2016-09-28,Libération,1600mots,Arnaud Vaulerin,"A Manille, «le temps des tueurs»","    ...  tôt, Diokno s'était livré à des  «rappels historiques qui justifient nos inquiétudes sur le  climat d'impunité que nous vivons en ce moment », analysetil en juriste.  «La faiblesse de ...  "
114,2016-09-08,Libération,431mots,Ramsès Kefi,Ménard et la clochardisation du débat public,    ...  Plus on le fait et moins on a la légitimité de dire ensuite que le  climat est nauséabond puisqu'on aura participé au spectacle. Car Ménard ne fait pas de politique au ...  
115,2016-09-10,Libération,1546mots,Elvire von Bardeleben,Armand Arnal des plants dans les plats,"    ...  avoir suivi une jolie route entre les étangs. Le jardinpotager de deux hectares prospère grâce au  climat agréable et rend possible une cuisine saine et créative, couronnée par une étoile.  ...  "
116,2016-10-20,Libération,451mots,Marie Piquemal,Eric Debarbieux : «Peu de violences en milieu scolaire résultent d'intrusions extérieures»,"    ...  entre les élèves, les réflexions racistes... Toutes ces incivilités qui se répètent et pourrissent le  climat d'un établissement. Dans les lycées touchés, les professeurs réclament des moyens humains... Oui, cela ne ...  "
117,2016-10-20,Libération,894mots,Amandine Cailhol,"CGT Goodyear : «Sans nous, l'usine aurait brûlé tout un tas de fois»","    ...  ce mercredi matin, devant le juge de la cour d'appel d'Amiens (Somme).  «Le  climat était anxiogène, très tendu, on était en congé imposé», explique l'un d'eux, invité à ...  "
118,2016-10-22,Libération,124mots,,Vidéo Club,"        ...  les premières fois du film (cinéaste, personnage, actrice épatante) se confondent dans une virée au  climat d'épiphanie. Fort du désopilant coup d'essai qui l'avait révélé  (la Fille du 14 ...  "
119,2016-10-28,Libération,705mots,Simon Blin,"Alexandre Kojève, à contre-courant","    ...  facette ? Dès l'âge de 15 ans, il développe sa pensée, sûrement aidé par le  climat culturel dans lequel il grandit. Dans les années 20, la guerre civile éclate en Russie. Ceux ...  "
120,2016-11-07,Libération,664mots,Stéphanie Harounyan,Accalmie en trompe-l'oeil aux urgences d'Avignon,"    ...  diffusé. Même au sein du service, le personnel paramédical doit continuer le travail dans un  climat très flou.  «C'était perturbant,  raconte une aidesoignante.  On ne savait même pas qui était ...  "
121,2016-11-19,Libération,872mots,Jérôme Lefilliâtre,"En France, les médias promettent de «réduire la distance avec les lecteurs»","    ...  qui n'ont pas été castés préalablement. Ils appellent librement le standard téléphonique.» Dans un  climat généralisé de défiance envers les élites, le principal enseignement à tirer de l'élection de Trump ...  "
122,2016-11-28,Libération,43mots,,«L'Arctique est un des endroits du monde qui se réchauffe le plus vite»,"        ...  MassonDelmotte, paléoclimatologue française et membre du Groupe d'experts intergouvernemental sur l'évolution du  climat (Giec), détaille avec pédagogie pourquoi l'Arctique connaît une hausse sans précédent de ses températures. Photo ...  "
123,2016-11-26,Libération,501mots,Coralie Schaub,Diesel : l'Europe carbure à l'huile de palme,"    ...  Les agrocarburants à base d'huile de palme sont trois fois plus nocifs pour le  climat que le diesel fossile, rappelle Transport &amp; Environment, en particulier à cause de la déforestation et du ...  "
124,2016-12-07,Libération,1008mots,Philippe Douroux|Marie Piquemal|Juliette Deborde,"L'Allemagne, le Danemark et le Canada ont obtenu de bons résultats à l'enquête Pisa de l'OCDE. Trois professeurs qui y [...]","    ...  dans la communauté. On a une relation quasi familiale avec les élèves et les parents. Il y a un plus grand respect, et le  climat est plus apaisé qu'en France.»  ...  "
125,2016-12-13,Libération,1903mots,Jonathan Bouchet-Petersen,Jean-Pierre Mignard : «Macron a montré qu'il savait mordre»,"    ...  premières fois du prochain président La première décision ? La tenue d'états généraux sur le  climat, la pollution et la santé, réunissant industrie automobile, professionnels de la santé, ONG et Etats. Le ...  "
126,2016-10-25,Libération,1570mots,Grégoire Biseau|Rachid Laïreche|Laure Bretton,"Taubira, roue de secours à gauche","    ...  son stylo. Il dit : «Avec elle, on peut raconter une belle histoire sincère. Dans le  climat actuel, une femme noire et de gauche face à la droite et au Front national, ça ...  "
127,2016-11-03,Libération,481mots,Virginie Bloch-Lainé,"Nathalie Sarraute, forte tête","    ...  admirative, parfois trop, cependant Sarraute ne s'y arrête et n'en profite jamais. Ce  climat, surprenant parce qu'il dure tout au long du livre, et donc peutêtre de leur ...  "
128,2016-11-16,Libération,993mots,Arthur Dreyfus,Un héros de télé-réalité,"    ...  de surmoi. Jouir, donc, de tout sans considération du lendemain, récuser les engagements sur le  climat, polluer davantage, détruire les accords de paix, insulter impulsivement, édifier de nouvelles tours; comme si le ...  "
129,2016-09-08,Libération,1023mots,Virginie Bloch-Lainé,Bob Marley et les sept mercenaires,"    ...  policiers, gangsters, politiciens, femmes à la dérive et journalistes commentent à tour de rôle le  climat qui règne dans la ville natale de Marlon James, Kingston, et la tentative d'assassinat visant ...  "
130,2016-09-27,Libération,473mots,Eric Favereau,"Economies à l'hôpital : «Cette espèce de pression, ça devient dramatique»","    Il y a comme un raslebol, un agacement persistant contre le mauvais  climat qui perdure à l'hôpital public. Lundi, ce sont essentiellement les anesthésistes et des réanimateurs qui avaient ...  "
131,2016-10-08,Libération,692mots,Dominique Albertini,Sarkozy l'agitateur,"    ...  Français de la basse classe», poursuit l'homme de 34 ans, qui fait fi du  climat judiciaire entourant son champion : « Qui n'a pas ses problèmes ?» Des Mathieu, on en croise beaucoup ...  "
132,2016-10-22,Libération,886mots,Natalie Levisalles,Enjeux d'enfants,"    ...  bouillir. Ça sent la viande de baleine et de phoque dans toute la maison». Le  climat polaire, la neige, le froid sont omniprésents. Les chiens aussi, qui ont l'air enragés,  «ils ...  "
133,2016-10-14,Libération,870mots,Emmanuelle WALTER,"Justin Trudeau, Canada Dry de la politique","    ...  Valls, débarqué lui aussi sur le sol canadien pour évoquer l'accord, mais aussi le  climat, le Mali, et... les vétérinaires français qui ne peuvent exercer quand ils immigrent au Québec. On ...  "
134,2016-10-04,Libération,652mots,,«Il y a un blocage idéologique à la dépénalisation»,"        ...  que la situation actuelle aboutit à financer des réseaux financiers mafieux et à entretenir un  climat de violence et de mort. Pourquoi ce discours ne passetil pas ? A gauche, il ...  "
135,2016-11-24,Libération,305mots,Arnaud Vaulerin,"Aux Philippines, le clan Duterte prêt à rétablir la peine de mort","    ...  l'âge de la responsabilité pénale soit abaissé de 15 à 9 ans. Dans un  climat tendu, les parlementaires discutent à nouveau cette semaine de ces deux projets de loi. Au moins ...  "
136,2016-12-09,Libération,1155mots,Sibylle Vincendon,Meka Brunel : Perse les nuages,    ...  d'avoir  «piloté le dossier Duo» et lui attribue un  «rôle non négligeable» dans le  «climat apaisé» qui règne à Paris autour des gratteciel. La dernière association encore au tribunal administratif ...  
137,2016-12-01,Libération,459mots,Alain Auffray,"La primaire, la pire des solutions à l'exception de toutes les autres","    ...  leurs voix au choeur de ceux qui dénoncent un retour au  «suffrage censitaire». Dans un  climat de crise politique, la primaire s'est imposée comme une solution fragile et sans doute provisoire ...  "
138,2016-11-26,Libération,2668mots,Clémentine Mercier,Le bling et le yuan,"    ...  passage des professionnels invités, au doigt mouillé (pas seulement à cause de la moiteur du  climat), on observe tout au plus la présence de quelques curieux et familles, a priori d'extraction ...  "
139,2016-09-01,Libération,117mots,Florian Bardou,23,    C'est le nombre de pays qui ont ratifié l'accord de Paris sur le  climat adopté en marge de la COP 21. Encore trop peu nombreux pour que le traité entre ...  
140,2016-10-08,Libération,1797mots,Laure Equy|Dominique Albertini,"Primaire LR : deux salles, deux ambiances","    ...  Français de la basse classe»,  poursuit l'homme de 34 ans, qui fait fi du  climat judiciaire entourant son champion : « Qui n'a pas ses problèmes ?»  Des Mathieu, on en croise beaucoup ...  "
141,2016-10-10,Libération,784mots,Un collectif,Appel à l'union de la gauche antilibérale,"    ...  une planification écologique, la sortie du nucléaire, lutter d'arrachepied contre le réchauffement du  climat, etc. D'accord pour abolir le traité budgétaire européen, renégocier les dettes en Europe, en finir ...  "
142,2016-10-05,Libération,3347mots,,Quand tout acte contestataire peut être qualifié de «terrorisme»,"        ...  dont on se plaît généralement à souligner le caractère autoritaire, ne peut être acceptée. Un  climat lourd s'installe, les libertés publiques sont limitées, menacées. Ainsi, ce qui est arrivé le soir ...  "
143,2016-09-20,Libération,1360mots,Guillaume Tion,"Ennio Morricone, maestro furioso","    ...  analyse le maestro assis sur un petit canapé, dans son appartement. A l'extérieur, le  climat est caniculaire. A l'intérieur, les fenêtres du grand salon, celui où se trouve le piano ...  "
144,2016-10-25,Libération,387mots,Aude Massiot|Estelle Pattée,Que prévoit le Ceta ?,"    ...  une explosion de la concurrence. L'environnement  Alors que l'accord de Paris sur le  climat doit entrer en vigueur début novembre, le Ceta ne mentionne pas ce traité historique, que les ...  "
145,2016-11-05,Libération,2369mots,Natalie Levisalles,Guadalupe Nettel : «Le départ est toujours un horizon»,"    ...  je suis arrivée. Je me suis adaptée à elle, comme on s'adapte à un  climat ou à un environnement. Et je me suis attachée surtout. J'ai compris que certains mots ...  "
146,2016-11-16,Libération,787mots,Dominique Albertini,FN: une précampagne à pas feutrés,"    ...  leur capacité à  «battre Marine Le Pen» un argument de poids en leur faveur. Un  climat encore renforcé par la victoire de Donald Trump, qui rend particulièrement concrète la perspective d'un ...  "
147,2016-11-26,Libération,1132mots,Sabrina Champenois,"Val McDermid: «Le vitriol et le venin se répandent, et l'élection de Trump légitime ces travers»","    ...  nous, les Ecossais, bien plus qu'avec les Américains, voire les Britanniques. Ça tient au  climat, à l'isolement, mais aussi au contrat socialdémocrate qui organise nos sociétés, aux valeurs qu ...  "
148,2016-12-08,Libération,905mots,Amandine Cailhol,Postiers : une grève contre l'épuisement,"    ...  facteurs ne réussissent pas à les faire dans leurs heures de boulot. Du coup, le  climat social est tendu entre agents. Cela génère aussi des arrêts maladie en cascade», raconte un agent ...  "
149,2016-12-16,Libération,1048mots,Olivier Ertzscheid,Pour des états généraux de l'Internet indépendant,"    ...  plateformes actuelles puissent les empêcher d'investir lesdits secteurs. Nécessité du storytelling faisant loi et  climat d'insécurité aidant, le politique a principalement traité ces questions sous l'angle de la menace ...  "
150,2016-12-23,Libération,817mots,Laurence Defranoux,Et pourtant la lutte antipollution progresse en Chine,"    ...  pollution est en nette baisse en Chine. Dong Liansai, responsable de la campagne Energie et  Climat de Greenpeace pour l'Asie de l'Est, précise :  «Entre 2014 et 2015, la moyenne de ...  "
151,2016-12-27,Libération,1412mots,Louis-Ary Laristan|Quentin Müller,Le footballeur qui remotive l'Irak face à Daech,"    ...  été le meilleur buteur de la sélection.  «Mon père et mon oncle jouaient dans un  climat de paix. L'Irak avait plusieurs joueurs importants [Hussein Saeed et Ahmed Radhi notamment, ndlr].  Maintenant ...  "
152,2016-09-08,Libération,1368mots,Elvire von Bardeleben,Empowerment : le grand détournement de fond,"    ...  c'est surtout au tournant des années 6070 que le terme se répand. Le  climat social explique en grande partie cette diffusion, analyse MarieHélène Bacqué dans son livre  l'Empowerment ...  "
153,2016-10-18,Libération,784mots,François Dubet,Cher Laurent Joffrin,"    ...  Valeurs actuelles, mais tout simplement parce qu'ils sont faux. Ils procèdent aussi du même  climat : assez de politiquement correct, assez d'hypocrisie, assez d'élitisme et d'analyses compliquées, assez de ...  "
154,2016-10-27,Libération,356mots,Marisa Endicott,Fawzia Mirza: «J'ai cherché un personnage que Trump ne pourrait supporter : sa fille musulmane illégitime»,"    ... Pourquoi cette oeuvre ? J'ai voulu montrer le  climat politique négatif qui pèse sur l'islam aux EtatsUnis, et que l'interdiction du mode vestimentaire musulman dans d'autres pays n ...  "
155,2016-11-07,Libération,2135mots,Grégoire Biseau|Tonino Serafini|Luc Peillon,Louis Gallois : «Le déclin industriel est le terreau du FN»,"    ...  France des territoires en déclin, les personnes en difficulté sont stigmatisées. Que pensezvous du  climat politique ? Traiter les démunis d'«assistés» crée de vrais traumatismes. Estce que l'on s ...  "
156,2016-11-18,Libération,934mots,Frédéric Worms,"Monsieur Obama, continuons votre mandat","    ...  Il faudra se souvenir de vous à ce momentlà. Il y aurait aussi le  climat, sur lequel du moins vous avez maintenu l'essentiel : le rapport à la vérité, à la ...  "
157,2016-11-19,Libération,559mots,Aude Massiot,Haïti : des élections au bout du rouleau,"    ...  octobre à DameMarie, et le 1er novembre à Les Cayes. Ces événements illustrent le  climat de plus en plus tendu dans le pays, alors qu'une partie de la population soupçonne ...  "
158,2016-12-22,Libération,144mots,Amaelle Guiton,"Guillaume Poupard : «La menace est élevée, elle est proportionnelle à la place qu'ont pris les moyens numériques.»","    ... (SGDSN), auquel elle est rattachée, restent prudents. Louis Gautier, le patron du SGDSN :  «Dans un  climat global où l'agressivité d'un certain nombre de pays et les intimidations se font sentir ...  "
159,2016-09-02,Libération,1906mots,Gilles Renault,Branle-bas de combats à Perpignan,"    ...  si ostensiblement  et caricaturalement  rassurer, n'en finiton pas, en outre, par propager un  climat anxiogène, à l'inverse du but recherché ? D'autant que Visa pour l'image n'est ...  "
