,date,publication,words,author,title,intro
156,2019-10-30,Libération,635mots,Bernadette Sauvaget,"Pour les représentants du culte musulman, un nouveau seuil d'intolérance","    ...  Depuis cette rentrée, beaucoup de responsables musulmans faisaient part de leur inquiétude. Un très mauvais  climat était, à nouveau, en train de s'installer après la tuerie de la préfecture de police ...  "
157,2019-12-13,Libération,981mots,Maria Malagardis,Le Niger en plein désert sécuritaire,"    ...  trouver dans un autre monde, d'où les informations ne parviennent visiblement que par bribes.  Climat délétère Dans l'immédiat, cette attaque a également conduit à reporter au début de l'année ...  "
158,2019-09-26,Libération,94mots,,Cohn-Bendit parmi les Français tirés au sort pour la convention citoyenne sur le climat,"        ...  CohnBendit a été prétiré au sort pour former la convention citoyenne pour le  climat, rapporte  l'Obs. Cette assemblée de 150 membres doit se réunir d'octobre à janvier. Pour ...  "
159,2019-12-11,Libération,71mots,,Climat : «Il faut développer l'agroécologie sur tout le territoire»,        ...  explique à  Libé comment l'agriculture peut aussi être source de nombreuses solutions pour le  climat. Notamment via  «la réintroduction d'arbres» mais aussi  «la préservation des sols pour favoriser le stockage ...  
160,2019-12-21,Libération,1091mots,Mathilde Frénois,"A Nice, Christian Estrosi s'évertue à se verdir","    ...  autour de sa nouvelle ligne de tram, Greenpeace France, l'Unicef et le Réseau Action  Climat (RAC) publiaient leur classement des agglomérations françaises en fonction de leurs  «efforts pour lutter contre la ...  "
161,2019-09-28,Libération,5603mots,Julien Gester,A la source d'«Atlantique»,    ...  annoncé de l'avantpremière  à l'équipe de s'apprêter en coulisses dans un  climat fervent et anxieux de veille d'examen. Seule Mati Diop s'est changée à la dernière ...  
162,2019-11-19,Libération,71mots,,"Fil Vert : «Viens voir les docteurs», du débat sans invectives sur le climat",        ...  lance sur CliqueTV une émission mensuelle de vulgarisation de la recherche. La première consacrée au  climat comporte en seconde partie un débat argumenté et contradictoire sans être hystérique. La solution estelle ...  
163,2019-10-28,Libération,1370mots,Isabelle Hanne,Mort d'Abou Bakr al-Baghdadi : l'Etat islamique perd sa tête,    ...  poussé le Pentagone à accélérer l'opération avant de perdre ses soutiens logistiques sur place.  Climat de défiance La mort d'Abou Bakr alBaghdadi intervient à point nommé pour Donald Trump ...  
164,2019-09-12,Libération,195mots,Thomas Piketty,Piketty : «L'étendard vert ne suffit pas toujours»,"    ... 'instant, sont très émiettées en termes de marché politique. Je me méfie des instrumentalisations du  climat, pas forcément par ces décrocheurslà. C'est bien de dire qu'on va changer de ...  "
165,2019-12-20,Libération,655mots,Anaïs Moran,"Dans les gares, les «gilets rouges» aiguillent les humeurs","    ...  leur arrive de dire une vacherie ou deux sur nos camarades en grève, mais le  climat est loin d'être électrique !» Difficile de le contredire : autour de lui, ça s'impatiente, ça ...  "
166,2019-09-28,Libération,90mots,,Plusieurs centaines de milliers de jeunes ont manifesté pour le climat vendredi en Italie,"        Plusieurs centaines de milliers de jeunes ont manifesté pour le  climat vendredi en Italie à l'occasion du «Friday for Future», mouvement mondial de grève des cours initié par Greta Thunberg. A ...  "
167,2019-11-20,Libération,2169mots,Simon Blin,Y a-t-il un «maccarthysme» à l'université ?,"    ...  Beytout. «Censure» Pour beaucoup, ces incidents seraient des éléments significatifs de la montée d'un  climat d'intimidation au sein du monde académique, d'autant qu'ils interviennent après d'autres. En ...  "
168,2019-12-10,Libération,2986mots,Pierre-Henri Allain|François Carrel|Mathilde Frénois|Eva Fonteneau,"De Saint-Brieuc à Draguignan, «la France est une Cocotte-Minute»",    ...  2 000 personnes environ. N'auraitelle pas confondu avec les défilés écolos pour le  climat ?  «J'ai fait cette pancarte parce que je n'entends plus d'oiseaux dans mon jardin ...  
169,2019-10-07,Libération,1030mots,Nelly Didelot,Extinction Rebellion : désobéissance fertile,"    Des ponts bloqués plusieurs jours d'affilée, des activistes enchaînés à des bâtiments ou perchés sur le toit des rames de métro, 55 lignes de bus déviées... En avril, moins de ...  "
170,2019-10-05,Libération,567mots,Didier Péron|Julien Gester,Trop belle poubelle,"    ... Les effets conjugués du réchauffement  climatique, des pollutions industrielles, de l'épuisement des ressources naturelles, de la saturation du moindre espace vivant par l'adjonction de matières toxiques censément fertilisantes et dévolues ...  "
171,2019-09-26,Libération,1017mots,Aurore Coulaud,Soulac-sur-Mer aux avant-postes de l'érosion côtière,"    ...  Aujourd'hui, seule une partie de l'érosion des côtes françaises est imputable au changement  climatique mais cette tendance va s'accentuer, selon les conclusions du rapport du Giec. Sur la côte ...  "
172,2019-10-17,Libération,973mots,Robert Maggiori,La promesse de l'autre,"    ...  la promesse» semble  «avoir cédé devant de nouvelles apocalypses», des crises et des menaces  («terroriste,  climatique, nucléaire, migratoire»). Doiton, pour échapper au triste constat de ne pouvoir promettre que désolation, penser ...  "
173,2019-11-14,Libération,325mots,Stéphanie Maurice,"«Pap' 40», antipub et fier de l'être","    ...  je ne peux pas faire plus, nous ne sommes pas entendus. Je parle d'urgence  climatique, d'urgence sociale et on me répond amende de 900 euros, je ne comprends pas.» Son ...  "
174,2019-12-04,Libération,503mots,Charlotte Belaich,La bataille pour la végétalisation de Paris a commencé,"    ...  45 à Londres ou 59 à Bruxelles. Trop peu pour faire face à l'urgence  climatique, la végétalisation permettant de faire baisser la température dans les villes. Les candidats à la mairie ...  "
175,2019-12-11,Libération,812mots,Laurent Joffrin,"Guillebaud, Franceschi, voyageurs du paradoxe","    ...  comprend : l'humanité risque de payer d'un prix exorbitant son aveuglement devant la crise  climatique. Mais à force de décrire les horreurs du monde qui vient, on en vient à oublier ...  "
176,2019-10-29,Libération,731mots,Bruno Amable,L'extinction expérimentale et aléatoire du paupérisme,"    ...  aléatoires estelle à la hauteur des questions telles que le développement ou le changement  climatique ? On suspecte que pour faire face à ces problèmes, il faudra envisager autre chose que la ...  "
177,2019-10-26,Libération,648mots,Mathieu Lindon,Vivement le droit de retrait pour tous,"    ...  d'exercer son droit de retrait en ne s'en mêlant pas qui sont l'inverse du principe de précaution : la gestion de la crise  climatique, si j'ai bien compris.  ...  "
178,2019-11-16,Libération,304mots,François Carrel,L'alpinisme conquiert l'Unesco,"    ...  constituerait un outil important pour la sauvegarde de l'activité : veille préventive face au réchauffement  climatique, suivi de l'évolution des formations nationales». Sans compter l'entretien et la restauration des refuges ...  "
179,2019-09-18,Libération,1399mots,Isabelle Hanne,"Primaires : Elizabeth Warren, l'autre voie de gauche","    ...  par son soutien au Green New Deal, cet ambitieux plan de lutte contre le changement  climatique, qui prévoit des investissements massifs dans les énergies renouvelables tout en promouvant la justice sociale. Il ...  "
180,2019-09-27,Libération,487mots,Christian Losson,"Chirac : sur l'écologie, les premiers petits pas","    ...  machin de postsoixantehuitards» lance un cri d'alarme sur la tragédie du «changement  climatique», le «scandale» du maldéveloppement, la nature  «mutilée, surexploitée». «Le coeur dit oui» L'assistance est ...  "
181,2019-10-09,Libération,300mots,Nelly Didelot,Extinction Rebellion campe à Châtelet,"    ...  expliquer les raisons du blocage et les revendications du mouvement : la reconnaissance de l'urgence  climatique et écologique par le gouvernement et les médias, la neutralité carbone d'ici à 2025 et ...  "
182,2019-12-24,Libération,72mots,,"En Amérique du Nord, le papillon monarque bat de l'aile","        ...  les efforts ne sont pas accrus pour le protéger. En cause : la perte et la fragmentation de leur habitat, le recours aux pesticides, des parasites et les effets du dérèglement  climatique.  ...  "
183,2019-10-10,Libération,68mots,,"Le Nobel de chimie pour un Américain, un Britannique et un Japonais.","        ...  Whittingham et Akira Yoshino, sont récompensés pour avoir inventé la batterie au lithiumion qui équipe smartphones et voitures électriques, dont la demande explose face à l'urgence  climatique. Photo AFP  ...  "
184,2019-10-10,Libération,945mots,Guillaume Lachenal,Santé mondiale : la France a de la pratique,"    ...  de la carte à puce) les droits de l'homme, l'Internet et la conscience  climatique. Il reste que, depuis la fin du XIXe siècle, l'Etat français a fait de la ...  "
185,2019-10-11,Libération,170mots,,Londres Extinction Rebellion cible un aéroport,"        ...  s'est levé au moment du décollage et a prononcé un discours sur l'urgence  climatique. L'avion a été retardé et l'activiste, un homme d'une soixantaine d'années élégamment ...  "
186,2019-09-27,Libération,77mots,,Municipales A Bordeaux l'écolo Pierre Hurmic y va,"        ...  de Bordeaux aux élections municipales du 15 mars, ville qu'il entend déclarer  «en urgence  climatique» une fois élu. Après avoir rassemblé depuis juin les écologistes (Mouvement des progressistes, Génération écologie...) autour ...  "
187,2019-12-27,Libération,2020mots,Isabelle Hanne,"Stand-up : aux Etats-Unis, le rire sur la corde raide","    ... Sur Donald  «attrapezles par la chatte» Trump et le consentement; Greta Thunberg, le changement  climatique et les pailles en plastique; sur le sexe pendant les règles; la fascination morbide des femmes ...  "
188,2019-10-22,Libération,826mots,Gurvan Kristanadjaja,"Face à l'ubérisation, Ken Loach livre bataille","    ...  pointe, outre les abus sociaux, de nouvelles réalités, à commencer par celle de l'urgence  climatique :  «Tu ne peux pas vivre dans un système où tout est livré individuellement dans des vans ...  "
189,2019-10-24,Libération,113mots,,60 % des oiseaux,"        ... «En ignorant les femelles, nous n'avons pas un tableau complet du vivant; or cela est essentiel pour prédire, entre autres, comment la taille des corps pourrait répondre au changement  climatique.»  ...  "
190,2019-10-29,Libération,953mots,Simon Blin,Le come-back des intellectuels,"    ...  du milieu nourri par des connaissances toujours plus pointues. Exemple parmi d'autres, la question  climatique constitue un des grands ensembles théoriques couvant des réflexions variées sur la philosophie, l'anthropologie, l ...  "
191,2019-11-14,Libération,1123mots,Sabrina Champenois,"Arnaldur Indridason, pilier d'Islande","    ...  accents militants : la préservation de la langue. Elle l'inquiète plus encore que le réchauffement  climatique qui a eu la peau du glacier Okjökull, qui le voit trier ses déchets, rouler en ...  "
192,2019-11-15,Libération,1265mots,Thierry Hoquet,Qu'est-ce qu'un steak ?,    ...  c'est l'agriculture tout entière qui est présentée comme la cause majeure du réchauffement  climatique. Nous serions donc coupables de ne plus être des chasseurscueilleurs. Une nostalgie «paléo» nourrit une ...  
193,2019-12-07,Libération,71mots,,"En Allemagne, le SPD ne fait pas (encore) exploser la «GroKo»",        ...  de la coalition Merkel. Tout en appelant à des  «discussions» avec la droite sur la politique  climatique ou la hausse du salaire minimum. Photo AP Lire notre décryptage sur  Libération.fr  ...  
194,2019-09-14,Libération,4744mots,Julien Gester,James Gray : «Hollywood vous dit toujours que c'est impossible : il faut enfoncer la porte»,"    ...  menace d'un holocauste nucléaire, qui me paraît sousestimée. Entre ça et le réchauffement  climatique, nous faisons face à deux menaces existentielles directes. Auxquelles s'ajoute, évidemment, l'horreur d'un ...  "
195,2019-10-04,Libération,1342mots,Gurvan Kristanadjaja,Tous écolos : trop bio pour être vrai ?,"    ...  et surtout de pouvoir d'achat. La réalité est bien sûr plus complexe. L'urgence  climatique se faisant de plus en plus pressante, le message écolo s'est intensifié ces derniers mois ...  "
196,2019-11-16,Libération,780mots,Paul B. Preciado,Naufrage et révolution,"    ...  capitalisme patriarcocolonial s'élève aujourd'hui sur la mer de la réalité du changement  climatique, de la destruction écologique et de l'exploitation de 99 % de la population vivante mondiale, comme ...  "
197,2019-11-16,Libération,783mots,François Carrel,Les stations de ski font le pari du grand saut,"    ...  blessure qui n'est pas encore cicatrisée, mais nous devons relever le défi du changement  climatique et faire revivre un site que l'on croyait mort. Avec une station sans moteur, respectueuse ...  "
198,2019-11-16,Libération,365mots,François Carrel|Rachid Laïreche,"A Grenoble, des socialistes tombent dans les bras de Piolle","    ...  à l'explosion des inégalités, ici, on rassemble nos forces pour la justice sociale et  climatique !»  expliquetil à  Libé. Parmi les socialistes qui ont décidé de le rejoindre : un des ...  "
199,2019-10-22,Libération,684mots,Anne-Laure Delatte,Du plastique à la plasticité du capitalisme,    ... 'appelle la plasticité du capitalisme : s'adapter coûte que coûte. Quitte à accélérer la catastrophe  climatique. La détermination politique est cruciale pour diminuer les promesses de rendement du monde à +5°C ...  
200,2019-11-15,Libération,1673mots,Laurence Defranoux,"Rohingyas : au bout de l'exil, le mirage d'une île","    ...  plus tard, le fardeau est devenu insupportable pour un Bangladesh surpeuplé, fragilisé par le changement  climatique et qui peine à sortir de la pauvreté malgré 7,9 % de croissance économique en 2018 ...  "
201,2019-11-25,Libération,746mots,Daniel Schneidermann,"Georgelin et Lallement, deux révélateurs","    ...  point de s'arranger. Interrogé, le ministre de la sécheresse et des catastrophes naturelles a déclaré qu'il ne savait pas si le réchauffement  climatique était provoqué par les activités humaines.  ...  "
202,2019-12-21,Libération,1789mots,Catherine Calvet|Thibaut Sardier,"Samuel Challéat: «On a négligé le besoin d'obscurité chez les humains, les animaux et les végétaux»","    ...  l'hémisphère sud où les conditions d'observation sont meilleures, notamment du point de vue  climatique. Dans les années 70, les astronomes amateurs prennent le relais de la mobilisation, car ils voient ...  "
203,2019-12-07,Libération,1290mots,Sibylle Vincendon,"A Asnières : j'peux pas, j'ai aquaponie","    ...  dans une note pour France Stratégie. En revanche elle est un bon moyen de régulation  climatique.  «Un toit planté a un très fort potentiel de rafraîchissement»,  explique Frédéric Madre, cofondateur de l ...  "
204,2019-09-27,Libération,1272mots,Lilian Alemagna,Niches fiscales : loin du compte 600 millions,"    ... «livret de la transition écologique» censé démontrer, en chiffres, que la lutte contre le réchauffement  climatique se retrouve concrétisée en euros dans ce budget 2020. Certes, la fiscalité carbone est au point ...  "
205,2019-09-18,Libération,270mots,Laurent Joffrin,Incarnation,"    ...  en ce qu'il traduit la prise de conscience de la société envers l'urgence  climatique, qui s'étend donc à la magistrature : tout arrive. Une nouvelle étude publiée mardi souligne le ...  "
206,2019-09-24,Libération,559mots,Franck Bouaziz,"Stéphane Villecroze «Pour nous, durable et profitable sont liés»","    ...  toujours un risque lorsqu'on investit dans un secteur vertueux, que ce soit le changement  climatique ou la transition énergétique. La probabilité existe de s'entendre dire que la performance sera moindre ...  "
207,2019-09-27,Libération,1704mots,Lilian Alemagna,"Budget et pouvoir d'achat : la troisième, c'est la bonne?","    ... «livret de la transition écologique»  censé démontrer, en chiffres, que la lutte contre le réchauffement  climatique se retrouve concrétisée en euros dans ce budget 2020. Certes, la fiscalité carbone est au point ...  "
208,2019-11-06,Libération,872mots,Juliette Delage,Huit façons de changer la couleur de l'argent,"    ...  impact positif sur la société.» V comme verte La finance pourraitelle endiguer le réchauffement  climatique et sauver la planète ? C'est ce que pensent de plus en plus de spécialistes, et ...  "
209,2019-11-05,Libération,405mots,Laurence Defranoux,Un nuage de particules fines paralyse New Delhi,"    ...  n'a toujours pas accès à l'électricité, un territoire très impacté par le changement  climatique et un PIB par habitant huit fois inférieur à celui de la France, les défis sont ...  "
210,2019-11-07,Libération,1479mots,Ariel Kenig,Chère soeur inconnue...,    ...  de CO2. J'en rigole parce que c'est vrai. Et parce que l'avenir  climatique est troublant. Il y a des jours rétrospectivement heureux. Le 9 novembre 1989 en fait partie ...  
211,2019-11-02,Libération,588mots,Mathieu Lindon,Augmentation du pouvoir du Chat,"    ...  exaspère au point qu'il  «commence à en avoir raslebobol». Et le réchauffement  climatique, qui d'un certain point de vue est bien tardif. Le Chat seraitil le premier ...  "
212,2019-12-07,Libération,589mots,Mathieu Lindon,La retraite dans le cul,"    ...  leurs retraites, auraientelles oublié qu'elles nous expliquent, en même temps, que le désastre  climatique les empêcherait d'en profiter de toutes les manières ? Si j'ai bien compris, on reproche ...  "
213,2019-12-28,Libération,186mots,Simon Blin,Flygskam,"    ...  les Suédois sont décidément à la pointe de l'éveil des consciences sur l'urgence  climatique , le mot s'est imposé pour qualifier cette culpabilité qui heurte désormais les convictions écolos des ...  "
214,2019-12-24,Libération,922mots,Clémentine Mercier,Des graphistes ultra-branchies,"    ...  sont en voie de disparition en raison de la destruction des habitats et du changement  climatique.» Car la nature est toujours plus complexe qu'il n'y paraît, ce qu'ils découvrent ...  "
215,2019-12-24,Libération,1617mots,Anne Proenza,"En Colombie, un labo contre les amphibiens mal acquis","    ... 'une centaine d'entre elles depuis les années 90, mais aussi du fait du changement  climatique, de la destruction des habitats et du braconnage qui alimente le trafic illégal. «Ferrari» La Colombie ...  "
216,2019-10-12,Libération,2174mots,Frédérique Roussel,Nina Allan «Le no-man's land fou entre réel et imaginaire»,"    ...  roman extraordinaire intitulé  Stillicide, de l'écrivain gallois Cynan Jones, qui porte sur le changement  climatique et qui est un des portraits les plus marquants de notre futur proche que j'ai ...  "
217,2019-09-21,Libération,245mots,Emma Donada,Est-il vrai que Ségolène Royal n'a jamais mis les pieds au Conseil de l'Arctique?,"    ...  Conseil de l'Arctique ? C'est d'attirer l'attention sur les conséquences du dérèglement  climatique», a expliqué l'exministre de l'Ecologie. Pour rappel, le Conseil de l'Arctique est ...  "
218,2019-09-28,Libération,300mots,Alexandra Schwartzbrod,Moyens,"    ...  interrompre la «semaine verte» que nous nous étions engagés à assurer avec la publication de six unes d'affilée dédiées au dérèglement  climatique. Lecteur/trice, tu ne perds rien pour attendre !  ...  "
219,2019-09-28,Libération,1399mots,Laure Equy,"«Chirac était comme les Français, un peu menteur et resquilleur»","    ...  services de sécurité israéliens à Jérusalem   «This is not a method» , le cri d'alerte  climatique de Johannesburg   «Notre maison brûle...» , le «non» à la guerre en Irak qui fut le sujet ...  "
220,2019-10-21,Libération,1596mots,Noémie Rousseau|Eva Fonteneau|Stéphane Thépot,"A Toulouse, Strasbourg et Bordeaux, liste commune ou défaite ensemble","    ...  la répartition des places devraient arriver à leur terme cette semaine. Portés par l'urgence  climatique et surfant sur les bons résultats du parti EELV aux européennes en Gironde, les écolos ...  "
221,2019-11-30,Libération,1531mots,Emmanuelle Steels,Les conférences de prêche de López Obrador,    ... «le féminisme est d'abord un humanisme») ; de l'absence de positionnement sur le changement  climatique et les questions globales. Le Président a par ailleurs fait marche arrière sur sa promesse de ...  
222,2019-12-03,Libération,102mots,,57 articles,"        C'est le nombre d'articles consacrés au changement  climatique sur les 77 000 publiés depuis leur création par les neuf revues scientifiques les plus importantes en économie, selon une étude reprise ...  "
223,2019-12-07,Libération,175mots,Sibylle Vincendon,Agriculture urbaine : ça pousse,"    ...  dans une note pour France Stratégie. En revanche elle est un bon moyen de régulation  climatique.  «Un toit planté a un très fort potentiel de rafraîchissement», explique Frédéric Madre, cofondateur de l ...  "
224,2019-12-21,Libération,343mots,Vincent Coquaz,"Sarkozy avait-il acheté les mots «racaille» ou «banlieue» sur Google, lors des émeutes de 2005 ?",    ...  en tête de page un lien vers son site de campagne lorsqu'ils tapent  «crise  climatique» ou des centaines d'autres expressions équivalentes sur le moteur de recherche. Ce qui ne veut ...  
225,2019-09-27,Libération,51mots,,Diaporama Or noir au Nigeria,"        ...  semaine verte, retrouvez tous les jours un coin du monde face aux enjeux du réchauffement  climatique. En 2017, Bénédicte Kurzen, membre du collectif Noor, constatait les dégâts écologiques et humains de l ...  "
226,2019-10-18,Libération,93mots,,Trump recevra le prochain G7 dans son club de golf à Miami,"        Non seulement le réchauffement  climatique ne sera pas au programme du prochain G7, prévu en 2020 aux EtatsUnis, mais il aura lieu dans un des clubs de golf de Donald Trump ...  "
227,2019-09-12,Libération,3259mots,Sonya Faure|Cécile Daumas|Vittorio De Filippis,Thomas Piketty : «Chaque société invente un récit idéologique pour justifier ses inégalités»,"    ...  propriété... Cette peur peut nous empêcher de résoudre des problèmes extrêmement graves, comme le réchauffement  climatique, et plus largement d'avoir un système économique qui soit acceptable pour le plus grand nombre ...  "
228,2019-12-31,Libération,85mots,,Ecologie La ville de Rennes interdit les terrasses chauffées,"        ...  ville française à adopter une telle mesure. Au nom de la lutte contre le réchauffement  climatique, la municipalité de Rennes a décidé d'interdire au 1er janvier les chauffages extérieurs, obligeant les ...  "
229,2019-11-06,Libération,1143mots,Michel Wieviorka,"Du Chili au Liban, le retour du social","    ...  au personnage principal du film de Todd Phillips. Mais ils s'intéressent peu au changement  climatique, à la domination masculine ou aux débats éthiques sur la vie et la mort. Il ne ...  "
230,2019-11-04,Libération,1037mots,Arnaud Vaulerin,Ouïghours : la communauté internationale à voix ténue,"    ...  chef de l'Etat à Shanghai, puis à Pékin, sera à dominante économique, culturelle et  climatique avec, notamment, la signature d'une  «quarantaine de contrats»,  espèreton dans l'entourage de ...  "
231,2019-11-18,Libération,57mots,,"Chez les nomades du Kirghizistan, la «terre brûle» déjà","        ...  au Kirghizistan. Dans ce petit pays d'Asie centrale, les nomades sont les plus vulnérables au changement  climatique et tentent de s'adapter avec des bouts de ficelle. Photo Maxime Fossat  ...  "
232,2019-11-16,Libération,1268mots,François Carrel,La mer de Glace «Un milieu que l'on croyait immuable...»,"    ...  randonnée audessus de la mer de Glace, de constater les effets stupéfiants du réchauffement  climatique sur le glacier. La première fois qu'il était passé ici, à la fin des années ...  "
233,2019-10-24,Libération,811mots,Clyde Plumauzille,L'émeutier peut être une émeutière,"    ...  slogans portés à même les gilets jaunes, convergence de luttes face à l'urgence économique,  climatique et démocratique soulignent la richesse de cette réappropriation de la parole politique qui est aussi réappropriation ...  "
234,2019-12-13,Libération,725mots,Michaël Foessel,Une vie avant la mort ?,"    ...  dans ce cas, nous avons quelques raisons d'inquiétude, à l'heure où le réchauffement  climatique semble réduire l'espace de nos certitudes à l'attente de la catastrophe. Dans ce contexte ...  "
235,2019-12-20,Libération,1087mots,Eva Fonteneau,"Architecture : avec sa tour en bois, Bordeaux laisse béton","    ...  45 % de moins qu'un bâtiment traditionnel. Un atout maître dans un contexte d'urgence  climatique.  «C'est aussi moins de nuisances sonores sur les chantiers. Les façades, les balcons, les planchers ...  "
236,2019-09-02,Libération,1015mots,Sébastien Farcis,"En Inde, ces villages qui font barrage à la désertification","    ...  à l'agriculture biologique car cela permet de mieux gérer l'eau. Avec le changement  climatique, les averses sont plus rares mais plus intenses, ce qui inonde les terres.  «Or les champs ...  "
