,date,publication,words,author,title,intro
79,2019-11-30,Libération,615mots,Laure Equy,Thierry Pech «L'exécutif s'est engagé à ne pas picorer»,"    ...  Nova, Thierry Pech est coprésident du comité de gouvernance de la convention citoyenne pour le  climat. Le Parlement et la convention sontils en concurrence ? La convention citoyenne n'a aucunement cette ...  "
80,2019-09-28,Libération,1204mots,Alain Auffray|Dominique Albertini,"Chiraquie, les rejetons sont chez Macron","    ...  trois points qu'il a choisi de mettre en avant dans le bilan de Chirac   climat, Europe et multilatéralisme  sont aussi les priorités de son quinquennat. Le  «cri d'alerte»  qu'il ...  "
81,2019-09-25,Libération,338mots,Laurent Joffrin,Vade retro Greta !,"    ...  dans l'avion vers New York, en référence au refus des décisions européennes sur le  climat exprimé par le gouvernement de Varsovie. Riche idée, en vérité, qui pourrait s'appliquer à d ...  "
82,2019-09-25,Libération,74mots,,Climat/Qui a peur de Greta Thunberg ?,"        Après son recours contre cinq pays, dont la France, pour inaction face à la crise  climatique, la militante suédoise de 16 ans braque ses détracteurs et crispe ses soutiens opportunistes. pages 2 ...  "
83,2019-10-10,Libération,756mots,Sophie Wahnich,Extinction Rebellion : une révolution radicalement non-violente,"    ...  des actions radicales non violentes contre des pouvoirs qui trahissent les attentes face au réchauffement  climatique, témoigne d'une réelle avancée démocratique. La répression n'a pas pu se déployer comme elle ...  "
84,2019-11-08,Libération,1851mots,Catherine Calvet,"Bertrand Badie : «Avec la chute du Mur, la décolonisation a pris tout son sens : le Sud est soudain [...]","    ...  que ceux du Nord. Ce sont eux qui souffrent le plus des effets du réchauffement  climatique. Au Sahel, la désertification gagne dix centimètres par heure ! Cela entraîne de nouvelles guerres et des ...  "
85,2019-09-07,Libération,815mots,Anne Proenza,"Amazonie : à Leticia, sept pays tentent de se coordonner","    ... 'assemblée générale des Nations unies fin septembre puis la conférence de Santiago sur le changement  climatique (CopChile), en décembre.  «L'Amazonie est un trésor et représente notre avenir. Il est important que ...  "
86,2019-11-01,Libération,1530mots,Léa Masseguin,Immigration vers l'Europe : «L'impression d'invasion est totalement fausse»,"    ...  personnes seront, d'ici à 2050, forcées de s'exiler à cause des bouleversements du  climat, en particulier en Afrique. Comment se préparer à ce phénomène ? L'urgence  climatique va engendrer de ...  "
87,2019-11-25,Libération,1313mots,Rachid Laïreche,Social et écologie : une gauche en commun ?,"    ... 'écologie défriche depuis longtemps et trace aujourd'hui la route. C'est la solidarité, le  climat, le vivant, qui donnent la direction. Nous sommes prêts à travailler avec tous ceux qui partagent ...  "
88,2019-12-26,Libération,982mots,Coralie Schaub,«Le changement climatique fragilise les forêts»,"    ...  la forêt française doit faire face à une  «immense tempête silencieuse» causée par le changement  climatique, avertit Claudine Richter  (photo ONF), cheffe du département Recherche, développement et innovation à l'Office national ...  "
89,2019-12-23,Libération,1054mots,Nelly Didelot,Australie : les nouvelles flammes du Sud,    ...  précipitations capables de changer les choses avant janvier ou février.» Sontils liés au dérèglement  climatique ? La question fait l'objet d'une vive controverse en Australie  (lire cidessus)  mais les ...  
90,2019-09-02,Libération,802mots,Romain Espinosa,Peut-on sauver la forêt en continuant à manger de la viande ?,"    ...  prendre des mesures importantes pour lutter contre la déforestation et plus globalement contre le changement  climatique. Transformer ce drame en résolutions concrètes, voici l'enjeu. Il nous faut agir fort et vite ...  "
91,2019-09-21,Libération,773mots,Johanna Luyssen,Plan climat : l'esquisse trop lisse d'Angela Merkel,"    Protéger le  climat est  «un défi pour l'humanité».  C'est en ces termes qu'Angela Merkel évoquait en début de semaine le plan gouvernemental pour le  climat, enfin dévoilé vendredi au ...  "
92,2019-10-24,Libération,2026mots,Alexandra Schwartzbrod,Jonathan Safran Foer : «On doit inscrire en nous qu'on ne vole pas la planète»,"    ...  je sentais au fond de moi un malaise parfois intolérable quand je pensais au changement  climatique. Imaginez, vous êtes assis dans votre cuisine, vous lisez vos mails, vos enfants s'amusent dans ...  "
93,2019-09-10,Libération,645mots,Ioana Marinescu,Comment faire accepter la taxe carbone ?,"    ...  pourquoi CNN a choisi de consacrer pas moins de sept heures à discuter du changement  climatique avec chacun des dix candidats à la primaire, le 4 septembre. Lors de ce débat, plus ...  "
94,2019-09-23,Libération,740mots,Daniel Schneidermann,"Emmanuel Macron, le régalien, et les prothèses mammaires","    ...  s'était détournée sur des sujets légers, comme la déroute des retraites ou l'effondrement  climatique. On ne peut pas être partout : on était occupés à accommoder notre apocalypse en brochettes. Mais ...  "
95,2019-09-26,Libération,633mots,Aude Massiot,Montée des eaux. Virginie Duvat : «Les outre-mer seront plus touchés que la métropole»,"    ...  côtes... Les territoires d'outremer sont déjà fortement touchés par les effets du dérèglement  climatique sur les océans. La géographe Virginie Duvat, professeure à l'université de La Rochelle et auteure ...  "
96,2019-12-23,Libération,291mots,Laurent Joffrin,Symbole,    ...  préfiguretil le destin commun ? On cherche souvent les traces tangibles de la crise  climatique dans le rétrécissement des glaces du Grand Nord. Et si elles étaient encore plus visibles à ...  
97,2019-09-02,Libération,535mots,Sébastien Farcis,Inde : une COP en terre aride,"    ...  de la Terre à Rio en 1992 (les deux autres sont celles sur le changement  climatique et la biodiversité). Son combat demeure pourtant essentiel, car il en va de notre capacité à ...  "
98,2019-12-10,Libération,987mots,Jean Laterrasse,La double peine de ceux qui habitent loin,"    ...  poser cette question, n'estce pas renoncer, à un moment où la mobilisation contre le changement  climatique est cruciale, à maîtriser nos consommations d'énergie dans le secteur des transports ?  ...  "
99,2019-12-17,Libération,1946mots,Jean Quatremer,Benoît Coeuré : «Il est normal que la Banque centrale européenne soit du côté de l'emploi»,"    ...  en 2015. Enfin, on a été un peu long à la détente sur la question  climatique, même si ça n'est pas notre métier principal. Le changement  climatique doit être, par exemple ...  "
100,2019-10-30,Libération,1890mots,ZEP Zone d'expression prioritaire,Moi Jeune : «J'avais enfin la sensation que je servais à quelque chose»,"    ...  réponse était la force.» Windy, 17 ans, lycéenne, MenetouSalon : «J'ai manifesté pour le  climat» «C'était une première pour moi : le 15 mars, j'ai participé à une manifestation pour ...  "
101,2019-10-17,Libération,57mots,,Le Fil vert,        ...  réellement mis en place en France pour réduire l'impact des activités humaines sur le  climat ? Selon le «Panorama des financements  climat» de l'Institut de l'économie pour le  climat (I4CE ...  
102,2019-12-23,Libération,1508mots,Catherine Calvet|Thibaut Sardier,Jérôme Gaillardet : «L'homme est un acteur géologique : il produit même de nouveaux atomes»,"    ...  aussi l'homme, qui est un acteur majeur du territoire, autant que la géologie, le  climat, la végétation. Sur la méthode, cela implique de pouvoir donner naissance à des modèles d'analyse ...  "
103,2019-10-30,Libération,287mots,,"Windy, 17 ans, lycéenne, Menetou-Salon «J'ai manifesté pour le climat»","        ...  une première pour moi : le 15 mars, j'ai participé à une manifestation pour le  climat. Ici, d'habitude, il n'y a pas trop de manifestations, et encore moins étudiantes. J ...  "
104,2019-09-23,Libération,809mots,Alexandra Schwartzbrod|Sylvain Mouillard|Margaux Lacroux|Philippine Renon,Manif climat : «On va être obligés de préparer d'autres formes de mobilisation»,"    ...  Paris appartiendratil un jour à la catégorie des souvenirs ? La marche pour le  climat, qui a rassemblé samedi 15 000 personnes dans la capitale, a connu un déroulement chaotique. C ...  "
105,2019-11-29,Libération,766mots,Nelly Didelot,Les opposants au Black Friday payent de leur personne,    ...  seront renvoyés puis détruits par les vendeurs.» Extinction Rebellion comme les jeunes grévistes pour le  climat de YFC visent en particulier le coût environnemental de la mode (2 % des émissions de gaz ...  
106,2019-11-02,Libération,81mots,,Climat La COP 25 se déroulera en Espagne,"        La conférence internationale sur le  climat (COP 25), prévue du 2 au 13 décembre, se tiendra en Espagne, en lieu et place du Chili, a annoncé l'ONU vendredi. Santiago a dû ...  "
107,2019-11-16,Libération,1368mots,Didier Péron|Sandra Onana,Sexisme et abus dans le cinéma : la fin du hors-champ ?,"    ... Climat électrique Le témoignage d'une photographe, Valentine Monnier, dans le Parisien,  où elle raconte avoir été violée à Gstaad par le cinéaste en 1975 alors qu'elle était une mannequin de ...  "
108,2019-11-09,Libération,2123mots,Stéphanie Maurice|Maïté Darnault|Bernadette Sauvaget|Mathilde Frénois|Eva Fonteneau,"De Nice à Roubaix, l'inquiétude des musulmans","    ...  son fils.  «Je n'ai pas entendu parler de cette manifestation, admetelle.  Vu le  climat, je n'écoute plus les informations.» Agente administrative d'une trentaine d'années, elle porte parfois ...  "
109,2019-10-23,Libération,1741mots,François Carrel,"Corinne Morel Darleux : «Refuser un poste, sortir de la surconsommation, c'est affirmer que cette société ne nous convient pas»","    ... 'engagement traditionnelles, partis et syndicats, face à l'inquiétude, voire l'anxiété, par rapport au  climat et la biodiversité, face au constat d'impuissance des acteurs étatiques et économiques. XR est arrivé ...  "
110,2019-10-28,Libération,4362mots,Julien Gester,Johnny Jewel «Il n'y a personne qui puisse faire ce que je fais»,"    ...  chromatiques ou graphiques, afin de fixer, d'illustrer, le genre d'humeur, de température, de  climat que je veux donner à la chanson  plutôt bleu ou rouge, plus ou moins agressive ? Mais ...  "
111,2019-10-12,Libération,1625mots,Simon Blin,"Jean-Claude Monod : «Au sommet de l'Etat, on entend des refrains néolibéraux devenus insupportables»","    ...  premiers rondspoints pour réclamer plus de justice sociale. Qu'elles touchent la question du  climat ou du pouvoir d'achat, que signifient ces nouvelles mobilisations, sinon des «crises de gouvernementalité» ? La ...  "
112,2019-09-24,Libération,290mots,Laurent Joffrin,Malentendu,"    Le capitalisme estil compatible avec la lutte pour le  climat ? Sous sa forme actuelle, certainement pas. Le laisserfaire généralisé et la stricte logique de rentabilité financière qui le gouvernent laissent ...  "
113,2019-09-12,Libération,1541mots,Thomas Piketty,Thomas Piketty rédacteur en chef,"    ...  à Washington pour faire le boulot sur des questions comme les salaires ou encore le  climat. Cette décision du Sénat californien est importante pour les EtatsUnis, mais aussi pour l'Europe ...  "
114,2019-09-24,Libération,115mots,,Climat Le Président suggère aux manifestants de nettoyer les plages,"  Climat Le Président suggère aux manifestants de nettoyer les plages Dans l'avion pour se rendre au sommet  climat à New York, Macron aurait dit avoir toujours « besoin de la mobilisation des ...  "
115,2019-10-12,Libération,384mots,Pauline Moullot,Qui finance Extinction Rebellion ?,"    Alors que la semaine d'action d'Extinction Rebellion (XR) contre le réchauffement  climatique s'achève, d'aucuns s'interrogent sur le financement de ce jeune mouvement international de désobéissance civile, créé ...  "
116,2019-10-25,Libération,920mots,Miguel Lago|Stefano Nunes,Jair Bolsonaro met le feu chez les évêques,"    ...  comment rendre légitime un discours raciste, xénophobe, qui bafoue les questions distributives et le changement  climatique dans des pays catholiques, alors que la plus grande autorité morale porte un discours ouvertement solidaire ...  "
117,2019-12-31,Libération,1775mots,Sonya Faure|Thibaut Sardier,Tim Flannery : «L'Europe a été le noeud crucial de l'évolution des espèces et de la naissance du monde moderne»,"    ...  un refuge pour de nombreuses espèces. Mais comment ontils réchappé à chaque grand changement  climatique ou environnemental comme l'âge de glace, la domestication des espèces, le déboisement ? C'est un ...  "
118,2019-12-28,Libération,226mots,Rachid Laïreche,26 mai Européennes : Jadot reçoit le feu vert des jeunes,    Des grandes manifestations qui rassemblent toutes les générations pour lutter contre le réchauffement  climatique ? Une jeunesse qui sèche les cours pour demander aux dirigeants politiques d'être à la hauteur du défi ...  
119,2019-09-26,Libération,83mots,,"Une collision d'astéroïdes, responsable du refroidissement climatique survenu il y a 450 millions d'années","        ...  même, due aux activités humaines). Une étude explique enfin l'une d'elles, le refroidissement  climatique survenu il y a 450 millions d'années : la poussière d'un astéroïde désintégré aurait envahi ...  "
120,2019-12-23,Libération,699mots,Margaux Lacroux,"«La fumée s'est infiltrée partout, dans les maisons, les bureaux, et même à l'hôpital»","    ...  rare, le Premier ministre climatosceptique Scott Morrison  (lire page 3)  a reconnu que le changement  climatique était l'un des  «facteurs»  à l'origine du désastre. Mais il ne souhaite pas renforcer ...  "
121,2019-11-29,Libération,112mots,,L'Europe décrète l'urgence climatique...,        Le Parlement européen a décrété jeudi l'urgence  climatique et environnementale. Un vote symbolique pour maintenir la pression sur les dirigeants de l'UE à l'approche de la COP 25 qui ...  
122,2019-10-26,Libération,1849mots,Anastasia Vécrin,Francis Wolff : «Seules les idées universalistes permettent la coexistence des cultures»,"    ...  autant conscience de former une seule humanité... Face aux risques globaux que sont le réchauffement  climatique mais aussi le terrorisme, les catastrophes nucléaires ou les crises économiques, oui, jamais dans l'histoire ...  "
123,2019-09-06,Libération,122mots,,Disparition Mort de l'économiste Martin Weitzman,"        Il avait mis le réchauffement  climatique au coeur de ses travaux. L'économiste américain Martin Weitzman est mort fin août, à 77 ans, rapporte le  New York Times. Professeur à Harvard, son ...  "
124,2019-09-28,Libération,1567mots,Jacky Durand,"La nantaise, divin bovin","    ...  noir et ses cornes altières, la nantaise pourrait bien nous éviter de manger de la vache enragée à l'ère du grand beuglement  climatique et de la déraison dans la prairie.  ...  "
125,2019-09-14,Libération,783mots,Lou Marillier,Norvège : la monarchie pétrolière fait sa «révolution électrique»,"    ... 'industrie du gaz et du pétrole» , explique Bard Lahn, chercheur à l'institut de recherche  climatique Cicero. Là est l'éternelle ambivalence norvégienne, car le secteur du gaz et du pétrole représente ...  "
126,2019-12-26,Libération,761mots,Tonino Serafini,1999-2019: Les forêts reprennent leur souffle,"    ...  millions d'euros. D'aucuns voient dans la récurrence de ces phénomènes météorologiques, souvent qualifiés d'«exceptionnels», une manifestation du dérèglement  climatique. Les scientifiques demeurent néanmoins très prudents sur le sujet.  ...  "
127,2019-12-23,Libération,83mots,,Chronique «Terre d'actions»,"        ...  du siècle», collectif d'associations qui avait lancé fin 2018 une campagne pour la justice  climatique. Chaque citoyen peut y raconter ses inquiétudes, ses constats, les conséquences directes du changement  climatique sur ...  "
128,2019-12-26,Libération,1539mots,Guillaume Krempp,"Haguenau : vingt ans après, des stigmates toujours visibles","    ...  sait pas pourquoi... Le pire, pour un forestier, c'est l'incertitude face au changement  climatique. Ce qu'on plante aujourd'hui ne sera visible que dans un siècle...» Sur les sentiers ...  "
129,2019-10-01,Libération,381mots,Margaux Lacroux,"Lorenzo, un cyclone pas comme les autres ?","    ...  partie dû à ce que l'on appelle  «l'expansion des tropiques».  Avec le réchauffement  climatique, la zone tropicale (chaude et humide), propice à la naissance et au maintien des ouragans, s ...  "
130,2019-09-11,Libération,1120mots,Catherine Calvet,Laurent Tillon : «Un petit parc peut abriter un nombre incroyable d'espèces»,    ...  villes plus vivables. La présence des arbres permet non seulement de lutter contre le réchauffement  climatique mais aussi de garder un minimum de biodiversité autour de nous. Pourquoi comparezvous l'arbre ...  
131,2019-12-16,Libération,1164mots,Laurence Defranoux,"Au Bangladesh, «notre maison a disparu sous nos yeux»","    ...  personnes. Sans protection sociale, sans indemnisation, invisibles aux yeux des politiques, les victimes du changement  climatique sont livrées à ellesmêmes. Comme tant d'autres, Moyna Begum et sa famille se retrouvent ...  "
132,2019-09-03,Libération,780mots,Luc Le Vaillant,"Greta Thunberg en transat, c'est mer sourire","    ...  tout cela mèneratil Greta Thunberg dans dix ans ? A la barre du Titanic  climatique pour éviter qu'il ne percute l'iceberg fatal ? Sur une des îles éparses, attendant que ...  "
133,2019-09-10,Libération,943mots,Judicaël Lavrador,"Olafur Eliasson, réflexions d'après nature","    ...  qu'il est, tel qu'il court à sa perte sur la pente du réchauffement  climatique, un de ses chevaux de bataille. Aussi atil intitulé sa rétrospective à la Tate ...  "
134,2019-11-05,Libération,2782mots,Clémentine Mercier,"Joel Sternfeld : «En tant qu'artiste, votre job est de tuer le père»","    ...  signes d'un sentiment d'apocalypse aux EtatsUnis. Parallèlement, les premiers effets du changement  climatique ont été diagnostiqués par le scientifique James Hansen qui a parlé de  ""réchauffement  climatique"" devant le ...  "
135,2019-11-13,Libération,1058mots,Léa Mormin-Chauvac,"Casey Camp-Horinek, le sentier de la Terre","    ...  ditelle, citant les études reçues par Einsenhower dans les années 50 sur le réchauffement  climatique. «Le choix a tout de même été de courir vers le dollar au mépris de la ...  "
136,2019-11-23,Libération,323mots,Charlotte Belaich,"A la Sorbonne, EE-LV et LFI planchent sur «l'écologie populaire»","    ...  journée de conférence consacrée à la construction d'une écologie populaire. «Alors que l'urgence  climatique est devenue un élément central de la recomposition politique, dans quelle direction devonsnous aller pour ...  "
137,2019-09-12,Libération,925mots,Manon Pignot,"Greta, sois jeune et tais-toi !","    ...  et solitaire devant le Parlement suédois pour protester contre l'inaction politique face au dérèglement  climatique. En une année, le monde a découvert son nom et son visage, et son combat a ...  "
138,2019-09-24,Libération,768mots,Anne-Laure Delatte,Sous le règne des banques centrales,"    ...  intensives en carbone (1). En fait, on marche sur la tête : on sait l'urgence  climatique, on connaît l'ampleur des investissements à réaliser pour opérer la transition  climatique, et en même ...  "
139,2019-10-12,Libération,1456mots,Luc Peillon|Jacques Pezet|Pauline Moullot|Fabien Leboucq|Anaïs Condomines,"D'Extinction Rebellion à la retraite, vos questions nos réponses","    ...  Extinction Rebellion ? Alors que la semaine d'action d'Extinction Rebellion (XR) contre le réchauffement  climatique s'achève, d'aucuns s'interrogent sur le financement de ce jeune mouvement international de désobéissance ...  "
140,2019-11-25,Libération,2786mots,Sonya Faure,"Adieu bio, vaches, cochons...","    ...  de milliards d'animaux, tout en étant l'un des plus grands responsables du changement  climatique. Pour ses supporteurs, les avantages de la viande synthétique sont clairs : elle mettrait fin à l ...  "
141,2019-12-10,Libération,1364mots,Charlotte Belaich,"EE-LV : à Paris, Belliard dans les bouchons","    ...  Le problème, c'est qu'il n'est pas le seul sur ce créneau. Urgence  climatique oblige, aucun candidat ne fait l'économie du sujet environnemental. On promet de faire disparaître le ...  "
142,2019-09-07,Libération,814mots,Frédéric Autran,"Après l'ouragan Dorian, les Bahamas ont «l'odeur de la mort»","    ...  ministre de la Barbade n'a pas hésité à faire le lien avec le combat  climatique.  «Que font les eaux plus chaudes ? Elles nourrissent la croissance et la force des ouragans, a ...  "
143,2019-10-23,Libération,1449mots,Christophe Alix,Jeremy Rifkin : «Le jour où la bulle carbone s'effondrera»,"    ...  1 200 projets ont ainsi émergé, permettant la création de milliers d'emplois. Le changement  climatique passe aussi par une réinvention démocratique. A vous lire, on a parfois l'impression que l ...  "
144,2019-11-23,Libération,1045mots,Marie Piquemal,Profs innovants Quand éducation rime avec invention,"    ... 'un coup visibles parce que le cours d'eau a baissé... La sécheresse, le réchauffement  climatique.» Sur le chemin du retour, Philippe Nicolas, enseignant depuis seize ans, rumine :  «Comment continuer comme si ...  "
145,2019-12-26,Libération,1539mots,Juliette Buchez,Cambodge : sous le signe descendant du poisson,"    ... 'économie locale autour du lac est fragilisée à la fois par les effets du réchauffement  climatique, la surpêche, l'activité illégale et le grand flou des régulations en vigueur. L'appauvrissement guette ...  "
146,2019-11-04,Libération,1734mots,Justine Salvestroni,Lech Walesa : «Les Polonais ont cassé quelques dents à l'ours soviétique»,"    ...  l'esprit du peuple polonais d'abord, de tous les autres ensuite, pour créer un  climat dans lequel les gens intéressés par la liberté se mobiliseraient. Il fallait donc organiser des manifestations ...  "
147,2019-12-06,Libération,2271mots,Pierre-Henri Allain|Stéphanie Maurice|Stéphanie Harounyan|Sylvain Mouillard|Marie Piquemal|Kim Hullot-Guiot|Amandine Cailhol|Gurvan Kristanadjaja|Anaïs Moran|Solange de Fréminville,"Dans toute la France, «on lâchera pas l'affaire»","    ...  de Montpellier, les jeunes ayant pris la tête du cortège, d'abord là pour le  climat, n'en étaient pas à leur première mobilisation. Aujourd'hui,  «c'est le rassemblement des causes ...  "
148,2019-12-21,Libération,972mots,Alexandra Schwartzbrod,Michel Wievorka : «Nous vivons l'extrême fin des Trente Glorieuses»,"    ...  des manifestations interprofessionnelles, parfois elles s'ignorent : les gilets jaunes et la mobilisation sur le  climat par exemple. Voire elles s'opposent : les mêmes gilets jaunes étaient plutôt hostiles aux syndicats au ...  "
149,2019-09-09,Libération,883mots,Laurent Joffrin,Affaire Ramadan : n'est pas Dreyfus qui veut,"    ... 'accuse sur la base de fausses preuves et le présente comme un coupable, dans un  climat général d'islamophobie virulente. Un Dreyfus musulman, donc. Ramadan attribue son sort au  «racisme systémique» qui ...  "
150,2019-11-04,Libération,717mots,Isabelle Hanne,Climat : Donald Trump prêt à déserter l'accord de Paris,"    ...  souvent d'avoir déjà sorti les EtatsUnis de l'accord de Paris sur le  climat, depuis qu'il a annoncé sa volonté d'en faire ainsi le 1er juin 2017. Mais ...  "
151,2019-11-14,Libération,847mots,Eric Favereau|Nathalie Raulin,L'hôpital public exige des grands remèdes,"    ...  à la taylorisation des soins, mais aussi aux rémunérations en berne, s'ajoute désormais un  climat interne lourd. L'épuisement des personnels soignants comme des médecins a entraîné une hémorragie vers le ...  "
152,2019-09-07,Libération,972mots,Marcos Uzal,"Mostra de Venise, désillusions optiques","    ...  insolente de ce festival, mais trois autres qui surent saisir une inquiétude plus générale, un  climat de révolte assez actuel, y compris dans sa tentation de la violence :  Joker  de Todd Phillips ...  "
153,2019-09-04,Libération,974mots,Dominique Albertini,L'exécutif tente de s'épargner une rentrée colère,"    ...  inspirera ces prochains mois deux exercices de moins grande ampleur :une convention citoyenne sur le  climat doit réunir, à partir d'octobre et pour six mois, 150 citoyens tirés au sort et ...  "
154,2019-12-14,Libération,774mots,Jean Quatremer,"Brexit : côté européen, la saga n'en finit pas","    ...  série d'accords dans les domaines qui intéressent les deux parties : transports, recherche, éducation, énergie,  climat, défense, nucléaire, coopération policière et judiciaire, accès à Galileo (le GPS européen), etc. A lire aussiBrexit ...  "
155,2019-09-23,Libération,316mots,Alexandra Schwartzbrod,Urgence,    ... on ces derniers jours en divers points de la planète dans les marches pour le  climat. On a tous en tête l'image de Laurent Fabius marquant d'un coup de marteau ...  
