,date,publication,words,author,title,intro
236,2021-01-02,Libération,498mots,Arnaud Vaulerin,"Face aux pressions chinoises, l'inquiétude de Taiwan","    ...  eaux par des appareils chinois. Un forcing militaire et sécuritaire qui s'inscrit dans un  climat de défiance croissant. Analyse Après l'étouffement sans grande contestation internationale de Hongkong, qui devait pourtant ...  "
237,2021-04-07,Libération,3410mots,Par Stéphanie Harounyan Correspondante à Marseille,"Au procès Guérini, à chaque jour suffit sa benne","    ... 'emplois, de logements ou de subventions à des affidés «Je voulais apporter une réponse au  climat anxiogène, mais je n'ai jamais eu l'intention de cacher des informations à la justice ...  "
238,2021-02-01,Libération,1882mots,Recueilli par SIMON BLIN,«La pandémie remet en cause nos catalogues de droits fondamentaux» «La pandémie met à l'épreuve notre degré de civisme»,    ...  moyens administratifs. Il faut que s'écoulent de nombreuses décennies et que s'instaure un  climat déjà propice aux valeurs libérales pour que se constitue la mentalité civile d'une population. Ma ...  
239,2021-04-09,Libération,1099mots,Par MARIE-FRANCE MALONGA,"«Pyramide»: n'en déplaise à Pépita, la dure réalité est là","    ...  collègues, accusant l'émission Quotidien d'avoir proposé un montage pernicieux ne reflétant pas le  climat heureux qui régnait sur le plateau de Pyramide. Mais n'en déplaise à Pépita, la dure ...  "
240,2021-02-09,Libération,1221mots,Recueilli par Charlotte Belaïch,Benoît Hamon : «Le revenu universel est l'autre affaire du siècle»,"    ...  une question de génération ? C'est l'autre affaire du siècle : il y a le  climat et il y aura le revenu universel. Dans la nouvelle génération, il y a une vraie ...  "
241,2021-03-02,Libération,1088mots,Par Arnaud Vaulerin,"Birmanie Aung San Suu Kyi, victime de la loi de la junte","    ...  Cour pénale internationale par le Conseil de sécurité de l'ONU. C'est dans ce  climat que doivent se retrouver, ce mardi en visio, les ministres de l'Asean. Celleci «doit ...  "
242,2021-03-02,Libération,624mots,Par Maria Malagardis Journaliste au service Monde,Rwanda : ce «R» qui poursuit Hubert Védrine,    ...  chassés du Rwanda suite à des massacres antérieurs. Rien dans cette lettre «R» sur le  climat de violences et de propagande haineuse contre les Tutsis entre 1990 et 1994. Pas un mot ...  
243,2021-04-01,Libération,1343mots,Par ARNAUD VAULERIN,De la révolte à la guerre ouverte,"    ...  le coup d'Etat militaire de Min Aung Hlaing, le pays s'enfonce dans un  climat de terreur, alors que les conflits redémarrent aux frontières. Divisé, le Conseil de sécurité de l ...  "
244,2021-01-06,Libération,285mots,Aurore Savarit- Lebrère,"A Canal +, «nous sommes tous des Stéphane Guy»","    ...  journalistes du groupe Canal +. Nous voudrions pouvoir nous exprimer librement, à visage découvert mais le  climat de peur qui règne et les intimidations répétées nous en empêchent.» Devant les locaux, les syndicalistes ...  "
245,2021-04-09,Libération,2609mots,Par ERWAN CARIO et MARIUS CHAPUIS Dessin ASEYN,"ÉCOLES DE JEUX VIDÉO «Tu ne peux pas gérer une team, t'es une femme»","    ...  puissent plus faire la sourde oreille, ces phrases isolées, une fois compilées, témoignent d'un  climat général. Dans le premier volet de notre enquête publié mercredi, nous révélions combien ces cursus de ...  "
246,2021-01-02,Libération,957mots,Léo Soesanto,"Serie/ «24 Heures», amphètes de fin d'année","    ...  vestige et vertige d'un autre âge. A son apogée, la série était indissociable du  climat politique toxique, paranoï aque et hébété au lendemain du 11 Septembre. Créée par les conservateurs Joel ...  "
247,2021-01-04,Libération,893mots,Par Jean Quatremer Correspondant à Bruxelles,Présidence allemande de l'UE : un virage et une pluie d'hommages,"    ...  permis de vendre en Allemagne des compromis, sur le fonds de relance ou sur le  climat, qui auraient eu du mal à passer en temps normal», analyse Clément Beaune, secrétaire d'Etat ...  "
248,2021-02-03,Libération,890mots,Adrien Franque,"A Canal + et CNews, silence radio chez les journalistes","    ...  à relativiser: «Il y a des craintes au niveau des journalistes sportifs, mais pas de  climat de terreur», estime JeanLuc Canteux de la CFDT. «Du point de vue de la direction ...  "
249,2021-02-05,Libération,2014mots,Par EVA FONTENEAU et FANNY MARLIER,Des étudiantes en échange à l'étranger violées et esseulées,"    ...  anonymement, réclament a minima davantage d'«empathie», d'«écoute», d'«aménagements scolaires», et dénoncent un  climat «peu propice à la prise de parole». «NE PAS ""SALIR"" L'IMAGE DE SCIENCESPO» «Nous ...  "
250,2021-03-05,Libération,1695mots,Par ELSA MAUDET et MARLÈNE THOMAS,«Pourquoi les gendarmes ne l'ont pas écoutée ?»,"    ...  des preuves, on refuse de prendre ses plaintes, alors que c'est illégal. Dans ce  climat délétère, Tiphanie Bel n'évoque «que» les violences psychologiques et physiques, ainsi que les dégradations matérielles ...  "
251,2021-04-02,Libération,54mots,,2 000 milliards de dollars [...],"        ...  avec l'objectif de créer des «millions d'emplois», tenir tête à la Chine et lutter pour le  climat. Son plan prévoit entre autres d'injecter 620 milliards dans les transports.  ...  "
252,2021-04-03,Libération,1943mots,Par ELODIE AUFFRAY Envoyée spéciale en Ille-et-Vilaine,«Elle a toujours cru que du mal pouvait surgir le bien»,"    ...  conjugal. Dans sa déposition, elle évoque quatre autres épisodes, entre 2005 et 2020, et un  climat difficile. «Généralement, les violences, ce sont plus des bousculades, des insultes en tout genre, des dénigrements ...  "
253,2021-01-02,Libération,1015mots,NICOLAS MASSOL,Le déclic de la politique par et pour tous ?,"    ...  des expériences comme le grand débat postgilets jaunes ou la Convention citoyenne pour le  climat (lire cicontre) sont toujours suspectes d'arrièrepensées politiciennes, il est plus facile au niveau local ...  "
254,2021-04-06,Libération,1414mots,Recueilli par ALEXANDRA PICHARD,"«En Bretagne, on tente d'acheter le silence d'une partie des médias»","    ...  sont prévus ce mardi à Rostrenen (Côtesd'Armor). Auprès de Libé, elle témoigne du  climat violent qui règne dans la région pour les journalistes traitant ces thèmes et de l'impunité ...  "
255,2021-01-05,Libération,958mots,Par LILIAN ALEMAGNA,VACCIN ANTI-COVID L'exécutif met la com,"    ...  la «transparence», sera accompagné, comme les tirés au sort de la Convention citoyenne pour le  climat, parle Conseil économique, social et environnemental (Cese). Un «gadget», a dénoncé le patron des députés Les ...  "
