,date,publication,words,author,title,intro
160,2016-09-19,Libération,696mots,Frédéric Autran,L'écueil de la Chambre des représentants,"    ...  n'hésitera pas à gouverner par décrets  sur le contrôle des armes, l'immigration, le  climat. Au risque de braquer définitivement ses opposants républicains. Pour  «guérir les fractures», et  «changer le ton ...  "
161,2016-09-24,Libération,625mots,François-Xavier Gomez|Recueilli par François-Xavier Gomez,Colombie : «Je ne crois pas à une jonction des deux gauches»,"    ...  Et l'arrivée au pouvoir de Santos, qui s'est démarqué de l'intransigeant Uribe, lié aux paramilitaires, a créé un  climat optimiste sur les chances de parvenir à un accord.  ...  "
162,2016-09-27,Libération,625mots,Luc Peillon,Chômage : des ambitions contrariées,"    ...  comme les promesses d'embauche sur la même période (+ 3,7 %) ou  «l'indicateur du  climat des affaires qui se maintient à un bon niveau», comme le rappelle le ministère. A l ...  "
163,2016-09-28,Libération,1600mots,Arnaud Vaulerin,"A Manille, «le temps des tueurs»","    ...  tôt, Diokno s'était livré à des  «rappels historiques qui justifient nos inquiétudes sur le  climat d'impunité que nous vivons en ce moment », analysetil en juriste.  «La faiblesse de ...  "
164,2016-09-15,Libération,341mots,,Alain Juppé et ses salades sur le regroupement familial,"        ...  ne serait pas grave. Mais c'est un vent mauvais chargé de préjugés sur les immigrés «assistés» qui font venir leur famille. Et vu le  climat, on s'en passerait bien.   ...  "
165,2016-09-10,Libération,304mots,Tonino Serafini,Arrêté anti-chicha : à quand un arrêté anti-spaghettis ?,"    ...  les gens d'aller et venir dans les rues des villes. En revanche, dans le  climat postattentats qui sévit dans le pays, tout ce qui peut évoquer de près ou de ...  "
166,2016-09-10,Libération,109mots,,"Un coffret regroupe le premier long métrage de Lucile Hadzihalilovic, Innocence (2004) et son dernier,","        ...  long métrage de Lucile Hadzihalilovic,  Innocence (2004) et son dernier,  Evolution , expérience sensorielle captivante au  climat fantastique : des jeunes femmes parquées sur une île veillent de jeunes garçons pas encore pubères qui ...  "
167,2016-10-06,Libération,450mots,Olivier Loubes,"«En classe, les maîtres réorganisent ce qui leur a été transmis»","    ...  plus anciens, à partir de ce qu'ils croient pouvoir et devoir faire, dans un  climat politique qui instrumentalise souvent l'enseignement de l'histoire. La fin du roman national aurait eu ...  "
168,2016-10-22,Libération,1593mots,Clémentine Mercier,"«PROVOKE», rage dedans","    ...  donne le pouls : il filme au plus près, la caméra est bousculée et traduit le  climat de guerre civile. La résistance à la puissance aliénante enfle : le traité de l'Anpo (Traité ...  "
169,2016-10-24,Libération,369mots,Didier Arnaud,Grève à i-Télé : «La direction est en train de détruire la chaîne»,"    ...  déplacés et des effets personnels des journalistes jetés à la poubelle. Tout ça alimente le  climat de défiance. Quant aux discussions, elles sont toujours au point mort. La commission de conciliation a ...  "
170,2016-10-25,Libération,735mots,Agnès Gayraud,"Abra, reine cool du r'n'b en chambre","    ...  canadienne Tommy Genesis, autre recrue prometteuse du label Awful, la caisse claire saturée et le  climat plus sombre installent un son plus massif. Résultat probable d'une méthode de travail cumulative où ...  "
171,2016-10-19,Libération,1577mots,Isabelle Hanne|Aude Massiot,Trudeau : l'homme d'une nouvelle ère ... et des promesses en l'air,"    ...  applaudi comme une rockstar, qu'il achève son discours au sommet mondial sur le  climat, en décembre au Bourget   «Chers amis, le Canada est de retour !» , rappelant, alors que son prédécesseur ...  "
172,2016-11-03,Libération,152mots,,Moscou ferme le bureau local d'Amnesty,"        ...  nos bureaux, a commenté John Dalhuisen, le directeur Europe d'Amnesty,  mais compte tenu du  climat actuel pour la société civile en Russie, il y a manifestement un grand nombre d'explications ...  "
173,2016-11-10,Libération,1162mots,Frédéric Autran,"Etats-Unis, l'empire du pire","    ...  la frontière mexicaine, jeter Hillary Clinton en prison, rejeter l'accord de Paris sur le  climat et celui sur le nucléaire iranien), lesquelles mettratil à exécution ? Après un an et ...  "
174,2016-11-16,Libération,1001mots,Luc Chessel,"«Planétarium», les illusions perçues","    ...  future star, Natalie Portman et LilyRose Depp) et un Français naturalisé que le violent  climat antisémite de l'époque, florissant bien avant que l'Occupation ne lui apporte un alibi, désigne ...  "
175,2016-12-15,Libération,1490mots,Rachid Laïreche|Laure Bretton,Primaire de gauche : six hommes et une femme pour une succession incertaine,"    ...  sur deux ministres du gouvernement : Emmanuelle Cosse (Logement) et Barbara Pompili (Relations internationales sur le  climat). Sinon, son allié JeanVincent Placé roule pour Valls. Son (ses) boulet(s) ? Certains concurrents sont ...  "
176,2016-12-27,Libération,2034mots,Jacques Denis|Guillaume Tion|Julien Gester|Charline Lecarpentier|Olivier Lamm|Agnès Gayraud,"Musiques, le grand mea culpa","    ...  flûtes et tambourins. De l'autre, l'orfèvrerie de berceuses cold wave, colorées d'un  climat de calme menace, d'une fièvre désaffectée sous la glace, qui paraissent perforer plusieurs épaisseurs d ...  "
177,2016-10-03,Libération,1461mots,Aude Massiot,"Grassroots, les ni-ni de la gauche radicale américaine","    ...  lutte pour un revenu horaire minimum de 15 dollars (13,3 euros), la défense du  climat ou des droits des travailleurs immigrés , ces mouvements tentent de s'unir pour peser sur la ...  "
178,2016-10-05,Libération,451mots,Didier Péron,L'«Exode» à bout portant,"    ...  un environnement autre que celui qu'elles ont connu jusqu'ici. Elles sont médusées du  climat de tranquillité qui règne partout, avec ses garçons et filles qui vont ensemble sans que personne ...  "
179,2016-11-11,Libération,790mots,Raphaël Balenieri,"Sur Internet, la Chine fait sa loi","    ...  pouvoir serre la vis de tous côtés et que les entreprises étrangères se plaignent d'une dégradation du  climat des affaires, tout cela fait craindre d'autres motivations à peine cachées.  ...  "
180,2016-10-24,Libération,251mots,,«On cherche quelqu'un pour se sacrifier»,"        ...  la COP et de m'impliquer plutôt à l'international», dit la ministre, à deux semaines de la COP 22, la conférence internationale sur le  climat prévue en novembre à Marrakech.   ...  "
181,2016-10-21,Libération,180mots,Jérôme Lefilliâtre,Le climat à i-Télé vire à la dinguerie,    ... Le  climat à iTélé vire à la dinguerie  ...  
182,2016-12-15,Libération,1261mots,Arnaud Vaulerin,"Poutine, 48 heures pour relancer les relations avec le Japon",    ... 'où ce projet de pipeline par le nord et donc par la Russie.» Dans un  climat de tension avec une Chine hégémonique et conquérante sur les mers et dans les airs de ...  
183,2016-12-28,Libération,411mots,Sibylle Vincendon,Un modèle à repenser pour la famille Mulliez,"    ...  28 %. Les enseignes spécialisées type Decathlon, Leroy Merlin ou Boulanger, elles, cartonnent. Preuve d'un  climat inquiet, une vaste réorganisation a été lancée, et pas en douceur. Arnaud Mulliez, qui dirigeait la ...  "
184,2016-09-23,Libération,315mots,Rachid Laïreche,Yannick Jadot Café du Gymnase (IXe),"    ...  par exemple, je vais plus facilement mettre en avant la mondialisation, l'Europe et le  climat, des combats que je mène depuis vingtcinq ans.» Il ajoute :  «Mais notre parti est, et ...  "
185,2016-09-17,Libération,1900mots,Catherine Calvet,"Caroline Rolland-Diamond: «Obama avait annoncé qu'il ne serait pas le président des Noirs, et il ne l'a pas été»","    ...  les haines étaient déjà très fortes, comme en témoigne le développement du Tea Party. Ce  climat a freiné toute politique raciale dès son premier mandat. Ses solutions à la crise bancaire ont ...  "
186,2016-10-05,Libération,799mots,Sibylle Vincendon,Les usines bougent encore,"    ...  rajoute dans cette ambiance de soins palliatifs  (lire page 5).  Mais voilà que, dans ce  climat, deux études viennent battre en brèche toutes ces certitudes. La première, due au cabinet d'études ...  "
187,2016-10-22,Libération,381mots,Maria Malagardis,Pourquoi le Burundi et l'Afrique du Sud quittent-ils la Cour pénale internationale ?,"    ...  multiplie les exactions et les massacres dans un huisclos désormais quasi total. Dans un  climat tendu de bras de fer, le bureau du procureur de la CPI avait ouvert un «examen ...  "
188,2016-10-21,Libération,1146mots,Laurence Defranoux,"Aum Neko, pourchassée jusqu'à Paris par les ultra royalistes","    ...  mépris, ne pourra pas leur donner la même légitimité que son père. Ils fabriquent un  climat de peur pour que la critique généralisée de la monarchie en tant qu'institution ne fasse ...  "
189,2016-10-22,Libération,289mots,Sibylle Vincendon,«Taxe charbon» : le gouvernement fait machine arrière,"    ... 'implantation des centrales, qui représentent 5 000 emplois. Célia Gautier, porteparole du Réseau Action  Climat, explique que l'exécutif ne découvre rien :  «Nous avions prévenu qu'il fallait accompagner cette mesure ...  "
190,2016-10-18,Libération,552mots,Jacques Denis,Ahmed Malek en ligne de mire,"    ...  de swing détaché, un tapis de motifs impressionnistes, le thème intitulé  Omar Gatlato imprime un  climat obsédant, quelque chose de poignant qui n'est pas sans rappeler le meilleur de François de ...  "
191,2016-10-28,Libération,421mots,Laure Bretton|Jérôme Lefilliâtre,Mystère «JDD» : les suspects se ramassent à l'appel,"    ...  ledit texte.  «A partir de là, c'est devenu dingo, on est tombés dans un  climat d'hystérie et de paranoïa», selon la même source. Tous les courants du PS s'accusent ...  "
192,2016-10-31,Libération,1326mots,Didier Arnaud,Tourisme : trou opérateur,"    ...  Paris, les attentats de Nice ont eu  «une grosse répercussion». La seule éclaircie dans ce  climat maussade vient de Jeannette. Elle tient Le Lit, un magasin près de République, et elle n ...  "
193,2016-10-17,Libération,2053mots,Rachid Laïreche,Olivier Besancenot : «La Ve République est un canard sans tête qui continue de marcher»,"    ...  Penser que le mouvement du printemps est parti dans les sables est une erreur. Le  climat général reste. La volonté de convergence des luttes aussi. Contre la répression, par exemple, aux côtés ...  "
194,2016-11-18,Libération,125mots,,22 voix contre 21,        ...  phare du projet de loi de finances 2017 est la dernière victime en date du  climat de déprime qui règne au sein de la majorité. C'est dans un hémicycle en partie ...  
195,2016-11-05,Libération,1252mots,Anne Denis,"Religion : chez Orange, prière d'être discret",    ...  rien à voir avec des phénomènes de radicalisation qui ont pu être évoqués ailleurs. Le  climat social s'est d'ailleurs plutôt détendu depuis l'arrivée de Stéphane Richard à la tête ...  
196,2016-11-10,Libération,953mots,Arnaud Vaulerin,Japon Des relations transpacifiques en danger,    ...  le respect des droits de l'homme et des libertés fondamentales. C'est dans ce  climat qu'Américains et Japonais vont devoir trouver un modus vivendi. Après les années harmonieuses avec Barack ...  
197,2016-11-12,Libération,1132mots,Aude Massiot|Estelle Pattée,L'élection de Trump déchaîne les tensions,"    ...  les spécialistes, ces témoignages n'ont rien d'anecdotique et accréditent la thèse d'un  climat de tension dans lequel vivent actuellement les minorités aux EtatsUnis. Ce discours de haine s ...  "
198,2016-12-01,Libération,716mots,,France-Rwanda : Paul Barril au coeur des accusations de complicité de génocide,        ...  Nul doute que la nouvelle offensive judiciaire rwandaise n'est pas de nature à réchauffer le  climat alors que le poste d'ambassadeur français au Rwanda est toujours vacant depuis 2015  ...  
199,2016-11-29,Libération,1505mots,Nathalie Raulin|Lilian Alemagna|Rachid Laïreche,Gauche : les ir-res-pon-sa-bles,"    ...  faire amende honorable sur la déchéance de nationalité. Avec l'accord de Paris sur le  climat et la nonévacuation de la ZAD de NotreDamedesLandes, il veut prouver qu ...  "
200,2016-12-21,Libération,628mots,Luc Chessel,"Yousry Nasrallah : «On m'a culpabilisé de raconter la joie, comme si c'était décadent»","    ...  caricatures. Le film atil été mal reçu en Egypte ? Estce lié au  climat politique actuel ? Finalement, plutôt que de censure politique à proprement parler, je dirais qu'il y ...  "
201,2016-09-23,Libération,393mots,Dounia Hadni|Recueilli par Dounia Hadni,"Sandra, 28 ans, ingénieure commerciale à Paris «Je ne me sens pas libre en France»","    ...  mari à changer de pays, on ne veut pas que notre fils grandisse dans ce  climat. Je suis dégoûtée, on a aujourd'hui un gouvernement de gauche qui se comporte comme un ...  "
202,2016-09-14,Libération,375mots,Philippe Douroux,"Trump n'a aucune chance, disait-on","    ...  convention de Cleveland. Incapable de définir une doctrine sur l'immigration, la santé ou le  climat, le Parti républicain n'a pu que constater les dégâts. Le Tea Party l'a emporté ...  "
203,2016-09-20,Libération,838mots,Dalibor Frioux|Jean-Pierre Giordanella|Antoine Hardy|Damien Léger,"Le sommeil des enfants, un enjeu politique","    ...  monde. Ils sont notre avenir, ils paieront nos dettes, nos retraites et ils sauveront le  climat. Avec un peu de chance, ils se sont bien reposés, et ils vont même peutêtre ...  "
204,2016-09-22,Libération,563mots,Maja Zoltowska,La Pologne s'apprête à durcir sa loi anti-IVG,"    ...  risquent désormais si le projet passe.» Mais avec l'arrivée au pouvoir du PiS, le  climat politique n'a jamais été aussi porteur pour les organisations antiIVG.  «Nous espérons qu'aujourd ...  "
205,2016-10-03,Libération,713mots,Maïté Darnault,"Au Chambon, Eliane Wauquiez n'accompagne pas les élans solidaires","    ...  détracteurs d'Eliane WauquiezMotte dénoncent ainsi une position  «équivoque»,  à l'origine d'un  climat délétère.  «Ici, on connaît l'opinion des gens, mais jusquelà, tout le monde faisait cohésion ...  "
206,2016-09-08,Libération,1494mots,Célian Macé|Maria Malagardis,Françafrique : Ali Bongo tue le Gabon du père,"    ...  représentants de l'opposition parmi ses huit membres», explique Jean Ping à  Libération. Dans ce  climat de méfiance, les ambassades française et américaine ont vite été impliquées dans la gestion de la ...  "
207,2016-09-07,Libération,910mots,Philippe Corcuff,Assumer la pluralité de nos identités,"    ...  galaxie antiraciste, par ailleurs dénigrée d'Alain Finkielkraut en Alain Soral. Et, pour aggraver le  climat, des secteurs de gauche n'échappent pas à l'aimantation néoconservatrice. Il nous faut davantage compter ...  "
208,2016-10-07,Libération,492mots,Ève Beauvallet,"Crystal Pite, sensation de «Season»","    ... 'effet de la scénographie : un cyclorama avec images de synthèse se charge d'installer un  climat d'apocalypse, convoquant la force des éléments déchaînés, du paysage en feu aux grands espaces enneigés ...  "
209,2016-10-28,Libération,1133mots,Laurence Defranoux,"Radha Rani Sarker, briseuse de mariages d'enfants","    ...  tous».  Ses parents, illettrés, ont déjà quatre filles, et son arrivée n'arrange pas le  climat familial miné par la violence et une pauvreté extrême. Une fille est considérée comme une calamité ...  "
210,2016-12-30,Libération,697mots,Mathilde Guillaume,"Argentine : embourbée dans une affaire de corruption, Cristina Kirchner résiste","    Dans un  climat économique et social délétère, la justice argentine a annoncé mardi l'inculpation pour «association illicite» et «administration frauduleuse» de l'ancienne présidente Cristina Kirchner dans une affaire de corruption ...  "
211,2016-09-30,Libération,222mots,,Tiques : des mesures pour améliorer la prise en charge de la maladie de Lyme,"        ...  années avec la propagation des tiques, qui ont peu de prédateurs naturels, grâce à un  climat favorable. Dans sa forme chronique, les patients ont souvent des symptômes peu distinctifs (maux de tête ...  "
212,2016-09-02,Libération,1574mots,Catherine Calvet|Cécile Daumas,Georges Didi-Huberman : «Les larmes sont une manifestation de la puissance politique»,"    ...  l'émotion du peuple via les images, aujourd'hui souvent opposée au logos ? Dans un  climat de défiance visàvis des émotions populaires, pourquoi vous intéresser aux larmes du peuple ?  Il ...  "
213,2016-09-05,Libération,58mots,,26,"        C'est le nombre de pays qui ont ratifié l'accord de Paris sur le  climat, dont les EtatsUnis et la Chine. Ces pays représentent désormais un peu plus de 39 ...  "
214,2016-09-08,Libération,582mots,Willy Le Devin|Julie Brafman,Voiture aux bonbonnes de gaz : un «coup d'essai» ?,"    ...  où est rassemblée une foule importante, ce type d'action étant multiplié pour créer un  climat de panique» , avaitil déclaré, à la stupeur générale, devant la commission de la défense nationale ...  "
215,2016-10-07,Libération,1618mots,Arnaud Vaulerin,"«Tu la fermes, sinon il y aura d'autres morts»","    ...  septembre. Mar était sans nouvelles de deux amis portés disparus et se disait inquiet du  climat sécuritaire. Car le rythme des exécutions ne faiblit pas. En moyenne, 37 personnes sont tuées chaque ...  "
216,2016-11-19,Libération,80mots,,Bilan COP 22,"        Après la 21e Conférence des parties sur le  climat à Paris et son accord adopté en décembre 2015 pour contenir à 2 degrés la hausse des températures mondiales, la COP 22, à ...  "
217,2016-11-17,Libération,415mots,Amandine Cailhol,Des violences à l'école en légère baisse,"    ...  qu'ils en soient victimes ou mis en cause. De quoi prendre le pouls du  «climat scolaire», estime la FAS qui publie chaque année un baromètre. Rendu public ce jeudi, il est ...  "
218,2016-11-11,Libération,26mots,,S'il tient ses promesse ...,"        Construire un mur avec le Mexique, dénoncer l'accord sur le  climat, remettre en cause l'avortement: quelle serait l'Amérique de Trump ? pages 211  ...  "
219,2016-11-23,Libération,1514mots,Mathilde Guillaume,"Argentine, le choc de la Macri-économie","    ...  argentine. L'antagonisme permanent de la Présidente et les nombreux scandales de corruption rendaient le  climat social très dur.» A lire aussi L'Argentine plonge un peu plus dans la dépression, un ...  "
220,2016-12-15,Libération,652mots,Julie Brafman,Fresnes : l'indignité carcérale,"    ...  aux activités, soins ou rendezvous prévus, et moins encore répondre aux demandes.» Dans ce  climat de «tension permanente», les contrôleurs ont noté un  «usage banalisé de la force» de la part ...  "
221,2016-12-02,Libération,799mots,Johanna Luyssen,Le parcours accidenté de la loi Veil,"    ... elle précisément, cette loi Veil que Philippe Gosselin appelle de ses voeux ? Votée dans un  climat délétère en novembre 1974, elle imposait un cadre strict à la pratique de l'IVG. D ...  "
222,2016-12-22,Libération,1007mots,Robert Maggiori,"Les plantes, liens dans l'autre",    ...  que parce qu'en elles  «se dévoile le secret de ce qu'on appelle : le  climat». Celuici  «n'est pas l'ensemble des gaz qui enveloppèrent le globe terrestre».  Mais plutôt ...  
223,2016-11-30,Libération,908mots,Gilles Fumey|Olivier Assouly,L'avenir agricole du «bon goût aveyronnais»,"    ...  tisser au fil du temps des liens avec les hommes, les plantes, le relief, le  climat, les expériences passées, etc. De fait, la comparaison ne peut que s'imposer avec le scénario ...  "
224,2016-12-09,Libération,707mots,Margot Chevance,"A la barre, deux ados marocaines jugées pour homosexualité",    ...  il n'était pas question d'écorner l'image du Maroc. Le procès a repris dès la fin de la grandmesse du  climat et le verdict sera rendu ce vendredi.  ...  
