,date,publication,words,author,title,intro
78,2021-03-05,Libération,1117mots,Par Claude Jaouen,Réduire la part du nucléaire : une fausse bonne idée,"    ...  les conclusions d'un organisme scientifique collégial international, le Giec : pour faire face au dérèglement  climatique, il est impératif de «décarboner» nos économies ! Une des sources majeures des gaz à effet de ...  "
79,2021-04-02,Libération,1121mots,Par Mihail Barboiu,Dessaler l'eau de mer : un procédé plus rentable et plus écologique,"    ...  la croissance de la population mondiale et de ses activités économiques sur fond de changement  climatique, de nombreux pays auront besoin de solutions urgentes. Dessaler l'eau de mer est une idée ...  "
80,2021-02-06,Libération,1060mots,Par Pierre Ducrozet,Sécession,"    ...  qui nous aide à résoudre des problèmes au plus long cours encore, comme le changement  climatique. Or, c'est la coercition et le cavalier seul qui triomphent pour l'instant  sans parler ...  "
81,2021-01-13,Libération,1085mots,Par CHARLOTTE CHAFFANJON et LAURE EQUY,"Pour l'exécutif, des réformes en quarantaine","    ...  dans les tuyaux: celui reprenant en partie les travaux de la Convention citoyenne pour le  climat, dont la présentation en Conseil des ministres est prévue le 10 février, et celui «confortant le ...  "
82,2021-02-10,Libération,296mots,Par Dov Alfon,David et Goliath,"    ...  ainsi que le démontre notre enquête sur les modifications apportées à la loi sur le  climat qui atterrit ce mercredi en Conseil des ministres. Car le projet «climat et résilience», rédigé par ...  "
83,2021-03-29,Libération,325mots,Par Paul Quinio,Pari,"    ...  particulier. Alors que majorité et opposition verte vont batailler pendant trois semaines sur la loi  climat qui arrive en examen ce lundi à l'Assemblée nationale, plusieurs milliers de manifestants ont défilé ...  "
84,2021-03-10,Libération,891mots,JEAN QUATREMER Correspondant à Bruxelles,"A Bruxelles, un sursaut bien tardif","    ...  partis politiques tiennent de tels propos à l'égard des journalistes, car ils créent un  climat qui mène à l'autocensure et peuvent même aboutir à des assassinats, comme en Slovaquie ou ...  "
85,2021-03-13,Libération,1505mots,Par STÉPHANE ROLAND Envoyé spécial à Stuttgart (Bade-Wurtemberg),"Chez les verts allemands, la révolution du consensus","    ... Wurtemberg, les Verts ne sont pas seulement un parti écologiste. «Je me bats pour le  climat mais aussi pour le féminisme, contre le fascisme et le racisme», martèle la représentante de la ...  "
86,2021-02-20,Libération,4122mots,Par Willy Le Devin,"Chez maître Pierrat, des collaborateurs «essorés par le dénigrement»","    ... 'une vingtaine de personnes ayant travaillé auprès de l'illustre avocat parisien, qui décrivent un  climat de peur, d'injures et de mépris. Certains envisagent de porter l'affaire devant les juridictions ...  "
87,2021-02-25,Libération,522mots,Gilles Bataillon,"L'Anthropocène, la der des ères?","    ...  perturbations anthropiques majeures dont les effets combinés menacent l'écosystème terrestre : des changements disruptifs du  climat, un effondrement de la biodiversité, des phénomènes de pollution, une artificialisation accrue de la terre et ...  "
88,2021-03-31,Libération,878mots,Sarah Finger Correspondante à Montpellier,"A Montpellier, le MoCo en plein micmac","    ...  et l'art contemporain montpelliérain.» Manifestations, pétitions, lettres ouvertes Les réactions s'enchaînent dans un  climat délétère. «Nous aurions souhaité que les choses se passent autrement, concède Michel Roussel, directeur régional des ...  "
89,2021-03-20,Libération,116mots,,Loi climat La création du controversé «délit d'écocide» votée par les députés,        C'est l'un des volets parmi les plus commentés du projet de loi «climat et résilience». Le «délit d'écocide» a été approuvé sans retouche jeudi soir avant d'être à ...  
90,2021-03-22,Libération,1570mots,Par LÉA MASSEGUIN Envoyée spéciale aux îles Canaries,"Pandémie, Canaries, paradis","    ...  peu élevé, ou encore l'accès aux services de santé. «LE BUREAU AVEC LE MEILLEUR  CLIMAT DU MONDE» Aurore, 31 ans, a elle aussi fui le confinement d'octobre pour rejoindre Tenerife ...  "
91,2021-02-12,Libération,1762mots,Par CAMILLE GÉVAUDAN,La Terre débarque sur Mars,"    ...  débarquent en paix, animés par les plus nobles intentions scientifiques pour tout comprendre de l'atmosphère martienne, son  climat, sa géologie, son passé et pourquoi pas planter quelques drapeaux au passage.  ...  "
92,2021-01-28,Libération,791mots,Par Éric Piolle,Pour un Beauvau de la confiance,"    ...  de telles addictions, créer le crime d'écocide demandé par la Convention citoyenne pour le  climat (CCC), aller vers la fiscalité universelle, pour particuliers et entreprises, proposée par Gabriel Zucman, etc. La ...  "
93,2021-04-29,Libération,534mots,M.Ma. et P.Pl.,«Les escrocs trouvent un terreau fertile dans le climat actuel»,    ...  sérieux. Les escrocs jouent sur l'opportunisme et ils trouvent un terreau fertile dans le  climat d'inquiétude actuel. Qui sont les cibles de ces arnaques ? Pour les arnaques aux ventes pyramidales ...  
94,2021-03-19,Libération,910mots,A. Coi.,"A l'école, des «sentinelles» contre l'escalade","    ...  compris à l'extérieur. Tout cela ne rentre pas dans des chiffres, ça imprègne le  climat d'un collège.» L'objectif : autonomiser le programme en rodant pendant six jours six adultes, qui ...  "
95,2021-01-13,Libération,1614mots,Maria Malagardis,"En Ouganda, le crépuscule d'un mythe et la genèse d'une idole","    ...  fait que redoubler à l'approche du scrutin présidentiel qui a lieu jeudi dans un  climat qui évoque bien plus une guerre qu'une élection. Onze candidats sont en lice, mais la ...  "
96,2021-02-12,Libération,648mots,Émilie Laystary,"«Avec OEnologouine, on découvre la dégustation sans paternalisme»","    ...  observer que l'on ne verrait pas dans un atelier classique ? Il y a un  climat général très agréable, des plaisanteries, des remarques sincères, mais aussi un référentiel culturel commun. Le dialogue ...  "
97,2021-04-15,Libération,1163mots,Par Guillaume Gendron,Impactez-vous !,"    ...  en suant sur son rameur, sonates de Schubert en fond, son esprit se trouble. Populisme,  climat, pandémie il est temps de réformer le capitalisme, se dit Cohen. Nul repentir ni révolte, plutôt ...  "
98,2021-03-05,Libération,746mots,Simon Blin,"A l'université Paris-Est Créteil, l'étrange caviardage d'une fiche de poste","    ...  supprimées d'un appel à candidature pour un poste à l'université ParisEst Créteil, avant de réapparaître. Un incident symptomatique du  climat de tension dans la recherche en sciences sociales.  ...  "
99,2021-03-03,Libération,2036mots,Par ISABELLE HANNE Correspondante à New York,La démocratie américaine en état cryptique,"    ...  que d'autres récits complotistes.» Autre facteur de son succès, la mouvance prospère dans le  climat entretenu par l'administration Trump, avec ses attaques répétées contre les experts, les médias, la science ...  "
100,2021-03-01,Libération,73mots,,"Dernière session de la Convention climat : «J'y ai cru, mais on ne nous a pas pris au sérieux»",        ...  endossant celui de maîtres d'école mécontents. Les «150» de la Convention citoyenne pour le  climat (CCC) se sont réunis à distance pour clôturer leur ultime session. Le résultat est sévère mais ...  
101,2021-03-06,Libération,2087mots,Recueilli par MATTHIEU ÉCOIFFIER et DIDIER RAVON,VENDÉE GLOBE Alexia Barrier : «La mer me manque déjà»,"    ...  avec mes oiseaux et mes poissons», glissetelle. Elle se dit déçue de la loi  climat et de la façon dont les lobbys ont dilué les propositions de la Convention citoyenne. «J ...  "
102,2021-03-16,Libération,505mots,Charline Lecarpentier,"The Weather Station, dans l'oeil du cyclone","    ...  prévisions : autour de deux thématiques pour ciel de plomb  la rupture amoureuse et l'anxiété  climatique, il réussit le tour de force anticyclonique d'éclaircir l'horizon, grâce à une association de ...  "
103,2021-03-18,Libération,623mots,Par Jean-Christophe Féraud Chef adjoint du service France,Danone ou l'impossible dépassement du capitalisme financier,"    ...  direction du monde du travail, cécité assumée visàvis de la bombe à retardement  climatique qui menace la planète et ses habitants Un an a passé et l'éviction brutale d ...  "
104,2021-01-18,Libération,2036mots,Par PHILIPPE COSTE Intérim à New York,TRUMP Bille en dette,"    ...  de la présidence Trump autour de quatre axes : la pandémie, la crise économique, le changement  climatique et l'égalité raciale après le mouvement de Black Lives Matter. Suite de la page 3 ...  "
105,2021-03-20,Libération,1657mots,Recueilli par Thibaut Sardier,«Seuls des chocs violents sont susceptibles de réduire durablement les inégalités»,"    ...  ou au MoyenOrient. Ce risque vaut pour la pandémie, mais aussi pour le changement  climatique et la destruction des écosystèmes qui pourraient entraîner des guerres, des mouvements révolutionnaires, des effondrements d ...  "
106,2021-04-13,Libération,915mots,Ch.B. et R.La.,Jean-Marc Germain s'investit dans la maison-maire,    ...  les 780 kilomètres de la Seine en cinquantedeux jours pour sensibiliser les âmes au changement  climatique. Les parents ne cachent pas leur fierté. Ils se sont rencontrés sous le regard de Martine ...  
107,2021-02-13,Libération,601mots,Par Mathieu Lindon,Cent mille milliards pour la soif,"    ...  remboursement ni à accuser ceux qui ont marché dessus de faire le jeu du réchauffement  climatique. Et puis après tout, nous aussi, on est too big to fail, on est la France ...  "
108,2021-03-10,Libération,364mots,,À LA TÉLÉ CE SOIR,        ...  6 à la maison. Magazine. Présenté par AnneÉlisabeth Lemoine &amp; Patrick Cohen. FRANCE 3 21h05. Le monde de Jamy. Magazine. Réchauffement  climatique : comment protéger nos montagnes ?. 23h05. Enquêtes de région. Magazine.  ...  
109,2021-04-26,Libération,1213mots,Par Benjamin Delille Envoyé spécial à Sancerre (Cher),"A Sancerre, des vignes brûlées par le froid","    ...  en 2016 et 2017, cela reste un phénomène relativement nouveau à Sancerre, lié au changement  climatique : «Le problème, ça n'est pas vraiment le gel en soi, c'est la douceur de ...  "
110,2021-02-25,Libération,888mots,Par Renan Larue,Viande à la cantine : une polémique à la noix,"    ...  de ne plus manger de produits d'origine animale pour ne pas accélérer le changement  climatique, ne pas souiller nos rivières, ne pas épuiser nos sols, ne pas raser les forêts, ne ...  "
111,2021-01-21,Libération,144mots,,A l'école de l'anthropocène : s'attaquer à la «vulnérabilité globale»,"        ...  un Manifeste mondial anthropocène autour de ce mot d'ordre: «Nous vivons ensemble le dérèglement  climatique, l'acidification des océans, l'élévation des mers... [...]. Nous avons tous des pistes, des idées [ ]. Seules ...  "
112,2021-04-16,Libération,470mots,Sébastien Missoffe directeur général de Google France,Une nouvelle organisation spatiale,"    ...  la crise sanitaire, pour répondre aux attentes des individus et faire face à l'urgence  climatique. Comment le numérique, et a fortiori l'usage des données, modifietil notre rapport à ...  "
113,2021-04-16,Libération,253mots,,Programme,"        ... 20 h 10 Numérique et écologie : quelles connexions ? Face au défi du réchauffement  climatique, le numérique peutil aider les villes à devenir plus résilientes ? Mais quel est son impact écologique ? Avec ...  "
114,2021-03-12,Libération,901mots,Par Charlotte Belaïch,"Régionales : dans les Hauts-de-France, la gauche s'allie derrière Delli","    ...  communes et conscients de nos différences que nous faisons union pour la justice sociale et  climatique [ ], pour rompre l'emprise suffocante que l'extrême droite exerce dans les HautsdeFrance», affirment ...  "
115,2021-04-30,Libération,749mots,Par Balla Fofana,Une maison connectée bientôt ouverte à tous ?,    ...  même logique de durée dans le temps.» A cela s'ajoute la prise de conscience  climatique par des générations qui s'inscrivent dans le mouvement de la consommation raisonnée. «Le partenariat Sonos ...  
116,2021-04-30,Libération,137mots,,"267 milliards C'est, en tonne, [...]",        ...  de la planète perdent de la masse depuis vingt ans sous l'effet du réchauffement  climatique et que le phénomène gagne en vitesse. Alors que la Terre a déjà gagné plus de ...  
117,2021-02-20,Libération,601mots,Par Mathieu Lindon,Les vieux font-ils des envieux ?,"    ...  et du chômage, surgit celui du Covid en horsd'oeuvre à la grande nouba  climatique. Ce n'est pas comme les peines compressibles où un sacrifice se fond dans le suivant ...  "
118,2021-01-29,Libération,1078mots,Par AURORE COULAUD Envoyée spéciale à Lamballe,"Dans les Côtes-d'Armor, les crapauds tentent de sauver leur peau","    ...  les causes majeures du déclin de la biodiversité auxquels s'ajoutent les pollutions, le changement  climatique » enchaîne PierreAlexis Rault. Concrètement, «c'est la route qui est sur leur passage, pas l ...  "
119,2021-01-12,Libération,1449mots,Par ANNE PROENZA Envoyée spéciale à Providencia (Colombie),Providencia dans le deuil du cyclone,"    ...  Caraïbes, ce qui ne laisse pas beaucoup de temps. D'autant qu'avec le réchauffement  climatique, les éléments se déchaînent chaque fois plus souvent et plus fort. En attendant, il pleut encore ...  "
120,2021-03-19,Libération,313mots,Margaux Lacroux,"Dans les Alpes, la neige pas éternelle",    ...  34 jours de neige dans les régions situées à moins de 2 000 mètres d'altitude. Au L'article rappelle dès l'introduction que «le changement  climatique en cours dans les  ...  
121,2021-03-20,Libération,1105mots,Camille Nevers,Ciné/ «The Quarry» au val du diable,"    ... 'avoir recueilli en route et en sale état sur le bascôté, plutôt une pesanteur  climatique, ou spatiale, comme si le lieu, chaque lieu du film, de la carrière à l'église ...  "
122,2021-04-12,Libération,755mots,Par Daniel Schneidermann,Il y a peut-être une alternative,"    ...  Biden, et d'autre part, un programme de grands travaux, notamment de préparation au changement  climatique (investissement dans le véhicule électrique, rénovation du réseau d'électricité, surélévation des autoroutes, des ponts, etc ...  "
123,2021-03-24,Libération,350mots,,À LA TÉLÉ CE SOIR,        ...  les grands duels. Jeu. FRANCE 4 21h05. Lumni science. Documentaire. Le monde de Jamy : réchauffement  climatique comment protéger nos montagnes. 22h55. Les animaux du zoo. FRANCE 5 20h50. La grande librairie. Magazine ...  
124,2021-02-12,Libération,959mots,Par Ricardo Azambuja Rennes School of Business et Fundação Dom Cabral (Brésil) Sophie Raynaud Rennes School of Business,Comment faire de l'alimentation végétale un nouvel art de vivre ?,"    ...  est un des principaux leviers d'action à notre disposition pour lutter contre la crise  climatique. Mais pourquoi, alors que la solution semble si simple et les bénéfices si grands pour notre ...  "
125,2021-02-18,Libération,1402mots,Recueilli par ARNAUD VAULERIN,«L'Occident était pris dans un conte de fées sur la démocratie birmane»,"    ...  façonnée par la guerre, la pauvreté, la discrimination raciale, l'inégalité et maintenant le changement  climatique, où les opinions de droite et d'ultradroite monopolisent le spectre politique. La Birmanie ne peut ...  "
126,2021-03-29,Libération,978mots,Par Charlotte Chaffanjon Journaliste au service Politique,L'idéal européen de Macron se cogne à la crise sanitaire,"    ...  unie et démocratique». A l'époque, les défis que le Président pointait couraient «du réchauffement  climatique à la transition numérique en passant par les migrations et le terrorisme». Il n'évoquait certainement ...  "
127,2021-03-31,Libération,719mots,Par PAULINE ACHARD,Entreprises Des aides au conditionnel ?,"    ...  cette absence d'encadrement des aides au risque d'accentuer encore injustice sociale et dérèglement  climatique. ? La mission parlementaire a dénombré près de 2 000 aides directes ou indirectes aux entreprises, pour ...  "
128,2021-04-23,Libération,810mots,DIDIER PÉRON,Sans faire de cinéma,    ...  reste d'icibas chaque jour un peu plus hanté par l'imminence du naufrage  climatique et les avantpostes du progrès piloté par ce capitaine Nemo normand ou Tintin intrépide au ...  
129,2021-01-23,Libération,888mots,AUDE MASSIOT Envoyée spéciale à Somerleyton (Angleterre),"En Angleterre, Wild East, des terres pleines de promesses","    ...  aide au retour des oiseaux et des insectes, et on réduit l'impact du changement  climatique, énumèretil. C'est aussi une question de santé publique et de souveraineté alimentaire que ...  "
130,2021-02-16,Libération,653mots,Par Olivier Monod,INDUSTRIE La vérité si je vends,"    ...  la disparition des abeilles, ou encore le lien entre les activités humaines et le changement  climatique, la Fabrique de l'ignorance plonge dans les grandes affaires de notre époque. Et décrit comment ...  "
131,2021-03-27,Libération,1905mots,Recueilli par ERWAN CARIO Dessin XAVIER LISSILLOUR,"«Dans nos bulles de confinés, on a perdu l'enchevêtrement entre l'espace et le temps»","    ...  l'action humaine et cette confiance doit être orientée dans le sens d'une justice  climatique, de la fin d'une mentalité néocolonialiste qui délocalise pollution et travail précaire. Vous dites que ...  "
132,2021-03-16,Libération,1612mots,Par Thibaut Sardier,"A Saint-Maur, réactions en chêne","    ...  cherchent tantôt à exploiter la forêt, tantôt à la protéger des incendies ou du changement  climatique. Mais sa vie est surtout guidée par les autres membres de son écosystème. Pour devenir l ...  "
133,2021-03-29,Libération,652mots,Marie Klock,Eddy de Pretto tourne en rondelle,"    ...  replis d'un album mortellement sérieux qui parle de galères, de doutes et de changement  climatique il faut admettre qu'on ne s'y attendait pas, mais alors vraiment, vraiment pas. Il ...  "
134,2021-04-21,Libération,136mots,,"4,5 milliards C'est, en euros, [...]","        ...  à cause des conflits et de la violence, des inégalités, de l'impact du changement  climatique, à cause de la perte de terres, d'emplois, de perspectives et à cause de la ...  "
135,2021-04-26,Libération,1134mots,Par NATALIE PETITEAU,"Commémorer l'Empire, plutôt que célébrer l'empereur",    ...  quelques générations nous seront condamnés de même pour n'avoir pas su enrayer le réchauffement  climatique Commémorer Napoléon est une façon de comprendre que Napoléon n'était pas seul à vouloir l ...  
136,2021-03-11,Libération,842mots,JEAN-CHRISTOPHE FÉRAUD,Dépression active pour l'industrie de l'atome,    ...  dans le déploiement d'une énergie qui serait seule à même d'enrayer le réchauffement  climatique. Le tournant dans la perception de l'atome a été le terrible accident de Tchernobyl (Ukraine ...  
137,2021-04-23,Libération,1359mots,Par CAMILLE GÉVAUDAN,"Thomas Pesquet, orbite repetita","    ...  sa webcam pour dialoguer avec des écoliers, expliquer encore et encore les enjeux du changement  climatique qui lui tiennent à coeur Et comment les astronautes font caca dans l'espace. ? LIBÉ. FR ...  "
138,2021-02-06,Libération,639mots,Par mathieu Lindon,Donald Trump pour les nuls,"    ...  l'heure qu'il est, on ne peut pas reprocher à Donald Trump de faire des conférences en faveur de la démocratie, du droit des femmes ou contre le réchauffement  climatique. ?  ...  "
139,2021-03-02,Libération,829mots,Par Luc Le Vaillant,Adieu à la viande,"    ...  la pensée qui soustend cette mise au régime désincarné. La lutte contre le réchauffement  climatique vaut bien une messe et un carême, même s'il aurait été plus clair d'annoncer ...  "
140,2021-03-06,Libération,1487mots,Par FRANÇOIS Musseau Envoyé spécial à Barcelone,"En Catalogne, une poussée de fièvre jeune","    ...  job étudiant. La pandémie nous prive du moindre amusement, de la moindre réunion. La crise  climatique nous fait mourir d'angoisse. Moi, j'ai plus foi en rien !» Ses copines acquiescent. Dans ...  "
141,2021-01-06,Libération,751mots,Par Olivier Steiner,Nous ne sommes pas des huîtres,"    ...  qui métastase : résilience du marché de l'auto, balles de tennis à haute résilience, résilience  climatique, etc. Jusqu'au champ lexical des politiques : la «startup nation» se devra d'être résiliante ...  "
142,2021-02-06,Libération,2056mots,Recueilli par CATHERINE CALVET et ANASTASIA VÉCRIN,"«Face au Covid, il faut une stratégie humaniste»","    ...  sanitaire n'estelle pas le symptôme d'une crise plus grave, celle du bouleversement  climatique ? J'entends bien les thèses des collapsologues, il faut les écouter et en même temps ne ...  "
143,2021-01-02,Libération,1688mots,Par JACKY DURAND,C'est bon pour la morale et le régal,    ...  engage chaque jour davantage nos choix de mode de vie à l'ère du réchauffement  climatique et de la pandémie de Covid19. De l'Afrique à l'Auvergne en passant par ...  
144,2021-02-04,Libération,1040mots,"Par Guillaume Lachenal Historien des sciences, professeur à Sciences-Po (Médialab)",Les éoliennes face aux vents du passé,"    ...  dans les réserves qu'il traverse et pollue). Pas sûr, même en temps de guerre  climatique, que l'alliance béate avec les promoteurs de l'éolien offshore doive rester le seul horizon ...  "
145,2021-02-08,Libération,2014mots,Recueilli par Catherine Calvet Anastasia Vécrin,«La patience enseignée aux femmes est une forme de soumission»,"    ...  y a aussi des facteurs extérieurs qu'on ne peut pas maîtriser comme le réchauffement  climatique : il provoque un exode rural massif, encore plus de pauvreté et même des famines. Les filles ...  "
146,2021-02-08,Libération,1731mots,Par François Carrel Envoyé spécial en Tarentaise,La mauvaise pente des stations de ski,"    ...  fort de son mémoire de master sur «l'adaptation des stations village face au changement  climatique». Sur 60 moniteurs, il espère qu'un tiers pourra travailler dès cette première semaine de vacances ...  "
147,2021-04-01,Libération,58mots,,"Frelon asiatique, moustique tigre l'énorme coût des invasions biologiques","        Avec le changement  climatique et la perte d'habitat, l'introduction d'espèces envahissantes est l'une des principales menaces pour la biodiversité. Une étude évalue pour la première fois son coût ...  "
148,2021-04-01,Libération,110mots,,"Au Japon, le temps des cerisiers prend de l'avance","        ...  japonaise, les fleurs de cerisiers deviennent de plus en plus précoces à cause du réchauffement  climatique. Selon eux, la température moyenne à Kyoto était de 10,6 degrés en mars 2020 contre ...  "
149,2021-04-03,Libération,1463mots,Par olivier richard,Chants de runes,    ...  et autres barbares ont encore pris une nouvelle dimension à l'heure de la crise  climatique. Ces peuples évoquent une vie en harmonie avec la nature et de saines valeurs traditionnelles qui ...  
150,2021-02-06,Libération,1113mots,Par Isabelle Hanne Correspondante à New York,"Biden, une politique étrangère à Trump","    ...  les organisations et traités multilatéraux, la promesse de faire de la lutte contre le changement  climatique et des droits LGBT+ des pierres angulaires de sa politique étrangère, en passant par l'augmentation ...  "
151,2021-03-01,Libération,874mots,RACHID LAÏRECHE,«Macron a choisi l'extrême droite comme son faire-valoir»,"    ...  Pen, si la pandémie a des conséquences économiques et sociales en chaîne, si la crise  climatique est devant nous, alors la gauche peutelle encore jouer à cachecache avec ellemême? Il ...  "
152,2021-01-08,Libération,1485mots,Par Frédéric Autran,Les treize jours les plus longs,"    ... Unis, ils la situent souvent au Capitole, cible des extraterrestres de Mars Attacks, du chaos  climatique dans le Jour d'après comme des ennemis de l'intérieur de la série Designated Survivor ...  "
153,2021-04-01,Libération,1159mots,Par Sabrina Champenois,A bras les corps,"    ...  leur clientèle. En écho à une génération Z qui carbure aux causes, féminisme, dégenrement, urgence  climatique, le retournement de veste est massif et général. Mais dans les faits, s'il y a ...  "
154,2021-03-17,Libération,1312mots,Par JUDICAËL LAVRADOR,Muséographie Vide d'artiste,"    ...  les murs de la galerie Iris Clert en blanc, cherche, proclametil, «à créer un  climat pictural invisible mais présent», qui touche au coeur de la sensibilité des spectateurs avec «beaucoup plus ...  "
155,2021-04-12,Libération,815mots,Par Vincent Chabault,"La fermeture de Gibert, symbole de la plateformisation du commerce",    ...  la majorité se félicitent de l'interdiction de la création de nouvelles zones commerciales (loi  climat et résilience) sans prendre en considération les évolutions des modes d'approvisionnement ? Au même titre que ...  
156,2021-02-25,Libération,378mots,,À LA TÉLÉ CE SOIR,        ...  22h50. Non élucidé  l'enquête continue. LCP 20h30. Émission spéciale : Sommets : dans les secrets des négociations européennes. Événement. Épisode 1 «Time to act» (climat)  Partie 1/2. 22h00. Dialogue citoyen. Magazine.  ...  
157,2021-02-10,Libération,43mots,,loi climat les Lobbys en horde de bataille,        ... loi  climat les Lobbys en horde de bataille  ...  
